Sheet: Arena
A1: !LR! | B1: ID | C1: Name | D1: ItemType | E1: ItemName | F1: ItemAmount | G1: Classify | H1: ShowLimit | I1: BuyLimit | J1: Tips | K1: Shining | L1: Recommend | M1: Count | N1: CostType | O1: Cost | P1: StandardAmount | Q1: Amount | R1: dummy
B2: int | C2: string | D2: string | E2: string | F2: int | G2: string | H2: string | I2: string | J2: string | K2: boolean | L2: boolean | M2: int | N2: string | O2: string | P2: int | Q2: int | R2: string
D3: optional | E3: optional | F3: optional | G3: optional | H3: optional | I3: optional | J3: optional | K3: optional | L3: optional | M3: optional | N3: array | O3: array | P3: array | Q3: array | R3: ignore
A4: ### | D4: 商品类型 | E4: 商品名 | F4: 数量 | G4: 分类 | H4: 显示条件 | I4: 购买条件 | J4: 条件提示 | K4: 高光边框 | L4: 推荐文本 | M4: 购买限次 | N4: 资源类型 | O4: 资源名 | P4: 标准价格 | Q4: 当前价格
A5: 定义 | C5: 商品
B6: 100001 | C6: 竞技场_突破石_1 | D6: 物品 | E6: 突破石 | F6: 1 | G6: 竞技场_商品 | M6: 999999 | N6: 资源 | O6: 声望 | P6: 10 | Q6: 10
B7: 100002 | C7: 竞技场_突破石_10 | D7: 物品 | E7: 突破石 | F7: 10 | G7: 竞技场_商品 | M7: 999999 | N7: 资源 | O7: 声望 | P7: 100 | Q7: 100
B8: 100003 | C8: 竞技场_突破石_100 | D8: 物品 | E8: 突破石 | F8: 100 | G8: 竞技场_商品 | M8: 999999 | N8: 资源 | O8: 声望 | P8: 1000 | Q8: 1000
B9: 100004 | C9: ="竞技场_"&RC[2] -> 竞技场_刘备碎片 | D9: 物品 | E9: 刘备碎片 | F9: 1 | G9: 竞技场_商品 | L9: 1 | M9: 999999 | N9: 资源 | O9: 声望 | P9: 300 | Q9: 300
B10: 100005 | C10: ="竞技场_"&RC[2] -> 竞技场_庞统碎片 | D10: 物品 | E10: 庞统碎片 | F10: 1 | G10: 竞技场_商品 | L10: 1 | M10: 999999 | N10: 资源 | O10: 声望 | P10: 300 | Q10: 300
B11: 100006 | C11: ="竞技场_"&RC[2] -> 竞技场_郭嘉碎片 | D11: 物品 | E11: 郭嘉碎片 | F11: 1 | G11: 竞技场_商品 | L11: 1 | M11: 999999 | N11: 资源 | O11: 声望 | P11: 300 | Q11: 300
B12: 100007 | C12: ="竞技场_"&RC[2] -> 竞技场_貂蝉碎片 | D12: 物品 | E12: 貂蝉碎片 | F12: 1 | G12: 竞技场_商品 | L12: 1 | M12: 999999 | N12: 资源 | O12: 声望 | P12: 300 | Q12: 300
B13: 100008 | C13: ="竞技场_"&RC[2] -> 竞技场_张郃碎片 | D13: 物品 | E13: 张郃碎片 | F13: 1 | G13: 竞技场_商品 | L13: 1 | M13: 999999 | N13: 资源 | O13: 声望 | P13: 300 | Q13: 300
B14: 100009 | C14: ="竞技场_"&RC[2] -> 竞技场_于吉碎片 | D14: 物品 | E14: 于吉碎片 | F14: 1 | G14: 竞技场_商品 | L14: 1 | M14: 999999 | N14: 资源 | O14: 声望 | P14: 300 | Q14: 300
B15: 100010 | C15: ="竞技场_"&RC[2] -> 竞技场_关羽碎片 | D15: 物品 | E15: 关羽碎片 | F15: 3 | G15: 竞技场_商品 | H15: 城主等级>=55 | I15: 城主等级>=60 | J15: TID_SHOP_ARENA_LIMIT_LEVEL_60 | L15: 1 | M15: 999999 | N15: 资源 | O15: 声望 | P15: 1000 | Q15: 1000
N16: 物品 | O16: 红色武将精华 | P16: 1 | Q16: 1
B17: 100011 | C17: ="竞技场_"&RC[2] -> 竞技场_甄宓碎片 | D17: 物品 | E17: 甄宓碎片 | F17: 3 | G17: 竞技场_商品 | H17: 城主等级>=55 | I17: 城主等级>=60 | J17: TID_SHOP_ARENA_LIMIT_LEVEL_60 | L17: 1 | M17: 999999 | N17: 资源 | O17: 声望 | P17: 1000 | Q17: 1000
N18: 物品 | O18: 红色武将精华 | P18: 1 | Q18: 1
B19: 100012 | C19: ="竞技场_"&RC[2] -> 竞技场_张角碎片 | D19: 物品 | E19: 张角碎片 | F19: 3 | G19: 竞技场_商品 | H19: 城主等级>=55 | I19: 城主等级>=60 | J19: TID_SHOP_ARENA_LIMIT_LEVEL_60 | L19: 1 | M19: 999999 | N19: 资源 | O19: 声望 | P19: 1000 | Q19: 1000
N20: 物品 | O20: 红色武将精华 | P20: 1 | Q20: 1
B21: 100013 | C21: 竞技场_闪卡洗炼材料 | D21: 物品 | E21: 闪卡洗炼材料 | F21: 1 | G21: 竞技场_商品 | H21: 城主等级>=100 | M21: 1 | N21: 资源 | O21: 声望 | P21: 200 | Q21: 200

Sheet: ArenaBonus
A1: !LR! | B1: ID | C1: Name | D1: ItemType | E1: ItemName | F1: ItemAmount | G1: Classify | H1: BuyLimit | I1: Tips | J1: Shining | K1: Recommend | L1: Count | M1: CostType | N1: Cost | O1: StandardAmount | P1: Amount | Q1: dummy
B2: int | C2: string | D2: string | E2: string | F2: int | G2: string | H2: string | I2: string | J2: boolean | K2: boolean | L2: int | M2: string | N2: string | O2: int | P2: int | Q2: string
D3: optional | E3: optional | F3: optional | G3: optional | H3: optional | I3: optional | J3: optional | K3: optional | L3: optional | M3: array | N3: array | O3: array | P3: array | Q3: ignore
A4: ### | D4: 商品类型 | E4: 商品名 | F4: 数量 | G4: 分类 | H4: 购买条件 | I4: 条件提示 | J4: 高光边框 | K4: 推荐文本 | L4: 购买限次 | M4: 资源类型 | N4: 资源名 | O4: 标准价格 | P4: 当前价格
A5: 定义 | C5: 商品
B6: 200001 | C6: ="竞技场奖励_"&RC[2]&"_"&COUNTIF(R6C5:RC[2],"="&RC[2]) -> 竞技场奖励_银龙宝宝整卡_1 | D6: 物品 | E6: 银龙宝宝整卡 | F6: 3 | G6: 竞技场_奖励 | H6: 竞技场最高排名<10001 | I6: TID_SHOP_ARENA_LIMIT_RANK_10000 | J6: 1 | L6: 1 | M6: 资源 | N6: 声望 | O6: =RC[1]*10 -> 1200 | P6: 120
B7: 200002 | C7: ="竞技场奖励_"&R[1]C[2]&"_"&COUNTIF(R6C5:R[1]C[2],"="&R[1]C[2]) -> 竞技场奖励_银两_1 | D7: 物品 | E7: 粮草 | F7: 600 | G7: 竞技场_奖励 | H7: 竞技场最高排名<3501 | I7: TID_SHOP_ARENA_LIMIT_RANK_3500 | J7: 1 | L7: 1 | M7: 资源 | N7: 声望 | O7: =RC[1]*10 -> 1200 | P7: 120
B8: 200003 | C8: ="竞技场奖励_"&R[-1]C[2]&"_"&COUNTIF(R6C5:RC[2],"="&R[-1]C[2]) -> 竞技场奖励_粮草_1 | D8: 资源 | E8: 银两 | F8: 100000 | G8: 竞技场_奖励 | H8: 竞技场最高排名<3001 | I8: TID_SHOP_ARENA_LIMIT_RANK_3000 | J8: 1 | L8: 1 | M8: 资源 | N8: 声望 | O8: =RC[1]*10 -> 1000 | P8: 100
B9: 200004 | C9: ="竞技场奖励_"&RC[2]&"_"&COUNTIF(R6C5:RC[2],"="&RC[2]) -> 竞技场奖励_元宝_1 | D9: 资源 | E9: 元宝 | F9: 500 | G9: 竞技场_奖励 | H9: 竞技场最高排名<2501 | I9: TID_SHOP_ARENA_LIMIT_RANK_2500 | J9: 1 | L9: 1 | M9: 资源 | N9: 声望 | O9: =RC[1]*10 -> 5000 | P9: 500
B10: 200005 | C10: ="竞技场奖励_"&RC[2]&"_"&COUNTIF(R6C5:RC[2],"="&RC[2]) -> 竞技场奖励_银龙宝宝整卡_2 | D10: 物品 | E10: 银龙宝宝整卡 | F10: 5 | G10: 竞技场_奖励 | H10: 竞技场最高排名<2001 | I10: TID_SHOP_ARENA_LIMIT_RANK_2000 | J10: 1 | L10: 1 | M10: 资源 | N10: 声望 | O10: =RC[1]*10 -> 2000 | P10: 200
B11: 200006 | C11: ="竞技场奖励_"&RC[2]&"_"&COUNTIF(R6C5:RC[2],"="&RC[2]) -> 竞技场奖励_粮草_2 | D11: 物品 | E11: 粮草 | F11: 800 | G11: 竞技场_奖励 | H11: 竞技场最高排名<1501 | I11: TID_SHOP_ARENA_LIMIT_RANK_1500 | J11: 1 | L11: 1 | M11: 资源 | N11: 声望 | O11: =RC[1]*10 -> 1600 | P11: 160
B12: 200007 | C12: ="竞技场奖励_"&RC[2]&"_"&COUNTIF(R6C5:RC[2],"="&RC[2]) -> 竞技场奖励_银两_2 | D12: 资源 | E12: 银两 | F12: 200000 | G12: 竞技场_奖励 | H12: 竞技场最高排名<1201 | I12: TID_SHOP_ARENA_LIMIT_RANK_1200 | J12: 1 | L12: 1 | M12: 资源 | N12: 声望 | O12: =RC[1]*10 -> 2000 | P12: 200
B13: 200008 | C13: ="竞技场奖励_"&RC[2]&"_"&COUNTIF(R6C5:RC[2],"="&RC[2]) -> 竞技场奖励_白银经验宝物整宝物_1 | D13: 物品 | E13: 白银经验宝物整宝物 | F13: 5 | G13: 竞技场_奖励 | H13: 竞技场最高排名<1001 | I13: TID_SHOP_ARENA_LIMIT_RANK_1000 | J13: 1 | L13: 1 | M13: 资源 | N13: 声望 | O13: =RC[1]*10 -> 10000 | P13: 1000
B14: 200009 | C14: ="竞技场奖励_"&RC[2]&"_"&COUNTIF(R6C5:RC[2],"="&RC[2]) -> 竞技场奖励_元宝_2 | D14: 资源 | E14: 元宝 | F14: 500 | G14: 竞技场_奖励 | H14: 竞技场最高排名<901 | I14: TID_SHOP_ARENA_LIMIT_RANK_900 | J14: 1 | L14: 1 | M14: 资源 | N14: 声望 | O14: =RC[1]*10 -> 5000 | P14: 500
B15: 200010 | C15: ="竞技场奖励_"&RC[2]&"_"&COUNTIF(R6C5:RC[2],"="&RC[2]) -> 竞技场奖励_紫色武将之魂_1 | D15: 物品 | E15: 紫色武将之魂 | F15: 1 | G15: 竞技场_奖励 | H15: 竞技场最高排名<801 | I15: TID_SHOP_ARENA_LIMIT_RANK_800 | J15: 1 | L15: 1 | M15: 资源 | N15: 声望 | O15: =RC[1]*10 -> 8000 | P15: 800
B16: 200011 | C16: ="竞技场奖励_"&RC[2]&"_"&COUNTIF(R6C5:RC[2],"="&RC[2]) -> 竞技场奖励_银两_3 | D16: 资源 | E16: 银两 | F16: 300000 | G16: 竞技场_奖励 | H16: 竞技场最高排名<701 | I16: TID_SHOP_ARENA_LIMIT_RANK_700 | J16: 1 | L16: 1 | M16: 资源 | N16: 声望 | O16: =RC[1]*10 -> 3000 | P16: 300
B17: 200012 | C17: ="竞技场奖励_"&RC[2]&"_"&COUNTIF(R6C5:RC[2],"="&RC[2]) -> 竞技场奖励_突破石_1 | D17: 物品 | E17: 突破石 | F17: 600 | G17: 竞技场_奖励 | H17: 竞技场最高排名<601 | I17: TID_SHOP_ARENA_LIMIT_RANK_600 | J17: 1 | L17: 1 | M17: 资源 | N17: 声望 | O17: =RC[1]*10 -> 6000 | P17: 600
B18: 200013 | C18: ="竞技场奖励_"&RC[2]&"_"&COUNTIF(R6C5:RC[2],"="&RC[2]) -> 竞技场奖励_粮草_3 | D18: 物品 | E18: 粮草 | F18: 1500 | G18: 竞技场_奖励 | H18: 竞技场最高排名<501 | I18: TID_SHOP_ARENA_LIMIT_RANK_500 | J18: 1 | L18: 1 | M18: 资源 | N18: 声望 | O18: =RC[1]*10 -> 3000 | P18: 300
B19: 200014 | C19: ="竞技场奖励_"&RC[2]&"_"&COUNTIF(R6C5:RC[2],"="&RC[2]) -> 竞技场奖励_紫装碎片箱_1 | D19: 物品 | E19: 紫装碎片箱 | F19: 10 | G19: 竞技场_奖励 | H19: 竞技场最高排名<401 | I19: TID_SHOP_ARENA_LIMIT_RANK_400 | J19: 1 | L19: 1 | M19: 资源 | N19: 声望 | O19: =RC[1]*10 -> 1600 | P19: 160
B20: 200015 | C20: ="竞技场奖励_"&RC[2]&"_"&COUNTIF(R6C5:RC[2],"="&RC[2]) -> 竞技场奖励_银两_4 | D20: 资源 | E20: 银两 | F20: 500000 | G20: 竞技场_奖励 | H20: 竞技场最高排名<301 | I20: TID_SHOP_ARENA_LIMIT_RANK_300 | J20: 1 | L20: 1 | M20: 资源 | N20: 声望 | O20: =RC[1]*10 -> 5000 | P20: 500
B21: 200016 | C21: ="竞技场奖励_"&RC[2]&"_"&COUNTIF(R6C5:RC[2],"="&RC[2]) -> 竞技场奖励_装备高级升品材料橙_1 | D21: 物品 | E21: 装备高级升品材料橙 | F21: 30 | G21: 竞技场_奖励 | H21: 竞技场最高排名<201 | I21: TID_SHOP_ARENA_LIMIT_RANK_200 | J21: 1 | L21: 1 | M21: 资源 | N21: 声望 | O21: =RC[1]*10 -> 7200 | P21: 720
B22: 200017 | C22: ="竞技场奖励_"&RC[2]&"_"&COUNTIF(R6C5:RC[2],"="&RC[2]) -> 竞技场奖励_元宝_3 | D22: 资源 | E22: 元宝 | F22: 1000 | G22: 竞技场_奖励 | H22: 竞技场最高排名<101 | I22: TID_SHOP_ARENA_LIMIT_RANK_100 | J22: 1 | L22: 1 | M22: 资源 | N22: 声望 | O22: =RC[1]*10 -> 10000 | P22: 1000
B23: 200018 | C23: ="竞技场奖励_"&RC[2]&"_"&COUNTIF(R6C5:RC[2],"="&RC[2]) -> 竞技场奖励_中级精炼石_1 | D23: 物品 | E23: 中级精炼石 | F23: 50 | G23: 竞技场_奖励 | H23: 竞技场最高排名<51 | I23: TID_SHOP_ARENA_LIMIT_RANK_50 | J23: 1 | L23: 1 | M23: 资源 | N23: 声望 | O23: =RC[1]*10 -> 4000 | P23: 400
B24: 200019 | C24: ="竞技场奖励_"&RC[2]&"_"&COUNTIF(R6C5:RC[2],"="&RC[2]) -> 竞技场奖励_宝物精炼石_1 | D24: 物品 | E24: 宝物精炼石 | F24: 1000 | G24: 竞技场_奖励 | H24: 竞技场最高排名<31 | I24: TID_SHOP_ARENA_LIMIT_RANK_30 | J24: 1 | L24: 1 | M24: 资源 | N24: 声望 | O24: =RC[1]*10 -> 50000 | P24: 5000
B25: 200020 | C25: ="竞技场奖励_"&RC[2]&"_"&COUNTIF(R6C5:RC[2],"="&RC[2]) -> 竞技场奖励_宝物橙_攻击_暴击整宝物_1 | D25: 物品 | E25: 宝物橙_攻击_暴击整宝物 | F25: 1 | G25: 竞技场_奖励 | H25: 竞技场最高排名<11 | I25: TID_SHOP_ARENA_LIMIT_RANK_10 | J25: 1 | L25: 1 | M25: 资源 | N25: 声望 | O25: =RC[1]*10 -> 4000 | P25: 400
B26: 200021 | C26: ="竞技场奖励_"&RC[2]&"_"&COUNTIF(R6C5:RC[2],"="&RC[2]) -> 竞技场奖励_宝物橙_生命_抗暴整宝物_1 | D26: 物品 | E26: 宝物橙_生命_抗暴整宝物 | F26: 1 | G26: 竞技场_奖励 | H26: 竞技场最高排名<6 | I26: TID_SHOP_ARENA_LIMIT_RANK_5 | J26: 1 | L26: 1 | M26: 资源 | N26: 声望 | O26: =RC[1]*10 -> 4000 | P26: 400
B27: 200022 | C27: ="竞技场奖励_"&RC[2]&"_"&COUNTIF(R6C5:RC[2],"="&RC[2]) -> 竞技场奖励_装备高级升品材料红_1 | D27: 物品 | E27: 装备高级升品材料红 | F27: 40 | G27: 竞技场_奖励 | H27: 竞技场最高排名<4 | I27: TID_SHOP_ARENA_LIMIT_RANK_3 | J27: 1 | L27: 1 | M27: 资源 | N27: 声望 | O27: =RC[1]*10 -> 32000 | P27: 3200
B28: 200023 | C28: ="竞技场奖励_"&RC[2]&"_"&COUNTIF(R6C5:RC[2],"="&RC[2]) -> 竞技场奖励_装备高级升品材料红_2 | D28: 物品 | E28: 装备高级升品材料红 | F28: 40 | G28: 竞技场_奖励 | H28: 竞技场最高排名<2 | I28: TID_SHOP_ARENA_LIMIT_RANK_1 | J28: 1 | L28: 1 | M28: 资源 | N28: 声望 | O28: =RC[1]*10 -> 32000 | P28: 3200

Sheet: Market
A1: !LR! | B1: ID | C1: Name | D1: ItemType | E1: ItemName | F1: ItemAmount | G1: Classify | H1: ShowLimit | I1: BuyLimit | J1: Tips | K1: Shining | L1: Recommend | M1: Count | N1: CostType | O1: Cost | P1: StandardAmount | Q1: Amount | R1: FormulaAmount | S1: dummy
B2: int | C2: string | D2: string | E2: string | F2: int | G2: string | H2: string | I2: string | J2: string | K2: boolean | L2: boolean | M2: int | N2: string | O2: string | P2: int | Q2: int | R2: string | S2: string
D3: optional | E3: optional | F3: optional | G3: optional | H3: optional | I3: optional | J3: optional | K3: optional | L3: optional | M3: optional | N3: array | O3: array | P3: array | Q3: array | R3: array | S3: ignore
A4: ### | D4: 商品类型 | E4: 商品名 | F4: 数量 | G4: 分类 | H4: 显示条件 | I4: 购买条件 | J4: 条件提示 | K4: 高光边框 | L4: 推荐文本 | M4: 购买限次 | N4: 资源类型 | O4: 资源名 | P4: 标准价格 | Q4: 固定价格 | R4: 当前价格
A5: 定义 | C5: 商品
B6: 300001 | C6: 银两_商城 | D6: 资源 | E6: 银两 | F6: 10000 | G6: 商城 | M6: 30 | N6: 资源 | O6: 元宝 | P6: 10 | Q6: 5 | R6: if 购买次数 <= 20 then return 10 end return 15
B7: 300002 | C7: 铜龙宝宝_商城 | D7: 物品 | E7: 铜龙宝宝整卡 | F7: 1 | G7: 商城 | H7: 城主等级<25 | I7: 城主等级<25 | M7: 80 | N7: 资源 | O7: 元宝 | P7: 10 | Q7: 10
B8: 300003 | C8: 银龙宝宝_商城 | D8: 物品 | E8: 银龙宝宝整卡 | F8: 1 | G8: 商城 | H8: 城主等级>=25 and 城主等级<50 | I8: 城主等级>=25 and 城主等级<50 | M8: 20 | N8: 资源 | O8: 元宝 | P8: 40 | Q8: 40
B9: 300004 | C9: 金龙宝宝_商城 | D9: 物品 | E9: 金龙宝宝整卡 | F9: 1 | G9: 商城 | H9: 城主等级>=50 | I9: 城主等级>=50 | M9: 4 | N9: 资源 | O9: 元宝 | P9: 200 | Q9: 200
B10: 300005 | C10: 橙色装备宝箱_商城 | D10: 物品 | E10: 紫色装备宝箱 | F10: 1 | G10: 商城 | M10: 6 | N10: 资源 | O10: 元宝 | P10: 30 | R10: if 购买次数 <= 2 then return 24 elseif 购买次数 > 2 and 购买次数 <= 4 then return 27 elseif 购买次数 > 4 and 购买次数 <= 6 then return 30 elseif 购买次数 > 6 and 购买次数 <= 8 then return 36 elseif 购买次数 > 8 and 购买次数 <= 9 then return 42 end return 45
B11: 300006 | C11: 红色装备宝箱_商城 | D11: 物品 | E11: 橙色装备宝箱 | F11: 1 | G11: 商城 | H11: 城主等级>=35 | I11: 城主等级>=35 | M11: 12 | N11: 资源 | O11: 元宝 | P11: 100 | R11: if 购买次数 <= 1 then return 80 elseif 购买次数 > 1 and 购买次数 <= 2 then return 90 elseif 购买次数 > 2 and 购买次数 <= 3 then return 100 elseif 购买次数 > 3 and 购买次数 <= 4 then return 110 elseif 购买次数 > 4 and 购买次数 <= 5 then return 120 elseif 购买次数 > 5 and 购买次数 <= 6 then return 130 elseif 购买次数 > 6 and 购买次数 <= 7 then return 140 end return 150
B12: 300007 | C12: 橙色宝物箱子_商城 | D12: 物品 | E12: 橙色宝物箱子 | F12: 1 | G12: 商城 | M12: 6 | N12: 资源 | O12: 元宝 | P12: 120 | R12: if 购买次数 <= 2 then return 120 elseif 购买次数 > 2 and 购买次数 <= 4 then return 150 end return 180
B13: 300008 | C13: 天命石_商城 | D13: 物品 | E13: 天命石 | F13: 1 | G13: 商城 | M13: 10000 | N13: 资源 | O13: 元宝 | P13: 10 | Q13: 10
B14: 300009 | C14: 初级精炼石_商城 | D14: 物品 | E14: 初级精炼石 | F14: 1 | G14: 商城 | H14: 城主等级<35 | I14: 城主等级<35 | M14: 1000 | N14: 资源 | O14: 元宝 | P14: 2 | Q14: 2
B15: 300010 | C15: 中级精炼石_商城 | D15: 物品 | E15: 中级精炼石 | F15: 1 | G15: 商城 | H15: 城主等级>=35 and 城主等级<40 | I15: 城主等级>=35 and 城主等级<40 | M15: 250 | N15: 资源 | O15: 元宝 | P15: 8 | Q15: 8
B16: 300011 | C16: 高级精炼石_商城 | D16: 物品 | E16: 高级精炼石 | F16: 1 | G16: 商城 | H16: 城主等级>=40 and 城主等级<50 | I16: 城主等级>=40 and 城主等级<50 | M16: 100 | N16: 资源 | O16: 元宝 | P16: 20 | Q16: 20
B17: 300012 | C17: 极品精炼石_商城 | D17: 物品 | E17: 极品精炼石 | F17: 1 | G17: 商城 | H17: 城主等级>=50 | I17: 城主等级>=50 | M17: 25 | N17: 资源 | O17: 元宝 | P17: 80 | Q17: 80
B18: 300013 | C18: 青铜经验宝物_商城 | D18: 物品 | E18: 青铜经验宝物整宝物 | F18: 1 | G18: 商城 | H18: 城主等级<25 | I18: 城主等级<25 | M18: 60 | N18: 资源 | O18: 元宝 | P18: 50 | Q18: 50
B19: 300014 | C19: 白银经验宝物_商城 | D19: 物品 | E19: 白银经验宝物整宝物 | F19: 1 | G19: 商城 | H19: 城主等级>=25 and 城主等级<50 | I19: 城主等级>=25 and 城主等级<50 | M19: 15 | N19: 资源 | O19: 元宝 | P19: 200 | Q19: 200
B20: 300015 | C20: 黄金经验宝物_商城 | D20: 物品 | E20: 黄金经验宝物整宝物 | F20: 1 | G20: 商城 | H20: 城主等级>=50 | I20: 城主等级>=50 | M20: 3 | N20: 资源 | O20: 元宝 | P20: 1000 | Q20: 1000
B21: 300016 | C21: 征讨令_商城 | D21: 物品 | E21: 征讨令 | F21: 1 | G21: 商城 | M21: 5 | N21: 资源 | O21: 元宝 | P21: 10 | Q21: 10
B22: 300017 | C22: 宝物精炼石_商城 | D22: 物品 | E22: 宝物精炼石 | F22: 1 | G22: 商城 | M22: 250 | N22: 资源 | O22: 元宝 | P22: 5 | Q22: 5
B23: 300018 | C23: 刷新令_商城 | D23: 物品 | E23: 刷新令 | F23: 1 | G23: 商城 | M23: 10000 | N23: 资源 | O23: 元宝 | P23: 10 | Q23: 10
B24: 300019 | C24: 闪卡洗炼材料_商城 | D24: 物品 | E24: 闪卡洗炼材料 | F24: 1 | G24: 商城 | M24: 2 | N24: 资源 | O24: 元宝 | P24: 20 | Q24: 20
B25: 300020 | C25: 金色装备宝箱_商城 | D25: 物品 | E25: 红色装备宝箱 | F25: 1 | G25: 商城 | H25: 城主等级>=50 | I25: 城主等级>=50 | M25: 20 | N25: 资源 | O25: 元宝 | P25: 160 | R25: if 购买次数 <= 1 then return 128 elseif 购买次数 > 1 and 购买次数 <= 2 then return 144 elseif 购买次数 > 2 and 购买次数 <= 10 then return 160 elseif 购买次数 > 10 and 购买次数 <= 15 then return 200 end return 240
B26: 300021 | C26: 紫色宝物箱子_商城 | D26: 物品 | E26: 紫色宝物箱子 | F26: 1 | G26: 商城 | M26: 6 | N26: 资源 | O26: 元宝 | P26: 120 | R26: if 购买次数 <= 2 then return 60 elseif 购买次数 > 2 and 购买次数 <= 4 then return 75 end return 90
B27: 300022 | C27: 粮草_商城 | D27: 物品 | E27: 粮草 | F27: 100 | G27: 商城 | M27: 10 | N27: 资源 | O27: 元宝 | P27: 20 | Q27: 20
B28: 300023 | C28: 军械_商城 | D28: 物品 | E28: 军械 | F28: 10 | G28: 商城 | M28: 5 | N28: 资源 | O28: 元宝 | P28: 20 | Q28: 20
B29: 300024 | C29: 小兵突破卡_商城 | D29: 物品 | E29: 小兵突破卡 | F29: 1 | G29: 商城 | M29: 10 | N29: 资源 | O29: 元宝 | P29: 500 | R29: if 购买次数 <= 1 then return 60 elseif 购买次数 > 1 and 购买次数 <= 3 then return 80 elseif 购买次数 > 3 and 购买次数 <= 6 then return 100 elseif 购买次数 > 6 and 购买次数 <= 8 then return 120 end return 150
B30: 300025 | C30: 紫色兵法升级材料_商城 | D30: 物品 | E30: 紫色兵法升级材料 | F30: 1 | G30: 商城 | M30: 10 | N30: 资源 | O30: 元宝 | P30: 40 | R30: if 购买次数 <= 2 then return 30 elseif 购买次数 > 2 and 购买次数 <= 4 then return 35 elseif 购买次数 > 4 and 购买次数 <= 6 then return 40 elseif 购买次数 > 6 and 购买次数 <= 8 then return 50 end return 60

Sheet: MarketNeccesary
A1: !LR! | B1: ID | C1: Name | D1: ItemType | E1: ItemName | F1: ItemAmount | G1: Classify | H1: ShowLimit | I1: BuyLimit | J1: Tips | K1: Shining | L1: Recommend | M1: Count | N1: CostType | O1: Cost | P1: StandardAmount | Q1: Amount | R1: FormulaAmount | S1: dummy
B2: int | C2: string | D2: string | E2: string | F2: int | G2: string | H2: string | I2: string | J2: string | K2: boolean | L2: boolean | M2: int | N2: string | O2: string | P2: int | Q2: int | R2: string | S2: string
D3: optional | E3: optional | F3: optional | G3: optional | H3: optional | I3: optional | J3: optional | K3: optional | L3: optional | M3: optional | N3: array | O3: array | P3: array | Q3: array | R3: array | S3: ignore
A4: ### | D4: 商品类型 | E4: 商品名 | F4: 数量 | G4: 分类 | H4: 显示条件 | I4: 购买条件 | J4: 条件提示 | K4: 高光边框 | L4: 推荐文本 | M4: 购买限次 | N4: 资源类型 | O4: 资源名 | P4: 标准价格 | Q4: 固定价格 | R4: 当前价格
A5: 定义 | C5: 商品
B6: 400001 | C6: 体力丹_商城必买 | D6: 物品 | E6: 体力丹 | F6: 1 | G6: 商城-每日必买 | L6: 1 | M6: 5 | N6: 资源 | O6: 元宝 | P6: 25 | Q6: 25
B7: 400002 | C7: 精力丹_商城必买 | D7: 物品 | E7: 精力丹 | F7: 1 | G7: 商城-每日必买 | L7: 1 | M7: 5 | N7: 资源 | O7: 元宝 | P7: 25 | Q7: 25
B8: 400003 | C8: 银两_商城必买 | D8: 资源 | E8: 银两 | F8: 10000 | G8: 商城-每日必买 | M8: 5 | N8: 资源 | O8: 元宝 | P8: 10 | Q8: 5
B9: 400004 | C9: 征讨令_商城必买 | D9: 物品 | E9: 征讨令 | F9: 1 | G9: 商城-每日必买 | M9: 5 | N9: 资源 | O9: 元宝 | P9: 10 | Q9: 5
B10: 400005 | C10: 铜龙宝宝_商城必买 | D10: 物品 | E10: 铜龙宝宝整卡 | F10: 1 | G10: 商城-每日必买 | H10: 城主等级<25 | I10: 城主等级<25 | M10: 20 | N10: 资源 | O10: 元宝 | P10: 10 | Q10: 5
B11: 400006 | C11: 银龙宝宝_商城必买 | D11: 物品 | E11: 银龙宝宝整卡 | F11: 1 | G11: 商城-每日必买 | H11: 城主等级>=25 and 城主等级<50 | I11: 城主等级>=25 and 城主等级<50 | M11: 5 | N11: 资源 | O11: 元宝 | P11: 40 | Q11: 20
B12: 400007 | C12: 金龙宝宝_商城必买 | D12: 物品 | E12: 金龙宝宝整卡 | F12: 1 | G12: 商城-每日必买 | H12: 城主等级>=50 | I12: 城主等级>=50 | M12: 1 | N12: 资源 | O12: 元宝 | P12: 200 | Q12: 100
B13: 400008 | C13: 橙色宝物箱子_商城必买 | D13: 物品 | E13: 橙色宝物箱子 | F13: 1 | G13: 商城-每日必买 | M13: 6 | N13: 资源 | O13: 元宝 | P13: 120 | R13: if 购买次数 <= 4 then return 60 end return 90

Sheet: Hero
A1: !LR! | B1: ID | C1: Name | D1: ItemType | E1: ItemName | F1: ItemAmount | G1: Classify | H1: Count | I1: Shining | J1: Recommend | K1: CostType | L1: Cost | M1: StandardAmount | N1: Amount | O1: dummy
B2: int | C2: string | D2: string | E2: string | F2: int | G2: string | H2: int | I2: boolean | J2: boolean | K2: string | L2: string | M2: int | N2: int | O2: string
D3: optional | E3: optional | F3: optional | G3: optional | H3: optional | I3: optional | J3: optional | K3: array | L3: array | M3: array | N3: array | O3: ignore
A4: ### | D4: 商品类型 | E4: 商品名 | F4: 数量 | G4: 分类 | H4: 购买限次 | I4: 高光边框 | J4: 推荐文本 | K4: 资源类型 | L4: 资源名 | M4: 标准价格 | N4: 当前价格
A5: 定义 | C5: 商品
B6: 800001 | C6: 神将商店_铜龙宝宝_1 | D6: 物品 | E6: 铜龙宝宝整卡 | F6: 1 | G6: 神将商店_商品 | H6: 1 | K6: 资源 | L6: 将魂 | M6: 10 | N6: 10
B7: 800002 | C7: 神将商店_铜龙宝宝_5 | D7: 物品 | E7: 铜龙宝宝整卡 | F7: 5 | G7: 神将商店_商品 | H7: 1 | K7: 资源 | L7: 将魂 | M7: 50 | N7: 50
B8: 800003 | C8: 神将商店_铜龙宝宝_10 | D8: 物品 | E8: 铜龙宝宝整卡 | F8: 10 | G8: 神将商店_商品 | H8: 1 | K8: 资源 | L8: 将魂 | M8: 100 | N8: 100
B9: 800004 | C9: 神将商店_银龙宝宝_1 | D9: 物品 | E9: 银龙宝宝整卡 | F9: 1 | G9: 神将商店_商品 | H9: 1 | K9: 资源 | L9: 将魂 | M9: 20 | N9: 20
B10: 800005 | C10: 神将商店_银龙宝宝_2 | D10: 物品 | E10: 银龙宝宝整卡 | F10: 2 | G10: 神将商店_商品 | H10: 1 | K10: 资源 | L10: 将魂 | M10: 40 | N10: 40
B11: 800006 | C11: 神将商店_银龙宝宝_5 | D11: 物品 | E11: 银龙宝宝整卡 | F11: 5 | G11: 神将商店_商品 | H11: 1 | K11: 资源 | L11: 将魂 | M11: 100 | N11: 100
B12: 800007 | C12: 神将商店_金龙宝宝_1 | D12: 物品 | E12: 金龙宝宝整卡 | F12: 1 | G12: 神将商店_商品 | H12: 1 | K12: 资源 | L12: 将魂 | M12: 40 | N12: 40
B13: 800008 | C13: 神将商店_金龙宝宝_2 | D13: 物品 | E13: 金龙宝宝整卡 | F13: 2 | G13: 神将商店_商品 | H13: 1 | K13: 资源 | L13: 将魂 | M13: 80 | N13: 80
B14: 800009 | C14: 神将商店_金龙宝宝_5 | D14: 物品 | E14: 金龙宝宝整卡 | F14: 5 | G14: 神将商店_商品 | H14: 1 | K14: 资源 | L14: 将魂 | M14: 200 | N14: 200
B15: 800010 | C15: 神将商店_突破石_10 | D15: 物品 | E15: 突破石 | F15: 10 | G15: 神将商店_商品 | H15: 1 | K15: 资源 | L15: 将魂 | M15: 10 | N15: 10
B16: 800011 | C16: 神将商店_突破石_20 | D16: 物品 | E16: 突破石 | F16: 20 | G16: 神将商店_商品 | H16: 1 | K16: 资源 | L16: 将魂 | M16: 20 | N16: 20
B17: 800012 | C17: 神将商店_突破石_30 | D17: 物品 | E17: 突破石 | F17: 30 | G17: 神将商店_商品 | H17: 1 | K17: 资源 | L17: 将魂 | M17: 30 | N17: 30
B18: 800016 | C18: 神将商店_张苞碎片_10 | D18: 物品 | E18: 张苞碎片 | F18: 10 | G18: 神将商店_商品 | H18: 1 | J18: 1 | K18: 资源 | L18: 将魂 | M18: 200 | N18: 200
B19: 800017 | C19: 神将商店_关兴碎片_10 | D19: 物品 | E19: 关兴碎片 | F19: 10 | G19: 神将商店_商品 | H19: 1 | J19: 1 | K19: 资源 | L19: 将魂 | M19: 200 | N19: 200
B20: 800018 | C20: 神将商店_关索碎片_10 | D20: 物品 | E20: 关索碎片 | F20: 10 | G20: 神将商店_商品 | H20: 1 | J20: 1 | K20: 资源 | L20: 将魂 | M20: 200 | N20: 200
B21: 800019 | C21: 神将商店_鲍三娘碎片_10 | D21: 物品 | E21: 鲍三娘碎片 | F21: 10 | G21: 神将商店_商品 | H21: 1 | J21: 1 | K21: 资源 | L21: 将魂 | M21: 200 | N21: 200
B22: 800020 | C22: 神将商店_王平碎片_10 | D22: 物品 | E22: 王平碎片 | F22: 10 | G22: 神将商店_商品 | H22: 1 | J22: 1 | K22: 资源 | L22: 将魂 | M22: 200 | N22: 200
B23: 800021 | C23: 神将商店_马岱碎片_10 | D23: 物品 | E23: 马岱碎片 | F23: 10 | G23: 神将商店_商品 | H23: 1 | J23: 1 | K23: 资源 | L23: 将魂 | M23: 200 | N23: 200
B24: 800022 | C24: 神将商店_皇甫嵩碎片_10 | D24: 物品 | E24: 皇甫嵩碎片 | F24: 10 | G24: 神将商店_商品 | H24: 1 | J24: 1 | K24: 资源 | L24: 将魂 | M24: 200 | N24: 200
B25: 800023 | C25: ="神将商店_"&RC[2]&"_10" -> 神将商店_荀攸碎片_10 | D25: 物品 | E25: 荀攸碎片 | F25: 10 | G25: 神将商店_商品 | H25: 1 | J25: 1 | K25: 资源 | L25: 将魂 | M25: 200 | N25: 200
B26: 800024 | C26: ="神将商店_"&RC[2]&"_10" -> 神将商店_程昱碎片_10 | D26: 物品 | E26: 程昱碎片 | F26: 10 | G26: 神将商店_商品 | H26: 1 | J26: 1 | K26: 资源 | L26: 将魂 | M26: 200 | N26: 200
B27: 800025 | C27: ="神将商店_"&RC[2]&"_10" -> 神将商店_于禁碎片_10 | D27: 物品 | E27: 于禁碎片 | F27: 10 | G27: 神将商店_商品 | H27: 1 | J27: 1 | K27: 资源 | L27: 将魂 | M27: 200 | N27: 200
B28: 800026 | C28: ="神将商店_"&RC[2]&"_10" -> 神将商店_李典碎片_10 | D28: 物品 | E28: 李典碎片 | F28: 10 | G28: 神将商店_商品 | H28: 1 | J28: 1 | K28: 资源 | L28: 将魂 | M28: 200 | N28: 200
B29: 800027 | C29: ="神将商店_"&RC[2]&"_10" -> 神将商店_钟会碎片_10 | D29: 物品 | E29: 钟会碎片 | F29: 10 | G29: 神将商店_商品 | H29: 1 | J29: 1 | K29: 资源 | L29: 将魂 | M29: 200 | N29: 200
B30: 800028 | C30: ="神将商店_"&RC[2]&"_10" -> 神将商店_邓艾碎片_10 | D30: 物品 | E30: 邓艾碎片 | F30: 10 | G30: 神将商店_商品 | H30: 1 | J30: 1 | K30: 资源 | L30: 将魂 | M30: 200 | N30: 200
B31: 800029 | C31: ="神将商店_"&RC[2]&"_10" -> 神将商店_朱儁碎片_10 | D31: 物品 | E31: 朱儁碎片 | F31: 10 | G31: 神将商店_商品 | H31: 1 | J31: 1 | K31: 资源 | L31: 将魂 | M31: 200 | N31: 200
B32: 800030 | C32: ="神将商店_"&RC[2]&"_10" -> 神将商店_颜良碎片_10 | D32: 物品 | E32: 颜良碎片 | F32: 10 | G32: 神将商店_商品 | H32: 1 | J32: 1 | K32: 资源 | L32: 将魂 | M32: 200 | N32: 200
B33: 800031 | C33: ="神将商店_"&RC[2]&"_10" -> 神将商店_文丑碎片_10 | D33: 物品 | E33: 文丑碎片 | F33: 10 | G33: 神将商店_商品 | H33: 1 | J33: 1 | K33: 资源 | L33: 将魂 | M33: 200 | N33: 200
B34: 800032 | C34: ="神将商店_"&RC[2]&"_10" -> 神将商店_沮授碎片_10 | D34: 物品 | E34: 沮授碎片 | F34: 10 | G34: 神将商店_商品 | H34: 1 | J34: 1 | K34: 资源 | L34: 将魂 | M34: 200 | N34: 200
B35: 800033 | C35: ="神将商店_"&RC[2]&"_10" -> 神将商店_田丰碎片_10 | D35: 物品 | E35: 田丰碎片 | F35: 10 | G35: 神将商店_商品 | H35: 1 | J35: 1 | K35: 资源 | L35: 将魂 | M35: 200 | N35: 200
B36: 800034 | C36: 神将商店_刘备碎片_5 | D36: 物品 | E36: 刘备碎片 | F36: 5 | G36: 神将商店_商品 | H36: 1 | J36: 1 | K36: 资源 | L36: 将魂 | M36: 150 | N36: 150
B37: 800035 | C37: 神将商店_赵云碎片_5 | D37: 物品 | E37: 赵云碎片 | F37: 5 | G37: 神将商店_商品 | H37: 1 | J37: 1 | K37: 资源 | L37: 将魂 | M37: 150 | N37: 150
B38: 800036 | C38: 神将商店_庞统碎片_5 | D38: 物品 | E38: 庞统碎片 | F38: 5 | G38: 神将商店_商品 | H38: 1 | J38: 1 | K38: 资源 | L38: 将魂 | M38: 150 | N38: 150
B39: 800037 | C39: 神将商店_张飞碎片_5 | D39: 物品 | E39: 张飞碎片 | F39: 5 | G39: 神将商店_商品 | H39: 1 | J39: 1 | K39: 资源 | L39: 将魂 | M39: 150 | N39: 150
B40: 800038 | C40: 神将商店_黄忠碎片_5 | D40: 物品 | E40: 黄忠碎片 | F40: 5 | G40: 神将商店_商品 | H40: 1 | J40: 1 | K40: 资源 | L40: 将魂 | M40: 150 | N40: 150
B41: 800039 | C41: 神将商店_法正碎片_5 | D41: 物品 | E41: 法正碎片 | F41: 5 | G41: 神将商店_商品 | H41: 1 | J41: 1 | K41: 资源 | L41: 将魂 | M41: 150 | N41: 150
B42: 800040 | C42: ="神将商店_"&RC[2]&"_5" -> 神将商店_郭嘉碎片_5 | D42: 物品 | E42: 郭嘉碎片 | F42: 5 | G42: 神将商店_商品 | H42: 1 | J42: 1 | K42: 资源 | L42: 将魂 | M42: 150 | N42: 150
B43: 800041 | C43: ="神将商店_"&RC[2]&"_5" -> 神将商店_贾诩碎片_5 | D43: 物品 | E43: 贾诩碎片 | F43: 5 | G43: 神将商店_商品 | H43: 1 | J43: 1 | K43: 资源 | L43: 将魂 | M43: 150 | N43: 150
B44: 800042 | C44: ="神将商店_"&RC[2]&"_5" -> 神将商店_张郃碎片_5 | D44: 物品 | E44: 张郃碎片 | F44: 5 | G44: 神将商店_商品 | H44: 1 | J44: 1 | K44: 资源 | L44: 将魂 | M44: 150 | N44: 150
B45: 800043 | C45: ="神将商店_"&RC[2]&"_5" -> 神将商店_司马懿碎片_5 | D45: 物品 | E45: 司马懿碎片 | F45: 5 | G45: 神将商店_商品 | H45: 1 | J45: 1 | K45: 资源 | L45: 将魂 | M45: 150 | N45: 150
B46: 800044 | C46: ="神将商店_"&RC[2]&"_5" -> 神将商店_夏侯惇碎片_5 | D46: 物品 | E46: 夏侯惇碎片 | F46: 5 | G46: 神将商店_商品 | H46: 1 | J46: 1 | K46: 资源 | L46: 将魂 | M46: 150 | N46: 150
B47: 800045 | C47: ="神将商店_"&RC[2]&"_5" -> 神将商店_夏侯渊碎片_5 | D47: 物品 | E47: 夏侯渊碎片 | F47: 5 | G47: 神将商店_商品 | H47: 1 | J47: 1 | K47: 资源 | L47: 将魂 | M47: 150 | N47: 150
B48: 800046 | C48: ="神将商店_"&RC[2]&"_5" -> 神将商店_董卓碎片_5 | D48: 物品 | E48: 董卓碎片 | F48: 5 | G48: 神将商店_商品 | H48: 1 | J48: 1 | K48: 资源 | L48: 将魂 | M48: 150 | N48: 150
B49: 800047 | C49: ="神将商店_"&RC[2]&"_5" -> 神将商店_貂蝉碎片_5 | D49: 物品 | E49: 貂蝉碎片 | F49: 5 | G49: 神将商店_商品 | H49: 1 | J49: 1 | K49: 资源 | L49: 将魂 | M49: 150 | N49: 150
B50: 800048 | C50: ="神将商店_"&RC[2]&"_5" -> 神将商店_公孙瓒碎片_5 | D50: 物品 | E50: 公孙瓒碎片 | F50: 5 | G50: 神将商店_商品 | H50: 1 | J50: 1 | K50: 资源 | L50: 将魂 | M50: 150 | N50: 150
B51: 800049 | C51: ="神将商店_"&RC[2]&"_5" -> 神将商店_卢植碎片_5 | D51: 物品 | E51: 卢植碎片 | F51: 5 | G51: 神将商店_商品 | H51: 1 | J51: 1 | K51: 资源 | L51: 将魂 | M51: 150 | N51: 150
B52: 800050 | C52: ="神将商店_"&RC[2]&"_5" -> 神将商店_左慈碎片_5 | D52: 物品 | E52: 左慈碎片 | F52: 5 | G52: 神将商店_商品 | H52: 1 | J52: 1 | K52: 资源 | L52: 将魂 | M52: 150 | N52: 150
B53: 800051 | C53: ="神将商店_"&RC[2]&"_5" -> 神将商店_于吉碎片_5 | D53: 物品 | E53: 于吉碎片 | F53: 5 | G53: 神将商店_商品 | H53: 1 | J53: 1 | K53: 资源 | L53: 将魂 | M53: 150 | N53: 150
B54: 800052 | C54: ="神将商店_"&RC[2]&"_10" -> 神将商店_郭嘉碎片_10 | D54: 物品 | E54: 郭嘉碎片 | F54: 10 | G54: 神将商店_商品 | H54: 1 | J54: 1 | K54: 资源 | L54: 元宝 | M54: 300 | N54: 300
B55: 800053 | C55: ="神将商店_"&RC[2]&"_10" -> 神将商店_贾诩碎片_10 | D55: 物品 | E55: 贾诩碎片 | F55: 10 | G55: 神将商店_商品 | H55: 1 | J55: 1 | K55: 资源 | L55: 元宝 | M55: 300 | N55: 300
B56: 800054 | C56: ="神将商店_"&RC[2]&"_10" -> 神将商店_张郃碎片_10 | D56: 物品 | E56: 张郃碎片 | F56: 10 | G56: 神将商店_商品 | H56: 1 | J56: 1 | K56: 资源 | L56: 元宝 | M56: 300 | N56: 300
B57: 800055 | C57: ="神将商店_"&RC[2]&"_10" -> 神将商店_司马懿碎片_10 | D57: 物品 | E57: 司马懿碎片 | F57: 10 | G57: 神将商店_商品 | H57: 1 | J57: 1 | K57: 资源 | L57: 元宝 | M57: 300 | N57: 300
B58: 800056 | C58: ="神将商店_"&RC[2]&"_10" -> 神将商店_夏侯惇碎片_10 | D58: 物品 | E58: 夏侯惇碎片 | F58: 10 | G58: 神将商店_商品 | H58: 1 | J58: 1 | K58: 资源 | L58: 元宝 | M58: 300 | N58: 300
B59: 800057 | C59: ="神将商店_"&RC[2]&"_10" -> 神将商店_夏侯渊碎片_10 | D59: 物品 | E59: 夏侯渊碎片 | F59: 10 | G59: 神将商店_商品 | H59: 1 | J59: 1 | K59: 资源 | L59: 元宝 | M59: 300 | N59: 300
B60: 800058 | C60: ="神将商店_"&RC[2]&"_10" -> 神将商店_董卓碎片_10 | D60: 物品 | E60: 董卓碎片 | F60: 10 | G60: 神将商店_商品 | H60: 1 | J60: 1 | K60: 资源 | L60: 元宝 | M60: 300 | N60: 300
B61: 800059 | C61: ="神将商店_"&RC[2]&"_10" -> 神将商店_貂蝉碎片_10 | D61: 物品 | E61: 貂蝉碎片 | F61: 10 | G61: 神将商店_商品 | H61: 1 | J61: 1 | K61: 资源 | L61: 元宝 | M61: 300 | N61: 300
B62: 800060 | C62: ="神将商店_"&RC[2]&"_10" -> 神将商店_公孙瓒碎片_10 | D62: 物品 | E62: 公孙瓒碎片 | F62: 10 | G62: 神将商店_商品 | H62: 1 | J62: 1 | K62: 资源 | L62: 元宝 | M62: 300 | N62: 300
B63: 800061 | C63: ="神将商店_"&RC[2]&"_10" -> 神将商店_卢植碎片_10 | D63: 物品 | E63: 卢植碎片 | F63: 10 | G63: 神将商店_商品 | H63: 1 | J63: 1 | K63: 资源 | L63: 元宝 | M63: 300 | N63: 300
B64: 800062 | C64: ="神将商店_"&RC[2]&"_10" -> 神将商店_左慈碎片_10 | D64: 物品 | E64: 左慈碎片 | F64: 10 | G64: 神将商店_商品 | H64: 1 | J64: 1 | K64: 资源 | L64: 元宝 | M64: 300 | N64: 300
B65: 800063 | C65: ="神将商店_"&RC[2]&"_10" -> 神将商店_于吉碎片_10 | D65: 物品 | E65: 于吉碎片 | F65: 10 | G65: 神将商店_商品 | H65: 1 | J65: 1 | K65: 资源 | L65: 元宝 | M65: 300 | N65: 300
B66: 800064 | C66: 神将商店_刘备碎片_10 | D66: 物品 | E66: 刘备碎片 | F66: 10 | G66: 神将商店_商品 | H66: 1 | J66: 1 | K66: 资源 | L66: 元宝 | M66: 300 | N66: 300
B67: 800065 | C67: 神将商店_赵云碎片_10 | D67: 物品 | E67: 赵云碎片 | F67: 10 | G67: 神将商店_商品 | H67: 1 | J67: 1 | K67: 资源 | L67: 元宝 | M67: 300 | N67: 300
B68: 800066 | C68: 神将商店_庞统碎片_10 | D68: 物品 | E68: 庞统碎片 | F68: 10 | G68: 神将商店_商品 | H68: 1 | J68: 1 | K68: 资源 | L68: 元宝 | M68: 300 | N68: 300
B69: 800067 | C69: 神将商店_张飞碎片_10 | D69: 物品 | E69: 张飞碎片 | F69: 10 | G69: 神将商店_商品 | H69: 1 | J69: 1 | K69: 资源 | L69: 元宝 | M69: 300 | N69: 300
B70: 800068 | C70: 神将商店_黄忠碎片_10 | D70: 物品 | E70: 黄忠碎片 | F70: 10 | G70: 神将商店_商品 | H70: 1 | J70: 1 | K70: 资源 | L70: 元宝 | M70: 300 | N70: 300
B71: 800069 | C71: 神将商店_法正碎片_10 | D71: 物品 | E71: 法正碎片 | F71: 10 | G71: 神将商店_商品 | H71: 1 | J71: 1 | K71: 资源 | L71: 元宝 | M71: 300 | N71: 300
B72: 800070 | C72: 神将商店_诸葛亮碎片_5 | D72: 物品 | E72: 诸葛亮碎片 | F72: 5 | G72: 神将商店_商品 | H72: 1 | J72: 1 | K72: 资源 | L72: 将魂 | M72: 250 | N72: 250
B73: 800071 | C73: 神将商店_关羽碎片_5 | D73: 物品 | E73: 关羽碎片 | F73: 5 | G73: 神将商店_商品 | H73: 1 | J73: 1 | K73: 资源 | L73: 将魂 | M73: 250 | N73: 250
B74: 800072 | C74: ="神将商店_"&RC[2]&"_5" -> 神将商店_曹操碎片_5 | D74: 物品 | E74: 曹操碎片 | F74: 5 | G74: 神将商店_商品 | H74: 1 | J74: 1 | K74: 资源 | L74: 将魂 | M74: 250 | N74: 250
B75: 800073 | C75: ="神将商店_"&RC[2]&"_5" -> 神将商店_甄宓碎片_5 | D75: 物品 | E75: 甄宓碎片 | F75: 5 | G75: 神将商店_商品 | H75: 1 | J75: 1 | K75: 资源 | L75: 将魂 | M75: 250 | N75: 250
B76: 800074 | C76: ="神将商店_"&RC[2]&"_5" -> 神将商店_吕布碎片_5 | D76: 物品 | E76: 吕布碎片 | F76: 5 | G76: 神将商店_商品 | H76: 1 | J76: 1 | K76: 资源 | L76: 将魂 | M76: 250 | N76: 250
B77: 800075 | C77: ="神将商店_"&RC[2]&"_5" -> 神将商店_张角碎片_5 | D77: 物品 | E77: 张角碎片 | F77: 5 | G77: 神将商店_商品 | H77: 1 | J77: 1 | K77: 资源 | L77: 将魂 | M77: 250 | N77: 250
B78: 800076 | C78: 神将商店_诸葛亮碎片_10 | D78: 物品 | E78: 诸葛亮碎片 | F78: 10 | G78: 神将商店_商品 | H78: 1 | J78: 1 | K78: 资源 | L78: 元宝 | M78: 500 | N78: 500
B79: 800077 | C79: 神将商店_关羽碎片_10 | D79: 物品 | E79: 关羽碎片 | F79: 10 | G79: 神将商店_商品 | H79: 1 | J79: 1 | K79: 资源 | L79: 元宝 | M79: 500 | N79: 500
B80: 800078 | C80: ="神将商店_"&RC[2]&"_10" -> 神将商店_曹操碎片_10 | D80: 物品 | E80: 曹操碎片 | F80: 10 | G80: 神将商店_商品 | H80: 1 | J80: 1 | K80: 资源 | L80: 元宝 | M80: 500 | N80: 500
B81: 800079 | C81: ="神将商店_"&RC[2]&"_10" -> 神将商店_甄宓碎片_10 | D81: 物品 | E81: 甄宓碎片 | F81: 10 | G81: 神将商店_商品 | H81: 1 | J81: 1 | K81: 资源 | L81: 元宝 | M81: 500 | N81: 500
B82: 800080 | C82: ="神将商店_"&RC[2]&"_10" -> 神将商店_吕布碎片_10 | D82: 物品 | E82: 吕布碎片 | F82: 10 | G82: 神将商店_商品 | H82: 1 | J82: 1 | K82: 资源 | L82: 元宝 | M82: 500 | N82: 500
B83: 800081 | C83: ="神将商店_"&RC[2]&"_10" -> 神将商店_张角碎片_10 | D83: 物品 | E83: 张角碎片 | F83: 10 | G83: 神将商店_商品 | H83: 1 | J83: 1 | K83: 资源 | L83: 元宝 | M83: 500 | N83: 500
B84: 800082 | C84: 神将商店_张苞整卡_将魂 | D84: 物品 | E84: 张苞整卡 | F84: 1 | G84: 神将商店_商品 | H84: 1 | I84: 1 | J84: 1 | K84: 资源 | L84: 将魂 | M84: 800 | N84: 800
B85: 800083 | C85: 神将商店_关兴整卡_将魂 | D85: 物品 | E85: 关兴整卡 | F85: 1 | G85: 神将商店_商品 | H85: 1 | I85: 1 | J85: 1 | K85: 资源 | L85: 将魂 | M85: 800 | N85: 800
B86: 800084 | C86: 神将商店_关索整卡_将魂 | D86: 物品 | E86: 关索整卡 | F86: 1 | G86: 神将商店_商品 | H86: 1 | I86: 1 | J86: 1 | K86: 资源 | L86: 将魂 | M86: 800 | N86: 800
B87: 800085 | C87: 神将商店_鲍三娘整卡_将魂 | D87: 物品 | E87: 鲍三娘整卡 | F87: 1 | G87: 神将商店_商品 | H87: 1 | I87: 1 | J87: 1 | K87: 资源 | L87: 将魂 | M87: 800 | N87: 800
B88: 800086 | C88: 神将商店_王平整卡_将魂 | D88: 物品 | E88: 王平整卡 | F88: 1 | G88: 神将商店_商品 | H88: 1 | I88: 1 | J88: 1 | K88: 资源 | L88: 将魂 | M88: 800 | N88: 800
B89: 800087 | C89: 神将商店_马岱整卡_将魂 | D89: 物品 | E89: 马岱整卡 | F89: 1 | G89: 神将商店_商品 | H89: 1 | I89: 1 | J89: 1 | K89: 资源 | L89: 将魂 | M89: 800 | N89: 800
B90: 800088 | C90: 神将商店_皇甫嵩整卡_将魂 | D90: 物品 | E90: 皇甫嵩整卡 | F90: 1 | G90: 神将商店_商品 | H90: 1 | I90: 1 | J90: 1 | K90: 资源 | L90: 将魂 | M90: 800 | N90: 800
B91: 800089 | C91: ="神将商店_"&RC[2]&"_将魂" -> 神将商店_荀攸整卡_将魂 | D91: 物品 | E91: 荀攸整卡 | F91: 1 | G91: 神将商店_商品 | H91: 1 | I91: 1 | J91: 1 | K91: 资源 | L91: 将魂 | M91: 800 | N91: 800
B92: 800090 | C92: ="神将商店_"&RC[2]&"_将魂" -> 神将商店_程昱整卡_将魂 | D92: 物品 | E92: 程昱整卡 | F92: 1 | G92: 神将商店_商品 | H92: 1 | I92: 1 | J92: 1 | K92: 资源 | L92: 将魂 | M92: 800 | N92: 800
B93: 800091 | C93: ="神将商店_"&RC[2]&"_将魂" -> 神将商店_于禁整卡_将魂 | D93: 物品 | E93: 于禁整卡 | F93: 1 | G93: 神将商店_商品 | H93: 1 | I93: 1 | J93: 1 | K93: 资源 | L93: 将魂 | M93: 800 | N93: 800
B94: 800092 | C94: ="神将商店_"&RC[2]&"_将魂" -> 神将商店_李典整卡_将魂 | D94: 物品 | E94: 李典整卡 | F94: 1 | G94: 神将商店_商品 | H94: 1 | I94: 1 | J94: 1 | K94: 资源 | L94: 将魂 | M94: 800 | N94: 800
B95: 800093 | C95: ="神将商店_"&RC[2]&"_将魂" -> 神将商店_钟会整卡_将魂 | D95: 物品 | E95: 钟会整卡 | F95: 1 | G95: 神将商店_商品 | H95: 1 | I95: 1 | J95: 1 | K95: 资源 | L95: 将魂 | M95: 800 | N95: 800
B96: 800094 | C96: ="神将商店_"&RC[2]&"_将魂" -> 神将商店_邓艾整卡_将魂 | D96: 物品 | E96: 邓艾整卡 | F96: 1 | G96: 神将商店_商品 | H96: 1 | I96: 1 | J96: 1 | K96: 资源 | L96: 将魂 | M96: 800 | N96: 800
B97: 800095 | C97: ="神将商店_"&RC[2]&"_将魂" -> 神将商店_朱儁整卡_将魂 | D97: 物品 | E97: 朱儁整卡 | F97: 1 | G97: 神将商店_商品 | H97: 1 | I97: 1 | J97: 1 | K97: 资源 | L97: 将魂 | M97: 800 | N97: 800
B98: 800096 | C98: ="神将商店_"&RC[2]&"_将魂" -> 神将商店_颜良整卡_将魂 | D98: 物品 | E98: 颜良整卡 | F98: 1 | G98: 神将商店_商品 | H98: 1 | I98: 1 | J98: 1 | K98: 资源 | L98: 将魂 | M98: 800 | N98: 800
B99: 800097 | C99: ="神将商店_"&RC[2]&"_将魂" -> 神将商店_文丑整卡_将魂 | D99: 物品 | E99: 文丑整卡 | F99: 1 | G99: 神将商店_商品 | H99: 1 | I99: 1 | J99: 1 | K99: 资源 | L99: 将魂 | M99: 800 | N99: 800
B100: 800098 | C100: ="神将商店_"&RC[2]&"_将魂" -> 神将商店_沮授整卡_将魂 | D100: 物品 | E100: 沮授整卡 | F100: 1 | G100: 神将商店_商品 | H100: 1 | I100: 1 | J100: 1 | K100: 资源 | L100: 将魂 | M100: 800 | N100: 800
B101: 800099 | C101: ="神将商店_"&RC[2]&"_将魂" -> 神将商店_田丰整卡_将魂 | D101: 物品 | E101: 田丰整卡 | F101: 1 | G101: 神将商店_商品 | H101: 1 | I101: 1 | J101: 1 | K101: 资源 | L101: 将魂 | M101: 800 | N101: 800
B102: 800100 | C102: 神将商店_张苞整卡_元宝 | D102: 物品 | E102: 张苞整卡 | F102: 1 | G102: 神将商店_商品 | H102: 1 | I102: 1 | J102: 1 | K102: 资源 | L102: 元宝 | M102: 800 | N102: 800
B103: 800101 | C103: 神将商店_关兴整卡_元宝 | D103: 物品 | E103: 关兴整卡 | F103: 1 | G103: 神将商店_商品 | H103: 1 | I103: 1 | J103: 1 | K103: 资源 | L103: 元宝 | M103: 800 | N103: 800
B104: 800102 | C104: 神将商店_关索整卡_元宝 | D104: 物品 | E104: 关索整卡 | F104: 1 | G104: 神将商店_商品 | H104: 1 | I104: 1 | J104: 1 | K104: 资源 | L104: 元宝 | M104: 800 | N104: 800
B105: 800103 | C105: 神将商店_鲍三娘整卡_元宝 | D105: 物品 | E105: 鲍三娘整卡 | F105: 1 | G105: 神将商店_商品 | H105: 1 | I105: 1 | J105: 1 | K105: 资源 | L105: 元宝 | M105: 800 | N105: 800
B106: 800104 | C106: 神将商店_王平整卡_元宝 | D106: 物品 | E106: 王平整卡 | F106: 1 | G106: 神将商店_商品 | H106: 1 | I106: 1 | J106: 1 | K106: 资源 | L106: 元宝 | M106: 800 | N106: 800
B107: 800105 | C107: 神将商店_马岱整卡_元宝 | D107: 物品 | E107: 马岱整卡 | F107: 1 | G107: 神将商店_商品 | H107: 1 | I107: 1 | J107: 1 | K107: 资源 | L107: 元宝 | M107: 800 | N107: 800
B108: 800106 | C108: 神将商店_皇甫嵩整卡_元宝 | D108: 物品 | E108: 皇甫嵩整卡 | F108: 1 | G108: 神将商店_商品 | H108: 1 | I108: 1 | J108: 1 | K108: 资源 | L108: 元宝 | M108: 800 | N108: 800
B109: 800107 | C109: ="神将商店_"&RC[2]&"_元宝" -> 神将商店_荀攸整卡_元宝 | D109: 物品 | E109: 荀攸整卡 | F109: 1 | G109: 神将商店_商品 | H109: 1 | I109: 1 | J109: 1 | K109: 资源 | L109: 元宝 | M109: 800 | N109: 800
B110: 800108 | C110: ="神将商店_"&RC[2]&"_元宝" -> 神将商店_程昱整卡_元宝 | D110: 物品 | E110: 程昱整卡 | F110: 1 | G110: 神将商店_商品 | H110: 1 | I110: 1 | J110: 1 | K110: 资源 | L110: 元宝 | M110: 800 | N110: 800
B111: 800109 | C111: ="神将商店_"&RC[2]&"_元宝" -> 神将商店_于禁整卡_元宝 | D111: 物品 | E111: 于禁整卡 | F111: 1 | G111: 神将商店_商品 | H111: 1 | I111: 1 | J111: 1 | K111: 资源 | L111: 元宝 | M111: 800 | N111: 800
B112: 800110 | C112: ="神将商店_"&RC[2]&"_元宝" -> 神将商店_李典整卡_元宝 | D112: 物品 | E112: 李典整卡 | F112: 1 | G112: 神将商店_商品 | H112: 1 | I112: 1 | J112: 1 | K112: 资源 | L112: 元宝 | M112: 800 | N112: 800
B113: 800111 | C113: ="神将商店_"&RC[2]&"_元宝" -> 神将商店_钟会整卡_元宝 | D113: 物品 | E113: 钟会整卡 | F113: 1 | G113: 神将商店_商品 | H113: 1 | I113: 1 | J113: 1 | K113: 资源 | L113: 元宝 | M113: 800 | N113: 800
B114: 800112 | C114: ="神将商店_"&RC[2]&"_元宝" -> 神将商店_邓艾整卡_元宝 | D114: 物品 | E114: 邓艾整卡 | F114: 1 | G114: 神将商店_商品 | H114: 1 | I114: 1 | J114: 1 | K114: 资源 | L114: 元宝 | M114: 800 | N114: 800
B115: 800113 | C115: ="神将商店_"&RC[2]&"_元宝" -> 神将商店_朱儁整卡_元宝 | D115: 物品 | E115: 朱儁整卡 | F115: 1 | G115: 神将商店_商品 | H115: 1 | I115: 1 | J115: 1 | K115: 资源 | L115: 元宝 | M115: 800 | N115: 800
B116: 800114 | C116: ="神将商店_"&RC[2]&"_元宝" -> 神将商店_颜良整卡_元宝 | D116: 物品 | E116: 颜良整卡 | F116: 1 | G116: 神将商店_商品 | H116: 1 | I116: 1 | J116: 1 | K116: 资源 | L116: 元宝 | M116: 800 | N116: 800
B117: 800115 | C117: ="神将商店_"&RC[2]&"_元宝" -> 神将商店_文丑整卡_元宝 | D117: 物品 | E117: 文丑整卡 | F117: 1 | G117: 神将商店_商品 | H117: 1 | I117: 1 | J117: 1 | K117: 资源 | L117: 元宝 | M117: 800 | N117: 800
B118: 800116 | C118: ="神将商店_"&RC[2]&"_元宝" -> 神将商店_沮授整卡_元宝 | D118: 物品 | E118: 沮授整卡 | F118: 1 | G118: 神将商店_商品 | H118: 1 | I118: 1 | J118: 1 | K118: 资源 | L118: 元宝 | M118: 800 | N118: 800
B119: 800117 | C119: ="神将商店_"&RC[2]&"_元宝" -> 神将商店_田丰整卡_元宝 | D119: 物品 | E119: 田丰整卡 | F119: 1 | G119: 神将商店_商品 | H119: 1 | I119: 1 | J119: 1 | K119: 资源 | L119: 元宝 | M119: 800 | N119: 800
B120: 800118 | C120: 神将商店_刘备整卡_将魂 | D120: 物品 | E120: 刘备整卡 | F120: 1 | G120: 神将商店_商品 | H120: 1 | I120: 1 | J120: 1 | K120: 资源 | L120: 将魂 | M120: 2400 | N120: 2400
B121: 800119 | C121: 神将商店_赵云整卡_将魂 | D121: 物品 | E121: 赵云整卡 | F121: 1 | G121: 神将商店_商品 | H121: 1 | I121: 1 | J121: 1 | K121: 资源 | L121: 将魂 | M121: 2400 | N121: 2400
B122: 800120 | C122: 神将商店_庞统整卡_将魂 | D122: 物品 | E122: 庞统整卡 | F122: 1 | G122: 神将商店_商品 | H122: 1 | I122: 1 | J122: 1 | K122: 资源 | L122: 将魂 | M122: 2400 | N122: 2400
B123: 800121 | C123: 神将商店_张飞整卡_将魂 | D123: 物品 | E123: 张飞整卡 | F123: 1 | G123: 神将商店_商品 | H123: 1 | I123: 1 | J123: 1 | K123: 资源 | L123: 将魂 | M123: 2400 | N123: 2400
B124: 800122 | C124: 神将商店_黄忠整卡_将魂 | D124: 物品 | E124: 黄忠整卡 | F124: 1 | G124: 神将商店_商品 | H124: 1 | I124: 1 | J124: 1 | K124: 资源 | L124: 将魂 | M124: 2400 | N124: 2400
B125: 800123 | C125: 神将商店_法正整卡_将魂 | D125: 物品 | E125: 法正整卡 | F125: 1 | G125: 神将商店_商品 | H125: 1 | I125: 1 | J125: 1 | K125: 资源 | L125: 将魂 | M125: 2400 | N125: 2400
B126: 800124 | C126: ="神将商店_"&RC[2]&"_将魂" -> 神将商店_董卓整卡_将魂 | D126: 物品 | E126: 董卓整卡 | F126: 1 | G126: 神将商店_商品 | H126: 1 | I126: 1 | J126: 1 | K126: 资源 | L126: 将魂 | M126: 2400 | N126: 2400
B127: 800125 | C127: ="神将商店_"&RC[2]&"_将魂" -> 神将商店_貂蝉整卡_将魂 | D127: 物品 | E127: 貂蝉整卡 | F127: 1 | G127: 神将商店_商品 | H127: 1 | I127: 1 | J127: 1 | K127: 资源 | L127: 将魂 | M127: 2400 | N127: 2400
B128: 800126 | C128: ="神将商店_"&RC[2]&"_将魂" -> 神将商店_公孙瓒整卡_将魂 | D128: 物品 | E128: 公孙瓒整卡 | F128: 1 | G128: 神将商店_商品 | H128: 1 | I128: 1 | J128: 1 | K128: 资源 | L128: 将魂 | M128: 2400 | N128: 2400
B129: 800127 | C129: ="神将商店_"&RC[2]&"_将魂" -> 神将商店_卢植整卡_将魂 | D129: 物品 | E129: 卢植整卡 | F129: 1 | G129: 神将商店_商品 | H129: 1 | I129: 1 | J129: 1 | K129: 资源 | L129: 将魂 | M129: 2400 | N129: 2400
B130: 800128 | C130: ="神将商店_"&RC[2]&"_将魂" -> 神将商店_左慈整卡_将魂 | D130: 物品 | E130: 左慈整卡 | F130: 1 | G130: 神将商店_商品 | H130: 1 | I130: 1 | J130: 1 | K130: 资源 | L130: 将魂 | M130: 2400 | N130: 2400
B131: 800129 | C131: ="神将商店_"&RC[2]&"_将魂" -> 神将商店_于吉整卡_将魂 | D131: 物品 | E131: 于吉整卡 | F131: 1 | G131: 神将商店_商品 | H131: 1 | I131: 1 | J131: 1 | K131: 资源 | L131: 将魂 | M131: 2400 | N131: 2400
B132: 800130 | C132: ="神将商店_"&RC[2]&"_将魂" -> 神将商店_郭嘉整卡_将魂 | D132: 物品 | E132: 郭嘉整卡 | F132: 1 | G132: 神将商店_商品 | H132: 1 | I132: 1 | J132: 1 | K132: 资源 | L132: 将魂 | M132: 2400 | N132: 2400
B133: 800131 | C133: ="神将商店_"&RC[2]&"_将魂" -> 神将商店_贾诩整卡_将魂 | D133: 物品 | E133: 贾诩整卡 | F133: 1 | G133: 神将商店_商品 | H133: 1 | I133: 1 | J133: 1 | K133: 资源 | L133: 将魂 | M133: 2400 | N133: 2400
B134: 800132 | C134: ="神将商店_"&RC[2]&"_将魂" -> 神将商店_张郃整卡_将魂 | D134: 物品 | E134: 张郃整卡 | F134: 1 | G134: 神将商店_商品 | H134: 1 | I134: 1 | J134: 1 | K134: 资源 | L134: 将魂 | M134: 2400 | N134: 2400
B135: 800133 | C135: ="神将商店_"&RC[2]&"_将魂" -> 神将商店_司马懿整卡_将魂 | D135: 物品 | E135: 司马懿整卡 | F135: 1 | G135: 神将商店_商品 | H135: 1 | I135: 1 | J135: 1 | K135: 资源 | L135: 将魂 | M135: 2400 | N135: 2400
B136: 800134 | C136: ="神将商店_"&RC[2]&"_将魂" -> 神将商店_夏侯惇整卡_将魂 | D136: 物品 | E136: 夏侯惇整卡 | F136: 1 | G136: 神将商店_商品 | H136: 1 | I136: 1 | J136: 1 | K136: 资源 | L136: 将魂 | M136: 2400 | N136: 2400
B137: 800135 | C137: ="神将商店_"&RC[2]&"_将魂" -> 神将商店_夏侯渊整卡_将魂 | D137: 物品 | E137: 夏侯渊整卡 | F137: 1 | G137: 神将商店_商品 | H137: 1 | I137: 1 | J137: 1 | K137: 资源 | L137: 将魂 | M137: 2400 | N137: 2400
B138: 800136 | C138: 神将商店_刘备整卡_元宝 | D138: 物品 | E138: 刘备整卡 | F138: 1 | G138: 神将商店_商品 | H138: 1 | I138: 1 | J138: 1 | K138: 资源 | L138: 元宝 | M138: 2400 | N138: 2400
B139: 800137 | C139: 神将商店_赵云整卡_元宝 | D139: 物品 | E139: 赵云整卡 | F139: 1 | G139: 神将商店_商品 | H139: 1 | I139: 1 | J139: 1 | K139: 资源 | L139: 元宝 | M139: 2400 | N139: 2400
B140: 800138 | C140: 神将商店_庞统整卡_元宝 | D140: 物品 | E140: 庞统整卡 | F140: 1 | G140: 神将商店_商品 | H140: 1 | I140: 1 | J140: 1 | K140: 资源 | L140: 元宝 | M140: 2400 | N140: 2400
B141: 800139 | C141: 神将商店_张飞整卡_元宝 | D141: 物品 | E141: 张飞整卡 | F141: 1 | G141: 神将商店_商品 | H141: 1 | I141: 1 | J141: 1 | K141: 资源 | L141: 元宝 | M141: 2400 | N141: 2400
B142: 800140 | C142: 神将商店_黄忠整卡_元宝 | D142: 物品 | E142: 黄忠整卡 | F142: 1 | G142: 神将商店_商品 | H142: 1 | I142: 1 | J142: 1 | K142: 资源 | L142: 元宝 | M142: 2400 | N142: 2400
B143: 800141 | C143: 神将商店_法正整卡_元宝 | D143: 物品 | E143: 法正整卡 | F143: 1 | G143: 神将商店_商品 | H143: 1 | I143: 1 | J143: 1 | K143: 资源 | L143: 元宝 | M143: 2400 | N143: 2400
B144: 800142 | C144: ="神将商店_"&RC[2]&"_元宝" -> 神将商店_董卓整卡_元宝 | D144: 物品 | E144: 董卓整卡 | F144: 1 | G144: 神将商店_商品 | H144: 1 | I144: 1 | J144: 1 | K144: 资源 | L144: 元宝 | M144: 2400 | N144: 2400
B145: 800143 | C145: ="神将商店_"&RC[2]&"_元宝" -> 神将商店_貂蝉整卡_元宝 | D145: 物品 | E145: 貂蝉整卡 | F145: 1 | G145: 神将商店_商品 | H145: 1 | I145: 1 | J145: 1 | K145: 资源 | L145: 元宝 | M145: 2400 | N145: 2400
B146: 800144 | C146: ="神将商店_"&RC[2]&"_元宝" -> 神将商店_公孙瓒整卡_元宝 | D146: 物品 | E146: 公孙瓒整卡 | F146: 1 | G146: 神将商店_商品 | H146: 1 | I146: 1 | J146: 1 | K146: 资源 | L146: 元宝 | M146: 2400 | N146: 2400
B147: 800145 | C147: ="神将商店_"&RC[2]&"_元宝" -> 神将商店_卢植整卡_元宝 | D147: 物品 | E147: 卢植整卡 | F147: 1 | G147: 神将商店_商品 | H147: 1 | I147: 1 | J147: 1 | K147: 资源 | L147: 元宝 | M147: 2400 | N147: 2400
B148: 800146 | C148: ="神将商店_"&RC[2]&"_元宝" -> 神将商店_左慈整卡_元宝 | D148: 物品 | E148: 左慈整卡 | F148: 1 | G148: 神将商店_商品 | H148: 1 | I148: 1 | J148: 1 | K148: 资源 | L148: 元宝 | M148: 2400 | N148: 2400
B149: 800147 | C149: ="神将商店_"&RC[2]&"_元宝" -> 神将商店_于吉整卡_元宝 | D149: 物品 | E149: 于吉整卡 | F149: 1 | G149: 神将商店_商品 | H149: 1 | I149: 1 | J149: 1 | K149: 资源 | L149: 元宝 | M149: 2400 | N149: 2400
B150: 800148 | C150: ="神将商店_"&RC[2]&"_元宝" -> 神将商店_郭嘉整卡_元宝 | D150: 物品 | E150: 郭嘉整卡 | F150: 1 | G150: 神将商店_商品 | H150: 1 | I150: 1 | J150: 1 | K150: 资源 | L150: 元宝 | M150: 2400 | N150: 2400
B151: 800149 | C151: ="神将商店_"&RC[2]&"_元宝" -> 神将商店_贾诩整卡_元宝 | D151: 物品 | E151: 贾诩整卡 | F151: 1 | G151: 神将商店_商品 | H151: 1 | I151: 1 | J151: 1 | K151: 资源 | L151: 元宝 | M151: 2400 | N151: 2400
B152: 800150 | C152: ="神将商店_"&RC[2]&"_元宝" -> 神将商店_张郃整卡_元宝 | D152: 物品 | E152: 张郃整卡 | F152: 1 | G152: 神将商店_商品 | H152: 1 | I152: 1 | J152: 1 | K152: 资源 | L152: 元宝 | M152: 2400 | N152: 2400
B153: 800151 | C153: ="神将商店_"&RC[2]&"_元宝" -> 神将商店_司马懿整卡_元宝 | D153: 物品 | E153: 司马懿整卡 | F153: 1 | G153: 神将商店_商品 | H153: 1 | I153: 1 | J153: 1 | K153: 资源 | L153: 元宝 | M153: 2400 | N153: 2400
B154: 800152 | C154: ="神将商店_"&RC[2]&"_元宝" -> 神将商店_夏侯惇整卡_元宝 | D154: 物品 | E154: 夏侯惇整卡 | F154: 1 | G154: 神将商店_商品 | H154: 1 | I154: 1 | J154: 1 | K154: 资源 | L154: 元宝 | M154: 2400 | N154: 2400
B155: 800153 | C155: ="神将商店_"&RC[2]&"_元宝" -> 神将商店_夏侯渊整卡_元宝 | D155: 物品 | E155: 夏侯渊整卡 | F155: 1 | G155: 神将商店_商品 | H155: 1 | I155: 1 | J155: 1 | K155: 资源 | L155: 元宝 | M155: 2400 | N155: 2400
B156: 800154 | C156: 神将商店_诸葛亮整卡_将魂 | D156: 物品 | E156: 诸葛亮整卡 | F156: 1 | G156: 神将商店_商品 | H156: 1 | I156: 1 | J156: 1 | K156: 资源 | L156: 将魂 | M156: 7500 | N156: 7500
B157: 800155 | C157: 神将商店_关羽整卡_将魂 | D157: 物品 | E157: 关羽整卡 | F157: 1 | G157: 神将商店_商品 | H157: 1 | I157: 1 | J157: 1 | K157: 资源 | L157: 将魂 | M157: 7500 | N157: 7500
B158: 800156 | C158: ="神将商店_"&RC[2]&"_将魂" -> 神将商店_曹操整卡_将魂 | D158: 物品 | E158: 曹操整卡 | F158: 1 | G158: 神将商店_商品 | H158: 1 | I158: 1 | J158: 1 | K158: 资源 | L158: 将魂 | M158: 7500 | N158: 7500
B159: 800157 | C159: ="神将商店_"&RC[2]&"_将魂" -> 神将商店_甄宓整卡_将魂 | D159: 物品 | E159: 甄宓整卡 | F159: 1 | G159: 神将商店_商品 | H159: 1 | I159: 1 | J159: 1 | K159: 资源 | L159: 将魂 | M159: 7500 | N159: 7500
B160: 800158 | C160: ="神将商店_"&RC[2]&"_将魂" -> 神将商店_吕布整卡_将魂 | D160: 物品 | E160: 吕布整卡 | F160: 1 | G160: 神将商店_商品 | H160: 1 | I160: 1 | J160: 1 | K160: 资源 | L160: 将魂 | M160: 7500 | N160: 7500
B161: 800159 | C161: ="神将商店_"&RC[2]&"_将魂" -> 神将商店_张角整卡_将魂 | D161: 物品 | E161: 张角整卡 | F161: 1 | G161: 神将商店_商品 | H161: 1 | I161: 1 | J161: 1 | K161: 资源 | L161: 将魂 | M161: 7500 | N161: 7500
B162: 800160 | C162: 神将商店_诸葛亮整卡_元宝 | D162: 物品 | E162: 诸葛亮整卡 | F162: 1 | G162: 神将商店_商品 | H162: 1 | I162: 1 | J162: 1 | K162: 资源 | L162: 元宝 | M162: 7500 | N162: 7500
B163: 800161 | C163: 神将商店_关羽整卡_元宝 | D163: 物品 | E163: 关羽整卡 | F163: 1 | G163: 神将商店_商品 | H163: 1 | I163: 1 | J163: 1 | K163: 资源 | L163: 元宝 | M163: 7500 | N163: 7500
B164: 800162 | C164: ="神将商店_"&RC[2]&"_元宝" -> 神将商店_曹操整卡_元宝 | D164: 物品 | E164: 曹操整卡 | F164: 1 | G164: 神将商店_商品 | H164: 1 | I164: 1 | J164: 1 | K164: 资源 | L164: 元宝 | M164: 7500 | N164: 7500
B165: 800163 | C165: ="神将商店_"&RC[2]&"_元宝" -> 神将商店_甄宓整卡_元宝 | D165: 物品 | E165: 甄宓整卡 | F165: 1 | G165: 神将商店_商品 | H165: 1 | I165: 1 | J165: 1 | K165: 资源 | L165: 元宝 | M165: 7500 | N165: 7500
B166: 800164 | C166: ="神将商店_"&RC[2]&"_元宝" -> 神将商店_吕布整卡_元宝 | D166: 物品 | E166: 吕布整卡 | F166: 1 | G166: 神将商店_商品 | H166: 1 | I166: 1 | J166: 1 | K166: 资源 | L166: 元宝 | M166: 7500 | N166: 7500
B167: 800165 | C167: ="神将商店_"&RC[2]&"_元宝" -> 神将商店_张角整卡_元宝 | D167: 物品 | E167: 张角整卡 | F167: 1 | G167: 神将商店_商品 | H167: 1 | I167: 1 | J167: 1 | K167: 资源 | L167: 元宝 | M167: 7500 | N167: 7500

Sheet: Wushuang
A1: !LR! | B1: ID | C1: Name | D1: ItemType | E1: ItemName | F1: ItemAmount | G1: Classify | H1: ShowLimit | I1: BuyLimit | J1: Tips | K1: Shining | L1: Recommend | M1: Count | N1: CostType | O1: Cost | P1: StandardAmount | Q1: Amount | R1: dummy
B2: int | C2: string | D2: string | E2: string | F2: int | G2: string | H2: string | I2: string | J2: string | K2: boolean | L2: boolean | M2: int | N2: string | O2: string | P2: int | Q2: int | R2: string
D3: optional | E3: optional | F3: optional | G3: optional | H3: optional | I3: optional | J3: optional | K3: optional | L3: optional | M3: optional | N3: array | O3: array | P3: array | Q3: array | R3: ignore
A4: ### | D4: 商品类型 | E4: 商品名 | F4: 数量 | G4: 分类 | H4: 显示条件 | I4: 购买条件 | J4: 条件提示 | K4: 高光边框 | L4: 推荐文本 | M4: 购买限次 | N4: 资源类型 | O4: 资源名 | P4: 标准价格 | Q4: 当前价格
A5: 定义 | C5: 商品
B6: 900001 | C6: 无双_初级精炼石 | D6: 物品 | E6: 初级精炼石 | F6: 1 | G6: 无双商店_消耗品 | M6: 999999 | N6: 资源 | O6: 威名 | P6: 20 | Q6: 20
B7: 900002 | C7: 无双_中级精炼石 | D7: 物品 | E7: 中级精炼石 | F7: 1 | G7: 无双商店_消耗品 | M7: 999999 | N7: 资源 | O7: 威名 | P7: 40 | Q7: 40
B8: 900003 | C8: 无双_高级精炼石 | D8: 物品 | E8: 高级精炼石 | F8: 1 | G8: 无双商店_消耗品 | M8: 999999 | N8: 资源 | O8: 威名 | P8: 100 | Q8: 100
B9: 900004 | C9: 无双_极品精炼石_10 | D9: 物品 | E9: 极品精炼石 | F9: 10 | G9: 无双商店_消耗品 | M9: 999999 | N9: 资源 | O9: 威名 | P9: 2000 | Q9: 2000
B10: 900005 | C10: 无双_宝物精炼石_1 | D10: 物品 | E10: 宝物精炼石 | F10: 1 | G10: 无双商店_消耗品 | M10: 999999 | N10: 资源 | O10: 威名 | P10: 50 | Q10: 50
B11: 900006 | C11: 无双_宝物精炼石_100 | D11: 物品 | E11: 宝物精炼石 | F11: 100 | G11: 无双商店_消耗品 | M11: 999999 | N11: 资源 | O11: 威名 | P11: 5000 | Q11: 5000
B12: 900007 | C12: 无双_红色装备精华 | D12: 物品 | E12: 红色装备精华 | F12: 1 | G12: 无双商店_消耗品 | H12: 无双星数>=55 | I12: 无双星数>=70 | J12: TID_SHOP_WUSHUANG_LIMIT_STAR_70 | M12: 4 | N12: 资源 | O12: 元宝 | P12: 50 | Q12: 50
B13: 900008 | C13: 无双_百炼钢_1 | D13: 物品 | E13: 装备升品材料绿 | F13: 1 | G13: 无双商店_消耗品 | M13: 999999 | N13: 资源 | O13: 威名 | P13: 10 | Q13: 10
B14: 900009 | C14: 无双_百炼钢_10 | D14: 物品 | E14: 装备升品材料绿 | F14: 10 | G14: 无双商店_消耗品 | M14: 999999 | N14: 资源 | O14: 威名 | P14: 100 | Q14: 100
B15: 900010 | C15: 无双_百炼钢_100 | D15: 物品 | E15: 装备升品材料绿 | F15: 100 | G15: 无双商店_消耗品 | M15: 999999 | N15: 资源 | O15: 威名 | P15: 1000 | Q15: 1000
B16: 900011 | C16: 无双_装备高级升品材料紫 | D16: 物品 | E16: 装备高级升品材料紫 | F16: 1 | G16: 无双商店_消耗品 | M16: 999999 | N16: 资源 | O16: 威名 | P16: 80 | Q16: 80
B17: 900012 | C17: 无双_装备高级升品材料橙 | D17: 物品 | E17: 装备高级升品材料橙 | F17: 1 | G17: 无双商店_消耗品 | I17: 无双星数>=20 | J17: TID_SHOP_WUSHUANG_LIMIT_STAR_20 | M17: 999999 | N17: 资源 | O17: 威名 | P17: 240 | Q17: 240
B18: 900013 | C18: 无双_装备高级升品材料红 | D18: 物品 | E18: 装备高级升品材料红 | F18: 1 | G18: 无双商店_消耗品 | I18: 无双星数>=40 | J18: TID_SHOP_WUSHUANG_LIMIT_STAR_40 | M18: 999999 | N18: 资源 | O18: 威名 | P18: 800 | Q18: 800
B19: 900014 | C19: 无双_装备高级升品材料金 | D19: 物品 | E19: 装备高级升品材料金 | F19: 1 | G19: 无双商店_消耗品 | H19: 无双星数>=55 | I19: 无双星数>=70 | J19: TID_SHOP_WUSHUANG_LIMIT_STAR_70 | M19: 999999 | N19: 资源 | O19: 威名 | P19: 1000 | Q19: 1000
N20: 物品 | O20: 红色装备精华 | P20: 2 | Q20: 2

Sheet: WushuangBonus
A1: !LR! | B1: ID | C1: Name | D1: ItemType | E1: ItemName | F1: ItemAmount | G1: Classify | H1: ShowLimit | I1: BuyLimit | J1: Tips | K1: Shining | L1: Recommend | M1: Count | N1: CostType | O1: Cost | P1: StandardAmount | Q1: Amount | R1: dummy
B2: int | C2: string | D2: string | E2: string | F2: int | G2: string | H2: string | I2: string | J2: string | K2: boolean | L2: boolean | M2: int | N2: string | O2: string | P2: int | Q2: int | R2: string
D3: optional | E3: optional | F3: optional | G3: optional | H3: optional | I3: optional | J3: optional | K3: optional | L3: optional | M3: optional | N3: array | O3: array | P3: array | Q3: array | R3: ignore
A4: ### | D4: 商品类型 | E4: 商品名 | F4: 数量 | G4: 分类 | H4: 显示条件 | I4: 购买条件 | J4: 条件提示 | K4: 高光边框 | L4: 推荐文本 | M4: 购买限次 | N4: 资源类型 | O4: 资源名 | P4: 标准价格 | Q4: 当前价格
A5: 定义 | C5: 商品
B6: 1000001 | C6: ="无双奖励_"&RC[2]&"_"&COUNTIF(R6C5:RC[2],"="&RC[2]) -> 无双奖励_银两_1 | D6: 资源 | E6: 银两 | F6: 100000 | G6: 无双商店_奖励 | I6: 无双星数>=2 | J6: TID_SHOP_WUSHUANG_LIMIT_STAR_2 | K6: 1 | M6: 1 | N6: 资源 | O6: 威名 | P6: =RC[1]*10 -> 1000 | Q6: 100
B7: 1000002 | C7: ="无双奖励_"&RC[2]&"_"&COUNTIF(R6C5:RC[2],"="&RC[2]) -> 无双奖励_装备高级升品材料紫_1 | D7: 物品 | E7: 装备高级升品材料紫 | F7: 20 | G7: 无双商店_奖励 | I7: 无双星数>=4 | J7: TID_SHOP_WUSHUANG_LIMIT_STAR_4 | K7: 1 | M7: 1 | N7: 资源 | O7: 威名 | P7: =RC[1]*10 -> 1600 | Q7: 160
B8: 1000003 | C8: ="无双奖励_"&RC[2]&"_"&COUNTIF(R6C5:RC[2],"="&RC[2]) -> 无双奖励_装备高级升品材料紫_2 | D8: 物品 | E8: 装备高级升品材料紫 | F8: 20 | G8: 无双商店_奖励 | I8: 无双星数>=6 | J8: TID_SHOP_WUSHUANG_LIMIT_STAR_6 | K8: 1 | M8: 1 | N8: 资源 | O8: 威名 | P8: =RC[1]*10 -> 1600 | Q8: 160
B9: 1000004 | C9: ="无双奖励_"&RC[2]&"_"&COUNTIF(R6C5:RC[2],"="&RC[2]) -> 无双奖励_粮草_1 | D9: 物品 | E9: 粮草 | F9: 500 | G9: 无双商店_奖励 | I9: 无双星数>=8 | J9: TID_SHOP_WUSHUANG_LIMIT_STAR_8 | K9: 1 | M9: 1 | N9: 资源 | O9: 威名 | P9: =RC[1]*10 -> 1000 | Q9: 100
B10: 1000005 | C10: ="无双奖励_"&RC[2]&"_"&COUNTIF(R6C5:RC[2],"="&RC[2]) -> 无双奖励_元宝_1 | D10: 资源 | E10: 元宝 | F10: 300 | G10: 无双商店_奖励 | I10: 无双星数>=10 | J10: TID_SHOP_WUSHUANG_LIMIT_STAR_10 | K10: 1 | M10: 1 | N10: 资源 | O10: 威名 | P10: =RC[1]*10 -> 3000 | Q10: 300
B11: 1000006 | C11: ="无双奖励_"&RC[2]&"_"&COUNTIF(R6C5:RC[2],"="&RC[2]) -> 无双奖励_装备高级升品材料紫_3 | D11: 物品 | E11: 装备高级升品材料紫 | F11: 20 | G11: 无双商店_奖励 | I11: 无双星数>=12 | J11: TID_SHOP_WUSHUANG_LIMIT_STAR_12 | K11: 1 | M11: 1 | N11: 资源 | O11: 威名 | P11: =RC[1]*10 -> 1600 | Q11: 160
B12: 1000007 | C12: ="无双奖励_"&RC[2]&"_"&COUNTIF(R6C5:RC[2],"="&RC[2]) -> 无双奖励_装备高级升品材料紫_4 | D12: 物品 | E12: 装备高级升品材料紫 | F12: 30 | G12: 无双商店_奖励 | I12: 无双星数>=14 | J12: TID_SHOP_WUSHUANG_LIMIT_STAR_14 | K12: 1 | M12: 1 | N12: 资源 | O12: 威名 | P12: =RC[1]*10 -> 2400 | Q12: 240
B13: 1000008 | C13: ="无双奖励_"&RC[2]&"_"&COUNTIF(R6C5:RC[2],"="&RC[2]) -> 无双奖励_装备高级升品材料橙_1 | D13: 物品 | E13: 装备高级升品材料橙 | F13: 15 | G13: 无双商店_奖励 | I13: 无双星数>=16 | J13: TID_SHOP_WUSHUANG_LIMIT_STAR_16 | K13: 1 | M13: 1 | N13: 资源 | O13: 威名 | P13: =RC[1]*10 -> 3600 | Q13: 360
B14: 1000009 | C14: ="无双奖励_"&RC[2]&"_"&COUNTIF(R6C5:RC[2],"="&RC[2]) -> 无双奖励_元宝_2 | D14: 资源 | E14: 元宝 | F14: 500 | G14: 无双商店_奖励 | I14: 无双星数>=18 | J14: TID_SHOP_WUSHUANG_LIMIT_STAR_18 | K14: 1 | M14: 1 | N14: 资源 | O14: 威名 | P14: =RC[1]*10 -> 5000 | Q14: 500
B15: 1000010 | C15: ="无双奖励_"&RC[2]&"_"&COUNTIF(R6C5:RC[2],"="&RC[2]) -> 无双奖励_粮草_2 | D15: 物品 | E15: 粮草 | F15: 500 | G15: 无双商店_奖励 | I15: 无双星数>=20 | J15: TID_SHOP_WUSHUANG_LIMIT_STAR_20 | K15: 1 | M15: 1 | N15: 资源 | O15: 威名 | P15: =RC[1]*10 -> 1000 | Q15: 100
B16: 1000011 | C16: ="无双奖励_"&RC[2]&"_"&COUNTIF(R6C5:RC[2],"="&RC[2]) -> 无双奖励_装备高级升品材料橙_2 | D16: 物品 | E16: 装备高级升品材料橙 | F16: 15 | G16: 无双商店_奖励 | I16: 无双星数>=22 | J16: TID_SHOP_WUSHUANG_LIMIT_STAR_22 | K16: 1 | M16: 1 | N16: 资源 | O16: 威名 | P16: =RC[1]*10 -> 3600 | Q16: 360
B17: 1000012 | C17: ="无双奖励_"&RC[2]&"_"&COUNTIF(R6C5:RC[2],"="&RC[2]) -> 无双奖励_装备高级升品材料橙_3 | D17: 物品 | E17: 装备高级升品材料橙 | F17: 20 | G17: 无双商店_奖励 | I17: 无双星数>=24 | J17: TID_SHOP_WUSHUANG_LIMIT_STAR_24 | K17: 1 | M17: 1 | N17: 资源 | O17: 威名 | P17: =RC[1]*10 -> 4800 | Q17: 480
B18: 1000013 | C18: ="无双奖励_"&RC[2]&"_"&COUNTIF(R6C5:RC[2],"="&RC[2]) -> 无双奖励_银两_2 | D18: 资源 | E18: 银两 | F18: 150000 | G18: 无双商店_奖励 | I18: 无双星数>=26 | J18: TID_SHOP_WUSHUANG_LIMIT_STAR_26 | K18: 1 | M18: 1 | N18: 资源 | O18: 威名 | P18: =RC[1]*10 -> 1500 | Q18: 150
B19: 1000014 | C19: ="无双奖励_"&RC[2]&"_"&COUNTIF(R6C5:RC[2],"="&RC[2]) -> 无双奖励_中级精炼石_1 | D19: 物品 | E19: 中级精炼石 | F19: 25 | G19: 无双商店_奖励 | I19: 无双星数>=28 | J19: TID_SHOP_WUSHUANG_LIMIT_STAR_28 | K19: 1 | M19: 1 | N19: 资源 | O19: 威名 | P19: =RC[1]*10 -> 2000 | Q19: 200
B20: 1000015 | C20: ="无双奖励_"&RC[2]&"_"&COUNTIF(R6C5:RC[2],"="&RC[2]) -> 无双奖励_粮草_3 | D20: 物品 | E20: 粮草 | F20: 800 | G20: 无双商店_奖励 | I20: 无双星数>=30 | J20: TID_SHOP_WUSHUANG_LIMIT_STAR_30 | K20: 1 | M20: 1 | N20: 资源 | O20: 威名 | P20: =RC[1]*10 -> 1600 | Q20: 160
B21: 1000016 | C21: ="无双奖励_"&RC[2]&"_"&COUNTIF(R6C5:RC[2],"="&RC[2]) -> 无双奖励_装备高级升品材料橙_4 | D21: 物品 | E21: 装备高级升品材料橙 | F21: 20 | G21: 无双商店_奖励 | I21: 无双星数>=32 | J21: TID_SHOP_WUSHUANG_LIMIT_STAR_32 | K21: 1 | M21: 1 | N21: 资源 | O21: 威名 | P21: =RC[1]*10 -> 4800 | Q21: 480
B22: 1000017 | C22: ="无双奖励_"&RC[2]&"_"&COUNTIF(R6C5:RC[2],"="&RC[2]) -> 无双奖励_中级精炼石_2 | D22: 物品 | E22: 中级精炼石 | F22: 25 | G22: 无双商店_奖励 | I22: 无双星数>=34 | J22: TID_SHOP_WUSHUANG_LIMIT_STAR_34 | K22: 1 | M22: 1 | N22: 资源 | O22: 威名 | P22: =RC[1]*10 -> 2000 | Q22: 200
B23: 1000018 | C23: ="无双奖励_"&RC[2]&"_"&COUNTIF(R6C5:RC[2],"="&RC[2]) -> 无双奖励_粮草_4 | D23: 物品 | E23: 粮草 | F23: 800 | G23: 无双商店_奖励 | I23: 无双星数>=35 | J23: TID_SHOP_WUSHUANG_LIMIT_STAR_35 | K23: 1 | M23: 1 | N23: 资源 | O23: 威名 | P23: =RC[1]*10 -> 1600 | Q23: 160
B24: 1000019 | C24: ="无双奖励_"&RC[2]&"_"&COUNTIF(R6C5:RC[2],"="&RC[2]) -> 无双奖励_装备高级升品材料橙_5 | D24: 物品 | E24: 装备高级升品材料橙 | F24: 20 | G24: 无双商店_奖励 | I24: 无双星数>=36 | J24: TID_SHOP_WUSHUANG_LIMIT_STAR_36 | K24: 1 | M24: 1 | N24: 资源 | O24: 威名 | P24: =RC[1]*10 -> 4800 | Q24: 480
B25: 1000020 | C25: ="无双奖励_"&RC[2]&"_"&COUNTIF(R6C5:RC[2],"="&RC[2]) -> 无双奖励_元宝_3 | D25: 资源 | E25: 元宝 | F25: 500 | G25: 无双商店_奖励 | I25: 无双星数>=37 | J25: TID_SHOP_WUSHUANG_LIMIT_STAR_37 | K25: 1 | M25: 1 | N25: 资源 | O25: 威名 | P25: =RC[1]*10 -> 5000 | Q25: 500
B26: 1000021 | C26: ="无双奖励_"&RC[2]&"_"&COUNTIF(R6C5:RC[2],"="&RC[2]) -> 无双奖励_粮草_5 | D26: 物品 | E26: 粮草 | F26: 800 | G26: 无双商店_奖励 | I26: 无双星数>=38 | J26: TID_SHOP_WUSHUANG_LIMIT_STAR_38 | K26: 1 | M26: 1 | N26: 资源 | O26: 威名 | P26: =RC[1]*10 -> 1600 | Q26: 160
B27: 1000022 | C27: ="无双奖励_"&RC[2]&"_"&COUNTIF(R6C5:RC[2],"="&RC[2]) -> 无双奖励_中级精炼石_3 | D27: 物品 | E27: 中级精炼石 | F27: 25 | G27: 无双商店_奖励 | I27: 无双星数>=39 | J27: TID_SHOP_WUSHUANG_LIMIT_STAR_39 | K27: 1 | M27: 1 | N27: 资源 | O27: 威名 | P27: =RC[1]*10 -> 2000 | Q27: 200
B28: 1000023 | C28: ="无双奖励_"&RC[2]&"_"&COUNTIF(R6C5:RC[2],"="&RC[2]) -> 无双奖励_高级精炼石_1 | D28: 物品 | E28: 高级精炼石 | F28: 25 | G28: 无双商店_奖励 | I28: 无双星数>=40 | J28: TID_SHOP_WUSHUANG_LIMIT_STAR_40 | K28: 1 | M28: 1 | N28: 资源 | O28: 威名 | P28: =RC[1]*10 -> 5000 | Q28: 500
B29: 1000024 | C29: ="无双奖励_"&RC[2]&"_"&COUNTIF(R6C5:RC[2],"="&RC[2]) -> 无双奖励_元宝_4 | D29: 资源 | E29: 元宝 | F29: 500 | G29: 无双商店_奖励 | I29: 无双星数>=41 | J29: TID_SHOP_WUSHUANG_LIMIT_STAR_41 | K29: 1 | M29: 1 | N29: 资源 | O29: 威名 | P29: =RC[1]*10 -> 5000 | Q29: 500
B30: 1000025 | C30: ="无双奖励_"&RC[2]&"_"&COUNTIF(R6C5:RC[2],"="&RC[2]) -> 无双奖励_粮草_6 | D30: 物品 | E30: 粮草 | F30: 800 | G30: 无双商店_奖励 | I30: 无双星数>=42 | J30: TID_SHOP_WUSHUANG_LIMIT_STAR_42 | K30: 1 | M30: 1 | N30: 资源 | O30: 威名 | P30: =RC[1]*10 -> 1600 | Q30: 160
B31: 1000026 | C31: ="无双奖励_"&RC[2]&"_"&COUNTIF(R6C5:RC[2],"="&RC[2]) -> 无双奖励_宝物精炼石_1 | D31: 物品 | E31: 宝物精炼石 | F31: 50 | G31: 无双商店_奖励 | I31: 无双星数>=43 | J31: TID_SHOP_WUSHUANG_LIMIT_STAR_43 | K31: 1 | M31: 1 | N31: 资源 | O31: 威名 | P31: =RC[1]*10 -> 2500 | Q31: 250
B32: 1000027 | C32: ="无双奖励_"&RC[2]&"_"&COUNTIF(R6C5:RC[2],"="&RC[2]) -> 无双奖励_高级精炼石_2 | D32: 物品 | E32: 高级精炼石 | F32: 25 | G32: 无双商店_奖励 | I32: 无双星数>=45 | J32: TID_SHOP_WUSHUANG_LIMIT_STAR_45 | K32: 1 | M32: 1 | N32: 资源 | O32: 威名 | P32: =RC[1]*10 -> 5000 | Q32: 500
B33: 1000028 | C33: ="无双奖励_"&RC[2]&"_"&COUNTIF(R6C5:RC[2],"="&RC[2]) -> 无双奖励_极品精炼石_1 | D33: 物品 | E33: 极品精炼石 | F33: 25 | G33: 无双商店_奖励 | I33: 无双星数>=46 | J33: TID_SHOP_WUSHUANG_LIMIT_STAR_46 | K33: 1 | M33: 1 | N33: 资源 | O33: 威名 | P33: =RC[1]*10 -> 20000 | Q33: 2000
B34: 1000029 | C34: ="无双奖励_"&RC[2]&"_"&COUNTIF(R6C5:RC[2],"="&RC[2]) -> 无双奖励_宝物精炼石_2 | D34: 物品 | E34: 宝物精炼石 | F34: 100 | G34: 无双商店_奖励 | I34: 无双星数>=48 | J34: TID_SHOP_WUSHUANG_LIMIT_STAR_48 | K34: 1 | M34: 1 | N34: 资源 | O34: 威名 | P34: =RC[1]*10 -> 5000 | Q34: 500
B35: 1000030 | C35: ="无双奖励_"&RC[2]&"_"&COUNTIF(R6C5:RC[2],"="&RC[2]) -> 无双奖励_装备高级升品材料红_1 | D35: 物品 | E35: 装备高级升品材料红 | F35: 20 | G35: 无双商店_奖励 | I35: 无双星数>=50 | J35: TID_SHOP_WUSHUANG_LIMIT_STAR_50 | K35: 1 | M35: 1 | N35: 资源 | O35: 威名 | P35: =RC[1]*10 -> 16000 | Q35: 1600
B36: 1000031 | C36: ="无双奖励_"&RC[2]&"_"&COUNTIF(R6C5:RC[2],"="&RC[2]) -> 无双奖励_粮草_7 | D36: 物品 | E36: 粮草 | F36: 800 | G36: 无双商店_奖励 | I36: 无双星数>=52 | J36: TID_SHOP_WUSHUANG_LIMIT_STAR_52 | K36: 1 | M36: 1 | N36: 资源 | O36: 威名 | P36: =RC[1]*10 -> 1600 | Q36: 160
B37: 1000032 | C37: ="无双奖励_"&RC[2]&"_"&COUNTIF(R6C5:RC[2],"="&RC[2]) -> 无双奖励_装备高级升品材料红_2 | D37: 物品 | E37: 装备高级升品材料红 | F37: 20 | G37: 无双商店_奖励 | I37: 无双星数>=54 | J37: TID_SHOP_WUSHUANG_LIMIT_STAR_54 | K37: 1 | M37: 1 | N37: 资源 | O37: 威名 | P37: =RC[1]*10 -> 16000 | Q37: 1600
B38: 1000033 | C38: ="无双奖励_"&RC[2]&"_"&COUNTIF(R6C5:RC[2],"="&RC[2]) -> 无双奖励_元宝_5 | D38: 资源 | E38: 元宝 | F38: 500 | G38: 无双商店_奖励 | I38: 无双星数>=56 | J38: TID_SHOP_WUSHUANG_LIMIT_STAR_56 | K38: 1 | M38: 1 | N38: 资源 | O38: 威名 | P38: =RC[1]*10 -> 5000 | Q38: 500
B39: 1000034 | C39: ="无双奖励_"&RC[2]&"_"&COUNTIF(R6C5:RC[2],"="&RC[2]) -> 无双奖励_极品精炼石_2 | D39: 物品 | E39: 极品精炼石 | F39: 40 | G39: 无双商店_奖励 | I39: 无双星数>=59 | J39: TID_SHOP_WUSHUANG_LIMIT_STAR_59 | K39: 1 | M39: 1 | N39: 资源 | O39: 威名 | P39: =RC[1]*10 -> 32000 | Q39: 3200
B40: 1000035 | C40: ="无双奖励_"&RC[2]&"_"&COUNTIF(R6C5:RC[2],"="&RC[2]) -> 无双奖励_宝物精炼石_3 | D40: 物品 | E40: 宝物精炼石 | F40: 150 | G40: 无双商店_奖励 | I40: 无双星数>=62 | J40: TID_SHOP_WUSHUANG_LIMIT_STAR_62 | K40: 1 | M40: 1 | N40: 资源 | O40: 威名 | P40: =RC[1]*10 -> 7500 | Q40: 750
B41: 1000036 | C41: ="无双奖励_"&RC[2]&"_"&COUNTIF(R6C5:RC[2],"="&RC[2]) -> 无双奖励_粮草_8 | D41: 物品 | E41: 粮草 | F41: 1000 | G41: 无双商店_奖励 | I41: 无双星数>=65 | J41: TID_SHOP_WUSHUANG_LIMIT_STAR_65 | K41: 1 | M41: 1 | N41: 资源 | O41: 威名 | P41: =RC[1]*10 -> 2000 | Q41: 200
B42: 1000037 | C42: ="无双奖励_"&RC[2]&"_"&COUNTIF(R6C5:RC[2],"="&RC[2]) -> 无双奖励_元宝_6 | D42: 资源 | E42: 元宝 | F42: 500 | G42: 无双商店_奖励 | I42: 无双星数>=68 | J42: TID_SHOP_WUSHUANG_LIMIT_STAR_68 | K42: 1 | M42: 1 | N42: 资源 | O42: 威名 | P42: =RC[1]*10 -> 5000 | Q42: 500
B43: 1000038 | C43: ="无双奖励_"&RC[2]&"_"&COUNTIF(R6C5:RC[2],"="&RC[2]) -> 无双奖励_极品精炼石_3 | D43: 物品 | E43: 极品精炼石 | F43: 50 | G43: 无双商店_奖励 | I43: 无双星数>=71 | J43: TID_SHOP_WUSHUANG_LIMIT_STAR_71 | K43: 1 | M43: 1 | N43: 资源 | O43: 威名 | P43: =RC[1]*10 -> 40000 | Q43: 4000
B44: 1000039 | C44: ="无双奖励_"&RC[2]&"_"&COUNTIF(R6C5:RC[2],"="&RC[2]) -> 无双奖励_宝物精炼石_4 | D44: 物品 | E44: 宝物精炼石 | F44: 250 | G44: 无双商店_奖励 | I44: 无双星数>=75 | J44: TID_SHOP_WUSHUANG_LIMIT_STAR_75 | K44: 1 | M44: 1 | N44: 资源 | O44: 威名 | P44: =RC[1]*10 -> 12500 | Q44: 1250
B45: 1000040 | C45: ="无双奖励_"&RC[2]&"_"&COUNTIF(R6C5:RC[2],"="&RC[2]) -> 无双奖励_装备高级升品材料金_1 | D45: 物品 | E45: 装备高级升品材料金 | F45: 10 | G45: 无双商店_奖励 | I45: 无双星数>=79 | J45: TID_SHOP_WUSHUANG_LIMIT_STAR_79 | K45: 1 | M45: 1 | N45: 资源 | O45: 威名 | P45: =RC[1]*10 -> 20000 | Q45: 2000
B46: 1000041 | C46: ="无双奖励_"&RC[2]&"_"&COUNTIF(R6C5:RC[2],"="&RC[2]) -> 无双奖励_极品精炼石_4 | D46: 物品 | E46: 极品精炼石 | F46: 50 | G46: 无双商店_奖励 | I46: 无双星数>=83 | J46: TID_SHOP_WUSHUANG_LIMIT_STAR_83 | K46: 1 | M46: 1 | N46: 资源 | O46: 威名 | P46: =RC[1]*10 -> 40000 | Q46: 4000
B47: 1000042 | C47: ="无双奖励_"&RC[2]&"_"&COUNTIF(R6C5:RC[2],"="&RC[2]) -> 无双奖励_宝物精炼石_5 | D47: 物品 | E47: 宝物精炼石 | F47: 250 | G47: 无双商店_奖励 | I47: 无双星数>=87 | J47: TID_SHOP_WUSHUANG_LIMIT_STAR_87 | K47: 1 | M47: 1 | N47: 资源 | O47: 威名 | P47: =RC[1]*10 -> 12500 | Q47: 1250
B48: 1000043 | C48: ="无双奖励_"&RC[2]&"_"&COUNTIF(R6C5:RC[2],"="&RC[2]) -> 无双奖励_装备高级升品材料金_2 | D48: 物品 | E48: 装备高级升品材料金 | F48: 15 | G48: 无双商店_奖励 | I48: 无双星数>=91 | J48: TID_SHOP_WUSHUANG_LIMIT_STAR_91 | K48: 1 | M48: 1 | N48: 资源 | O48: 威名 | P48: =RC[1]*10 -> 30000 | Q48: 3000
B49: 1000044 | C49: ="无双奖励_"&RC[2]&"_"&COUNTIF(R6C5:RC[2],"="&RC[2]) -> 无双奖励_元宝_7 | D49: 资源 | E49: 元宝 | F49: 1000 | G49: 无双商店_奖励 | I49: 无双星数>=95 | J49: TID_SHOP_WUSHUANG_LIMIT_STAR_95 | K49: 1 | M49: 1 | N49: 资源 | O49: 威名 | P49: =RC[1]*10 -> 10000 | Q49: 1000
B50: 1000045 | C50: ="无双奖励_"&RC[2]&"_"&COUNTIF(R6C5:RC[2],"="&RC[2]) -> 无双奖励_装备高级升品材料金_3 | D50: 物品 | E50: 装备高级升品材料金 | F50: 20 | G50: 无双商店_奖励 | I50: 无双星数>=99 | J50: TID_SHOP_WUSHUANG_LIMIT_STAR_99 | K50: 1 | M50: 1 | N50: 资源 | O50: 威名 | P50: =RC[1]*10 -> 40000 | Q50: 4000
B51: 1000046 | C51: ="无双奖励_"&RC[2]&"_"&COUNTIF(R6C5:RC[2],"="&RC[2]) -> 无双奖励_极品精炼石_5 | D51: 物品 | E51: 极品精炼石 | F51: 50 | G51: 无双商店_奖励 | I51: 无双星数>=103 | J51: TID_SHOP_WUSHUANG_LIMIT_STAR_103 | K51: 1 | M51: 1 | N51: 资源 | O51: 威名 | P51: =RC[1]*10 -> 40000 | Q51: 4000
B52: 1000047 | C52: ="无双奖励_"&RC[2]&"_"&COUNTIF(R6C5:RC[2],"="&RC[2]) -> 无双奖励_元宝_8 | D52: 资源 | E52: 元宝 | F52: 1000 | G52: 无双商店_奖励 | I52: 无双星数>=107 | J52: TID_SHOP_WUSHUANG_LIMIT_STAR_107 | K52: 1 | M52: 1 | N52: 资源 | O52: 威名 | P52: =RC[1]*10 -> 10000 | Q52: 1000

Sheet: WushuangTreasure
A1: !LR! | B1: ID | C1: Name | D1: ItemType | E1: ItemName | F1: ItemAmount | G1: Classify | H1: ShowLimit | I1: BuyLimit | J1: Tips | K1: Shining | L1: Recommend | M1: Count | N1: CostType | O1: Cost | P1: StandardAmount | Q1: Amount | R1: dummy
B2: int | C2: string | D2: string | E2: string | F2: int | G2: string | H2: string | I2: string | J2: string | K2: boolean | L2: boolean | M2: int | N2: string | O2: string | P2: int | Q2: int | R2: string
D3: optional | E3: optional | F3: optional | G3: optional | H3: optional | I3: optional | J3: optional | K3: optional | L3: optional | M3: optional | N3: array | O3: array | P3: array | Q3: array | R3: ignore
A4: ### | B4: ### | C4: ### | D4: 商品类型 | E4: 商品名 | F4: 数量 | G4: 分类 | H4: 显示条件 | I4: 购买条件 | J4: 条件提示 | K4: 高光边框 | L4: 推荐文本 | M4: 购买限次 | N4: 资源类型 | O4: 资源名 | P4: 标准价格 | Q4: 当前价格
A5: 定义 | C5: 商品
B6: 1200001 | C6: 无双秘藏_金龙宝宝_2 | D6: 物品 | E6: 金龙宝宝整卡 | F6: 2 | G6: 无双秘藏 | M6: 1 | N6: 资源 | O6: 元宝 | P6: 80 | Q6: 72
B7: 1200002 | C7: 无双秘藏_金龙宝宝_4 | D7: 物品 | E7: 金龙宝宝整卡 | F7: 4 | G7: 无双秘藏 | M7: 1 | N7: 资源 | O7: 元宝 | P7: 160 | Q7: 136
B8: 1200003 | C8: 无双秘藏_金龙宝宝_8 | D8: 物品 | E8: 金龙宝宝整卡 | F8: 8 | G8: 无双秘藏 | M8: 1 | N8: 资源 | O8: 元宝 | P8: 320 | Q8: 256
B9: 1200004 | C9: 无双秘藏_银两_10w | D9: 资源 | E9: 银两 | F9: 100000 | G9: 无双秘藏 | M9: 1 | N9: 资源 | O9: 元宝 | P9: 100 | Q9: 85
B10: 1200005 | C10: 无双秘藏_银两_50w | D10: 资源 | E10: 银两 | F10: 500000 | G10: 无双秘藏 | M10: 1 | N10: 资源 | O10: 元宝 | P10: 500 | Q10: 400
B11: 1200006 | C11: 无双秘藏_银两_100w | D11: 资源 | E11: 银两 | F11: 1000000 | G11: 无双秘藏 | M11: 1 | N11: 资源 | O11: 元宝 | P11: 1000 | Q11: 750
B12: 1200007 | C12: 无双秘藏_天命石_50_1 | D12: 物品 | E12: 天命石 | F12: 50 | G12: 无双秘藏 | M12: 1 | N12: 资源 | O12: 元宝 | P12: 500 | Q12: 450
B13: 1200008 | C13: 无双秘藏_天命石_50_2 | D13: 物品 | E13: 天命石 | F13: 50 | G13: 无双秘藏 | M13: 1 | N13: 资源 | O13: 元宝 | P13: 500 | Q13: 475
B14: 1200009 | C14: 无双秘藏_极品精炼石_30 | D14: 物品 | E14: 极品精炼石 | F14: 30 | G14: 无双秘藏 | M14: 1 | N14: 资源 | O14: 元宝 | P14: 600 | Q14: 480
B15: 1200010 | C15: 无双秘藏_极品精炼石_100 | D15: 物品 | E15: 极品精炼石 | F15: 100 | G15: 无双秘藏 | M15: 1 | N15: 资源 | O15: 元宝 | P15: 2000 | Q15: 1600
B16: 1200011 | C16: 无双秘藏_红色武将精华_10_1 | D16: 物品 | E16: 红色武将精华 | F16: 10 | G16: 无双秘藏 | M16: 1 | N16: 资源 | O16: 元宝 | P16: 500 | Q16: 500
B17: 1200012 | C17: 无双秘藏_红色武将精华_10_2 | D17: 物品 | E17: 红色武将精华 | F17: 10 | G17: 无双秘藏 | M17: 1 | N17: 资源 | O17: 元宝 | P17: 500 | Q17: 450
B18: 1200013 | C18: 无双秘藏_红色装备精华_10 | D18: 物品 | E18: 红色装备精华 | F18: 10 | G18: 无双秘藏 | M18: 1 | N18: 资源 | O18: 元宝 | P18: 500 | Q18: 500
B19: 1200014 | C19: ="无双秘藏_"&RC[2]&"_1" -> 无双秘藏_刘备整卡_1 | D19: 物品 | E19: 刘备整卡 | F19: 1 | G19: 无双秘藏 | M19: 1 | N19: 资源 | O19: 元宝 | P19: 2400 | Q19: 2280
B20: 1200015 | C20: ="无双秘藏_"&RC[2]&"_1" -> 无双秘藏_赵云整卡_1 | D20: 物品 | E20: 赵云整卡 | F20: 1 | G20: 无双秘藏 | M20: 1 | N20: 资源 | O20: 元宝 | P20: 2400 | Q20: 2280
B21: 1200016 | C21: ="无双秘藏_"&RC[2]&"_1" -> 无双秘藏_庞统整卡_1 | D21: 物品 | E21: 庞统整卡 | F21: 1 | G21: 无双秘藏 | M21: 1 | N21: 资源 | O21: 元宝 | P21: 2400 | Q21: 2280
B22: 1200017 | C22: ="无双秘藏_"&RC[2]&"_1" -> 无双秘藏_张飞整卡_1 | D22: 物品 | E22: 张飞整卡 | F22: 1 | G22: 无双秘藏 | M22: 1 | N22: 资源 | O22: 元宝 | P22: 2400 | Q22: 2280
B23: 1200018 | C23: ="无双秘藏_"&RC[2]&"_1" -> 无双秘藏_黄忠整卡_1 | D23: 物品 | E23: 黄忠整卡 | F23: 1 | G23: 无双秘藏 | M23: 1 | N23: 资源 | O23: 元宝 | P23: 2400 | Q23: 2280
B24: 1200019 | C24: ="无双秘藏_"&RC[2]&"_1" -> 无双秘藏_法正整卡_1 | D24: 物品 | E24: 法正整卡 | F24: 1 | G24: 无双秘藏 | M24: 1 | N24: 资源 | O24: 元宝 | P24: 2400 | Q24: 2280
B25: 1200020 | C25: ="无双秘藏_"&RC[2]&"_1" -> 无双秘藏_董卓整卡_1 | D25: 物品 | E25: 董卓整卡 | F25: 1 | G25: 无双秘藏 | M25: 1 | N25: 资源 | O25: 元宝 | P25: 2400 | Q25: 2280
B26: 1200021 | C26: ="无双秘藏_"&RC[2]&"_1" -> 无双秘藏_貂蝉整卡_1 | D26: 物品 | E26: 貂蝉整卡 | F26: 1 | G26: 无双秘藏 | M26: 1 | N26: 资源 | O26: 元宝 | P26: 2400 | Q26: 2280
B27: 1200022 | C27: ="无双秘藏_"&RC[2]&"_1" -> 无双秘藏_公孙瓒整卡_1 | D27: 物品 | E27: 公孙瓒整卡 | F27: 1 | G27: 无双秘藏 | M27: 1 | N27: 资源 | O27: 元宝 | P27: 2400 | Q27: 2280
B28: 1200023 | C28: ="无双秘藏_"&RC[2]&"_1" -> 无双秘藏_卢植整卡_1 | D28: 物品 | E28: 卢植整卡 | F28: 1 | G28: 无双秘藏 | M28: 1 | N28: 资源 | O28: 元宝 | P28: 2400 | Q28: 2280
B29: 1200024 | C29: ="无双秘藏_"&RC[2]&"_1" -> 无双秘藏_左慈整卡_1 | D29: 物品 | E29: 左慈整卡 | F29: 1 | G29: 无双秘藏 | M29: 1 | N29: 资源 | O29: 元宝 | P29: 2400 | Q29: 2280
B30: 1200025 | C30: ="无双秘藏_"&RC[2]&"_1" -> 无双秘藏_于吉整卡_1 | D30: 物品 | E30: 于吉整卡 | F30: 1 | G30: 无双秘藏 | M30: 1 | N30: 资源 | O30: 元宝 | P30: 2400 | Q30: 2280
B31: 1200026 | C31: ="无双秘藏_"&RC[2]&"_1" -> 无双秘藏_郭嘉整卡_1 | D31: 物品 | E31: 郭嘉整卡 | F31: 1 | G31: 无双秘藏 | M31: 1 | N31: 资源 | O31: 元宝 | P31: 2400 | Q31: 2280
B32: 1200027 | C32: ="无双秘藏_"&RC[2]&"_1" -> 无双秘藏_贾诩整卡_1 | D32: 物品 | E32: 贾诩整卡 | F32: 1 | G32: 无双秘藏 | M32: 1 | N32: 资源 | O32: 元宝 | P32: 2400 | Q32: 2280
B33: 1200028 | C33: ="无双秘藏_"&RC[2]&"_1" -> 无双秘藏_张郃整卡_1 | D33: 物品 | E33: 张郃整卡 | F33: 1 | G33: 无双秘藏 | M33: 1 | N33: 资源 | O33: 元宝 | P33: 2400 | Q33: 2280
B34: 1200029 | C34: ="无双秘藏_"&RC[2]&"_1" -> 无双秘藏_司马懿整卡_1 | D34: 物品 | E34: 司马懿整卡 | F34: 1 | G34: 无双秘藏 | M34: 1 | N34: 资源 | O34: 元宝 | P34: 2400 | Q34: 2280
B35: 1200030 | C35: ="无双秘藏_"&RC[2]&"_1" -> 无双秘藏_夏侯惇整卡_1 | D35: 物品 | E35: 夏侯惇整卡 | F35: 1 | G35: 无双秘藏 | M35: 1 | N35: 资源 | O35: 元宝 | P35: 2400 | Q35: 2280
B36: 1200031 | C36: ="无双秘藏_"&RC[2]&"_1" -> 无双秘藏_夏侯渊整卡_1 | D36: 物品 | E36: 夏侯渊整卡 | F36: 1 | G36: 无双秘藏 | M36: 1 | N36: 资源 | O36: 元宝 | P36: 2400 | Q36: 2280
B37: 1200032 | C37: ="无双秘藏_"&RC[2]&"_10" -> 无双秘藏_郭嘉碎片_10 | D37: 物品 | E37: 郭嘉碎片 | F37: 10 | G37: 无双秘藏 | M37: 1 | N37: 资源 | O37: 元宝 | P37: 300 | Q37: 285
B38: 1200033 | C38: ="无双秘藏_"&RC[2]&"_10" -> 无双秘藏_贾诩碎片_10 | D38: 物品 | E38: 贾诩碎片 | F38: 10 | G38: 无双秘藏 | M38: 1 | N38: 资源 | O38: 元宝 | P38: 300 | Q38: 285
B39: 1200034 | C39: ="无双秘藏_"&RC[2]&"_10" -> 无双秘藏_张郃碎片_10 | D39: 物品 | E39: 张郃碎片 | F39: 10 | G39: 无双秘藏 | M39: 1 | N39: 资源 | O39: 元宝 | P39: 300 | Q39: 285
B40: 1200035 | C40: ="无双秘藏_"&RC[2]&"_10" -> 无双秘藏_司马懿碎片_10 | D40: 物品 | E40: 司马懿碎片 | F40: 10 | G40: 无双秘藏 | M40: 1 | N40: 资源 | O40: 元宝 | P40: 300 | Q40: 285
B41: 1200036 | C41: ="无双秘藏_"&RC[2]&"_10" -> 无双秘藏_夏侯惇碎片_10 | D41: 物品 | E41: 夏侯惇碎片 | F41: 10 | G41: 无双秘藏 | M41: 1 | N41: 资源 | O41: 元宝 | P41: 300 | Q41: 285
B42: 1200037 | C42: ="无双秘藏_"&RC[2]&"_10" -> 无双秘藏_夏侯渊碎片_10 | D42: 物品 | E42: 夏侯渊碎片 | F42: 10 | G42: 无双秘藏 | M42: 1 | N42: 资源 | O42: 元宝 | P42: 300 | Q42: 285
B43: 1200038 | C43: ="无双秘藏_"&RC[2]&"_10" -> 无双秘藏_董卓碎片_10 | D43: 物品 | E43: 董卓碎片 | F43: 10 | G43: 无双秘藏 | M43: 1 | N43: 资源 | O43: 元宝 | P43: 300 | Q43: 285
B44: 1200039 | C44: ="无双秘藏_"&RC[2]&"_10" -> 无双秘藏_貂蝉碎片_10 | D44: 物品 | E44: 貂蝉碎片 | F44: 10 | G44: 无双秘藏 | M44: 1 | N44: 资源 | O44: 元宝 | P44: 300 | Q44: 285
B45: 1200040 | C45: ="无双秘藏_"&RC[2]&"_10" -> 无双秘藏_公孙瓒碎片_10 | D45: 物品 | E45: 公孙瓒碎片 | F45: 10 | G45: 无双秘藏 | M45: 1 | N45: 资源 | O45: 元宝 | P45: 300 | Q45: 285
B46: 1200041 | C46: ="无双秘藏_"&RC[2]&"_10" -> 无双秘藏_卢植碎片_10 | D46: 物品 | E46: 卢植碎片 | F46: 10 | G46: 无双秘藏 | M46: 1 | N46: 资源 | O46: 元宝 | P46: 300 | Q46: 285
B47: 1200042 | C47: ="无双秘藏_"&RC[2]&"_10" -> 无双秘藏_左慈碎片_10 | D47: 物品 | E47: 左慈碎片 | F47: 10 | G47: 无双秘藏 | M47: 1 | N47: 资源 | O47: 元宝 | P47: 300 | Q47: 285
B48: 1200043 | C48: ="无双秘藏_"&RC[2]&"_10" -> 无双秘藏_于吉碎片_10 | D48: 物品 | E48: 于吉碎片 | F48: 10 | G48: 无双秘藏 | M48: 1 | N48: 资源 | O48: 元宝 | P48: 300 | Q48: 285
B49: 1200044 | C49: ="无双秘藏_"&RC[2]&"_10" -> 无双秘藏_刘备碎片_10 | D49: 物品 | E49: 刘备碎片 | F49: 10 | G49: 无双秘藏 | M49: 1 | N49: 资源 | O49: 元宝 | P49: 300 | Q49: 285
B50: 1200045 | C50: ="无双秘藏_"&RC[2]&"_10" -> 无双秘藏_赵云碎片_10 | D50: 物品 | E50: 赵云碎片 | F50: 10 | G50: 无双秘藏 | M50: 1 | N50: 资源 | O50: 元宝 | P50: 300 | Q50: 285
B51: 1200046 | C51: ="无双秘藏_"&RC[2]&"_10" -> 无双秘藏_庞统碎片_10 | D51: 物品 | E51: 庞统碎片 | F51: 10 | G51: 无双秘藏 | M51: 1 | N51: 资源 | O51: 元宝 | P51: 300 | Q51: 285
B52: 1200047 | C52: ="无双秘藏_"&RC[2]&"_10" -> 无双秘藏_张飞碎片_10 | D52: 物品 | E52: 张飞碎片 | F52: 10 | G52: 无双秘藏 | M52: 1 | N52: 资源 | O52: 元宝 | P52: 300 | Q52: 285
B53: 1200048 | C53: ="无双秘藏_"&RC[2]&"_10" -> 无双秘藏_黄忠碎片_10 | D53: 物品 | E53: 黄忠碎片 | F53: 10 | G53: 无双秘藏 | M53: 1 | N53: 资源 | O53: 元宝 | P53: 300 | Q53: 285
B54: 1200049 | C54: ="无双秘藏_"&RC[2]&"_10" -> 无双秘藏_法正碎片_10 | D54: 物品 | E54: 法正碎片 | F54: 10 | G54: 无双秘藏 | M54: 1 | N54: 资源 | O54: 元宝 | P54: 300 | Q54: 285
B55: 1200050 | C55: ="无双秘藏_"&RC[2]&"_10" -> 无双秘藏_关羽碎片_10 | D55: 物品 | E55: 关羽碎片 | F55: 10 | G55: 无双秘藏 | M55: 1 | N55: 资源 | O55: 元宝 | P55: 500 | Q55: 475
B56: 1200051 | C56: ="无双秘藏_"&RC[2]&"_10" -> 无双秘藏_诸葛亮碎片_10 | D56: 物品 | E56: 诸葛亮碎片 | F56: 10 | G56: 无双秘藏 | M56: 1 | N56: 资源 | O56: 元宝 | P56: 500 | Q56: 475
B57: 1200052 | C57: ="无双秘藏_"&RC[2]&"_10" -> 无双秘藏_曹操碎片_10 | D57: 物品 | E57: 曹操碎片 | F57: 10 | G57: 无双秘藏 | M57: 1 | N57: 资源 | O57: 元宝 | P57: 500 | Q57: 475
B58: 1200053 | C58: ="无双秘藏_"&RC[2]&"_10" -> 无双秘藏_甄宓碎片_10 | D58: 物品 | E58: 甄宓碎片 | F58: 10 | G58: 无双秘藏 | M58: 1 | N58: 资源 | O58: 元宝 | P58: 500 | Q58: 475
B59: 1200054 | C59: ="无双秘藏_"&RC[2]&"_10" -> 无双秘藏_吕布碎片_10 | D59: 物品 | E59: 吕布碎片 | F59: 10 | G59: 无双秘藏 | M59: 1 | N59: 资源 | O59: 元宝 | P59: 500 | Q59: 475
B60: 1200055 | C60: ="无双秘藏_"&RC[2]&"_10" -> 无双秘藏_张角碎片_10 | D60: 物品 | E60: 张角碎片 | F60: 10 | G60: 无双秘藏 | M60: 1 | N60: 资源 | O60: 元宝 | P60: 500 | Q60: 475
B61: 1200056 | C61: 无双秘藏_装备高级升品材料橙_10 | D61: 物品 | E61: 装备高级升品材料橙 | F61: 10 | G61: 无双秘藏 | M61: 1 | N61: 资源 | O61: 元宝 | P61: 300 | Q61: 255
B62: 1200057 | C62: 无双秘藏_装备高级升品材料红_10 | D62: 物品 | E62: 装备高级升品材料红 | F62: 10 | G62: 无双秘藏 | M62: 1 | N62: 资源 | O62: 元宝 | P62: 1000 | Q62: 900
B63: 1200058 | C63: 无双秘藏_装备高级升品材料金_10 | D63: 物品 | E63: 装备高级升品材料金 | F63: 10 | G63: 无双秘藏 | M63: 1 | N63: 资源 | O63: 元宝 | P63: 1000 | Q63: 900
B64: 1200059 | C64: 无双秘藏_黄金经验宝物整宝物_4 | D64: 物品 | E64: 黄金经验宝物整宝物 | F64: 4 | G64: 无双秘藏 | M64: 1 | N64: 资源 | O64: 元宝 | P64: 800 | Q64: 640
B65: 1200060 | C65: 无双秘藏_黄金经验宝物整宝物_8 | D65: 物品 | E65: 黄金经验宝物整宝物 | F65: 8 | G65: 无双秘藏 | M65: 1 | N65: 资源 | O65: 元宝 | P65: 1600 | Q65: 1280
B66: 1200061 | C66: 无双秘藏_宝物紫_攻击_暴击整宝物_1 | D66: 物品 | E66: 宝物紫_攻击_暴击整宝物 | F66: 1 | G66: 无双秘藏 | M66: 1 | N66: 资源 | O66: 元宝 | P66: 200 | Q66: 180
B67: 1200062 | C67: 无双秘藏_宝物紫_攻击_命中整宝物_1 | D67: 物品 | E67: 宝物紫_攻击_命中整宝物 | F67: 1 | G67: 无双秘藏 | M67: 1 | N67: 资源 | O67: 元宝 | P67: 200 | Q67: 180
B68: 1200063 | C68: 无双秘藏_宝物紫_生命_抗暴整宝物_1 | D68: 物品 | E68: 宝物紫_生命_抗暴整宝物 | F68: 1 | G68: 无双秘藏 | M68: 1 | N68: 资源 | O68: 元宝 | P68: 200 | Q68: 180
B69: 1200064 | C69: 无双秘藏_宝物紫_生命_闪避整宝物_1 | D69: 物品 | E69: 宝物紫_生命_闪避整宝物 | F69: 1 | G69: 无双秘藏 | M69: 1 | N69: 资源 | O69: 元宝 | P69: 200 | Q69: 180
B70: 1200065 | C70: 无双秘藏_宝物橙_攻击_暴击整宝物_1 | D70: 物品 | E70: 宝物橙_攻击_暴击整宝物 | F70: 1 | G70: 无双秘藏 | M70: 1 | N70: 资源 | O70: 元宝 | P70: 400 | Q70: 360
B71: 1200066 | C71: 无双秘藏_宝物橙_攻击_命中整宝物_1 | D71: 物品 | E71: 宝物橙_攻击_命中整宝物 | F71: 1 | G71: 无双秘藏 | M71: 1 | N71: 资源 | O71: 元宝 | P71: 400 | Q71: 360
B72: 1200067 | C72: 无双秘藏_宝物橙_生命_抗暴整宝物_1 | D72: 物品 | E72: 宝物橙_生命_抗暴整宝物 | F72: 1 | G72: 无双秘藏 | M72: 1 | N72: 资源 | O72: 元宝 | P72: 400 | Q72: 360
B73: 1200068 | C73: 无双秘藏_宝物橙_生命_闪避整宝物_1 | D73: 物品 | E73: 宝物橙_生命_闪避整宝物 | F73: 1 | G73: 无双秘藏 | M73: 1 | N73: 资源 | O73: 元宝 | P73: 400 | Q73: 360
B74: 1200069 | C74: 无双秘藏_宝物橙_攻击_暴击_碎片_10 | D74: 物品 | E74: 宝物橙_攻击_暴击_碎片_1 | F74: 1 | G74: 无双秘藏 | M74: 1 | N74: 资源 | O74: 元宝 | P74: 200 | Q74: 180
B75: 1200070 | C75: 无双秘藏_宝物橙_攻击_命中_碎片_10 | D75: 物品 | E75: 宝物橙_攻击_命中_碎片_1 | F75: 1 | G75: 无双秘藏 | M75: 1 | N75: 资源 | O75: 元宝 | P75: 200 | Q75: 180
B76: 1200071 | C76: 无双秘藏_宝物橙_生命_抗暴_碎片_10 | D76: 物品 | E76: 宝物橙_生命_抗暴_碎片_1 | F76: 1 | G76: 无双秘藏 | M76: 1 | N76: 资源 | O76: 元宝 | P76: 200 | Q76: 180
B77: 1200072 | C77: 无双秘藏_宝物橙_生命_闪避_碎片_10 | D77: 物品 | E77: 宝物橙_生命_闪避_碎片_1 | F77: 1 | G77: 无双秘藏 | M77: 1 | N77: 资源 | O77: 元宝 | P77: 200 | Q77: 180
B78: 1200073 | C78: 无双秘藏_宝物红_攻击_暴击_碎片_10 | D78: 物品 | E78: 宝物红_攻击_暴击_碎片_1 | F78: 1 | G78: 无双秘藏 | M78: 1 | N78: 资源 | O78: 元宝 | P78: 500 | Q78: 450
B79: 1200074 | C79: 无双秘藏_宝物红_攻击_命中_碎片_10 | D79: 物品 | E79: 宝物红_攻击_命中_碎片_1 | F79: 1 | G79: 无双秘藏 | M79: 1 | N79: 资源 | O79: 元宝 | P79: 500 | Q79: 450
B80: 1200075 | C80: 无双秘藏_宝物红_生命_抗暴_碎片_10 | D80: 物品 | E80: 宝物红_生命_抗暴_碎片_1 | F80: 1 | G80: 无双秘藏 | M80: 1 | N80: 资源 | O80: 元宝 | P80: 500 | Q80: 450
B81: 1200076 | C81: 无双秘藏_宝物红_生命_闪避_碎片_10 | D81: 物品 | E81: 宝物红_生命_闪避_碎片_1 | F81: 1 | G81: 无双秘藏 | M81: 1 | N81: 资源 | O81: 元宝 | P81: 500 | Q81: 450

Sheet: BOSS
A1: !LR! | B1: ID | C1: Name | D1: ItemType | E1: ItemName | F1: ItemAmount | G1: Classify | H1: ShowLimit | I1: BuyLimit | J1: Tips | K1: Shining | L1: Recommend | M1: Count | N1: CostType | O1: Cost | P1: StandardAmount | Q1: Amount | R1: dummy
B2: int | C2: string | D2: string | E2: string | F2: int | G2: string | H2: string | I2: string | J2: string | K2: boolean | L2: boolean | M2: int | N2: string | O2: string | P2: int | Q2: int | R2: string
D3: optional | E3: optional | F3: optional | G3: optional | H3: optional | I3: optional | J3: optional | K3: optional | L3: optional | M3: optional | N3: array | O3: array | P3: array | Q3: array | R3: ignore
A4: ### | D4: 商品类型 | E4: 商品名 | F4: 数量 | G4: 分类 | H4: 显示条件 | I4: 购买条件 | J4: 条件提示 | K4: 高光边框 | L4: 推荐文本 | M4: 购买限次 | N4: 资源类型 | O4: 资源名 | P4: 标准价格 | Q4: 当前价格
A5: 定义 | C5: 商品
B6: 1100001 | C6: BOSS商店_天命石_1 | D6: 物品 | E6: 天命石 | F6: 1 | G6: BOSS商店_商品 | M6: 999999 | N6: 资源 | O6: 战功 | P6: 100 | Q6: 100
B7: 1100002 | C7: BOSS商店_天命石_10 | D7: 物品 | E7: 初级精炼石 | F7: 10 | G7: BOSS商店_商品 | M7: 999999 | N7: 资源 | O7: 战功 | P7: 1000 | Q7: 1000
B8: 1100003 | C8: BOSS商店_天命石_20 | D8: 物品 | E8: 初级精炼石 | F8: 20 | G8: BOSS商店_商品 | M8: 999999 | N8: 资源 | O8: 战功 | P8: 2000 | Q8: 2000
B9: 1100004 | C9: ="BOSS商店_"&RC[2] -> BOSS商店_法正碎片 | D9: 物品 | E9: 法正碎片 | F9: 1 | G9: BOSS商店_商品 | L9: 1 | M9: 999999 | N9: 资源 | O9: 战功 | P9: 300 | Q9: 300
B10: 1100005 | C10: ="BOSS商店_"&RC[2] -> BOSS商店_夏侯惇碎片 | D10: 物品 | E10: 夏侯惇碎片 | F10: 1 | G10: BOSS商店_商品 | L10: 1 | M10: 999999 | N10: 资源 | O10: 战功 | P10: 300 | Q10: 300
B11: 1100006 | C11: ="BOSS商店_"&RC[2] -> BOSS商店_公孙瓒碎片 | D11: 物品 | E11: 公孙瓒碎片 | F11: 1 | G11: BOSS商店_商品 | L11: 1 | M11: 999999 | N11: 资源 | O11: 战功 | P11: 300 | Q11: 300
B12: 1100007 | C12: ="BOSS商店_"&RC[2] -> BOSS商店_诸葛亮碎片 | D12: 物品 | E12: 诸葛亮碎片 | F12: 1 | G12: BOSS商店_商品 | H12: 城主等级>=55 | I12: 城主等级>=60 | J12: TID_SHOP_BOSS_LIMIT_LEVEL_60 | L12: 1 | M12: 999999 | N12: 资源 | O12: 战功 | P12: 1000 | Q12: 1000
N13: 物品 | O13: 红色武将精华 | P13: 1 | Q13: 1
B14: 1100008 | C14: ="BOSS商店_"&RC[2] -> BOSS商店_曹操碎片 | D14: 物品 | E14: 曹操碎片 | F14: 1 | G14: BOSS商店_商品 | H14: 城主等级>=55 | I14: 城主等级>=60 | J14: TID_SHOP_BOSS_LIMIT_LEVEL_60 | L14: 1 | M14: 999999 | N14: 资源 | O14: 战功 | P14: 1000 | Q14: 1000
N15: 物品 | O15: 红色武将精华 | P15: 1 | Q15: 1
B16: 1100009 | C16: ="BOSS商店_"&RC[2] -> BOSS商店_吕布碎片 | D16: 物品 | E16: 吕布碎片 | F16: 1 | G16: BOSS商店_商品 | H16: 城主等级>=55 | I16: 城主等级>=60 | J16: TID_SHOP_BOSS_LIMIT_LEVEL_60 | L16: 1 | M16: 999999 | N16: 资源 | O16: 战功 | P16: 1000 | Q16: 1000
N17: 物品 | O17: 红色武将精华 | P17: 1 | Q17: 1
B18: 1100010 | C18: BOSS商店_铜龙宝宝 | D18: 物品 | E18: 铜龙宝宝整卡 | F18: 1 | G18: BOSS商店_商品 | M18: 999999 | N18: 资源 | O18: 战功 | P18: 100 | Q18: 100
B19: 1100011 | C19: BOSS商店_白银经验宝物 | D19: 物品 | E19: 白银经验宝物整宝物 | F19: 1 | G19: BOSS商店_商品 | M19: 999999 | N19: 资源 | O19: 战功 | P19: 500 | Q19: 500

Sheet: BOSSBonus
A1: !LR! | B1: ID | C1: Name | D1: ItemType | E1: ItemName | F1: ItemAmount | G1: Classify | H1: ShowLimit | I1: BuyLimit | J1: Tips | K1: Shining | L1: Recommend | M1: Count | N1: CostType | O1: Cost | P1: StandardAmount | Q1: Amount | R1: dummy | S1: dummy
B2: int | C2: string | D2: string | E2: string | F2: int | G2: string | H2: string | I2: string | J2: string | K2: boolean | L2: boolean | M2: int | N2: string | O2: string | P2: int | Q2: int | R2: string | S2: string
D3: optional | E3: optional | F3: optional | G3: optional | H3: optional | I3: optional | J3: optional | K3: optional | L3: optional | M3: optional | N3: array | O3: array | P3: array | Q3: array | R3: ignore | S3: ignore
A4: ### | D4: 商品类型 | E4: 商品名 | F4: 数量 | G4: 分类 | H4: 显示条件 | I4: 购买条件 | J4: 条件提示 | K4: 高光边框 | L4: 推荐文本 | M4: 购买限次 | N4: 资源类型 | O4: 资源名 | P4: 标准价格 | Q4: 当前价格
A5: 定义 | C5: 商品
B6: 1300001 | C6: ="叛军奖励_"&RC[2]&"_"&COUNTIF(R6C5:RC[2],"="&RC[2]) -> 叛军奖励_银两_1 | D6: 资源 | E6: 银两 | F6: 50000 | G6: BOSS商店_奖励 | I6: 世界BOSS每周攻打次数>=5 | J6: TID_SHOP_BOSS_LIMIT_TIMES_5 | K6: 1 | M6: 1 | N6: 资源 | O6: 战功 | P6: =RC[1]*5 -> 500 | Q6: 100 | R6: 世界BOSS每周攻打次数>=5
B7: 1300002 | C7: ="叛军奖励_"&RC[2]&"_"&COUNTIF(R6C5:RC[2],"="&RC[2]) -> 叛军奖励_粮草_1 | D7: 物品 | E7: 粮草 | F7: 300 | G7: BOSS商店_奖励 | I7: 世界BOSS每周攻打次数>=10 | J7: TID_SHOP_BOSS_LIMIT_TIMES_10 | K7: 1 | M7: 1 | N7: 资源 | O7: 战功 | P7: =RC[1]*5 -> 600 | Q7: 120 | R7: 世界BOSS每周攻打次数>=10
B8: 1300003 | C8: ="叛军奖励_"&RC[2]&"_"&COUNTIF(R6C5:RC[2],"="&RC[2]) -> 叛军奖励_天命石_1 | D8: 物品 | E8: 天命石 | F8: 10 | G8: BOSS商店_奖励 | I8: 世界BOSS每周攻打次数>=15 | J8: TID_SHOP_BOSS_LIMIT_TIMES_15 | K8: 1 | M8: 1 | N8: 资源 | O8: 战功 | P8: =RC[1]*5 -> 1000 | Q8: 200 | R8: 世界BOSS每周攻打次数>=15
B9: 1300004 | C9: ="叛军奖励_"&RC[2]&"_"&COUNTIF(R6C5:RC[2],"="&RC[2]) -> 叛军奖励_银两_2 | D9: 资源 | E9: 银两 | F9: 50000 | G9: BOSS商店_奖励 | I9: 世界BOSS每周攻打次数>=20 | J9: TID_SHOP_BOSS_LIMIT_TIMES_20 | K9: 1 | M9: 1 | N9: 资源 | O9: 战功 | P9: =RC[1]*5 -> 500 | Q9: 100 | R9: 世界BOSS每周攻打次数>=20
B10: 1300005 | C10: ="叛军奖励_"&RC[2]&"_"&COUNTIF(R6C5:RC[2],"="&RC[2]) -> 叛军奖励_粮草_2 | D10: 物品 | E10: 粮草 | F10: 300 | G10: BOSS商店_奖励 | I10: 世界BOSS每周攻打次数>=25 | J10: TID_SHOP_BOSS_LIMIT_TIMES_25 | K10: 1 | M10: 1 | N10: 资源 | O10: 战功 | P10: =RC[1]*5 -> 600 | Q10: 120 | R10: 世界BOSS每周攻打次数>=25
B11: 1300006 | C11: ="叛军奖励_"&RC[2]&"_"&COUNTIF(R6C5:RC[2],"="&RC[2]) -> 叛军奖励_天命石_2 | D11: 物品 | E11: 天命石 | F11: 10 | G11: BOSS商店_奖励 | I11: 世界BOSS每周攻打次数>=30 | J11: TID_SHOP_BOSS_LIMIT_TIMES_30 | K11: 1 | M11: 1 | N11: 资源 | O11: 战功 | P11: =RC[1]*5 -> 1000 | Q11: 200 | R11: 世界BOSS每周攻打次数>=30
B12: 1300007 | C12: ="叛军奖励_"&RC[2]&"_"&COUNTIF(R6C5:RC[2],"="&RC[2]) -> 叛军奖励_银两_3 | D12: 资源 | E12: 银两 | F12: 50000 | G12: BOSS商店_奖励 | I12: 世界BOSS每周攻打次数>=35 | J12: TID_SHOP_BOSS_LIMIT_TIMES_35 | K12: 1 | M12: 1 | N12: 资源 | O12: 战功 | P12: =RC[1]*5 -> 500 | Q12: 100 | R12: 世界BOSS每周攻打次数>=35
B13: 1300008 | C13: ="叛军奖励_"&RC[2]&"_"&COUNTIF(R6C5:RC[2],"="&RC[2]) -> 叛军奖励_粮草_3 | D13: 物品 | E13: 粮草 | F13: 300 | G13: BOSS商店_奖励 | I13: 世界BOSS每周攻打次数>=40 | J13: TID_SHOP_BOSS_LIMIT_TIMES_40 | K13: 1 | M13: 1 | N13: 资源 | O13: 战功 | P13: =RC[1]*5 -> 600 | Q13: 120 | R13: 世界BOSS每周攻打次数>=40
B14: 1300009 | C14: ="叛军奖励_"&RC[2]&"_"&COUNTIF(R6C5:RC[2],"="&RC[2]) -> 叛军奖励_天命石_3 | D14: 物品 | E14: 天命石 | F14: 10 | G14: BOSS商店_奖励 | I14: 世界BOSS每周攻打次数>=45 | J14: TID_SHOP_BOSS_LIMIT_TIMES_45 | K14: 1 | M14: 1 | N14: 资源 | O14: 战功 | P14: =RC[1]*5 -> 1000 | Q14: 200 | R14: 世界BOSS每周攻打次数>=45
B15: 1300010 | C15: ="叛军奖励_"&RC[2]&"_"&COUNTIF(R6C5:RC[2],"="&RC[2]) -> 叛军奖励_银两_4 | D15: 资源 | E15: 银两 | F15: 50000 | G15: BOSS商店_奖励 | I15: 世界BOSS每周攻打次数>=50 | J15: TID_SHOP_BOSS_LIMIT_TIMES_50 | K15: 1 | M15: 1 | N15: 资源 | O15: 战功 | P15: =RC[1]*5 -> 500 | Q15: 100 | R15: 世界BOSS每周攻打次数>=50
B16: 1300011 | C16: ="叛军奖励_"&RC[2]&"_"&COUNTIF(R6C5:RC[2],"="&RC[2]) -> 叛军奖励_粮草_4 | D16: 物品 | E16: 粮草 | F16: 500 | G16: BOSS商店_奖励 | I16: 世界BOSS每周攻打次数>=55 | J16: TID_SHOP_BOSS_LIMIT_TIMES_55 | K16: 1 | M16: 1 | N16: 资源 | O16: 战功 | P16: =RC[1]*5 -> 1000 | Q16: 200 | R16: 世界BOSS每周攻打次数>=55
B17: 1300012 | C17: ="叛军奖励_"&RC[2]&"_"&COUNTIF(R6C5:RC[2],"="&RC[2]) -> 叛军奖励_天命石_4 | D17: 物品 | E17: 天命石 | F17: 20 | G17: BOSS商店_奖励 | I17: 世界BOSS每周攻打次数>=60 | J17: TID_SHOP_BOSS_LIMIT_TIMES_60 | K17: 1 | M17: 1 | N17: 资源 | O17: 战功 | P17: =RC[1]*5 -> 2000 | Q17: 400 | R17: 世界BOSS每周攻打次数>=60
B18: 1300013 | C18: ="叛军奖励_"&RC[2]&"_"&COUNTIF(R6C5:RC[2],"="&RC[2]) -> 叛军奖励_银两_5 | D18: 资源 | E18: 银两 | F18: 100000 | G18: BOSS商店_奖励 | I18: 世界BOSS每周攻打次数>=65 | J18: TID_SHOP_BOSS_LIMIT_TIMES_65 | K18: 1 | M18: 1 | N18: 资源 | O18: 战功 | P18: =RC[1]*5 -> 1000 | Q18: 200 | R18: 世界BOSS每周攻打次数>=65
B19: 1300014 | C19: ="叛军奖励_"&RC[2]&"_"&COUNTIF(R6C5:RC[2],"="&RC[2]) -> 叛军奖励_粮草_5 | D19: 物品 | E19: 粮草 | F19: 500 | G19: BOSS商店_奖励 | I19: 世界BOSS每周攻打次数>=70 | J19: TID_SHOP_BOSS_LIMIT_TIMES_70 | K19: 1 | M19: 1 | N19: 资源 | O19: 战功 | P19: =RC[1]*5 -> 1000 | Q19: 200 | R19: 世界BOSS每周攻打次数>=70
B20: 1300015 | C20: ="叛军奖励_"&RC[2]&"_"&COUNTIF(R6C5:RC[2],"="&RC[2]) -> 叛军奖励_天命石_5 | D20: 物品 | E20: 天命石 | F20: 20 | G20: BOSS商店_奖励 | I20: 世界BOSS每周攻打次数>=75 | J20: TID_SHOP_BOSS_LIMIT_TIMES_75 | K20: 1 | M20: 1 | N20: 资源 | O20: 战功 | P20: =RC[1]*5 -> 2000 | Q20: 400 | R20: 世界BOSS每周攻打次数>=75
B21: 1300016 | C21: ="叛军奖励_"&RC[2]&"_"&COUNTIF(R6C5:RC[2],"="&RC[2]) -> 叛军奖励_银两_6 | D21: 资源 | E21: 银两 | F21: 100000 | G21: BOSS商店_奖励 | I21: 世界BOSS每周攻打次数>=80 | J21: TID_SHOP_BOSS_LIMIT_TIMES_80 | K21: 1 | M21: 1 | N21: 资源 | O21: 战功 | P21: =RC[1]*5 -> 1000 | Q21: 200 | R21: 世界BOSS每周攻打次数>=80
B22: 1300017 | C22: ="叛军奖励_"&RC[2]&"_"&COUNTIF(R6C5:RC[2],"="&RC[2]) -> 叛军奖励_粮草_6 | D22: 物品 | E22: 粮草 | F22: 500 | G22: BOSS商店_奖励 | I22: 世界BOSS每周攻打次数>=85 | J22: TID_SHOP_BOSS_LIMIT_TIMES_85 | K22: 1 | M22: 1 | N22: 资源 | O22: 战功 | P22: =RC[1]*5 -> 1000 | Q22: 200 | R22: 世界BOSS每周攻打次数>=85
B23: 1300018 | C23: ="叛军奖励_"&RC[2]&"_"&COUNTIF(R6C5:RC[2],"="&RC[2]) -> 叛军奖励_天命石_6 | D23: 物品 | E23: 天命石 | F23: 20 | G23: BOSS商店_奖励 | I23: 世界BOSS每周攻打次数>=90 | J23: TID_SHOP_BOSS_LIMIT_TIMES_90 | K23: 1 | M23: 1 | N23: 资源 | O23: 战功 | P23: =RC[1]*5 -> 2000 | Q23: 400 | R23: 世界BOSS每周攻打次数>=90
B24: 1300019 | C24: ="叛军奖励_"&RC[2]&"_"&COUNTIF(R6C5:RC[2],"="&RC[2]) -> 叛军奖励_银两_7 | D24: 资源 | E24: 银两 | F24: 100000 | G24: BOSS商店_奖励 | I24: 世界BOSS每周攻打次数>=95 | J24: TID_SHOP_BOSS_LIMIT_TIMES_95 | K24: 1 | M24: 1 | N24: 资源 | O24: 战功 | P24: =RC[1]*5 -> 1000 | Q24: 200 | R24: 世界BOSS每周攻打次数>=95
B25: 1300020 | C25: ="叛军奖励_"&RC[2]&"_"&COUNTIF(R6C5:RC[2],"="&RC[2]) -> 叛军奖励_粮草_7 | D25: 物品 | E25: 粮草 | F25: 800 | G25: BOSS商店_奖励 | I25: 世界BOSS每周攻打次数>=100 | J25: TID_SHOP_BOSS_LIMIT_TIMES_100 | K25: 1 | M25: 1 | N25: 资源 | O25: 战功 | P25: =RC[1]*5 -> 1600 | Q25: 320 | R25: 世界BOSS每周攻打次数>=100
B26: 1300021 | C26: ="叛军奖励_"&RC[2]&"_"&COUNTIF(R6C5:RC[2],"="&RC[2]) -> 叛军奖励_天命石_7 | D26: 物品 | E26: 天命石 | F26: 30 | G26: BOSS商店_奖励 | I26: 世界BOSS每周攻打次数>=105 | J26: TID_SHOP_BOSS_LIMIT_TIMES_105 | K26: 1 | M26: 1 | N26: 资源 | O26: 战功 | P26: =RC[1]*5 -> 3000 | Q26: 600 | R26: 世界BOSS每周攻打次数>=105
B27: 1300022 | C27: ="叛军奖励_"&RC[2]&"_"&COUNTIF(R6C5:RC[2],"="&RC[2]) -> 叛军奖励_银两_8 | D27: 资源 | E27: 银两 | F27: 100000 | G27: BOSS商店_奖励 | I27: 世界BOSS每周攻打次数>=110 | J27: TID_SHOP_BOSS_LIMIT_TIMES_110 | K27: 1 | M27: 1 | N27: 资源 | O27: 战功 | P27: =RC[1]*5 -> 1000 | Q27: 200 | R27: 世界BOSS每周攻打次数>=110
B28: 1300023 | C28: ="叛军奖励_"&RC[2]&"_"&COUNTIF(R6C5:RC[2],"="&RC[2]) -> 叛军奖励_粮草_8 | D28: 物品 | E28: 粮草 | F28: 800 | G28: BOSS商店_奖励 | I28: 世界BOSS每周攻打次数>=115 | J28: TID_SHOP_BOSS_LIMIT_TIMES_115 | K28: 1 | M28: 1 | N28: 资源 | O28: 战功 | P28: =RC[1]*5 -> 1600 | Q28: 320 | R28: 世界BOSS每周攻打次数>=115
B29: 1300024 | C29: ="叛军奖励_"&RC[2]&"_"&COUNTIF(R6C5:RC[2],"="&RC[2]) -> 叛军奖励_天命石_8 | D29: 物品 | E29: 天命石 | F29: 30 | G29: BOSS商店_奖励 | I29: 世界BOSS每周攻打次数>=120 | J29: TID_SHOP_BOSS_LIMIT_TIMES_120 | K29: 1 | M29: 1 | N29: 资源 | O29: 战功 | P29: =RC[1]*5 -> 3000 | Q29: 600 | R29: 世界BOSS每周攻打次数>=120

Sheet: HeroBingo
A1: !LR! | B1: ID | C1: Name | D1: ItemType | E1: ItemName | F1: ItemAmount | G1: Classify | H1: ShowLimit | I1: BuyLimit | J1: Tips | K1: Shining | L1: Recommend | M1: Count | N1: CostType | O1: Cost | P1: StandardAmount | Q1: Amount | R1: dummy | S1: dummy
B2: int | C2: string | D2: string | E2: string | F2: int | G2: string | H2: string | I2: string | J2: string | K2: boolean | L2: boolean | M2: int | N2: string | O2: string | P2: int | Q2: int | R2: string | S2: string
D3: optional | E3: optional | F3: optional | G3: optional | H3: optional | I3: optional | J3: optional | K3: optional | L3: optional | M3: optional | N3: array | O3: array | P3: array | Q3: array | R3: ignore | S3: ignore
A4: ### | D4: 商品类型 | E4: 商品名 | F4: 数量 | G4: 分类 | H4: 显示条件 | I4: 购买条件 | J4: 条件提示 | K4: 高光边框 | L4: 推荐文本 | M4: 购买限次 | N4: 资源类型 | O4: 资源名 | P4: 标准价格 | Q4: 当前价格
A5: 定义 | C5: 商品
B6: 1400009 | C6: 军需商店_粮草_500 | D6: 物品 | E6: 粮草 | F6: 50 | G6: 军需商店_商品 | M6: 999999 | N6: 资源 | O6: 兵符 | P6: 100 | Q6: 100
B7: 1400010 | C7: 军需商店_军械_10 | D7: 物品 | E7: 军械 | F7: 10 | G7: 军需商店_商品 | M7: 999999 | N7: 资源 | O7: 兵符 | P7: 200 | Q7: 200
B8: 1400011 | C8: 军需商店_小兵突破石_10 | D8: 物品 | E8: 小兵突破石 | F8: 10 | G8: 军需商店_商品 | M8: 999999 | N8: 资源 | O8: 兵符 | P8: 500 | Q8: 500
B9: 1400012 | C9: 军需商店_小兵突破卡_1 | D9: 物品 | E9: 小兵突破卡 | F9: 1 | G9: 军需商店_商品 | M9: 999999 | N9: 资源 | O9: 兵符 | P9: 1000 | Q9: 1000

Sheet: HeroBingoBonus
A1: !LR! | B1: ID | C1: Name | D1: ItemType | E1: ItemName | F1: ItemAmount | G1: Classify | H1: ShowLimit | I1: BuyLimit | J1: Tips | K1: Shining | L1: Recommend | M1: Count | N1: CostType | O1: Cost | P1: StandardAmount | Q1: Amount | R1: dummy | S1: dummy
B2: int | C2: string | D2: string | E2: string | F2: int | G2: string | H2: string | I2: string | J2: string | K2: boolean | L2: boolean | M2: int | N2: string | O2: string | P2: int | Q2: int | R2: string | S2: string
D3: optional | E3: optional | F3: optional | G3: optional | H3: optional | I3: optional | J3: optional | K3: optional | L3: optional | M3: optional | N3: array | O3: array | P3: array | Q3: array | R3: ignore | S3: ignore
A4: ### | D4: 商品类型 | E4: 商品名 | F4: 数量 | G4: 分类 | H4: 显示条件 | I4: 购买条件 | J4: 条件提示 | K4: 高光边框 | L4: 推荐文本 | M4: 购买限次 | N4: 资源类型 | O4: 资源名 | P4: 标准价格 | Q4: 当前价格
A5: 定义 | C5: 商品
B6: 1500001 | C6: 军需奖励_粮草_2500_1 | D6: 物品 | E6: 粮草 | F6: 600 | G6: 军需商店_奖励 | I6: 名将点兵每周积分>=650 | J6: TID_SHOP_HEROBINGO_LIMIT_SCORE_650 | K6: 1 | M6: 1 | N6: 资源 | O6: 兵符 | P6: 1200 | Q6: 120 | R6: 名将点兵每周积分>=650 | S6: 夺帅积分>=11050
B7: 1500002 | C7: 军需奖励_蓝色兵法升级材料_5_1 | D7: 物品 | E7: 蓝色兵法升级材料 | F7: 8 | G7: 军需商店_奖励 | I7: 名将点兵每周积分>=1300 | J7: TID_SHOP_HEROBINGO_LIMIT_SCORE_1300 | K7: 1 | M7: 1 | N7: 资源 | O7: 兵符 | P7: 500 | Q7: 50 | R7: 名将点兵每周积分>=1300 | S7: 夺帅积分>=11700
B8: 1500003 | C8: 军需奖励_银两_50000_1 | D8: 资源 | E8: 银两 | F8: 50000 | G8: 军需商店_奖励 | I8: 名将点兵每周积分>=1950 | J8: TID_SHOP_HEROBINGO_LIMIT_SCORE_1950 | K8: 1 | M8: 1 | N8: 资源 | O8: 兵符 | P8: 500 | Q8: 50 | R8: 名将点兵每周积分>=1950 | S8: 夺帅积分>=12350
B9: 1500004 | C9: 军需奖励_粮草_2500_2 | D9: 物品 | E9: 粮草 | F9: 600 | G9: 军需商店_奖励 | I9: 名将点兵每周积分>=2600 | J9: TID_SHOP_HEROBINGO_LIMIT_SCORE_2600 | K9: 1 | M9: 1 | N9: 资源 | O9: 兵符 | P9: 1200 | Q9: 120 | R9: 名将点兵每周积分>=2600 | S9: 夺帅积分>=13000
B10: 1500005 | C10: 军需奖励_蓝色兵法升级材料_5_2 | D10: 物品 | E10: 蓝色兵法升级材料 | F10: 8 | G10: 军需商店_奖励 | I10: 名将点兵每周积分>=3250 | J10: TID_SHOP_HEROBINGO_LIMIT_SCORE_3250 | K10: 1 | M10: 1 | N10: 资源 | O10: 兵符 | P10: 500 | Q10: 50 | R10: 名将点兵每周积分>=3250 | S10: 夺帅积分>=13650
B11: 1500006 | C11: 军需奖励_银两_50000_2 | D11: 资源 | E11: 银两 | F11: 50000 | G11: 军需商店_奖励 | I11: 名将点兵每周积分>=3900 | J11: TID_SHOP_HEROBINGO_LIMIT_SCORE_3900 | K11: 1 | M11: 1 | N11: 资源 | O11: 兵符 | P11: 500 | Q11: 50 | R11: 名将点兵每周积分>=3900 | S11: 夺帅积分>=14300
B12: 1500007 | C12: 军需奖励_悬赏令_1_1 | D12: 物品 | E12: 悬赏令 | F12: 1 | G12: 军需商店_奖励 | I12: 名将点兵每周积分>=4550 | J12: TID_SHOP_HEROBINGO_LIMIT_SCORE_4550 | K12: 1 | M12: 1 | N12: 资源 | O12: 兵符 | P12: 20000 | Q12: 2000 | R12: 名将点兵每周积分>=4550 | S12: 夺帅积分>=14950
B13: 1500008 | C13: 军需奖励_粮草_2500_3 | D13: 物品 | E13: 粮草 | F13: 800 | G13: 军需商店_奖励 | I13: 名将点兵每周积分>=5200 | J13: TID_SHOP_HEROBINGO_LIMIT_SCORE_5200 | K13: 1 | M13: 1 | N13: 资源 | O13: 兵符 | P13: 1600 | Q13: 160 | R13: 名将点兵每周积分>=5200 | S13: 夺帅积分>=15600
B14: 1500009 | C14: 军需奖励_蓝色兵法升级材料_5_3 | D14: 物品 | E14: 蓝色兵法升级材料 | F14: 8 | G14: 军需商店_奖励 | I14: 名将点兵每周积分>=5850 | J14: TID_SHOP_HEROBINGO_LIMIT_SCORE_5850 | K14: 1 | M14: 1 | N14: 资源 | O14: 兵符 | P14: 500 | Q14: 50 | R14: 名将点兵每周积分>=5850
B15: 1500010 | C15: 军需奖励_银两_50000_3 | D15: 资源 | E15: 银两 | F15: 50000 | G15: 军需商店_奖励 | I15: 名将点兵每周积分>=6500 | J15: TID_SHOP_HEROBINGO_LIMIT_SCORE_6500 | K15: 1 | M15: 1 | N15: 资源 | O15: 兵符 | P15: 500 | Q15: 50 | R15: 名将点兵每周积分>=6500
B16: 1500011 | C16: 军需奖励_兵法_1 | D16: 物品 | E16: 随机兵法宝箱 | F16: 1 | G16: 军需商店_奖励 | I16: 名将点兵每周积分>=7150 | J16: TID_SHOP_HEROBINGO_LIMIT_SCORE_7150 | K16: 1 | M16: 1 | N16: 资源 | O16: 兵符 | P16: 10000 | Q16: 1000 | R16: 名将点兵每周积分>=7150
B17: 1500012 | C17: 军需奖励_粮草_2500_4 | D17: 物品 | E17: 粮草 | F17: 1000 | G17: 军需商店_奖励 | I17: 名将点兵每周积分>=7800 | J17: TID_SHOP_HEROBINGO_LIMIT_SCORE_7800 | K17: 1 | M17: 1 | N17: 资源 | O17: 兵符 | P17: 2000 | Q17: 200 | R17: 名将点兵每周积分>=7800
B18: 1500013 | C18: 军需奖励_蓝色兵法升级材料_5_4 | D18: 物品 | E18: 蓝色兵法升级材料 | F18: 8 | G18: 军需商店_奖励 | I18: 名将点兵每周积分>=8450 | J18: TID_SHOP_HEROBINGO_LIMIT_SCORE_8450 | K18: 1 | M18: 1 | N18: 资源 | O18: 兵符 | P18: 500 | Q18: 50 | R18: 名将点兵每周积分>=8450
B19: 1500014 | C19: 军需奖励_银两_50000_4 | D19: 资源 | E19: 银两 | F19: 50000 | G19: 军需商店_奖励 | I19: 名将点兵每周积分>=9100 | J19: TID_SHOP_HEROBINGO_LIMIT_SCORE_9100 | K19: 1 | M19: 1 | N19: 资源 | O19: 兵符 | P19: 500 | Q19: 50 | R19: 名将点兵每周积分>=9100
B20: 1500015 | C20: 军需奖励_元宝_100_2 | D20: 资源 | E20: 元宝 | F20: 100 | G20: 军需商店_奖励 | I20: 名将点兵每周积分>=9750 | J20: TID_SHOP_HEROBINGO_LIMIT_SCORE_9750 | K20: 1 | M20: 1 | N20: 资源 | O20: 兵符 | P20: 1000 | Q20: 100 | R20: 名将点兵每周积分>=9750
B21: 1500016 | C21: 军需奖励_悬赏令_1_2 | D21: 物品 | E21: 悬赏令 | F21: 1 | G21: 军需商店_奖励 | I21: 名将点兵每周积分>=10400 | J21: TID_SHOP_HEROBINGO_LIMIT_SCORE_10400 | K21: 1 | M21: 1 | N21: 资源 | O21: 兵符 | P21: 20000 | Q21: 2000 | R21: 名将点兵每周积分>=10400

Sheet: Warcraft
A1: !LR! | B1: ID | C1: Name | D1: ItemType | E1: ItemName | F1: ItemAmount | G1: Classify | H1: ShowLimit | I1: BuyLimit | J1: Tips | K1: Shining | L1: Recommend | M1: Count | N1: CostType | O1: Cost | P1: StandardAmount | Q1: Amount | R1: dummy | S1: dummy
B2: int | C2: string | D2: string | E2: string | F2: int | G2: string | H2: string | I2: string | J2: string | K2: boolean | L2: boolean | M2: int | N2: string | O2: string | P2: int | Q2: int | R2: string | S2: string
D3: optional | E3: optional | F3: optional | G3: optional | H3: optional | I3: optional | J3: optional | K3: optional | L3: optional | M3: optional | N3: array | O3: array | P3: array | Q3: array | R3: ignore | S3: ignore
A4: ### | D4: 商品类型 | E4: 商品名 | F4: 数量 | G4: 分类 | H4: 显示条件 | I4: 购买条件 | J4: 条件提示 | K4: 高光边框 | L4: 推荐文本 | M4: 购买限次 | N4: 资源类型 | O4: 资源名 | P4: 标准价格 | Q4: 当前价格
A5: 定义 | C5: 商品
B6: 1600008 | C6: 兵法商店_无懈可击_碎片_1 | D6: 物品 | E6: 无懈可击_碎片 | F6: 1 | G6: 兵法商店_商品 | M6: 1 | N6: 资源 | O6: 竹简 | P6: 500 | Q6: 500
B7: 1600009 | C7: 兵法商店_诛心饮血_碎片_1 | D7: 物品 | E7: 诛心饮血_碎片 | F7: 1 | G7: 兵法商店_商品 | M7: 1 | N7: 资源 | O7: 竹简 | P7: 500 | Q7: 500
B8: 1600010 | C8: 兵法商店_追亡逐北_碎片_1 | D8: 物品 | E8: 追亡逐北_碎片 | F8: 1 | G8: 兵法商店_商品 | M8: 1 | N8: 资源 | O8: 竹简 | P8: 500 | Q8: 500
B9: 1600011 | C9: 兵法商店_绝地反击_碎片_1 | D9: 物品 | E9: 绝地反击_碎片 | F9: 1 | G9: 兵法商店_商品 | M9: 1 | N9: 资源 | O9: 竹简 | P9: 500 | Q9: 500
B10: 1600012 | C10: 兵法商店_坚甲护卫_碎片_1 | D10: 物品 | E10: 坚甲护卫_碎片 | F10: 1 | G10: 兵法商店_商品 | M10: 1 | N10: 资源 | O10: 竹简 | P10: 500 | Q10: 500
B11: 1600013 | C11: 兵法商店_死生有命_碎片_1 | D11: 物品 | E11: 死生有命_碎片 | F11: 1 | G11: 兵法商店_商品 | M11: 1 | N11: 资源 | O11: 竹简 | P11: 500 | Q11: 500
B12: 1600014 | C12: 兵法商店_乱阵狂刀_碎片_1 | D12: 物品 | E12: 乱阵狂刀_碎片 | F12: 1 | G12: 兵法商店_商品 | M12: 1 | N12: 资源 | O12: 竹简 | P12: 500 | Q12: 500
B13: 1600015 | C13: 兵法商店_避险回生_碎片_1 | D13: 物品 | E13: 避险回生_碎片 | F13: 1 | G13: 兵法商店_商品 | M13: 1 | N13: 资源 | O13: 竹简 | P13: 500 | Q13: 500
B14: 1600016 | C14: 兵法商店_刀光毒影_碎片_1 | D14: 物品 | E14: 刀光毒影_碎片 | F14: 1 | G14: 兵法商店_商品 | M14: 1 | N14: 资源 | O14: 竹简 | P14: 500 | Q14: 500
B15: 1600017 | C15: 兵法商店_一鼓作气_碎片_1 | D15: 物品 | E15: 一鼓作气_碎片 | F15: 1 | G15: 兵法商店_商品 | M15: 1 | N15: 资源 | O15: 竹简 | P15: 500 | Q15: 500
B16: 1600018 | C16: 兵法商店_山止川行_碎片_1 | D16: 物品 | E16: 山止川行_碎片 | F16: 1 | G16: 兵法商店_商品 | M16: 1 | N16: 资源 | O16: 竹简 | P16: 500 | Q16: 500
B17: 1600019 | C17: 兵法商店_化险为夷_碎片_1 | D17: 物品 | E17: 化险为夷_碎片 | F17: 1 | G17: 兵法商店_商品 | M17: 1 | N17: 资源 | O17: 竹简 | P17: 500 | Q17: 500
B18: 1600020 | C18: 兵法商店_将士齐心_碎片_1 | D18: 物品 | E18: 将士齐心_碎片 | F18: 1 | G18: 兵法商店_商品 | M18: 1 | N18: 资源 | O18: 竹简 | P18: 500 | Q18: 500
B19: 1600021 | C19: 兵法商店_血战不屈_碎片_1 | D19: 物品 | E19: 血战不屈_碎片 | F19: 1 | G19: 兵法商店_商品 | M19: 1 | N19: 资源 | O19: 竹简 | P19: 500 | Q19: 500
B20: 1600022 | C20: 兵法商店_纵横疆场_碎片_1 | D20: 物品 | E20: 纵横疆场_碎片 | F20: 1 | G20: 兵法商店_商品 | M20: 1 | N20: 资源 | O20: 竹简 | P20: 500 | Q20: 500
B21: 1600023 | C21: 兵法商店_破釜沉舟_碎片_1 | D21: 物品 | E21: 破釜沉舟_碎片 | F21: 1 | G21: 兵法商店_商品 | M21: 1 | N21: 资源 | O21: 竹简 | P21: 500 | Q21: 500
B22: 1600024 | C22: 兵法商店_无懈可击_碎片_2 | D22: 物品 | E22: 无懈可击_碎片 | F22: 2 | G22: 兵法商店_商品 | M22: 1 | N22: 资源 | O22: 元宝 | P22: 100 | Q22: 100
B23: 1600025 | C23: 兵法商店_诛心饮血_碎片_2 | D23: 物品 | E23: 诛心饮血_碎片 | F23: 2 | G23: 兵法商店_商品 | M23: 1 | N23: 资源 | O23: 元宝 | P23: 100 | Q23: 100
B24: 1600026 | C24: 兵法商店_追亡逐北_碎片_2 | D24: 物品 | E24: 追亡逐北_碎片 | F24: 2 | G24: 兵法商店_商品 | M24: 1 | N24: 资源 | O24: 元宝 | P24: 100 | Q24: 100
B25: 1600027 | C25: 兵法商店_绝地反击_碎片_2 | D25: 物品 | E25: 绝地反击_碎片 | F25: 2 | G25: 兵法商店_商品 | M25: 1 | N25: 资源 | O25: 元宝 | P25: 100 | Q25: 100
B26: 1600028 | C26: 兵法商店_坚甲护卫_碎片_2 | D26: 物品 | E26: 坚甲护卫_碎片 | F26: 2 | G26: 兵法商店_商品 | M26: 1 | N26: 资源 | O26: 元宝 | P26: 100 | Q26: 100
B27: 1600029 | C27: 兵法商店_死生有命_碎片_2 | D27: 物品 | E27: 死生有命_碎片 | F27: 2 | G27: 兵法商店_商品 | M27: 1 | N27: 资源 | O27: 元宝 | P27: 100 | Q27: 100
B28: 1600030 | C28: 兵法商店_乱阵狂刀_碎片_2 | D28: 物品 | E28: 乱阵狂刀_碎片 | F28: 2 | G28: 兵法商店_商品 | M28: 1 | N28: 资源 | O28: 元宝 | P28: 100 | Q28: 100
B29: 1600031 | C29: 兵法商店_避险回生_碎片_2 | D29: 物品 | E29: 避险回生_碎片 | F29: 2 | G29: 兵法商店_商品 | M29: 1 | N29: 资源 | O29: 元宝 | P29: 100 | Q29: 100
B30: 1600032 | C30: 兵法商店_刀光毒影_碎片_2 | D30: 物品 | E30: 刀光毒影_碎片 | F30: 2 | G30: 兵法商店_商品 | M30: 1 | N30: 资源 | O30: 元宝 | P30: 100 | Q30: 100
B31: 1600033 | C31: 兵法商店_一鼓作气_碎片_2 | D31: 物品 | E31: 一鼓作气_碎片 | F31: 2 | G31: 兵法商店_商品 | M31: 1 | N31: 资源 | O31: 元宝 | P31: 100 | Q31: 100
B32: 1600034 | C32: 兵法商店_山止川行_碎片_2 | D32: 物品 | E32: 山止川行_碎片 | F32: 2 | G32: 兵法商店_商品 | M32: 1 | N32: 资源 | O32: 元宝 | P32: 100 | Q32: 100
B33: 1600035 | C33: 兵法商店_化险为夷_碎片_2 | D33: 物品 | E33: 化险为夷_碎片 | F33: 2 | G33: 兵法商店_商品 | M33: 1 | N33: 资源 | O33: 元宝 | P33: 100 | Q33: 100
B34: 1600036 | C34: 兵法商店_将士齐心_碎片_2 | D34: 物品 | E34: 将士齐心_碎片 | F34: 2 | G34: 兵法商店_商品 | M34: 1 | N34: 资源 | O34: 元宝 | P34: 100 | Q34: 100
B35: 1600037 | C35: 兵法商店_血战不屈_碎片_2 | D35: 物品 | E35: 血战不屈_碎片 | F35: 2 | G35: 兵法商店_商品 | M35: 1 | N35: 资源 | O35: 元宝 | P35: 100 | Q35: 100
B36: 1600038 | C36: 兵法商店_纵横疆场_碎片_2 | D36: 物品 | E36: 纵横疆场_碎片 | F36: 2 | G36: 兵法商店_商品 | M36: 1 | N36: 资源 | O36: 元宝 | P36: 100 | Q36: 100
B37: 1600039 | C37: 兵法商店_破釜沉舟_碎片_2 | D37: 物品 | E37: 破釜沉舟_碎片 | F37: 2 | G37: 兵法商店_商品 | M37: 1 | N37: 资源 | O37: 元宝 | P37: 100 | Q37: 100
B38: 1600040 | C38: 兵法商店_无懈可击_1 | D38: 物品 | E38: 无懈可击 | F38: 1 | G38: 兵法商店_商品 | K38: 1 | M38: 1 | N38: 资源 | O38: 元宝 | P38: 1000 | Q38: 900
B39: 1600041 | C39: 兵法商店_诛心饮血_1 | D39: 物品 | E39: 诛心饮血 | F39: 1 | G39: 兵法商店_商品 | K39: 1 | M39: 1 | N39: 资源 | O39: 元宝 | P39: 1000 | Q39: 900
B40: 1600042 | C40: 兵法商店_追亡逐北_1 | D40: 物品 | E40: 追亡逐北 | F40: 1 | G40: 兵法商店_商品 | K40: 1 | M40: 1 | N40: 资源 | O40: 元宝 | P40: 1000 | Q40: 900
B41: 1600043 | C41: 兵法商店_绝地反击_1 | D41: 物品 | E41: 绝地反击 | F41: 1 | G41: 兵法商店_商品 | K41: 1 | M41: 1 | N41: 资源 | O41: 元宝 | P41: 1000 | Q41: 900
B42: 1600044 | C42: 兵法商店_坚甲护卫_1 | D42: 物品 | E42: 坚甲护卫 | F42: 1 | G42: 兵法商店_商品 | K42: 1 | M42: 1 | N42: 资源 | O42: 元宝 | P42: 1000 | Q42: 900
B43: 1600045 | C43: 兵法商店_死生有命_1 | D43: 物品 | E43: 死生有命 | F43: 1 | G43: 兵法商店_商品 | K43: 1 | M43: 1 | N43: 资源 | O43: 元宝 | P43: 1000 | Q43: 900
B44: 1600046 | C44: 兵法商店_乱阵狂刀_1 | D44: 物品 | E44: 乱阵狂刀 | F44: 1 | G44: 兵法商店_商品 | K44: 1 | M44: 1 | N44: 资源 | O44: 元宝 | P44: 1000 | Q44: 900
B45: 1600047 | C45: 兵法商店_避险回生_1 | D45: 物品 | E45: 避险回生 | F45: 1 | G45: 兵法商店_商品 | K45: 1 | M45: 1 | N45: 资源 | O45: 元宝 | P45: 1000 | Q45: 900
B46: 1600048 | C46: 兵法商店_刀光毒影_1 | D46: 物品 | E46: 刀光毒影 | F46: 1 | G46: 兵法商店_商品 | K46: 1 | M46: 1 | N46: 资源 | O46: 元宝 | P46: 1000 | Q46: 900
B47: 1600049 | C47: 兵法商店_一鼓作气_1 | D47: 物品 | E47: 一鼓作气 | F47: 1 | G47: 兵法商店_商品 | K47: 1 | M47: 1 | N47: 资源 | O47: 元宝 | P47: 1000 | Q47: 900
B48: 1600050 | C48: 兵法商店_山止川行_1 | D48: 物品 | E48: 山止川行 | F48: 1 | G48: 兵法商店_商品 | K48: 1 | M48: 1 | N48: 资源 | O48: 元宝 | P48: 1000 | Q48: 900
B49: 1600051 | C49: 兵法商店_化险为夷_1 | D49: 物品 | E49: 化险为夷 | F49: 1 | G49: 兵法商店_商品 | K49: 1 | M49: 1 | N49: 资源 | O49: 元宝 | P49: 1000 | Q49: 900
B50: 1600052 | C50: 兵法商店_将士齐心_1 | D50: 物品 | E50: 将士齐心 | F50: 1 | G50: 兵法商店_商品 | K50: 1 | M50: 1 | N50: 资源 | O50: 元宝 | P50: 1000 | Q50: 900
B51: 1600053 | C51: 兵法商店_血战不屈_1 | D51: 物品 | E51: 血战不屈 | F51: 1 | G51: 兵法商店_商品 | K51: 1 | M51: 1 | N51: 资源 | O51: 元宝 | P51: 1000 | Q51: 900
B52: 1600054 | C52: 兵法商店_纵横疆场_1 | D52: 物品 | E52: 纵横疆场 | F52: 1 | G52: 兵法商店_商品 | K52: 1 | M52: 1 | N52: 资源 | O52: 元宝 | P52: 1000 | Q52: 900
B53: 1600055 | C53: 兵法商店_破釜沉舟_1 | D53: 物品 | E53: 破釜沉舟 | F53: 1 | G53: 兵法商店_商品 | K53: 1 | M53: 1 | N53: 资源 | O53: 元宝 | P53: 1000 | Q53: 900
B54: 1600056 | C54: 兵法商店_绿色兵法升级材料_15 | D54: 物品 | E54: 绿色兵法升级材料 | F54: 15 | G54: 兵法商店_商品 | M54: 1 | N54: 资源 | O54: 竹简 | P54: 150 | Q54: 150
B55: 1600057 | C55: 兵法商店_绿色兵法升级材料_20 | D55: 物品 | E55: 绿色兵法升级材料 | F55: 20 | G55: 兵法商店_商品 | M55: 1 | N55: 资源 | O55: 竹简 | P55: 200 | Q55: 200
B56: 1600058 | C56: 兵法商店_绿色兵法升级材料_25 | D56: 物品 | E56: 绿色兵法升级材料 | F56: 25 | G56: 兵法商店_商品 | M56: 1 | N56: 资源 | O56: 竹简 | P56: 250 | Q56: 250
B57: 1600059 | C57: 兵法商店_绿色兵法升级材料_30 | D57: 物品 | E57: 绿色兵法升级材料 | F57: 30 | G57: 兵法商店_商品 | M57: 1 | N57: 资源 | O57: 元宝 | P57: 30 | Q57: 30
B58: 1600060 | C58: 兵法商店_绿色兵法升级材料_40 | D58: 物品 | E58: 绿色兵法升级材料 | F58: 40 | G58: 兵法商店_商品 | M58: 1 | N58: 资源 | O58: 元宝 | P58: 40 | Q58: 40
B59: 1600061 | C59: 兵法商店_绿色兵法升级材料_50 | D59: 物品 | E59: 绿色兵法升级材料 | F59: 50 | G59: 兵法商店_商品 | M59: 1 | N59: 资源 | O59: 元宝 | P59: 50 | Q59: 50
B60: 1600062 | C60: 兵法商店_蓝色兵法升级材料_5 | D60: 物品 | E60: 蓝色兵法升级材料 | F60: 5 | G60: 兵法商店_商品 | M60: 1 | N60: 资源 | O60: 竹简 | P60: 400 | Q60: 400
B61: 1600063 | C61: 兵法商店_蓝色兵法升级材料_10 | D61: 物品 | E61: 蓝色兵法升级材料 | F61: 10 | G61: 兵法商店_商品 | M61: 1 | N61: 资源 | O61: 元宝 | P61: 80 | Q61: 80
B62: 1600064 | C62: 兵法商店_紫色兵法升级材料_10 | D62: 物品 | E62: 紫色兵法升级材料 | F62: 10 | G62: 兵法商店_商品 | K62: 1 | M62: 1 | N62: 资源 | O62: 元宝 | P62: 400 | Q62: 360
B63: 1600065 | C63: 兵法商店_兵法精粹绿_1 | D63: 物品 | E63: 兵法精粹绿 | F63: 1 | G63: 兵法商店_商品 | M63: 1 | N63: 资源 | O63: 竹简 | P63: 1000 | Q63: 1000
B64: 1600066 | C64: 兵法商店_兵法精粹绿_2 | D64: 物品 | E64: 兵法精粹绿 | F64: 2 | G64: 兵法商店_商品 | M64: 1 | N64: 资源 | O64: 元宝 | P64: 200 | Q64: 200
B65: 1600067 | C65: 兵法商店_兵法精粹蓝_1 | D65: 物品 | E65: 兵法精粹蓝 | F65: 1 | G65: 兵法商店_商品 | K65: 1 | M65: 1 | N65: 资源 | O65: 元宝 | P65: 500 | Q65: 450