Sheet: trade
A1: !LR! | B1: ID | C1: Name | D1: Title | E1: Campaign | F1: Reward | G1: MoneyType | H1: OriginPrice | I1: CurrentPrice | J1: Count | K1: HighlightItem1
B2: int | C2: string | D2: string | E2: string | F2: string | G2: string | H2: int | I2: string | J2: int | K2: string
D3: optional | E3: optional | K3: optional
A4: ### | D4: 显示名称 | F4: 奖励 | G4: 货币 | H4: 原始售价 | I4: 当前售价 | J4: 数量
A5: 定义 | C5: 活动任务
A6: 引用 | E6: 活动 | F6: 奖励 | G6: 资源 | K6: 物品
B7: 1010001 | C7: 第1天_活动4 | D7: TID_CAMPAIGN_7DAY_HALF_PRICE_1 | E7: 第1天_活动4 | F7: 第1天_活动4 | G7: 元宝 | H7: 800 | I7: 400 | J7: 1 | K7: 装备高级升品材料紫
B8: 1010002 | C8: 第2天_活动4 | D8: TID_CAMPAIGN_7DAY_HALF_PRICE_2 | E8: 第2天_活动4 | F8: 第2天_活动4 | G8: 元宝 | H8: 2400 | I8: 1200 | J8: 1 | K8: 橙将_魏蜀群_礼包2
B9: 1010003 | C9: 第3天_活动4 | D9: TID_CAMPAIGN_7DAY_HALF_PRICE_3 | E9: 第3天_活动4 | F9: 第3天_活动4 | G9: 元宝 | H9: 2400 | I9: 1200 | J9: 1 | K9: 装备高级升品材料橙
B10: 1010004 | C10: 第4天_活动4 | D10: TID_CAMPAIGN_7DAY_HALF_PRICE_4 | E10: 第4天_活动4 | F10: 第4天_活动4 | G10: 元宝 | H10: 2400 | I10: 1200 | J10: 1 | K10: 橙将_魏蜀群_礼包3
B11: 1010005 | C11: 第5天_活动4_1 | D11: TID_CAMPAIGN_7DAY_HALF_PRICE_5_1 | E11: 第5天_活动4 | F11: 第5天_活动4_1 | G11: 元宝 | H11: 2500 | I11: 1250 | J11: 1 | K11: 小兵突破石
B12: 1010006 | C12: 第5天_活动4_2 | D12: TID_CAMPAIGN_7DAY_HALF_PRICE_5_2 | E12: 第5天_活动4 | F12: 第5天_活动4_2 | G12: 元宝 | H12: 3000 | I12: 1500 | J12: 1 | K12: 小兵突破卡
B13: 1010007 | C13: 第6天_活动4 | D13: TID_CAMPAIGN_7DAY_HALF_PRICE_6 | E13: 第6天_活动4 | F13: 第6天_活动4 | G13: 元宝 | H13: 3000 | I13: 1500 | J13: 1 | K13: 兵法礼包综合12
B14: 1010008 | C14: 第7天_活动4 | D14: TID_CAMPAIGN_7DAY_HALF_PRICE_7 | E14: 第7天_活动4 | F14: 第7天_活动4 | G14: 元宝 | H14: 7500 | I14: 3750 | J14: 1 | K14: 红将_魏蜀群_礼包2
B15: 1010009 | C15: 第8天_活动4 | D15: TID_CAMPAIGN_14DAY_HALF_PRICE_1 | E15: 第8天_活动4 | F15: 第8天_活动4 | G15: 元宝 | H15: 7500 | I15: 3750 | J15: 1 | K15: 红将_魏蜀群_礼包1
B16: 1010010 | C16: 第9天_活动4 | D16: TID_CAMPAIGN_14DAY_HALF_PRICE_2 | E16: 第9天_活动4 | F16: 第9天_活动4 | G16: 元宝 | H16: 1600 | I16: 800 | J16: 1 | K16: 橙色宝物礼包
B17: 1010011 | C17: 第10天_活动4 | D17: TID_CAMPAIGN_14DAY_HALF_PRICE_3 | E17: 第10天_活动4 | F17: 第10天_活动4 | G17: 元宝 | H17: 3000 | I17: 1500 | J17: 1 | K17: 兵法礼包综合34
B18: 1010012 | C18: 第11天_活动4 | D18: TID_CAMPAIGN_14DAY_HALF_PRICE_4 | E18: 第11天_活动4 | F18: 第11天_活动4 | G18: 元宝 | H18: 7500 | I18: 3750 | J18: 1 | K18: 红将_魏蜀群_礼包1
B19: 1010013 | C19: 第12天_活动4 | D19: TID_CAMPAIGN_14DAY_HALF_PRICE_5 | E19: 第12天_活动4 | F19: 第12天_活动4 | G19: 元宝 | H19: 1600 | I19: 800 | J19: 1 | K19: 橙色宝物礼包
B20: 1010014 | C20: 第13天_活动4 | D20: TID_CAMPAIGN_14DAY_HALF_PRICE_6 | E20: 第13天_活动4 | F20: 第13天_活动4 | G20: 元宝 | H20: 3000 | I20: 1500 | J20: 1 | K20: 兵法礼包综合12
B21: 1010015 | C21: 第14天_活动4 | D21: TID_CAMPAIGN_14DAY_HALF_PRICE_7 | E21: 第14天_活动4 | F21: 第14天_活动4 | G21: 元宝 | H21: 2000 | I21: 1000 | J21: 1 | K21: 红色宝物礼包
B22: 1020001 | C22: 第8天_活动3_1 | D22: TID_CAMPAIGN_14DAY_SALE_1_1 | E22: 第8天_活动3 | F22: 第8天_活动3_1 | G22: 元宝 | H22: 250 | I22: 250 | J22: 2
B23: 1020002 | C23: 第8天_活动3_2 | D23: TID_CAMPAIGN_14DAY_SALE_1_2 | E23: 第8天_活动3 | F23: 第8天_活动3_2 | G23: 元宝 | H23: 2400 | I23: 1920 | J23: 2 | K23: 橙将_魏蜀群_礼包1
B24: 1020003 | C24: 第8天_活动3_3 | D24: TID_CAMPAIGN_14DAY_SALE_1_3 | E24: 第8天_活动3 | F24: 第8天_活动3_3 | G24: 元宝 | H24: 2400 | I24: 1920 | J24: 2 | K24: 橙将_魏蜀群_礼包2
B25: 1020004 | C25: 第8天_活动3_4 | D25: TID_CAMPAIGN_14DAY_SALE_1_4 | E25: 第8天_活动3 | F25: 第8天_活动3_4 | G25: 元宝 | H25: 2400 | I25: 1920 | J25: 2 | K25: 橙将_魏蜀群_礼包5
B26: 1020005 | C26: 第8天_活动3_5 | D26: TID_CAMPAIGN_14DAY_SALE_1_5 | E26: 第8天_活动3 | F26: 第8天_活动3_5 | G26: 元宝 | H26: 2400 | I26: 1920 | J26: 2 | K26: 橙将_魏蜀群_礼包6
B27: 1020006 | C27: 第8天_活动3_6 | D27: TID_CAMPAIGN_14DAY_SALE_1_6 | E27: 第8天_活动3 | F27: 第8天_活动3_6 | G27: 元宝 | H27: 100 | I27: 80 | J27: 20
B28: 1020007 | C28: 第8天_活动3_7 | D28: TID_CAMPAIGN_14DAY_SALE_1_7 | E28: 第8天_活动3 | F28: 第8天_活动3_7 | G28: 元宝 | H28: 800 | I28: 480 | J28: 2
B29: 1020008 | C29: 第8天_活动3_8 | D29: TID_CAMPAIGN_14DAY_SALE_1_8 | E29: 第8天_活动3 | F29: 第8天_活动3_8 | G29: 元宝 | H29: 400 | I29: 320 | J29: 20
B30: 1020009 | C30: 第8天_活动3_9 | D30: TID_CAMPAIGN_14DAY_SALE_1_9 | E30: 第8天_活动3 | F30: 第8天_活动3_9 | G30: 元宝 | H30: 4000 | I30: 2400 | J30: 2
B31: 1020010 | C31: 第8天_活动3_10 | D31: TID_CAMPAIGN_14DAY_SALE_1_10 | E31: 第8天_活动3 | F31: 第8天_活动3_10 | G31: 元宝 | H31: 100 | I31: 70 | J31: 20
B32: 1030001 | C32: 第9天_活动3_1 | D32: TID_CAMPAIGN_14DAY_SALE_2_1 | E32: 第9天_活动3 | F32: 第9天_活动3_1 | G32: 元宝 | H32: 250 | I32: 250 | J32: 2
B33: 1030002 | C33: 第9天_活动3_2 | D33: TID_CAMPAIGN_14DAY_SALE_2_2 | E33: 第9天_活动3 | F33: 第9天_活动3_2 | G33: 元宝 | H33: 400 | I33: 2 | J33: 4 | K33: 橙色宝
B34: 1030003 | C34: 第9天_活动3_3 | D34: TID_CAMPAIGN_14DAY_SALE_2_3 | E34: 第9天_活动3 | F34: 第9天_活动3_3 | G34: 元宝 | H34: 200 | I34: 180 | J34: 4 | K34: 橙宝_碎片_礼包
B35: 1030004 | C35: 第9天_活动3_4 | D35: TID_CAMPAIGN_14DAY_SALE_2_4 | E35: 第9天_活动3 | F35: 第9天_活动3_4 | G35: 元宝 | H35: 800 | I35: 640 | J35: 5 | K35: 装备高级升品材料红
B36: 1030005 | C36: 第9天_活动3_5 | D36: TID_CAMPAIGN_14DAY_SALE_2_5 | E36: 第9天_活动3 | F36: 第9天_活动3_5 | G36: 元宝 | H36: 200 | I36: 160 | J36: 20
B37: 1030006 | C37: 第9天_活动3_6 | D37: TID_CAMPAIGN_14DAY_SALE_2_6 | E37: 第9天_活动3 | F37: 第9天_活动3_6 | G37: 元宝 | H37: 2000 | I37: 1200 | J37: 2
B38: 1030007 | C38: 第9天_活动3_7 | D38: TID_CAMPAIGN_14DAY_SALE_2_7 | E38: 第9天_活动3 | F38: 第9天_活动3_7 | G38: 元宝 | H38: 200 | I38: 160 | J38: 20
B39: 1030008 | C39: 第9天_活动3_8 | D39: TID_CAMPAIGN_14DAY_SALE_2_8 | E39: 第9天_活动3 | F39: 第9天_活动3_8 | G39: 元宝 | H39: 2000 | I39: 1200 | J39: 2
B40: 1030009 | C40: 第9天_活动3_9 | D40: TID_CAMPAIGN_14DAY_SALE_2_9 | E40: 第9天_活动3 | F40: 第9天_活动3_9 | G40: 元宝 | H40: 200 | I40: 140 | J40: 20
B41: 1030010 | C41: 第9天_活动3_10 | D41: TID_CAMPAIGN_14DAY_SALE_2_10 | E41: 第9天_活动3 | F41: 第9天_活动3_10 | G41: 元宝 | H41: 200 | I41: 140 | J41: 20
B42: 1040001 | C42: 第10天_活动3_1 | D42: TID_CAMPAIGN_14DAY_SALE_3_1 | E42: 第10天_活动3 | F42: 第10天_活动3_1 | G42: 元宝 | H42: 250 | I42: 250 | J42: 2
B43: 1040002 | C43: 第10天_活动3_2 | D43: TID_CAMPAIGN_14DAY_SALE_3_2 | E43: 第10天_活动3 | F43: 第10天_活动3_2 | G43: 元宝 | H43: 1000 | I43: 800 | J43: 4 | K43: 兵法礼包3
B44: 1040003 | C44: 第10天_活动3_3 | D44: TID_CAMPAIGN_14DAY_SALE_3_3 | E44: 第10天_活动3 | F44: 第10天_活动3_3 | G44: 元宝 | H44: 1000 | I44: 800 | J44: 4 | K44: 兵法礼包4
B45: 1040004 | C45: 第10天_活动3_4 | D45: TID_CAMPAIGN_14DAY_SALE_3_4 | E45: 第10天_活动3 | F45: 第10天_活动3_4 | G45: 元宝 | H45: 2000 | I45: 1400 | J45: 5 | K45: 悬赏令
B46: 1040005 | C46: 第10天_活动3_5 | D46: TID_CAMPAIGN_14DAY_SALE_3_5 | E46: 第10天_活动3 | F46: 第10天_活动3_5 | G46: 元宝 | H46: 250 | I46: 175 | J46: 20
B47: 1040006 | C47: 第10天_活动3_6 | D47: TID_CAMPAIGN_14DAY_SALE_3_6 | E47: 第10天_活动3 | F47: 第10天_活动3_6 | G47: 元宝 | H47: 1000 | I47: 700 | J47: 20
B48: 1040007 | C48: 第10天_活动3_7 | D48: TID_CAMPAIGN_14DAY_SALE_3_7 | E48: 第10天_活动3 | F48: 第10天_活动3_7 | G48: 元宝 | H48: 400 | I48: 320 | J48: 20
B49: 1040008 | C49: 第10天_活动3_8 | D49: TID_CAMPAIGN_14DAY_SALE_3_8 | E49: 第10天_活动3 | F49: 第10天_活动3_8 | G49: 元宝 | H49: 4000 | I49: 2400 | J49: 2
B50: 1040009 | C50: 第10天_活动3_9 | D50: TID_CAMPAIGN_14DAY_SALE_3_9 | E50: 第10天_活动3 | F50: 第10天_活动3_9 | G50: 元宝 | H50: 200 | I50: 160 | J50: 20
B51: 1040010 | C51: 第10天_活动3_10 | D51: TID_CAMPAIGN_14DAY_SALE_3_10 | E51: 第10天_活动3 | F51: 第10天_活动3_10 | G51: 元宝 | H51: 2000 | I51: 1200 | J51: 2
B52: 1050001 | C52: 第11天_活动3_1 | D52: TID_CAMPAIGN_14DAY_SALE_4_1 | E52: 第11天_活动3 | F52: 第11天_活动3_1 | G52: 元宝 | H52: 250 | I52: 250 | J52: 2
B53: 1050002 | C53: 第11天_活动3_2 | D53: TID_CAMPAIGN_14DAY_SALE_4_2 | E53: 第11天_活动3 | F53: 第11天_活动3_2 | G53: 元宝 | H53: 2400 | I53: 1920 | J53: 2 | K53: 橙将_魏蜀群_礼包3
B54: 1050003 | C54: 第11天_活动3_3 | D54: TID_CAMPAIGN_14DAY_SALE_4_3 | E54: 第11天_活动3 | F54: 第11天_活动3_3 | G54: 元宝 | H54: 2400 | I54: 1920 | J54: 2 | K54: 橙将_魏蜀群_礼包4
B55: 1050004 | C55: 第11天_活动3_4 | D55: TID_CAMPAIGN_14DAY_SALE_4_4 | E55: 第11天_活动3 | F55: 第11天_活动3_4 | G55: 元宝 | H55: 2400 | I55: 1920 | J55: 2 | K55: 橙将_魏蜀群_礼包5
B56: 1050005 | C56: 第11天_活动3_5 | D56: TID_CAMPAIGN_14DAY_SALE_4_5 | E56: 第11天_活动3 | F56: 第11天_活动3_5 | G56: 元宝 | H56: 2 | I56: 1920 | J56: 2 | K56: 橙将_魏蜀群_礼包6
B57: 1050006 | C57: 第11天_活动3_6 | D57: TID_CAMPAIGN_14DAY_SALE_4_6 | E57: 第11天_活动3 | F57: 第11天_活动3_6 | G57: 元宝 | H57: 100 | I57: 80 | J57: 20
B58: 1050007 | C58: 第11天_活动3_7 | D58: TID_CAMPAIGN_14DAY_SALE_4_7 | E58: 第11天_活动3 | F58: 第11天_活动3_7 | G58: 元宝 | H58: 800 | I58: 480 | J58: 2
B59: 1050008 | C59: 第11天_活动3_8 | D59: TID_CAMPAIGN_14DAY_SALE_4_8 | E59: 第11天_活动3 | F59: 第11天_活动3_8 | G59: 元宝 | H59: 400 | I59: 320 | J59: 20
B60: 1050009 | C60: 第11天_活动3_9 | D60: TID_CAMPAIGN_14DAY_SALE_4_9 | E60: 第11天_活动3 | F60: 第11天_活动3_9 | G60: 元宝 | H60: 4000 | I60: 2400 | J60: 2
B61: 1050010 | C61: 第11天_活动3_10 | D61: TID_CAMPAIGN_14DAY_SALE_4_10 | E61: 第11天_活动3 | F61: 第11天_活动3_10 | G61: 元宝 | H61: 100 | I61: 70 | J61: 20
B62: 1060001 | C62: 第12天_活动3_1 | D62: TID_CAMPAIGN_14DAY_SALE_5_1 | E62: 第12天_活动3 | F62: 第12天_活动3_1 | G62: 元宝 | H62: 250 | I62: 250 | J62: 2 | K62: newadd
B63: 1060003 | C63: TID_CAMPAIGN_14DAY_SALE_5_2 | D63: 第12天_活动3 | E63: 第12天_活动3_2 | F63: 元宝 | G63: 400 | H63: 280 | I63: 4 | J63: 橙色宝物礼包
B64: 1060003 | C64: 第12天_活动3_3 | D64: TID_CAMPAIGN_14DAY_SALE_5_3 | E64: 第12天_活动3 | F64: 第12天_活动3_3 | G64: 元宝 | H64: 200 | I64: 180 | J64: 4 | K64: 橙宝_碎片
B65: 10600040 | C65: 第12天_活动3_4 | D65: TID_CAMPAIGN_14DAY_SALE_5_4 | E65: 第12天_活动3 | F65: 第12天_活动3_4 | G65: 元宝 | H65: 800 | I65: 640 | J65: 5 | K65: 装备高级升品材料红
B66: 1060005 | C66: 第12天_活动3_5 | D66: TID_CAMPAIGN_14DAY_SALE_5_5 | E66: 第12天_活动3 | F66: 第12天_活动3_5 | G66: 元宝 | H66: 200 | I66: 160 | J66: 20
B67: 1060006 | C67: 第12天_活动3_6 | D67: TID_CAMPAIGN_14DAY_SALE_5_6 | E67: 第12天_活动3 | F67: 第12天_活动3_6 | G67: 元宝 | H67: 2000 | I67: 1200 | J67: 2
B68: 1060007 | C68: 第12天_活动3_7 | D68: TID_CAMPAIGN_14DAY_SALE_5_7 | E68: 第12天_活动3 | F68: 第12天_活动3_7 | G68: 元宝 | H68: 200 | I68: 160 | J68: 20
B69: 1060008 | C69: 第12天_活动3_8 | D69: TID_CAMPAIGN_14DAY_SALE_5_8 | E69: 第12天_活动3 | F69: 第12天_活动3_8 | G69: 元宝 | H69: 2000 | I69: 1200 | J69: 2
B70: 1060009 | C70: 第12天_活动3_9 | D70: TID_CAMPAIGN_14DAY_SALE_5_9 | E70: 第12天_活动3 | F70: 第12天_活动3_9 | G70: 元宝 | H70: 200 | I70: 140 | J70: 20
B71: 1060010 | C71: 第12天_活动3_10 | D71: TID_CAMPAIGN_14DAY_SALE_5_10 | E71: 第12天_活动3 | F71: 第12天_活动3_10 | G71: 元宝 | H71: 200 | I71: 140 | J71: 20
B72: 1070001 | C72: 第13天_活动3_1 | D72: TID_CAMPAIGN_14DAY_SALE_6_1 | E72: 第13天_活动3 | F72: 第13天_活动3_1 | G72: 元宝 | H72: 250 | I72: 250 | J72: 2
B73: 1070002 | C73: 第13天_活动3_2 | D73: TID_CAMPAIGN_14DAY_SALE_6_2 | E73: 第13天_活动3 | F73: 第13天_活动3_2 | G73: 元宝 | H73: 1000 | I73: 800 | J73: 4 | K73: 兵法礼包1
B74: 1070003 | C74: 第13天_活动3_3 | D74: TID_CAMPAIGN_14DAY_SALE_6_3 | E74: 第13天_活动3 | F74: 第13天_活动3_3 | G74: 元宝 | H74: 1000 | I74: 800 | J74: 4 | K74: 兵法礼包2
B75: 1070004 | C75: 第13天_活动3_4 | D75: TID_CAMPAIGN_14DAY_SALE_6_4 | E75: 第13天_活动3 | F75: 第13天_活动3_4 | G75: 元宝 | H75: 2000 | I75: 1400 | J75: 5 | K75: 悬赏令
B76: 1070005 | C76: 第13天_活动3_5 | D76: TID_CAMPAIGN_14DAY_SALE_6_5 | E76: 第13天_活动3 | F76: 第13天_活动3_5 | G76: 元宝 | H76: 250 | I76: 175 | J76: 20
B77: 1070006 | C77: 第13天_活动3_6 | D77: TID_CAMPAIGN_14DAY_SALE_6_6 | E77: 第13天_活动3 | F77: 第13天_活动3_6 | G77: 元宝 | H77: 1000 | I77: 700 | J77: 20
B78: 1070007 | C78: 第13天_活动3_7 | D78: TID_CAMPAIGN_14DAY_SALE_6_7 | E78: 第13天_活动3 | F78: 第13天_活动3_7 | G78: 元宝 | H78: 400 | I78: 320 | J78: 20
B79: 1070008 | C79: 第13天_活动3_8 | D79: TID_CAMPAIGN_14DAY_SALE_6_8 | E79: 第13天_活动3 | F79: 第13天_活动3_8 | G79: 元宝 | H79: 4000 | I79: 2400 | J79: 2
B80: 1070009 | C80: 第13天_活动3_9 | D80: TID_CAMPAIGN_14DAY_SALE_6_9 | E80: 第13天_活动3 | F80: 第13天_活动3_9 | G80: 元宝 | H80: 200 | I80: 160 | J80: 20
B81: 1070010 | C81: 第13天_活动3_10 | D81: TID_CAMPAIGN_14DAY_SALE_6_10 | E81: 第13天_活动3 | F81: 第13天_活动3_10 | G81: 元宝 | H81: 2000 | I81: 1200 | J81: 2
B82: 1080001 | C82: 第14天_活动3_1 | D82: TID_CAMPAIGN_14DAY_SALE_7_1 | E82: 第14天_活动3 | F82: 第14天_活动3_1 | G82: 元宝 | H82: 250 | I82: 250 | J82: 2
B83: 1080002 | C83: 第14天_活动3_2 | D83: TID_CAMPAIGN_14DAY_SALE_7_2 | E83: 第14天_活动3 | F83: 第14天_活动3_2 | G83: 元宝 | H83: 250 | I83: 250 | J83: 2
B84: 1080003 | C84: 第14天_活动3_3 | D84: TID_CAMPAIGN_14DAY_SALE_7_3 | E84: 第14天_活动3 | F84: 第14天_活动3_3 | G84: 元宝 | H84: 7500 | I84: 6000 | J84: 2 | K84: 红将_魏蜀群_礼包1
B85: 1080004 | C85: 第14天_活动3_4 | D85: TID_CAMPAIGN_14DAY_SALE_7_4 | E85: 第14天_活动3 | F85: 第14天_活动3_4 | G85: 元宝 | H85: 7500 | I85: 6000 | J85: 2 | K85: 红将_魏蜀群_礼包2
B86: 1080005 | C86: 第14天_活动3_5 | D86: TID_CAMPAIGN_14DAY_SALE_7_5 | E86: 第14天_活动3 | F86: 第14天_活动3_5 | G86: 元宝 | H86: 1000 | I86: 700 | J86: 2 | K86: 红色宝物礼包
B87: 1080006 | C87: 第14天_活动3_6 | D87: TID_CAMPAIGN_14DAY_SALE_7_6 | E87: 第14天_活动3 | F87: 第14天_活动3_6 | G87: 元宝 | H87: 500 | I87: 450 | J87: 2 | K87: 红宝_碎片_礼包
B88: 1080007 | C88: 第14天_活动3_7 | D88: TID_CAMPAIGN_14DAY_SALE_7_7 | E88: 第14天_活动3 | F88: 第14天_活动3_7 | G88: 元宝 | H88: 200 | I88: 140 | J88: 20
B89: 1090001 | C89: 测试贩售条目 | D89: TID_CAMPAIGN_TEST_TRADE | E89: 测试_贩售条目 | F89: 测试条目奖励 | G89: 元宝 | H89: 100 | I89: 80 | J89: 100
B90: 1100001 | C90: 等级礼包1_贩售1 | D90: TID_CAMPAIGN_LEVEL_PACKAGE_SELL_1 | E90: 等级礼包1 | F90: 等级礼包1_贩售1 | G90: 元宝 | H90: 250 | I90: 150 | J90: 10
B91: 1100002 | C91: 等级礼包1_贩售2 | D91: TID_CAMPAIGN_LEVEL_PACKAGE_SELL_2 | E91: 等级礼包1 | F91: 等级礼包1_贩售2 | G91: 元宝 | H91: 100 | I91: 60 | J91: 10
B92: 1100003 | C92: 等级礼包2_贩售 | D92: TID_CAMPAIGN_LEVEL_PACKAGE_SELL_3 | E92: 等级礼包2 | F92: 等级礼包2_贩售 | G92: 元宝 | H92: 100 | I92: 80 | J92: 20
B93: 1100004 | C93: 等级礼包3_贩售 | D93: TID_CAMPAIGN_LEVEL_PACKAGE_SELL_4 | E93: 等级礼包3 | F93: 等级礼包3_贩售 | G93: 元宝 | H93: 200 | I93: 120 | J93: 10
B94: 1100005 | C94: 等级礼包4_贩售 | D94: TID_CAMPAIGN_LEVEL_PACKAGE_SELL_5 | E94: 等级礼包4 | F94: 等级礼包4_贩售 | G94: 元宝 | H94: 100 | I94: 80 | J94: 5
B95: 1100006 | C95: 等级礼包5_贩售1 | D95: TID_CAMPAIGN_LEVEL_PACKAGE_SELL_6 | E95: 等级礼包5 | F95: 等级礼包5_贩售1 | G95: 元宝 | H95: 500 | I95: 250 | J95: 20
B96: 1100007 | C96: 等级礼包5_贩售2 | D96: TID_CAMPAIGN_LEVEL_PACKAGE_SELL_7 | E96: 等级礼包5 | F96: 等级礼包5_贩售2 | G96: 元宝 | H96: 200 | I96: 160 | J96: 20
B97: 1100008 | C97: 等级礼包6_贩售1 | D97: TID_CAMPAIGN_LEVEL_PACKAGE_SELL_8 | E97: 等级礼包6 | F97: 等级礼包6_贩售1 | G97: 元宝 | H97: 250 | I97: 150 | J97: 10
B98: 1100009 | C98: 等级礼包6_贩售2 | D98: TID_CAMPAIGN_LEVEL_PACKAGE_SELL_9 | E98: 等级礼包6 | F98: 等级礼包6_贩售2 | G98: 元宝 | H98: 200 | I98: 160 | J98: 10
B99: 1100010 | C99: 等级礼包7_贩售1 | D99: TID_CAMPAIGN_LEVEL_PACKAGE_SELL_10 | E99: 等级礼包7 | F99: 等级礼包7_贩售1 | G99: 元宝 | H99: 1000 | I99: 800 | J99: 3 | K99: 兵法礼包1
B100: 1100011 | C100: 等级礼包7_贩售2 | D100: TID_CAMPAIGN_LEVEL_PACKAGE_SELL_11 | E100: 等级礼包7 | F100: 等级礼包7_贩售2 | G100: 元宝 | H100: 1000 | I100: 800 | J100: 3 | K100: 兵法礼包2
B101: 1100012 | C101: 等级礼包7_贩售3 | D101: TID_CAMPAIGN_LEVEL_PACKAGE_SELL_12 | E101: 等级礼包7 | F101: 等级礼包7_贩售3 | G101: 元宝 | H101: 400 | I101: 200 | J101: 20
B102: 1100013 | C102: 等级礼包8_贩售1 | D102: TID_CAMPAIGN_LEVEL_PACKAGE_SELL_13 | E102: 等级礼包8 | F102: 等级礼包8_贩售1 | G102: 元宝 | H102: 250 | I102: 150 | J102: 10
B103: 1100014 | C103: 等级礼包8_贩售2 | D103: TID_CAMPAIGN_LEVEL_PACKAGE_SELL_14 | E103: 等级礼包8 | F103: 等级礼包8_贩售2 | G103: 元宝 | H103: 200 | I103: 160 | J103: 20
B104: 1100015 | C104: 等级礼包9_贩售 | D104: TID_CAMPAIGN_LEVEL_PACKAGE_SELL_15 | E104: 等级礼包9 | F104: 等级礼包9_贩售 | G104: 元宝 | H104: 500 | I104: 300 | J104: 20
B105: 1100016 | C105: 等级礼包10_贩售 | D105: TID_CAMPAIGN_LEVEL_PACKAGE_SELL_16 | E105: 等级礼包10 | F105: 等级礼包10_贩售 | G105: 元宝 | H105: 2000 | I105: 1200 | J105: 500

Sheet: ques
A1: !LR! | B1: ID | C1: Name | D1: Title | E1: Campaign | F1: Target | G1: Reward | H1: GameEvent | I1: ClientTarget | J1: HighlightItem1
B2: int | C2: string | D2: string | E2: string | F2: int | G2: string | H2: string | I2: string | J2: string
D3: optional | E3: optional | F3: array | G3: array | I3: optional | J3: optional
A4: ### | D4: 显示名称 | F4: 数量 | G4: 奖励 | H4: 对应服务器的玩法事件
A5: 定义 | C5: 活动任务
A6: 引用 | E6: 活动 | G6: 奖励 | I6: 客户端跳转 | J6: 物品
B7: 3010001 | C7: 每日签到_第1天 | D7: TID_CAMPAIGN_LOGIN_EVERYDAY_MISSION | E7: 每日签到 | F7: 1 | G7: 每日签到_第1天 | H7: daily_login
B8: 3010002 | C8: 每日签到_第2天 | D8: TID_CAMPAIGN_LOGIN_EVERYDAY_MISSION | E8: 每日签到 | F8: 2 | G8: 每日签到_第2天 | H8: daily_login
B9: 3010003 | C9: 每日签到_第3天 | D9: TID_CAMPAIGN_LOGIN_EVERYDAY_MISSION | E9: 每日签到 | F9: 3 | G9: 每日签到_第3天 | H9: daily_login
B10: 3010004 | C10: 每日签到_第4天 | D10: TID_CAMPAIGN_LOGIN_EVERYDAY_MISSION | E10: 每日签到 | F10: 4 | G10: 每日签到_第4天 | H10: daily_login
B11: 3010005 | C11: 每日签到_第5天 | D11: TID_CAMPAIGN_LOGIN_EVERYDAY_MISSION | E11: 每日签到 | F11: 5 | G11: 每日签到_第5天 | H11: daily_login
B12: 3010006 | C12: 每日签到_第6天 | D12: TID_CAMPAIGN_LOGIN_EVERYDAY_MISSION | E12: 每日签到 | F12: 6 | G12: 每日签到_第6天 | H12: daily_login
B13: 3010007 | C13: 每日签到_第7天 | D13: TID_CAMPAIGN_LOGIN_EVERYDAY_MISSION | E13: 每日签到 | F13: 7 | G13: 每日签到_第7天 | H13: daily_login
B14: 3010008 | C14: 每日签到_第8天 | D14: TID_CAMPAIGN_LOGIN_EVERYDAY_MISSION | E14: 每日签到 | F14: 8 | G14: 每日签到_第8天 | H14: daily_login
B15: 3010009 | C15: 每日签到_第9天 | D15: TID_CAMPAIGN_LOGIN_EVERYDAY_MISSION | E15: 每日签到 | F15: 9 | G15: 每日签到_第9天 | H15: daily_login
B16: 3010010 | C16: 每日签到_第10天 | D16: TID_CAMPAIGN_LOGIN_EVERYDAY_MISSION | E16: 每日签到 | F16: 10 | G16: 每日签到_第10天 | H16: daily_login
B17: 3010011 | C17: 每日签到_第11天 | D17: TID_CAMPAIGN_LOGIN_EVERYDAY_MISSION | E17: 每日签到 | F17: 11 | G17: 每日签到_第11天 | H17: daily_login
B18: 3010012 | C18: 每日签到_第12天 | D18: TID_CAMPAIGN_LOGIN_EVERYDAY_MISSION | E18: 每日签到 | F18: 12 | G18: 每日签到_第12天 | H18: daily_login
B19: 3010013 | C19: 每日签到_第13天 | D19: TID_CAMPAIGN_LOGIN_EVERYDAY_MISSION | E19: 每日签到 | F19: 13 | G19: 每日签到_第13天 | H19: daily_login
B20: 3010014 | C20: 每日签到_第14天 | D20: TID_CAMPAIGN_LOGIN_EVERYDAY_MISSION | E20: 每日签到 | F20: 14 | G20: 每日签到_第14天 | H20: daily_login
B21: 3010015 | C21: 每日签到_第15天 | D21: TID_CAMPAIGN_LOGIN_EVERYDAY_MISSION | E21: 每日签到 | F21: 15 | G21: 每日签到_第15天 | H21: daily_login
B22: 3010016 | C22: 每日签到_第16天 | D22: TID_CAMPAIGN_LOGIN_EVERYDAY_MISSION | E22: 每日签到 | F22: 16 | G22: 每日签到_第16天 | H22: daily_login
B23: 3010017 | C23: 每日签到_第17天 | D23: TID_CAMPAIGN_LOGIN_EVERYDAY_MISSION | E23: 每日签到 | F23: 17 | G23: 每日签到_第17天 | H23: daily_login
B24: 3010018 | C24: 每日签到_第18天 | D24: TID_CAMPAIGN_LOGIN_EVERYDAY_MISSION | E24: 每日签到 | F24: 18 | G24: 每日签到_第18天 | H24: daily_login
B25: 3010019 | C25: 每日签到_第19天 | D25: TID_CAMPAIGN_LOGIN_EVERYDAY_MISSION | E25: 每日签到 | F25: 19 | G25: 每日签到_第19天 | H25: daily_login
B26: 3010020 | C26: 每日签到_第20天 | D26: TID_CAMPAIGN_LOGIN_EVERYDAY_MISSION | E26: 每日签到 | F26: 20 | G26: 每日签到_第20天 | H26: daily_login
B27: 3010021 | C27: 每日签到_第21天 | D27: TID_CAMPAIGN_LOGIN_EVERYDAY_MISSION | E27: 每日签到 | F27: 21 | G27: 每日签到_第21天 | H27: daily_login
B28: 3010022 | C28: 每日签到_第22天 | D28: TID_CAMPAIGN_LOGIN_EVERYDAY_MISSION | E28: 每日签到 | F28: 22 | G28: 每日签到_第22天 | H28: daily_login
B29: 3010023 | C29: 每日签到_第23天 | D29: TID_CAMPAIGN_LOGIN_EVERYDAY_MISSION | E29: 每日签到 | F29: 23 | G29: 每日签到_第23天 | H29: daily_login
B30: 3010024 | C30: 每日签到_第24天 | D30: TID_CAMPAIGN_LOGIN_EVERYDAY_MISSION | E30: 每日签到 | F30: 24 | G30: 每日签到_第24天 | H30: daily_login
B31: 3010025 | C31: 每日签到_第25天 | D31: TID_CAMPAIGN_LOGIN_EVERYDAY_MISSION | E31: 每日签到 | F31: 25 | G31: 每日签到_第25天 | H31: daily_login
B32: 3010026 | C32: 每日签到_第26天 | D32: TID_CAMPAIGN_LOGIN_EVERYDAY_MISSION | E32: 每日签到 | F32: 26 | G32: 每日签到_第26天 | H32: daily_login
B33: 3010027 | C33: 每日签到_第27天 | D33: TID_CAMPAIGN_LOGIN_EVERYDAY_MISSION | E33: 每日签到 | F33: 27 | G33: 每日签到_第27天 | H33: daily_login
B34: 3010028 | C34: 每日签到_第28天 | D34: TID_CAMPAIGN_LOGIN_EVERYDAY_MISSION | E34: 每日签到 | F34: 28 | G34: 每日签到_第28天 | H34: daily_login
B35: 3010029 | C35: 每日签到_第29天 | D35: TID_CAMPAIGN_LOGIN_EVERYDAY_MISSION | E35: 每日签到 | F35: 29 | G35: 每日签到_第29天 | H35: daily_login
B36: 3010030 | C36: 每日签到_第30天 | D36: TID_CAMPAIGN_LOGIN_EVERYDAY_MISSION | E36: 每日签到 | F36: 30 | G36: 每日签到_第30天 | H36: daily_login
B37: 3020001 | C37: 第1天_活动1_登陆 | D37: TID_CAMPAIGN_LOGIN | E37: 第1天_活动1 | F37: 1 | G37: 第1天_活动1_登陆 | H37: daily_login
B38: 3020002 | C38: 第2天_活动1_登陆 | D38: TID_CAMPAIGN_LOGIN | E38: 第2天_活动1 | F38: 1 | G38: 第2天_活动1_登陆 | H38: daily_login
B39: 3020003 | C39: 第3天_活动1_登陆 | D39: TID_CAMPAIGN_LOGIN | E39: 第3天_活动1 | F39: 1 | G39: 第3天_活动1_登陆 | H39: daily_login
B40: 3020004 | C40: 第4天_活动1_登陆 | D40: TID_CAMPAIGN_LOGIN | E40: 第4天_活动1 | F40: 1 | G40: 第4天_活动1_登陆 | H40: daily_login
B41: 3020005 | C41: 第5天_活动1_登陆 | D41: TID_CAMPAIGN_LOGIN | E41: 第5天_活动1 | F41: 1 | G41: 第5天_活动1_登陆 | H41: daily_login
B42: 3020006 | C42: 第6天_活动1_登陆 | D42: TID_CAMPAIGN_LOGIN | E42: 第6天_活动1 | F42: 1 | G42: 第6天_活动1_登陆 | H42: daily_login
B43: 3020007 | C43: 第7天_活动1_登陆 | D43: TID_CAMPAIGN_LOGIN | E43: 第7天_活动1 | F43: 1 | G43: 第7天_活动1_登陆 | H43: daily_login | J43: 橙将_魏蜀群_礼包4
B44: 3020008 | C44: 第8天_活动1_登陆 | D44: TID_CAMPAIGN_LOGIN | E44: 第8天_活动1 | F44: 1 | G44: 第8天_活动1_登陆 | H44: daily_login | J44: 红将_魏蜀群_碎片_礼包2
B45: 3020009 | C45: 第9天_活动1_登陆 | D45: TID_CAMPAIGN_LOGIN | E45: 第9天_活动1 | F45: 1 | G45: 第9天_活动1_登陆 | H45: daily_login | J45: 红将_魏蜀群_碎片_礼包2
B46: 3020010 | C46: 第10天_活动1_登陆 | D46: TID_CAMPAIGN_LOGIN | E46: 第10天_活动1 | F46: 1 | G46: 第10天_活动1_登陆 | H46: daily_login | J46: 红将_魏蜀群_碎片_礼包2
B47: 3020011 | C47: 第11天_活动1_登陆 | D47: TID_CAMPAIGN_LOGIN | E47: 第11天_活动1 | F47: 1 | G47: 第11天_活动1_登陆 | H47: daily_login | J47: 红将_魏蜀群_碎片_礼包2
B48: 3020012 | C48: 第12天_活动1_登陆 | D48: TID_CAMPAIGN_LOGIN | E48: 第12天_活动1 | F48: 1 | G48: 第12天_活动1_登陆 | H48: daily_login | J48: 红将_魏蜀群_碎片_礼包2
B49: 3020013 | C49: 第13天_活动1_登陆 | D49: TID_CAMPAIGN_LOGIN | E49: 第13天_活动1 | F49: 1 | G49: 第13天_活动1_登陆 | H49: daily_login | J49: 红将_魏蜀群_碎片_礼包2
B50: 3020014 | C50: 第14天_活动1_登陆 | D50: TID_CAMPAIGN_LOGIN | E50: 第14天_活动1 | F50: 1 | G50: 第14天_活动1_登陆 | H50: daily_login | J50: 红宝_碎片_礼包
B51: 3030001 | C51: 第2天_活动3_1 | D51: TID_CAMPAIGN_TREASURE_COMINE | E51: 第2天_活动3 | F51: 10 | G51: 第2天_活动3_1 | H51: treasure_combine | I51: 夺宝
B52: 3030002 | C52: 第2天_活动3_2 | D52: TID_CAMPAIGN_TREASURE_COMINE | E52: 第2天_活动3 | F52: 20 | G52: 第2天_活动3_2 | H52: treasure_combine | I52: 夺宝
B53: 3030003 | C53: 第2天_活动3_3 | D53: TID_CAMPAIGN_TREASURE_COMINE_PURPLE | E53: 第2天_活动3 | F53: 2 | G53: 第2天_活动3_3 | H53: treasure_combine_purple | I53: 夺宝
B54: 3030004 | C54: 第2天_活动3_4 | D54: TID_CAMPAIGN_TREASURE_COMINE_PURPLE | E54: 第2天_活动3 | F54: 5 | G54: 第2天_活动3_4 | H54: treasure_combine_purple | I54: 夺宝
B55: 3030005 | C55: 第2天_活动3_5 | D55: TID_CAMPAIGN_TREASURE_COMINE_ORANGE | E55: 第2天_活动3 | F55: 2 | G55: 第2天_活动3_5 | H55: treasure_combine_orange | I55: 夺宝
B56: 3030006 | C56: 第2天_活动3_6 | D56: TID_CAMPAIGN_TREASURE_COMINE_ORANGE | E56: 第2天_活动3 | F56: 5 | G56: 第2天_活动3_6 | H56: treasure_combine_orange | I56: 夺宝
B57: 3040001 | C57: 第5天_活动2_1 | D57: TID_CAMPAIGN_HERO_BINGO_WIN | E57: 第5天_活动2 | F57: 2 | G57: 第5天_活动2_1 | H57: hero_bingo_win | I57: 小兵玩法
B58: 3040002 | C58: 第5天_活动2_2 | D58: TID_CAMPAIGN_HERO_BINGO_WIN | E58: 第5天_活动2 | F58: 4 | G58: 第5天_活动2_2 | H58: hero_bingo_win | I58: 小兵玩法
B59: 3040003 | C59: 第5天_活动2_3 | D59: TID_CAMPAIGN_HERO_BINGO_WIN | E59: 第5天_活动2 | F59: 6 | G59: 第5天_活动2_3 | H59: hero_bingo_win | I59: 小兵玩法
B60: 3040004 | C60: 第5天_活动2_4 | D60: TID_CAMPAIGN_HERO_BINGO_WIN | E60: 第5天_活动2 | F60: 8 | G60: 第5天_活动2_4 | H60: hero_bingo_win | I60: 小兵玩法
B61: 3040005 | C61: 第5天_活动2_5 | D61: TID_CAMPAIGN_HERO_BINGO_WIN | E61: 第5天_活动2 | F61: 10 | G61: 第5天_活动2_5 | H61: hero_bingo_win | I61: 小兵玩法
B62: 3040006 | C62: 第5天_活动2_6 | D62: TID_CAMPAIGN_HERO_BINGO_WIN | E62: 第5天_活动2 | F62: 12 | G62: 第5天_活动2_6 | H62: hero_bingo_win | I62: 小兵玩法
B63: 3040007 | C63: 第5天_活动2_7 | D63: TID_CAMPAIGN_HERO_BINGO_WIN | E63: 第5天_活动2 | F63: 14 | G63: 第5天_活动2_7 | H63: hero_bingo_win | I63: 小兵玩法
B64: 3040008 | C64: 第5天_活动2_8 | D64: TID_CAMPAIGN_HERO_BINGO_WIN | E64: 第5天_活动2 | F64: 16 | G64: 第5天_活动2_8 | H64: hero_bingo_win | I64: 小兵玩法
B65: 3040009 | C65: 第5天_活动2_9 | D65: TID_CAMPAIGN_HERO_BINGO_WIN | E65: 第5天_活动2 | F65: 18 | G65: 第5天_活动2_9 | H65: hero_bingo_win | I65: 小兵玩法
B66: 3040010 | C66: 第5天_活动2_10 | D66: TID_CAMPAIGN_HERO_BINGO_WIN | E66: 第5天_活动2 | F66: 20 | G66: 第5天_活动2_10 | H66: hero_bingo_win | I66: 小兵玩法
B67: 3050001 | C67: 第6天_活动2_1 | D67: TID_CAMPAIGN_SHOP_WARCRAFT_REFRESH | E67: 第6天_活动2 | F67: 10 | G67: 第6天_活动2_1 | H67: shop_warcraft_refresh | I67: 兵法商店
B68: 3050002 | C68: 第6天_活动2_2 | D68: TID_CAMPAIGN_SHOP_WARCRAFT_REFRESH | E68: 第6天_活动2 | F68: 15 | G68: 第6天_活动2_2 | H68: shop_warcraft_refresh | I68: 兵法商店
B69: 3050003 | C69: 第6天_活动2_3 | D69: TID_CAMPAIGN_SHOP_WARCRAFT_REFRESH | E69: 第6天_活动2 | F69: 20 | G69: 第6天_活动2_3 | H69: shop_warcraft_refresh | I69: 兵法商店
B70: 3050004 | C70: 第6天_活动2_4 | D70: TID_CAMPAIGN_SHOP_WARCRAFT_REFRESH | E70: 第6天_活动2 | F70: 25 | G70: 第6天_活动2_4 | H70: shop_warcraft_refresh | I70: 兵法商店
B71: 3050005 | C71: 第6天_活动2_5 | D71: TID_CAMPAIGN_SHOP_WARCRAFT_REFRESH | E71: 第6天_活动2 | F71: 30 | G71: 第6天_活动2_5 | H71: shop_warcraft_refresh | I71: 兵法商店
B72: 3050006 | C72: 第6天_活动2_6 | D72: TID_CAMPAIGN_SHOP_WARCRAFT_BUY | E72: 第6天_活动2 | F72: 10 | G72: 第6天_活动2_6 | H72: shop_warcraft_buy | I72: 兵法商店
B73: 3050007 | C73: 第6天_活动2_7 | D73: TID_CAMPAIGN_SHOP_WARCRAFT_BUY | E73: 第6天_活动2 | F73: 20 | G73: 第6天_活动2_7 | H73: shop_warcraft_buy | I73: 兵法商店
B74: 3050008 | C74: 第6天_活动2_8 | D74: TID_CAMPAIGN_SHOP_WARCRAFT_BUY | E74: 第6天_活动2 | F74: 30 | G74: 第6天_活动2_8 | H74: shop_warcraft_buy | I74: 兵法商店
B75: 3050009 | C75: 第6天_活动2_9 | D75: TID_CAMPAIGN_SHOP_WARCRAFT_BUY | E75: 第6天_活动2 | F75: 40 | G75: 第6天_活动2_9 | H75: shop_warcraft_buy | I75: 兵法商店
B76: 3050010 | C76: 第6天_活动2_10 | D76: TID_CAMPAIGN_SHOP_WARCRAFT_BUY | E76: 第6天_活动2 | F76: 50 | G76: 第6天_活动2_10 | H76: shop_warcraft_buy | I76: 兵法商店
B77: 3060001 | C77: 第7天_活动2_1 | D77: TID_CAMPAIGN_SHOP_ARENA_PAY_HONOR | E77: 第7天_活动2 | F77: 1000 | G77: 第7天_活动2_1 | H77: shop_arena_pay_honor | I77: 声望商店_商品
B78: 3060002 | C78: 第7天_活动2_2 | D78: TID_CAMPAIGN_SHOP_ARENA_PAY_HONOR | E78: 第7天_活动2 | F78: 2000 | G78: 第7天_活动2_2 | H78: shop_arena_pay_honor | I78: 声望商店_商品
B79: 3060003 | C79: 第7天_活动2_3 | D79: TID_CAMPAIGN_SHOP_WUSHUANG_PAY_REPUTE | E79: 第7天_活动2 | F79: 1000 | G79: 第7天_活动2_3 | H79: shop_wushuang_pay_repute | I79: 无双商店_消耗品
B80: 3060004 | C80: 第7天_活动2_4 | D80: TID_CAMPAIGN_SHOP_WUSHUANG_PAY_REPUTE | E80: 第7天_活动2 | F80: 2000 | G80: 第7天_活动2_4 | H80: shop_wushuang_pay_repute | I80: 无双商店_消耗品
B81: 3060005 | C81: 第7天_活动2_5 | D81: TID_CAMPAIGN_SHOP_WORLDBOSS_PAY_ZHANGONG | E81: 第7天_活动2 | F81: 1000 | G81: 第7天_活动2_5 | H81: shop_worldboss_pay_zhangong | I81: 战功商店_商品
B82: 3060006 | C82: 第7天_活动2_6 | D82: TID_CAMPAIGN_SHOP_WORLDBOSS_PAY_ZHANGONG | E82: 第7天_活动2 | F82: 2000 | G82: 第7天_活动2_6 | H82: shop_worldboss_pay_zhangong | I82: 战功商店_商品
B83: 3060007 | C83: 第7天_活动2_7 | D83: TID_CAMPAIGN_SHOP_BINGO_PAY_BINGFU | E83: 第7天_活动2 | F83: 1000 | G83: 第7天_活动2_7 | H83: shop_hero_bingo_pay_bingfu | I83: 小兵玩法
B84: 3060008 | C84: 第7天_活动2_8 | D84: TID_CAMPAIGN_SHOP_BINGO_PAY_BINGFU | E84: 第7天_活动2 | F84: 2000 | G84: 第7天_活动2_8 | H84: shop_hero_bingo_pay_bingfu | I84: 小兵玩法
B85: 3060009 | C85: 第7天_活动2_9 | D85: TID_CAMPAIGN_SHOP_WARCRAFT_PAY_ZHUJIAN | E85: 第7天_活动2 | F85: 1000 | G85: 第7天_活动2_9 | H85: shop_warcraft_pay_zhujian | I85: 兵法商店
B86: 3060010 | C86: 第7天_活动2_10 | D86: TID_CAMPAIGN_SHOP_WARCRAFT_PAY_ZHUJIAN | E86: 第7天_活动2 | F86: 2000 | G86: 第7天_活动2_10 | H86: shop_warcraft_pay_zhujian | I86: 兵法商店
B87: 3060011 | C87: 第7天_活动2_11 | D87: TID_CAMPAIGN_SHOP_HERO_PAY_JIANGHUN | E87: 第7天_活动2 | F87: 1000 | G87: 第7天_活动2_11 | H87: shop_hero_pay_jianghun | I87: 神将商店
B88: 3060012 | C88: 第7天_活动2_12 | D88: TID_CAMPAIGN_SHOP_HERO_PAY_JIANGHUN | E88: 第7天_活动2 | F88: 2000 | G88: 第7天_活动2_12 | H88: shop_hero_pay_jianghun | I88: 神将商店
B89: 3070001 | C89: 第8天_活动2_1 | D89: TID_CAMPAIGN_ARENA_WIN | E89: 第8天_活动2 | F89: 20 | G89: 第8天_活动2_1 | H89: arena_win | I89: 竞技场
B90: 3070002 | C90: 第8天_活动2_2 | D90: TID_CAMPAIGN_ARENA_WIN | E90: 第8天_活动2 | F90: 40 | G90: 第8天_活动2_2 | H90: arena_win | I90: 竞技场
B91: 3070003 | C91: 第8天_活动2_3 | D91: TID_CAMPAIGN_ARENA_WIN | E91: 第8天_活动2 | F91: 60 | G91: 第8天_活动2_3 | H91: arena_win | I91: 竞技场
B92: 3070004 | C92: 第8天_活动2_4 | D92: TID_CAMPAIGN_ARENA_WIN | E92: 第8天_活动2 | F92: 80 | G92: 第8天_活动2_4 | H92: arena_win | I92: 竞技场
B93: 3070005 | C93: 第8天_活动2_5 | D93: TID_CAMPAIGN_ARENA_WIN | E93: 第8天_活动2 | F93: 100 | G93: 第8天_活动2_5 | H93: arena_win | I93: 竞技场
B94: 3070006 | C94: 第8天_活动2_6 | D94: TID_CAMPAIGN_WORLDBOSS_ATTACK | E94: 第8天_活动2 | F94: 5 | G94: 第8天_活动2_6 | H94: worldboss_attack | I94: 叛军
B95: 3070007 | C95: 第8天_活动2_7 | D95: TID_CAMPAIGN_WORLDBOSS_ATTACK | E95: 第8天_活动2 | F95: 10 | G95: 第8天_活动2_7 | H95: worldboss_attack | I95: 叛军
B96: 3070008 | C96: 第8天_活动2_8 | D96: TID_CAMPAIGN_WORLDBOSS_ATTACK | E96: 第8天_活动2 | F96: 15 | G96: 第8天_活动2_8 | H96: worldboss_attack | I96: 叛军
B97: 3070009 | C97: 第8天_活动2_9 | D97: TID_CAMPAIGN_WORLDBOSS_ATTACK | E97: 第8天_活动2 | F97: 20 | G97: 第8天_活动2_9 | H97: worldboss_attack | I97: 叛军
B98: 3070010 | C98: 第8天_活动2_10 | D98: TID_CAMPAIGN_WORLDBOSS_ATTACK | E98: 第8天_活动2 | F98: 25 | G98: 第8天_活动2_10 | H98: worldboss_attack | I98: 叛军
B99: 3080001 | C99: 第9天_活动2_1 | D99: TID_CAMPAIGN_ESOTERIC_WAR_ATTACK | E99: 第9天_活动2 | F99: 20 | G99: 第9天_活动2_1 | H99: esoteric_war_attack | I99: 夺宝
B100: 3080002 | C100: 第9天_活动2_2 | D100: TID_CAMPAIGN_ESOTERIC_WAR_ATTACK | E100: 第9天_活动2 | F100: 40 | G100: 第9天_活动2_2 | H100: esoteric_war_attack | I100: 夺宝
B101: 3080003 | C101: 第9天_活动2_3 | D101: TID_CAMPAIGN_ESOTERIC_WAR_ATTACK | E101: 第9天_活动2 | F101: 60 | G101: 第9天_活动2_3 | H101: esoteric_war_attack | I101: 夺宝
B102: 3080004 | C102: 第9天_活动2_4 | D102: TID_CAMPAIGN_ESOTERIC_WAR_ATTACK | E102: 第9天_活动2 | F102: 80 | G102: 第9天_活动2_4 | H102: esoteric_war_attack | I102: 夺宝
B103: 3080005 | C103: 第9天_活动2_5 | D103: TID_CAMPAIGN_ESOTERIC_WAR_ATTACK | E103: 第9天_活动2 | F103: 100 | G103: 第9天_活动2_5 | H103: esoteric_war_attack | I103: 夺宝
B104: 3080006 | C104: 第9天_活动2_6 | D104: TID_CAMPAIGN_WUSHUANG_WIN | E104: 第9天_活动2 | F104: 10 | G104: 第9天_活动2_6 | H104: wushuang_win | I104: 无双
B105: 3080007 | C105: 第9天_活动2_7 | D105: TID_CAMPAIGN_WUSHUANG_WIN | E105: 第9天_活动2 | F105: 15 | G105: 第9天_活动2_7 | H105: wushuang_win | I105: 无双
B106: 3080008 | C106: 第9天_活动2_8 | D106: TID_CAMPAIGN_WUSHUANG_WIN | E106: 第9天_活动2 | F106: 20 | G106: 第9天_活动2_8 | H106: wushuang_win | I106: 无双
B107: 3080009 | C107: 第9天_活动2_9 | D107: TID_CAMPAIGN_WUSHUANG_WIN | E107: 第9天_活动2 | F107: 25 | G107: 第9天_活动2_9 | H107: wushuang_win | I107: 无双
B108: 3080010 | C108: 第9天_活动2_10 | D108: TID_CAMPAIGN_WUSHUANG_WIN | E108: 第9天_活动2 | F108: 30 | G108: 第9天_活动2_10 | H108: wushuang_win | I108: 无双
B109: 3090001 | C109: 第10天_活动2_1 | D109: TID_CAMPAIGN_STORY_STAGE_WIN | E109: 第10天_活动2 | F109: 20 | G109: 第10天_活动2_1 | H109: story_stage_win | I109: 主线副本
B110: 3090002 | C110: 第10天_活动2_2 | D110: TID_CAMPAIGN_STORY_STAGE_WIN | E110: 第10天_活动2 | F110: 40 | G110: 第10天_活动2_2 | H110: story_stage_win | I110: 主线副本
B111: 3090003 | C111: 第10天_活动2_3 | D111: TID_CAMPAIGN_STORY_STAGE_WIN | E111: 第10天_活动2 | F111: 60 | G111: 第10天_活动2_3 | H111: story_stage_win | I111: 主线副本
B112: 3090004 | C112: 第10天_活动2_4 | D112: TID_CAMPAIGN_STORY_STAGE_WIN | E112: 第10天_活动2 | F112: 80 | G112: 第10天_活动2_4 | H112: story_stage_win | I112: 主线副本
B113: 3090005 | C113: 第10天_活动2_5 | D113: TID_CAMPAIGN_STORY_STAGE_WIN | E113: 第10天_活动2 | F113: 100 | G113: 第10天_活动2_5 | H113: story_stage_win | I113: 主线副本
B114: 3090006 | C114: 第10天_活动2_6 | D114: TID_CAMPAIGN_HERO_BINGO_WIN | E114: 第10天_活动2 | F114: 2 | G114: 第10天_活动2_6 | H114: hero_bingo_win | I114: 小兵玩法
B115: 3090007 | C115: 第10天_活动2_7 | D115: TID_CAMPAIGN_HERO_BINGO_WIN | E115: 第10天_活动2 | F115: 3 | G115: 第10天_活动2_7 | H115: hero_bingo_win | I115: 小兵玩法
B116: 3090008 | C116: 第10天_活动2_8 | D116: TID_CAMPAIGN_HERO_BINGO_WIN | E116: 第10天_活动2 | F116: 4 | G116: 第10天_活动2_8 | H116: hero_bingo_win | I116: 小兵玩法
B117: 3090009 | C117: 第10天_活动2_9 | D117: TID_CAMPAIGN_HERO_BINGO_WIN | E117: 第10天_活动2 | F117: 5 | G117: 第10天_活动2_9 | H117: hero_bingo_win | I117: 小兵玩法
B118: 3090010 | C118: 第10天_活动2_10 | D118: TID_CAMPAIGN_HERO_BINGO_WIN | E118: 第10天_活动2 | F118: 6 | G118: 第10天_活动2_10 | H118: hero_bingo_win | I118: 小兵玩法
B119: 3100001 | C119: 第11天_活动2_1 | D119: TID_CAMPAIGN_ARENA_WIN | E119: 第11天_活动2 | F119: 20 | G119: 第11天_活动2_1 | H119: arena_win | I119: 竞技场
B120: 3100002 | C120: 第11天_活动2_2 | D120: TID_CAMPAIGN_ARENA_WIN | E120: 第11天_活动2 | F120: 40 | G120: 第11天_活动2_2 | H120: arena_win | I120: 竞技场
B121: 3100003 | C121: 第11天_活动2_3 | D121: TID_CAMPAIGN_ARENA_WIN | E121: 第11天_活动2 | F121: 60 | G121: 第11天_活动2_3 | H121: arena_win | I121: 竞技场
B122: 3100004 | C122: 第11天_活动2_4 | D122: TID_CAMPAIGN_ARENA_WIN | E122: 第11天_活动2 | F122: 80 | G122: 第11天_活动2_4 | H122: arena_win | I122: 竞技场
B123: 3100005 | C123: 第11天_活动2_5 | D123: TID_CAMPAIGN_ARENA_WIN | E123: 第11天_活动2 | F123: 100 | G123: 第11天_活动2_5 | H123: arena_win | I123: 竞技场
B124: 3100006 | C124: 第11天_活动2_6 | D124: TID_CAMPAIGN_WORLDBOSS_ATTACK | E124: 第11天_活动2 | F124: 5 | G124: 第11天_活动2_6 | H124: worldboss_attack | I124: 叛军
B125: 3100007 | C125: 第11天_活动2_7 | D125: TID_CAMPAIGN_WORLDBOSS_ATTACK | E125: 第11天_活动2 | F125: 10 | G125: 第11天_活动2_7 | H125: worldboss_attack | I125: 叛军
B126: 3100008 | C126: 第11天_活动2_8 | D126: TID_CAMPAIGN_WORLDBOSS_ATTACK | E126: 第11天_活动2 | F126: 15 | G126: 第11天_活动2_8 | H126: worldboss_attack | I126: 叛军
B127: 3100009 | C127: 第11天_活动2_9 | D127: TID_CAMPAIGN_WORLDBOSS_ATTACK | E127: 第11天_活动2 | F127: 20 | G127: 第11天_活动2_9 | H127: worldboss_attack | I127: 叛军
B128: 3100010 | C128: 第11天_活动2_10 | D128: TID_CAMPAIGN_WORLDBOSS_ATTACK | E128: 第11天_活动2 | F128: 25 | G128: 第11天_活动2_10 | H128: worldboss_attack | I128: 叛军
B129: 3110001 | C129: 第12天_活动2_1 | D129: TID_CAMPAIGN_ESOTERIC_WAR_ATTACK | E129: 第12天_活动2 | F129: 20 | G129: 第12天_活动2_1 | H129: esoteric_war_attack | I129: 夺宝
B130: 3110002 | C130: 第12天_活动2_2 | D130: TID_CAMPAIGN_ESOTERIC_WAR_ATTACK | E130: 第12天_活动2 | F130: 40 | G130: 第12天_活动2_2 | H130: esoteric_war_attack | I130: 夺宝
B131: 3110003 | C131: 第12天_活动2_3 | D131: TID_CAMPAIGN_ESOTERIC_WAR_ATTACK | E131: 第12天_活动2 | F131: 60 | G131: 第12天_活动2_3 | H131: esoteric_war_attack | I131: 夺宝
B132: 3110004 | C132: 第12天_活动2_4 | D132: TID_CAMPAIGN_ESOTERIC_WAR_ATTACK | E132: 第12天_活动2 | F132: 80 | G132: 第12天_活动2_4 | H132: esoteric_war_attack | I132: 夺宝
B133: 3110005 | C133: 第12天_活动2_5 | D133: TID_CAMPAIGN_ESOTERIC_WAR_ATTACK | E133: 第12天_活动2 | F133: 100 | G133: 第12天_活动2_5 | H133: esoteric_war_attack | I133: 夺宝
B134: 3110006 | C134: 第12天_活动2_6 | D134: TID_CAMPAIGN_WUSHUANG_WIN | E134: 第12天_活动2 | F134: 10 | G134: 第12天_活动2_6 | H134: wushuang_win | I134: 无双
B135: 3110007 | C135: 第12天_活动2_7 | D135: TID_CAMPAIGN_WUSHUANG_WIN | E135: 第12天_活动2 | F135: 15 | G135: 第12天_活动2_7 | H135: wushuang_win | I135: 无双
B136: 3110008 | C136: 第12天_活动2_8 | D136: TID_CAMPAIGN_WUSHUANG_WIN | E136: 第12天_活动2 | F136: 20 | G136: 第12天_活动2_8 | H136: wushuang_win | I136: 无双
B137: 3110009 | C137: 第12天_活动2_9 | D137: TID_CAMPAIGN_WUSHUANG_WIN | E137: 第12天_活动2 | F137: 25 | G137: 第12天_活动2_9 | H137: wushuang_win | I137: 无双
B138: 3110010 | C138: 第12天_活动2_10 | D138: TID_CAMPAIGN_WUSHUANG_WIN | E138: 第12天_活动2 | F138: 30 | G138: 第12天_活动2_10 | H138: wushuang_win | I138: 无双
B139: 3120001 | C139: 第13天_活动2_1 | D139: TID_CAMPAIGN_STORY_STAGE_WIN | E139: 第13天_活动2 | F139: 20 | G139: 第13天_活动2_1 | H139: story_stage_win | I139: 主线副本
B140: 3120002 | C140: 第13天_活动2_2 | D140: TID_CAMPAIGN_STORY_STAGE_WIN | E140: 第13天_活动2 | F140: 40 | G140: 第13天_活动2_2 | H140: story_stage_win | I140: 主线副本
B141: 3120003 | C141: 第13天_活动2_3 | D141: TID_CAMPAIGN_STORY_STAGE_WIN | E141: 第13天_活动2 | F141: 60 | G141: 第13天_活动2_3 | H141: story_stage_win | I141: 主线副本
B142: 3120004 | C142: 第13天_活动2_4 | D142: TID_CAMPAIGN_STORY_STAGE_WIN | E142: 第13天_活动2 | F142: 80 | G142: 第13天_活动2_4 | H142: story_stage_win | I142: 主线副本
B143: 3120005 | C143: 第13天_活动2_5 | D143: TID_CAMPAIGN_STORY_STAGE_WIN | E143: 第13天_活动2 | F143: 100 | G143: 第13天_活动2_5 | H143: story_stage_win | I143: 主线副本
B144: 3120006 | C144: 第13天_活动2_6 | D144: TID_CAMPAIGN_HERO_BINGO_WIN | E144: 第13天_活动2 | F144: 2 | G144: 第13天_活动2_6 | H144: hero_bingo_win | I144: 小兵玩法
B145: 3120007 | C145: 第13天_活动2_7 | D145: TID_CAMPAIGN_HERO_BINGO_WIN | E145: 第13天_活动2 | F145: 3 | G145: 第13天_活动2_7 | H145: hero_bingo_win | I145: 小兵玩法
B146: 3120008 | C146: 第13天_活动2_8 | D146: TID_CAMPAIGN_HERO_BINGO_WIN | E146: 第13天_活动2 | F146: 4 | G146: 第13天_活动2_8 | H146: hero_bingo_win | I146: 小兵玩法
B147: 3120009 | C147: 第13天_活动2_9 | D147: TID_CAMPAIGN_HERO_BINGO_WIN | E147: 第13天_活动2 | F147: 5 | G147: 第13天_活动2_9 | H147: hero_bingo_win | I147: 小兵玩法
B148: 3120010 | C148: 第13天_活动2_10 | D148: TID_CAMPAIGN_HERO_BINGO_WIN | E148: 第13天_活动2 | F148: 6 | G148: 第13天_活动2_10 | H148: hero_bingo_win | I148: 小兵玩法
B149: 3130001 | C149: 第14天_活动2_1 | D149: TID_CAMPAIGN_STORY_STAGE_WIN | E149: 第14天_活动2 | F149: 20 | G149: 第14天_活动2_1 | H149: story_stage_win | I149: 主线副本
B150: 3130002 | C150: 第14天_活动2_2 | D150: TID_CAMPAIGN_STORY_STAGE_WIN | E150: 第14天_活动2 | F150: 40 | G150: 第14天_活动2_2 | H150: story_stage_win | I150: 主线副本
B151: 3130003 | C151: 第14天_活动2_3 | D151: TID_CAMPAIGN_ARENA_WIN | E151: 第14天_活动2 | F151: 20 | G151: 第14天_活动2_3 | H151: arena_win | I151: 竞技场
B152: 3130004 | C152: 第14天_活动2_4 | D152: TID_CAMPAIGN_ARENA_WIN | E152: 第14天_活动2 | F152: 40 | G152: 第14天_活动2_4 | H152: arena_win | I152: 竞技场
B153: 3130005 | C153: 第14天_活动2_5 | D153: TID_CAMPAIGN_ESOTERIC_WAR_ATTACK | E153: 第14天_活动2 | F153: 20 | G153: 第14天_活动2_5 | H153: esoteric_war_attack | I153: 夺宝
B154: 3130006 | C154: 第14天_活动2_6 | D154: TID_CAMPAIGN_ESOTERIC_WAR_ATTACK | E154: 第14天_活动2 | F154: 40 | G154: 第14天_活动2_6 | H154: esoteric_war_attack | I154: 夺宝
B155: 3130007 | C155: 第14天_活动2_7 | D155: TID_CAMPAIGN_WUSHUANG_WIN | E155: 第14天_活动2 | F155: 10 | G155: 第14天_活动2_7 | H155: wushuang_win | I155: 无双
B156: 3130008 | C156: 第14天_活动2_8 | D156: TID_CAMPAIGN_WUSHUANG_WIN | E156: 第14天_活动2 | F156: 20 | G156: 第14天_活动2_8 | H156: wushuang_win | I156: 无双
B157: 3130009 | C157: 第14天_活动2_9 | D157: TID_CAMPAIGN_WORLDBOSS_ATTACK | E157: 第14天_活动2 | F157: 10 | G157: 第14天_活动2_9 | H157: worldboss_attack | I157: 叛军
B158: 3130010 | C158: 第14天_活动2_10 | D158: TID_CAMPAIGN_WORLDBOSS_ATTACK | E158: 第14天_活动2 | F158: 20 | G158: 第14天_活动2_10 | H158: worldboss_attack | I158: 叛军
B159: 3130011 | C159: 第14天_活动2_11 | D159: TID_CAMPAIGN_HERO_BINGO_WIN | E159: 第14天_活动2 | F159: 2 | G159: 第14天_活动2_11 | H159: hero_bingo_win | I159: 小兵玩法
B160: 3130012 | C160: 第14天_活动2_12 | D160: TID_CAMPAIGN_HERO_BINGO_WIN | E160: 第14天_活动2 | F160: 4 | G160: 第14天_活动2_12 | H160: hero_bingo_win | I160: 小兵玩法
B161: 3140001 | C161: 当日登陆 | D161: TID_CAMPAIGN_TEST_QUEST1 | E161: 测试_quest条目 | F161: 1 | G161: 测试条目奖励 | H161: daily_login
B162: 3140002 | C162: 活动内累计登录N天 | D162: TID_CAMPAIGN_TEST_QUEST2 | E162: 测试_quest条目 | F162: 10 | G162: 测试条目奖励 | H162: daily_login
B163: 3140003 | C163: 装备强化N次 | D163: TID_CAMPAIGN_TEST_QUEST3 | E163: 测试_quest条目 | F163: 10 | G163: 测试条目奖励 | H163: equip_enhance | I163: 装备列表
B164: 3140004 | C164: 装备精炼N次 | D164: TID_CAMPAIGN_TEST_QUEST4 | E164: 测试_quest条目 | F164: 10 | G164: 测试条目奖励 | H164: equip_refine | I164: 装备列表
B165: 3140005 | C165: 宝物强化N次 | D165: TID_CAMPAIGN_TEST_QUEST5 | E165: 测试_quest条目 | F165: 10 | G165: 测试条目奖励 | H165: treasure_enhance | I165: 宝物列表
B166: 3140006 | C166: 合成N个宝物 | D166: TID_CAMPAIGN_TEST_QUEST6 | E166: 测试_quest条目 | F166: 2 | G166: 测试条目奖励 | H166: treasure_combine | I166: 夺宝
B167: 3140007 | C167: 合成N个紫色宝物 | D167: TID_CAMPAIGN_TEST_QUEST7 | E167: 测试_quest条目 | F167: 2 | G167: 测试条目奖励 | H167: treasure_combine_purple | I167: 夺宝
B168: 3140008 | C168: 合成N个橙色宝物 | D168: TID_CAMPAIGN_TEST_QUEST8 | E168: 测试_quest条目 | F168: 2 | G168: 测试条目奖励 | H168: treasure_combine_orange | I168: 夺宝
B169: 3140009 | C169: 武将培养N次 | D169: TID_CAMPAIGN_TEST_QUEST9 | E169: 测试_quest条目 | F169: 10 | G169: 测试条目奖励 | H169: hero_train | I169: 武将列表
B170: 3140010 | C170: 主线副本胜利N次 | D170: TID_CAMPAIGN_TEST_QUEST10 | E170: 测试_quest条目 | F170: 5 | G170: 测试条目奖励 | H170: story_stage_win | I170: 主线副本
B171: 3140011 | C171: 名将副本胜利N次 | D171: TID_CAMPAIGN_TEST_QUEST11 | E171: 测试_quest条目 | F171: 2 | G171: 测试条目奖励 | H171: hero_stage_win | I171: 名将副本
B172: 3140012 | C172: 日常副本胜利N次 | D172: TID_CAMPAIGN_TEST_QUEST12 | E172: 测试_quest条目 | F172: 2 | G172: 测试条目奖励 | H172: daily_stage_win | I172: 日常副本
B173: 3140013 | C173: 夺宝N次 | D173: TID_CAMPAIGN_TEST_QUEST13 | E173: 测试_quest条目 | F173: 5 | G173: 测试条目奖励 | H173: esoteric_war_attack | I173: 夺宝
B174: 3140014 | C174: 竞技场胜利N次 | D174: TID_CAMPAIGN_TEST_QUEST14 | E174: 测试_quest条目 | F174: 5 | G174: 测试条目奖励 | H174: arena_win | I174: 竞技场
B175: 3140015 | C175: 三国无双重置N次 | D175: TID_CAMPAIGN_TEST_QUEST15 | E175: 测试_quest条目 | F175: 2 | G175: 测试条目奖励 | H175: wushuang_reset | I175: 无双
B176: 3140016 | C176: 三国无双胜利N次 | D176: TID_CAMPAIGN_TEST_QUEST16 | E176: 测试_quest条目 | F176: 5 | G176: 测试条目奖励 | H176: wushuang_win | I176: 无双
B177: 3140017 | C177: 与叛军战斗N次 | D177: TID_CAMPAIGN_TEST_QUEST17 | E177: 测试_quest条目 | F177: 5 | G177: 测试条目奖励 | H177: worldboss_attack | I177: 叛军
B178: 3140018 | C178: 元宝抽卡N次 | D178: TID_CAMPAIGN_TEST_QUEST18 | E178: 测试_quest条目 | F178: 10 | G178: 测试条目奖励 | H178: diamond_gacha | I178: 元宝抽卡
B179: 3140019 | C179: 战将令抽卡N次 | D179: TID_CAMPAIGN_TEST_QUEST19 | E179: 测试_quest条目 | F179: 10 | G179: 测试条目奖励 | H179: gacha | I179: 元宝抽卡
B180: 3140020 | C180: 商城购买征讨令N个 | D180: TID_CAMPAIGN_TEST_QUEST20 | E180: 测试_quest条目 | F180: 10 | G180: 测试条目奖励 | H180: shop_grocery_buy_zhengtaoling | I180: 商城
B181: 3140021 | C181: 商城购买体力丹N个 | D181: TID_CAMPAIGN_TEST_QUEST21 | E181: 测试_quest条目 | F181: 10 | G181: 测试条目奖励 | H181: shop_grocery_buy_dan_power | I181: 商城
B182: 3140022 | C182: 商城购买精力丹N个 | D182: TID_CAMPAIGN_TEST_QUEST22 | E182: 测试_quest条目 | F182: 10 | G182: 测试条目奖励 | H182: shop_grocery_buy_dan_energy | I182: 商城
B183: 3140023 | C183: 商城购买物品N个 | D183: TID_CAMPAIGN_TEST_QUEST23 | E183: 测试_quest条目 | F183: 20 | G183: 测试条目奖励 | H183: shop_grocery_buy_item | I183: 商城
B184: 3140024 | C184: 商城消耗N元宝 | D184: TID_CAMPAIGN_TEST_QUEST24 | E184: 测试_quest条目 | F184: 2000 | G184: 测试条目奖励 | H184: shop_grocery_pay_diamond | I184: 商城
B185: 3140025 | C185: 神将商店刷新N次 | D185: TID_CAMPAIGN_TEST_QUEST25 | E185: 测试_quest条目 | F185: 10 | G185: 测试条目奖励 | H185: shop_hero_refresh | I185: 神将商店
B186: 3140026 | C186: 神将商店购买N次 | D186: TID_CAMPAIGN_TEST_QUEST26 | E186: 测试_quest条目 | F186: 10 | G186: 测试条目奖励 | H186: shop_hero_buy | I186: 神将商店
B187: 3140027 | C187: 神将商店消耗N将魂 | D187: TID_CAMPAIGN_TEST_QUEST27 | E187: 测试_quest条目 | F187: 2000 | G187: 测试条目奖励 | H187: shop_hero_pay_jianghun | I187: 神将商店
B188: 3140028 | C188: 竞技场商店消耗N声望 | D188: TID_CAMPAIGN_TEST_QUEST28 | E188: 测试_quest条目 | F188: 2000 | G188: 测试条目奖励 | H188: shop_arena_pay_honor | I188: 声望商店_商品
B189: 3140029 | C189: 无双商店消耗N威名 | D189: TID_CAMPAIGN_TEST_QUEST29 | E189: 测试_quest条目 | F189: 2000 | G189: 测试条目奖励 | H189: shop_wushuang_pay_repute | I189: 无双商店_消耗品
B190: 3140030 | C190: Boss商店消耗N战功 | D190: TID_CAMPAIGN_TEST_QUEST30 | E190: 测试_quest条目 | F190: 2000 | G190: 测试条目奖励 | H190: shop_worldboss_pay_zhangong | I190: 战功商店_商品
B191: 3140031 | C191: 商城购买N次 | D191: TID_CAMPAIGN_TEST_QUEST31 | E191: 测试_quest条目 | F191: 10 | G191: 测试条目奖励 | H191: shop_grocery_buy | I191: 商城
B192: 3140032 | C192: 兵法升级2次 | D192: TID_CAMPAIGN_TEST_QUEST32 | E192: 测试_quest条目 | F192: 2 | G192: 测试条目奖励 | H192: warcraft_upgrade | I192: 阵容
B193: 3140033 | C193: 小兵训练2次 | D193: TID_CAMPAIGN_TEST_QUEST33 | E193: 测试_quest条目 | F193: 2 | G193: 测试条目奖励 | H193: squad_upgrade | I193: 阵容
B194: 3140034 | C194: 三军夺帅胜利2次 | D194: TID_CAMPAIGN_TEST_QUEST34 | E194: 测试_quest条目 | F194: 2 | G194: 测试条目奖励 | H194: hero_bingo_win | I194: 阵容
B195: 3140035 | C195: 普通点兵2次 | D195: TID_CAMPAIGN_TEST_QUEST35 | E195: 测试_quest条目 | F195: 2 | G195: 测试条目奖励 | H195: soldier_gacha | I195: 阵容
B196: 3140036 | C196: 豪华点兵2次 | D196: TID_CAMPAIGN_TEST_QUEST36 | E196: 测试_quest条目 | F196: 2 | G196: 测试条目奖励 | H196: diamond_soldier_gacha | I196: 阵容
B197: 3140037 | C197: 军需商店消耗1000兵符 | D197: TID_CAMPAIGN_TEST_QUEST37 | E197: 测试_quest条目 | F197: 1000 | G197: 测试条目奖励 | H197: shop_hero_bingo_pay_bingfu | I197: 阵容
B198: 3140038 | C198: 兵法商店刷新2次 | D198: TID_CAMPAIGN_TEST_QUEST38 | E198: 测试_quest条目 | F198: 2 | G198: 测试条目奖励 | H198: shop_warcraft_refresh | I198: 阵容
B199: 3140039 | C199: 兵法商店购买2次 | D199: TID_CAMPAIGN_TEST_QUEST39 | E199: 测试_quest条目 | F199: 2 | G199: 测试条目奖励 | H199: shop_warcraft_buy | I199: 阵容
B200: 3140040 | C200: 兵法商店消耗1000竹简 | D200: TID_CAMPAIGN_TEST_QUEST40 | E200: 测试_quest条目 | F200: 1000 | G200: 测试条目奖励 | H200: shop_warcraft_pay_zhujian | I200: 阵容

Sheet: achieve
A1: !LR! | B1: ID | C1: Name | D1: Campaign | E1: Descend | F1: TargetTitle | G1: Target | H1: Reward | I1: Achievement | J1: ClientTarget | K1: HighlightItem1
B2: int | C2: string | D2: string | E2: boolean | F2: string | G2: int | H2: string | I2: string | J2: string | K2: string
D3: optional | E3: optional | F3: array | G3: array | H3: array | J3: optional | K3: optional
A4: ### | E4: 降序 | F4: 显示名称 | G4: 数量 | H4: 奖励 | I4: 成就属性
A5: 定义 | C5: 活动任务
A6: 引用 | D6: 活动 | H6: 奖励 | J6: 客户端跳转 | K6: 物品
B7: 2000001 | C7: 第1天_活动1_等级 | D7: 第1天_活动1 | F7: TID_CAMPAIGN_ROLE_LEVEL | G7: 28 | H7: 第1天_活动1_等级 | I7: role_level | J7: 主线副本
B8: 2000002 | C8: 第2天_活动1_等级 | D8: 第2天_活动1 | F8: TID_CAMPAIGN_ROLE_LEVEL | G8: 33 | H8: 第2天_活动1_等级 | I8: role_level | J8: 主线副本
B9: 2000003 | C9: 第3天_活动1_等级 | D9: 第3天_活动1 | F9: TID_CAMPAIGN_ROLE_LEVEL | G9: 36 | H9: 第3天_活动1_等级 | I9: role_level | J9: 主线副本
B10: 2000004 | C10: 第4天_活动1_等级 | D10: 第4天_活动1 | F10: TID_CAMPAIGN_ROLE_LEVEL | G10: 38 | H10: 第4天_活动1_等级 | I10: role_level | J10: 主线副本
B11: 2000005 | C11: 第5天_活动1_等级 | D11: 第5天_活动1 | F11: TID_CAMPAIGN_ROLE_LEVEL | G11: 40 | H11: 第5天_活动1_等级 | I11: role_level | J11: 主线副本
B12: 2000006 | C12: 第6天_活动1_等级 | D12: 第6天_活动1 | F12: TID_CAMPAIGN_ROLE_LEVEL | G12: 42 | H12: 第6天_活动1_等级 | I12: role_level | J12: 主线副本
B13: 2000007 | C13: 第7天_活动1_等级 | D13: 第7天_活动1 | F13: TID_CAMPAIGN_ROLE_LEVEL | G13: 43 | H13: 第7天_活动1_等级 | I13: role_level | J13: 主线副本
B14: 2000008 | C14: 第8天_活动1_等级 | D14: 第8天_活动1 | F14: TID_CAMPAIGN_ROLE_LEVEL | G14: 44 | H14: 第8天_活动1_等级 | I14: role_level | J14: 主线副本
B15: 2000009 | C15: 第9天_活动1_等级 | D15: 第9天_活动1 | F15: TID_CAMPAIGN_ROLE_LEVEL | G15: 45 | H15: 第9天_活动1_等级 | I15: role_level | J15: 主线副本
B16: 2000010 | C16: 第10天_活动1_等级 | D16: 第10天_活动1 | F16: TID_CAMPAIGN_ROLE_LEVEL | G16: 46 | H16: 第10天_活动1_等级 | I16: role_level | J16: 主线副本
B17: 2000011 | C17: 第11天_活动1_等级 | D17: 第11天_活动1 | F17: TID_CAMPAIGN_ROLE_LEVEL | G17: 47 | H17: 第11天_活动1_等级 | I17: role_level | J17: 主线副本
B18: 2000012 | C18: 第12天_活动1_等级 | D18: 第12天_活动1 | F18: TID_CAMPAIGN_ROLE_LEVEL | G18: 48 | H18: 第12天_活动1_等级 | I18: role_level | J18: 主线副本
B19: 2000013 | C19: 第13天_活动1_等级 | D19: 第13天_活动1 | F19: TID_CAMPAIGN_ROLE_LEVEL | G19: 49 | H19: 第13天_活动1_等级 | I19: role_level | J19: 主线副本
B20: 2000014 | C20: 第14天_活动1_等级 | D20: 第14天_活动1 | F20: TID_CAMPAIGN_ROLE_LEVEL | G20: 50 | H20: 第14天_活动1_等级 | I20: role_level | J20: 主线副本
B21: 2010001 | C21: 第1天_活动1_战力 | D21: 第1天_活动1 | F21: TID_CAMPAIGN_ROLE_COMBAT_POWER | G21: 300000 | H21: 第1天_活动1_战力 | I21: combat_power | J21: 阵容
B22: 2010002 | C22: 第2天_活动1_战力 | D22: 第2天_活动1 | F22: TID_CAMPAIGN_ROLE_COMBAT_POWER | G22: 600000 | H22: 第2天_活动1_战力 | I22: combat_power | J22: 阵容
B23: 2010003 | C23: 第3天_活动1_战力 | D23: 第3天_活动1 | F23: TID_CAMPAIGN_ROLE_COMBAT_POWER | G23: 900000 | H23: 第3天_活动1_战力 | I23: combat_power | J23: 阵容
B24: 2010004 | C24: 第4天_活动1_战力 | D24: 第4天_活动1 | F24: TID_CAMPAIGN_ROLE_COMBAT_POWER | G24: 1200000 | H24: 第4天_活动1_战力 | I24: combat_power | J24: 阵容
B25: 2010005 | C25: 第5天_活动1_战力 | D25: 第5天_活动1 | F25: TID_CAMPAIGN_ROLE_COMBAT_POWER | G25: 1400000 | H25: 第5天_活动1_战力 | I25: combat_power | J25: 阵容
B26: 2010006 | C26: 第6天_活动1_战力 | D26: 第6天_活动1 | F26: TID_CAMPAIGN_ROLE_COMBAT_POWER | G26: 1600000 | H26: 第6天_活动1_战力 | I26: combat_power | J26: 阵容
B27: 2010007 | C27: 第7天_活动1_战力 | D27: 第7天_活动1 | F27: TID_CAMPAIGN_ROLE_COMBAT_POWER | G27: 1800000 | H27: 第7天_活动1_战力 | I27: combat_power | J27: 阵容
B28: 2020001 | C28: 第1天_活动2_1 | D28: 第1天_活动2 | F28: TID_CAMPAIGN_STORY_STAGE_CHAPTER | G28: 1 | H28: 第1天_活动2_1 | I28: story_stage_chapter | J28: 主线副本
B29: 2020002 | C29: 第1天_活动2_2 | D29: 第1天_活动2 | F29: TID_CAMPAIGN_STORY_STAGE_CHAPTER | G29: 2 | H29: 第1天_活动2_2 | I29: story_stage_chapter | J29: 主线副本
B30: 2020003 | C30: 第1天_活动2_3 | D30: 第1天_活动2 | F30: TID_CAMPAIGN_STORY_STAGE_CHAPTER | G30: 3 | H30: 第1天_活动2_3 | I30: story_stage_chapter | J30: 主线副本
B31: 2020004 | C31: 第1天_活动2_4 | D31: 第1天_活动2 | F31: TID_CAMPAIGN_STORY_STAGE_CHAPTER | G31: 4 | H31: 第1天_活动2_4 | I31: story_stage_chapter | J31: 主线副本
B32: 2020005 | C32: 第1天_活动2_5 | D32: 第1天_活动2 | F32: TID_CAMPAIGN_STORY_STAGE_CHAPTER | G32: 5 | H32: 第1天_活动2_5 | I32: story_stage_chapter | J32: 主线副本
B33: 2020006 | C33: 第1天_活动2_6 | D33: 第1天_活动2 | F33: TID_CAMPAIGN_STORY_STAGE_CHAPTER | G33: 6 | H33: 第1天_活动2_6 | I33: story_stage_chapter | J33: 主线副本
B34: 2020007 | C34: 第1天_活动2_7 | D34: 第1天_活动2 | F34: TID_CAMPAIGN_STORY_STAGE_CHAPTER | G34: 7 | H34: 第1天_活动2_7 | I34: story_stage_chapter | J34: 主线副本
B35: 2020008 | C35: 第1天_活动2_8 | D35: 第1天_活动2 | F35: TID_CAMPAIGN_STORY_STAGE_CHAPTER | G35: 8 | H35: 第1天_活动2_8 | I35: story_stage_chapter | J35: 主线副本 | K35: 橙将_魏蜀群_礼包1
B36: 2020009 | C36: 第1天_活动2_9 | D36: 第1天_活动2 | F36: TID_CAMPAIGN_STORY_STAGE_CHAPTER | G36: 9 | H36: 第1天_活动2_9 | I36: story_stage_chapter | J36: 主线副本
B37: 2020010 | C37: 第1天_活动2_10 | D37: 第1天_活动2 | F37: TID_CAMPAIGN_STORY_STAGE_CHAPTER | G37: 10 | H37: 第1天_活动2_10 | I37: story_stage_chapter | J37: 主线副本
B38: 2020011 | C38: 第1天_活动2_11 | D38: 第1天_活动2 | F38: TID_CAMPAIGN_STORY_STAGE_CHAPTER | G38: 11 | H38: 第1天_活动2_11 | I38: story_stage_chapter | J38: 主线副本
B39: 2020012 | C39: 第1天_活动2_12 | D39: 第1天_活动2 | F39: TID_CAMPAIGN_STORY_STAGE_CHAPTER | G39: 12 | H39: 第1天_活动2_12 | I39: story_stage_chapter | J39: 主线副本
B40: 2030001 | C40: 第1天_活动3_1 | D40: 第1天_活动3 | F40: TID_CAMPAIGN_LINEUP_EQUIP_ENHANCE_LEVEL | G40: 10 | H40: 第1天_活动3_1 | I40: lineup_equip_enhance_level | J40: 阵容
B41: 2030002 | C41: 第1天_活动3_2 | D41: 第1天_活动3 | F41: TID_CAMPAIGN_LINEUP_EQUIP_ENHANCE_LEVEL | G41: 20 | H41: 第1天_活动3_2 | I41: lineup_equip_enhance_level | J41: 阵容
B42: 2030003 | C42: 第1天_活动3_3 | D42: 第1天_活动3 | F42: TID_CAMPAIGN_LINEUP_EQUIP_ENHANCE_LEVEL | G42: 30 | H42: 第1天_活动3_3 | I42: lineup_equip_enhance_level | J42: 阵容
B43: 2030004 | C43: 第1天_活动3_4 | D43: 第1天_活动3 | F43: TID_CAMPAIGN_LINEUP_EQUIP_ENHANCE_LEVEL | G43: 40 | H43: 第1天_活动3_4 | I43: lineup_equip_enhance_level | J43: 阵容
B44: 2030005 | C44: 第1天_活动3_5 | D44: 第1天_活动3 | F44: TID_CAMPAIGN_LINEUP_EQUIP_ENHANCE_LEVEL | G44: 50 | H44: 第1天_活动3_5 | I44: lineup_equip_enhance_level | J44: 阵容
B45: 2030006 | C45: 第1天_活动3_6 | D45: 第1天_活动3 | F45: TID_CAMPAIGN_LINEUP_EQUIP_ENHANCE_LEVEL | G45: 60 | H45: 第1天_活动3_6 | I45: lineup_equip_enhance_level | J45: 阵容
B46: 2030007 | C46: 第1天_活动3_7 | D46: 第1天_活动3 | F46: TID_CAMPAIGN_LINEUP_WEAR_BLUE_EQUIP_HERO_COUNT | G46: 1 | H46: 第1天_活动3_7 | I46: lineup_wear_4_blue_equip_hero_count | J46: 阵容
B47: 2030008 | C47: 第1天_活动3_8 | D47: 第1天_活动3 | F47: TID_CAMPAIGN_LINEUP_WEAR_BLUE_EQUIP_HERO_COUNT | G47: 2 | H47: 第1天_活动3_8 | I47: lineup_wear_4_blue_equip_hero_count | J47: 阵容
B48: 2030009 | C48: 第1天_活动3_9 | D48: 第1天_活动3 | F48: TID_CAMPAIGN_LINEUP_WEAR_BLUE_EQUIP_HERO_COUNT | G48: 3 | H48: 第1天_活动3_9 | I48: lineup_wear_4_blue_equip_hero_count | J48: 阵容
B49: 2030010 | C49: 第1天_活动3_10 | D49: 第1天_活动3 | F49: TID_CAMPAIGN_LINEUP_WEAR_PURPLE_EQUIP_HERO_COUNT | G49: 1 | H49: 第1天_活动3_10 | I49: lineup_wear_4_purple_equip_hero_count | J49: 阵容
B50: 2030011 | C50: 第1天_活动3_11 | D50: 第1天_活动3 | F50: TID_CAMPAIGN_LINEUP_WEAR_PURPLE_EQUIP_HERO_COUNT | G50: 2 | H50: 第1天_活动3_11 | I50: lineup_wear_4_purple_equip_hero_count | J50: 阵容
B51: 2030012 | C51: 第1天_活动3_12 | D51: 第1天_活动3 | F51: TID_CAMPAIGN_LINEUP_WEAR_PURPLE_EQUIP_HERO_COUNT | G51: 3 | H51: 第1天_活动3_12 | I51: lineup_wear_4_purple_equip_hero_count | J51: 阵容
B52: 2040001 | C52: 第2天_活动2_1 | D52: 第2天_活动2 | E52: 1 | F52: TID_CAMPAIGN_ARENA_BEST_RANK | G52: 4000 | H52: 第2天_活动2_1 | I52: arena_best_rank | J52: 竞技场
B53: 2040002 | C53: 第2天_活动2_2 | D53: 第2天_活动2 | E53: 1 | F53: TID_CAMPAIGN_ARENA_BEST_RANK | G53: 2000 | H53: 第2天_活动2_2 | I53: arena_best_rank | J53: 竞技场
B54: 2040003 | C54: 第2天_活动2_3 | D54: 第2天_活动2 | E54: 1 | F54: TID_CAMPAIGN_ARENA_BEST_RANK | G54: 1000 | H54: 第2天_活动2_3 | I54: arena_best_rank | J54: 竞技场
B55: 2040004 | C55: 第2天_活动2_4 | D55: 第2天_活动2 | E55: 1 | F55: TID_CAMPAIGN_ARENA_BEST_RANK | G55: 700 | H55: 第2天_活动2_4 | I55: arena_best_rank | J55: 竞技场
B56: 2040005 | C56: 第2天_活动2_5 | D56: 第2天_活动2 | E56: 1 | F56: TID_CAMPAIGN_ARENA_BEST_RANK | G56: 500 | H56: 第2天_活动2_5 | I56: arena_best_rank | J56: 竞技场
B57: 2040006 | C57: 第2天_活动2_6 | D57: 第2天_活动2 | E57: 1 | F57: TID_CAMPAIGN_ARENA_BEST_RANK | G57: 300 | H57: 第2天_活动2_6 | I57: arena_best_rank | J57: 竞技场
B58: 2040007 | C58: 第2天_活动2_7 | D58: 第2天_活动2 | E58: 1 | F58: TID_CAMPAIGN_ARENA_BEST_RANK | G58: 200 | H58: 第2天_活动2_7 | I58: arena_best_rank | J58: 竞技场
B59: 2040008 | C59: 第2天_活动2_8 | D59: 第2天_活动2 | E59: 1 | F59: TID_CAMPAIGN_ARENA_BEST_RANK | G59: 100 | H59: 第2天_活动2_8 | I59: arena_best_rank | J59: 竞技场
B60: 2040009 | C60: 第2天_活动2_9 | D60: 第2天_活动2 | E60: 1 | F60: TID_CAMPAIGN_ARENA_BEST_RANK | G60: 30 | H60: 第2天_活动2_9 | I60: arena_best_rank | J60: 竞技场
B61: 2040010 | C61: 第2天_活动2_10 | D61: 第2天_活动2 | E61: 1 | F61: TID_CAMPAIGN_ARENA_BEST_RANK | G61: 10 | H61: 第2天_活动2_10 | I61: arena_best_rank | J61: 竞技场 | K61: 橙将_魏蜀群_碎片_礼包2
B62: 2040011 | C62: 第2天_活动2_11 | D62: 第2天_活动2 | E62: 1 | F62: TID_CAMPAIGN_ARENA_BEST_RANK | G62: 3 | H62: 第2天_活动2_11 | I62: arena_best_rank | J62: 竞技场 | K62: 橙将_魏蜀群_碎片_礼包2
B63: 2040012 | C63: 第2天_活动2_12 | D63: 第2天_活动2 | E63: 1 | F63: TID_CAMPAIGN_ARENA_BEST_RANK | G63: 1 | H63: 第2天_活动2_12 | I63: arena_best_rank | J63: 竞技场 | K63: 橙将_魏蜀群_碎片_礼包2
B64: 2050001 | C64: 第2天_活动3_achieve1 | D64: 第2天_活动3 | F64: TID_CAMPAIGN_LINEUP_HERO_BREAKTHROUGH_LEVEL | G64: 1 | H64: 第2天_活动3_achieve1 | I64: lineup_hero_breakthrough_level | J64: 阵容
B65: 2050002 | C65: 第2天_活动3_achieve2 | D65: 第2天_活动3 | F65: TID_CAMPAIGN_LINEUP_HERO_BREAKTHROUGH_LEVEL | G65: 2 | H65: 第2天_活动3_achieve2 | I65: lineup_hero_breakthrough_level | J65: 阵容
B66: 2050003 | C66: 第2天_活动3_achieve3 | D66: 第2天_活动3 | F66: TID_CAMPAIGN_LINEUP_HERO_BREAKTHROUGH_LEVEL | G66: 3 | H66: 第2天_活动3_achieve3 | I66: lineup_hero_breakthrough_level | J66: 阵容
B67: 2050004 | C67: 第2天_活动3_achieve4 | D67: 第2天_活动3 | F67: TID_CAMPAIGN_LINEUP_HERO_BREAKTHROUGH_LEVEL | G67: 4 | H67: 第2天_活动3_achieve4 | I67: lineup_hero_breakthrough_level | J67: 阵容
B68: 2050005 | C68: 第2天_活动3_achieve5 | D68: 第2天_活动3 | F68: TID_CAMPAIGN_LINEUP_HERO_BREAKTHROUGH_LEVEL | G68: 5 | H68: 第2天_活动3_achieve5 | I68: lineup_hero_breakthrough_level | J68: 阵容
B69: 2050006 | C69: 第2天_活动3_achieve6 | D69: 第2天_活动3 | F69: TID_CAMPAIGN_HERO_BREAKTHROUGH_LEVEL | G69: 4 | H69: 第2天_活动3_achieve6 | I69: hero_breakthrough_level | J69: 阵容
B70: 2050007 | C70: 第2天_活动3_achieve7 | D70: 第2天_活动3 | F70: TID_CAMPAIGN_HERO_BREAKTHROUGH_LEVEL | G70: 5 | H70: 第2天_活动3_achieve7 | I70: hero_breakthrough_level | J70: 阵容
B71: 2060001 | C71: 第3天_活动2_1 | D71: 第3天_活动2 | F71: TID_CAMPAIGN_WUSHUANG_TOTAL_STAR | G71: 30 | H71: 第3天_活动2_1 | I71: wushuang_total_star | J71: 无双
B72: 2060002 | C72: 第3天_活动2_2 | D72: 第3天_活动2 | F72: TID_CAMPAIGN_WUSHUANG_TOTAL_STAR | G72: 33 | H72: 第3天_活动2_2 | I72: wushuang_total_star | J72: 无双
B73: 2060003 | C73: 第3天_活动2_3 | D73: 第3天_活动2 | F73: TID_CAMPAIGN_WUSHUANG_TOTAL_STAR | G73: 36 | H73: 第3天_活动2_3 | I73: wushuang_total_star | J73: 无双
B74: 2060004 | C74: 第3天_活动2_4 | D74: 第3天_活动2 | F74: TID_CAMPAIGN_WUSHUANG_TOTAL_STAR | G74: 39 | H74: 第3天_活动2_4 | I74: wushuang_total_star | J74: 无双
B75: 2060005 | C75: 第3天_活动2_5 | D75: 第3天_活动2 | F75: TID_CAMPAIGN_WUSHUANG_TOTAL_STAR | G75: 42 | H75: 第3天_活动2_5 | I75: wushuang_total_star | J75: 无双
B76: 2060006 | C76: 第3天_活动2_6 | D76: 第3天_活动2 | F76: TID_CAMPAIGN_WUSHUANG_TOTAL_STAR | G76: 45 | H76: 第3天_活动2_6 | I76: wushuang_total_star | J76: 无双
B77: 2060007 | C77: 第3天_活动2_7 | D77: 第3天_活动2 | F77: TID_CAMPAIGN_WUSHUANG_TOTAL_STAR | G77: 48 | H77: 第3天_活动2_7 | I77: wushuang_total_star | J77: 无双
B78: 2060008 | C78: 第3天_活动2_8 | D78: 第3天_活动2 | F78: TID_CAMPAIGN_WUSHUANG_TOTAL_STAR | G78: 51 | H78: 第3天_活动2_8 | I78: wushuang_total_star | J78: 无双
B79: 2060009 | C79: 第3天_活动2_9 | D79: 第3天_活动2 | F79: TID_CAMPAIGN_WUSHUANG_TOTAL_STAR | G79: 54 | H79: 第3天_活动2_9 | I79: wushuang_total_star | J79: 无双
B80: 2060010 | C80: 第3天_活动2_10 | D80: 第3天_活动2 | F80: TID_CAMPAIGN_WUSHUANG_TOTAL_STAR | G80: 57 | H80: 第3天_活动2_10 | I80: wushuang_total_star | J80: 无双
B81: 2060011 | C81: 第3天_活动2_11 | D81: 第3天_活动2 | F81: TID_CAMPAIGN_WUSHUANG_TOTAL_STAR | G81: 60 | H81: 第3天_活动2_11 | I81: wushuang_total_star | J81: 无双
B82: 2070001 | C82: 第3天_活动3_1 | D82: 第3天_活动3 | F82: TID_CAMPAIGN_LINEUP_WEAR_ORANGE_EQUIP_HERO_COUNT | G82: 1 | H82: 第3天_活动3_1 | I82: lineup_wear_4_orange_equip_hero_count | J82: 阵容
B83: 2070002 | C83: 第3天_活动3_2 | D83: 第3天_活动3 | F83: TID_CAMPAIGN_LINEUP_WEAR_ORANGE_EQUIP_HERO_COUNT | G83: 2 | H83: 第3天_活动3_2 | I83: lineup_wear_4_orange_equip_hero_count | J83: 阵容
B84: 2070003 | C84: 第3天_活动3_3 | D84: 第3天_活动3 | F84: TID_CAMPAIGN_LINEUP_WEAR_ORANGE_EQUIP_HERO_COUNT | G84: 3 | H84: 第3天_活动3_3 | I84: lineup_wear_4_orange_equip_hero_count | J84: 阵容
B85: 2070004 | C85: 第3天_活动3_4 | D85: 第3天_活动3 | F85: TID_CAMPAIGN_LINEUP_EQUIP_REFINE_LEVEL | G85: 2 | H85: 第3天_活动3_4 | I85: lineup_equip_refine_level | J85: 阵容
B86: 2070005 | C86: 第3天_活动3_5 | D86: 第3天_活动3 | F86: TID_CAMPAIGN_LINEUP_EQUIP_REFINE_LEVEL | G86: 3 | H86: 第3天_活动3_5 | I86: lineup_equip_refine_level | J86: 阵容
B87: 2070006 | C87: 第3天_活动3_6 | D87: 第3天_活动3 | F87: TID_CAMPAIGN_LINEUP_EQUIP_REFINE_LEVEL | G87: 4 | H87: 第3天_活动3_6 | I87: lineup_equip_refine_level | J87: 阵容
B88: 2070007 | C88: 第3天_活动3_7 | D88: 第3天_活动3 | F88: TID_CAMPAIGN_LINEUP_EQUIP_REFINE_LEVEL | G88: 5 | H88: 第3天_活动3_7 | I88: lineup_equip_refine_level | J88: 阵容
B89: 2070008 | C89: 第3天_活动3_8 | D89: 第3天_活动3 | F89: TID_CAMPAIGN_LINEUP_EQUIP_REFINE_LEVEL | G89: 6 | H89: 第3天_活动3_8 | I89: lineup_equip_refine_level | J89: 阵容
B90: 2070009 | C90: 第3天_活动3_9 | D90: 第3天_活动3 | F90: TID_CAMPAIGN_LINEUP_EQUIP_REFINE_LEVEL | G90: 7 | H90: 第3天_活动3_9 | I90: lineup_equip_refine_level | J90: 阵容
B91: 2070010 | C91: 第3天_活动3_10 | D91: 第3天_活动3 | F91: TID_CAMPAIGN_LINEUP_EQUIP_REFINE_LEVEL | G91: 8 | H91: 第3天_活动3_10 | I91: lineup_equip_refine_level | J91: 阵容
B92: 2070011 | C92: 第3天_活动3_11 | D92: 第3天_活动3 | F92: TID_CAMPAIGN_LINEUP_EQUIP_REFINE_LEVEL | G92: 9 | H92: 第3天_活动3_11 | I92: lineup_equip_refine_level | J92: 阵容
B93: 2070012 | C93: 第3天_活动3_12 | D93: 第3天_活动3 | F93: TID_CAMPAIGN_LINEUP_EQUIP_REFINE_LEVEL | G93: 10 | H93: 第3天_活动3_12 | I93: lineup_equip_refine_level | J93: 阵容
B94: 2080001 | C94: 第4天_活动2_1 | D94: 第4天_活动2 | F94: TID_CAMPAIGN_WORLDBOSS_MAX_DAMAGE | G94: 50000 | H94: 第4天_活动2_1 | I94: worldboss_max_damage | J94: 叛军
B95: 2080002 | C95: 第4天_活动2_2 | D95: 第4天_活动2 | F95: TID_CAMPAIGN_WORLDBOSS_MAX_DAMAGE | G95: 80000 | H95: 第4天_活动2_2 | I95: worldboss_max_damage | J95: 叛军
B96: 2080003 | C96: 第4天_活动2_3 | D96: 第4天_活动2 | F96: TID_CAMPAIGN_WORLDBOSS_MAX_DAMAGE | G96: 110000 | H96: 第4天_活动2_3 | I96: worldboss_max_damage | J96: 叛军
B97: 2080004 | C97: 第4天_活动2_4 | D97: 第4天_活动2 | F97: TID_CAMPAIGN_WORLDBOSS_MAX_DAMAGE | G97: 140000 | H97: 第4天_活动2_4 | I97: worldboss_max_damage | J97: 叛军
B98: 2080005 | C98: 第4天_活动2_5 | D98: 第4天_活动2 | F98: TID_CAMPAIGN_WORLDBOSS_MAX_DAMAGE | G98: 170000 | H98: 第4天_活动2_5 | I98: worldboss_max_damage | J98: 叛军
B99: 2080006 | C99: 第4天_活动2_6 | D99: 第4天_活动2 | F99: TID_CAMPAIGN_WORLDBOSS_MAX_DAMAGE | G99: 200000 | H99: 第4天_活动2_6 | I99: worldboss_max_damage | J99: 叛军
B100: 2080007 | C100: 第4天_活动2_7 | D100: 第4天_活动2 | F100: TID_CAMPAIGN_WORLDBOSS_TOTAL_DAMAGE | G100: 1000000 | H100: 第4天_活动2_7 | I100: worldboss_total_damage | J100: 叛军
B101: 2080008 | C101: 第4天_活动2_8 | D101: 第4天_活动2 | F101: TID_CAMPAIGN_WORLDBOSS_TOTAL_DAMAGE | G101: 1600000 | H101: 第4天_活动2_8 | I101: worldboss_total_damage | J101: 叛军
B102: 2080009 | C102: 第4天_活动2_9 | D102: 第4天_活动2 | F102: TID_CAMPAIGN_WORLDBOSS_TOTAL_DAMAGE | G102: 2200000 | H102: 第4天_活动2_9 | I102: worldboss_total_damage | J102: 叛军
B103: 2080010 | C103: 第4天_活动2_10 | D103: 第4天_活动2 | F103: TID_CAMPAIGN_WORLDBOSS_TOTAL_DAMAGE | G103: 2800000 | H103: 第4天_活动2_10 | I103: worldboss_total_damage | J103: 叛军
B104: 2080011 | C104: 第4天_活动2_11 | D104: 第4天_活动2 | F104: TID_CAMPAIGN_WORLDBOSS_TOTAL_DAMAGE | G104: 3400000 | H104: 第4天_活动2_11 | I104: worldboss_total_damage | J104: 叛军
B105: 2080012 | C105: 第4天_活动2_12 | D105: 第4天_活动2 | F105: TID_CAMPAIGN_WORLDBOSS_TOTAL_DAMAGE | G105: 4000000 | H105: 第4天_活动2_12 | I105: worldboss_total_damage | J105: 叛军
B106: 2090001 | C106: 第4天_活动3_1 | D106: 第4天_活动3 | F106: TID_CAMPAIGN_LINEUP_HERO_STARDUST_LEVEL | G106: 2 | H106: 第4天_活动3_1 | I106: lineup_hero_stardust_level | J106: 阵容
B107: 2090002 | C107: 第4天_活动3_2 | D107: 第4天_活动3 | F107: TID_CAMPAIGN_LINEUP_HERO_STARDUST_LEVEL | G107: 3 | H107: 第4天_活动3_2 | I107: lineup_hero_stardust_level | J107: 阵容
B108: 2090003 | C108: 第4天_活动3_3 | D108: 第4天_活动3 | F108: TID_CAMPAIGN_LINEUP_HERO_STARDUST_LEVEL | G108: 4 | H108: 第4天_活动3_3 | I108: lineup_hero_stardust_level | J108: 阵容
B109: 2090004 | C109: 第4天_活动3_4 | D109: 第4天_活动3 | F109: TID_CAMPAIGN_LINEUP_HERO_STARDUST_LEVEL | G109: 5 | H109: 第4天_活动3_4 | I109: lineup_hero_stardust_level | J109: 阵容
B110: 2090005 | C110: 第4天_活动3_5 | D110: 第4天_活动3 | F110: TID_CAMPAIGN_HERO_STARDUST_LEVEL | G110: 4 | H110: 第4天_活动3_5 | I110: hero_stardust_level | J110: 阵容
B111: 2090006 | C111: 第4天_活动3_6 | D111: 第4天_活动3 | F111: TID_CAMPAIGN_HERO_STARDUST_LEVEL | G111: 5 | H111: 第4天_活动3_6 | I111: hero_stardust_level | J111: 阵容
B112: 2090007 | C112: 第4天_活动3_7 | D112: 第4天_活动3 | F112: TID_CAMPAIGN_HERO_STARDUST_LEVEL | G112: 6 | H112: 第4天_活动3_7 | I112: hero_stardust_level | J112: 阵容
B113: 2090008 | C113: 第4天_活动3_8 | D113: 第4天_活动3 | F113: TID_CAMPAIGN_LINEUP_TREASURE_REFINE_LEVEL | G113: 1 | H113: 第4天_活动3_8 | I113: lineup_treasure_refine_level | J113: 阵容
B114: 2090009 | C114: 第4天_活动3_9 | D114: 第4天_活动3 | F114: TID_CAMPAIGN_LINEUP_TREASURE_REFINE_LEVEL | G114: 2 | H114: 第4天_活动3_9 | I114: lineup_treasure_refine_level | J114: 阵容
B115: 2090010 | C115: 第4天_活动3_10 | D115: 第4天_活动3 | F115: TID_CAMPAIGN_LINEUP_TREASURE_REFINE_LEVEL | G115: 3 | H115: 第4天_活动3_10 | I115: lineup_treasure_refine_level | J115: 阵容
B116: 2090011 | C116: 第4天_活动3_11 | D116: 第4天_活动3 | F116: TID_CAMPAIGN_TREASURE_REFINE_LEVEL | G116: 4 | H116: 第4天_活动3_11 | I116: treasure_refine_level | J116: 阵容
B117: 2100001 | C117: 第5天_活动3_1 | D117: 第5天_活动3 | F117: TID_CAMPAIGN_LINEUP_SQUAD_LEVEL | G117: 70 | H117: 第5天_活动3_1 | I117: lineup_squad_level | J117: 阵容
B118: 2100002 | C118: 第5天_活动3_2 | D118: 第5天_活动3 | F118: TID_CAMPAIGN_LINEUP_SQUAD_LEVEL | G118: 75 | H118: 第5天_活动3_2 | I118: lineup_squad_level | J118: 阵容
B119: 2100003 | C119: 第5天_活动3_3 | D119: 第5天_活动3 | F119: TID_CAMPAIGN_LINEUP_SQUAD_LEVEL | G119: 80 | H119: 第5天_活动3_3 | I119: lineup_squad_level | J119: 阵容
B120: 2100004 | C120: 第5天_活动3_4 | D120: 第5天_活动3 | F120: TID_CAMPAIGN_LINEUP_SQUAD_LEVEL | G120: 85 | H120: 第5天_活动3_4 | I120: lineup_squad_level | J120: 阵容
B121: 2100005 | C121: 第5天_活动3_5 | D121: 第5天_活动3 | F121: TID_CAMPAIGN_LINEUP_SQUAD_LEVEL | G121: 90 | H121: 第5天_活动3_5 | I121: lineup_squad_level | J121: 阵容
B122: 2100006 | C122: 第5天_活动3_6 | D122: 第5天_活动3 | F122: TID_CAMPAIGN_LIENUP_SQUAD_BREAKTHROUGH_LEVEL | G122: 1 | H122: 第5天_活动3_6 | I122: lineup_squad_breakthrough_level | J122: 阵容 | K122: 悬赏令
B123: 2100007 | C123: 第5天_活动3_7 | D123: 第5天_活动3 | F123: TID_CAMPAIGN_LIENUP_SQUAD_BREAKTHROUGH_LEVEL | G123: 2 | H123: 第5天_活动3_7 | I123: lineup_squad_breakthrough_level | J123: 阵容 | K123: 悬赏令
B124: 2100008 | C124: 第5天_活动3_8 | D124: 第5天_活动3 | F124: TID_CAMPAIGN_LIENUP_SQUAD_BREAKTHROUGH_LEVEL | G124: 3 | H124: 第5天_活动3_8 | I124: lineup_squad_breakthrough_level | J124: 阵容 | K124: 悬赏令
B125: 2100009 | C125: 第5天_活动3_9 | D125: 第5天_活动3 | F125: TID_CAMPAIGN_LIENUP_SQUAD_BREAKTHROUGH_LEVEL | G125: 4 | H125: 第5天_活动3_9 | I125: lineup_squad_breakthrough_level | J125: 阵容 | K125: 悬赏令
B126: 2110001 | C126: 第6天_活动3_1 | D126: 第6天_活动3 | F126: TID_CAMPAIGN_WARCRAFT_REFINE_LEVEL | G126: 2 | H126: 第6天_活动3_1 | I126: warcraft_refine_level | J126: 阵容
B127: 2110002 | C127: 第6天_活动3_2 | D127: 第6天_活动3 | F127: TID_CAMPAIGN_WARCRAFT_REFINE_LEVEL | G127: 3 | H127: 第6天_活动3_2 | I127: warcraft_refine_level | J127: 阵容
B128: 2110003 | C128: 第6天_活动3_3 | D128: 第6天_活动3 | F128: TID_CAMPAIGN_WARCRAFT_REFINE_LEVEL | G128: 4 | H128: 第6天_活动3_3 | I128: warcraft_refine_level | J128: 阵容
B129: 2110004 | C129: 第6天_活动3_4 | D129: 第6天_活动3 | F129: TID_CAMPAIGN_LINEUP_TOP3_WARCRAFT_REFINE_LEVEL | G129: 2 | H129: 第6天_活动3_4 | I129: lineup_top3_warcraft_refine_level | J129: 阵容
B130: 2110005 | C130: 第6天_活动3_5 | D130: 第6天_活动3 | F130: TID_CAMPAIGN_LINEUP_TOP3_WARCRAFT_REFINE_LEVEL | G130: 3 | H130: 第6天_活动3_5 | I130: lineup_top3_warcraft_refine_level | J130: 阵容
B131: 2110006 | C131: 第6天_活动3_6 | D131: 第6天_活动3 | F131: TID_CAMPAIGN_LINEUP_TOP3_WARCRAFT_REFINE_LEVEL | G131: 4 | H131: 第6天_活动3_6 | I131: lineup_top3_warcraft_refine_level | J131: 阵容
B132: 2110007 | C132: 第6天_活动3_7 | D132: 第6天_活动3 | F132: TID_CAMPAIGN_LINEUP_TOP3_WARCRAFT_LEVEL | G132: 30 | H132: 第6天_活动3_7 | I132: lineup_top3_warcraft_level | J132: 阵容
B133: 2110008 | C133: 第6天_活动3_8 | D133: 第6天_活动3 | F133: TID_CAMPAIGN_LINEUP_TOP3_WARCRAFT_LEVEL | G133: 35 | H133: 第6天_活动3_8 | I133: lineup_top3_warcraft_level | J133: 阵容
B134: 2110009 | C134: 第6天_活动3_9 | D134: 第6天_活动3 | F134: TID_CAMPAIGN_LINEUP_TOP3_WARCRAFT_LEVEL | G134: 40 | H134: 第6天_活动3_9 | I134: lineup_top3_warcraft_level | J134: 阵容
B135: 2110010 | C135: 第6天_活动3_10 | D135: 第6天_活动3 | F135: TID_CAMPAIGN_LINEUP_TOP3_WARCRAFT_LEVEL | G135: 45 | H135: 第6天_活动3_10 | I135: lineup_top3_warcraft_level | J135: 阵容
B136: 2120001 | C136: 第7天_活动3_1 | D136: 第7天_活动3 | F136: TID_CAMPAIGN_ROLE_COMBAT_POWER | G136: 1900000 | H136: 第7天_活动3_1 | I136: combat_power | J136: 阵容
B137: 2120002 | C137: 第7天_活动3_2 | D137: 第7天_活动3 | F137: TID_CAMPAIGN_ROLE_COMBAT_POWER | G137: 2000000 | H137: 第7天_活动3_2 | I137: combat_power | J137: 阵容
B138: 2120003 | C138: 第7天_活动3_3 | D138: 第7天_活动3 | F138: TID_CAMPAIGN_ROLE_COMBAT_POWER | G138: 2100000 | H138: 第7天_活动3_3 | I138: combat_power | J138: 阵容
B139: 2120004 | C139: 第7天_活动3_4 | D139: 第7天_活动3 | F139: TID_CAMPAIGN_ROLE_COMBAT_POWER | G139: 2200000 | H139: 第7天_活动3_4 | I139: combat_power | J139: 阵容
B140: 2120005 | C140: 第7天_活动3_5 | D140: 第7天_活动3 | F140: TID_CAMPAIGN_ROLE_COMBAT_POWER | G140: 2300000 | H140: 第7天_活动3_5 | I140: combat_power | J140: 阵容
B141: 2120006 | C141: 第7天_活动3_6 | D141: 第7天_活动3 | F141: TID_CAMPAIGN_LINEUP_GREEN_SOLDIER_COUNT | G141: 1 | H141: 第7天_活动3_6 | I141: lineup_green_soldier_count | J141: 阵容
B142: 2120007 | C142: 第7天_活动3_7 | D142: 第7天_活动3 | F142: TID_CAMPAIGN_LINEUP_GREEN_SOLDIER_COUNT | G142: 2 | H142: 第7天_活动3_7 | I142: lineup_green_soldier_count | J142: 阵容
B143: 2120008 | C143: 第7天_活动3_8 | D143: 第7天_活动3 | F143: TID_CAMPAIGN_LINEUP_GREEN_SOLDIER_COUNT | G143: 3 | H143: 第7天_活动3_8 | I143: lineup_green_soldier_count | J143: 阵容
B144: 2120009 | C144: 第7天_活动3_9 | D144: 第7天_活动3 | F144: TID_CAMPAIGN_LINEUP_BLUE_SOLDIER_COUNT | G144: 1 | H144: 第7天_活动3_9 | I144: lineup_blue_soldier_count | J144: 阵容
B145: 2120010 | C145: 第7天_活动3_10 | D145: 第7天_活动3 | F145: TID_CAMPAIGN_LINEUP_BLUE_SOLDIER_COUNT | G145: 2 | H145: 第7天_活动3_10 | I145: lineup_blue_soldier_count | J145: 阵容
B146: 2120011 | C146: 第7天_活动3_11 | D146: 第7天_活动3 | F146: TID_CAMPAIGN_LINEUP_BLUE_SOLDIER_COUNT | G146: 3 | H146: 第7天_活动3_11 | I146: lineup_blue_soldier_count | J146: 阵容
B147: 2130001 | C147: 成就_战力 | D147: 成就 | F147: TID_CAMPAIGN_ROLE_COMBAT_POWER | G147: 200000 | H147: 成就_战力1 | I147: combat_power | J147: 阵容
F148: TID_CAMPAIGN_ROLE_COMBAT_POWER | G148: 400000 | H148: 成就_战力2
F149: TID_CAMPAIGN_ROLE_COMBAT_POWER | G149: 600000 | H149: 成就_战力3
F150: TID_CAMPAIGN_ROLE_COMBAT_POWER | G150: 800000 | H150: 成就_战力4
F151: TID_CAMPAIGN_ROLE_COMBAT_POWER | G151: 1000000 | H151: 成就_战力5
F152: TID_CAMPAIGN_ROLE_COMBAT_POWER | G152: 1500000 | H152: 成就_战力6
F153: TID_CAMPAIGN_ROLE_COMBAT_POWER | G153: 2000000 | H153: 成就_战力7
F154: TID_CAMPAIGN_ROLE_COMBAT_POWER | G154: 2500000 | H154: 成就_战力8
F155: TID_CAMPAIGN_ROLE_COMBAT_POWER | G155: 3000000 | H155: 成就_战力9
F156: TID_CAMPAIGN_ROLE_COMBAT_POWER | G156: 3500000 | H156: 成就_战力10
F157: TID_CAMPAIGN_ROLE_COMBAT_POWER | G157: 4000000 | H157: 成就_战力11
F158: TID_CAMPAIGN_ROLE_COMBAT_POWER | G158: 4500000 | H158: 成就_战力12
F159: TID_CAMPAIGN_ROLE_COMBAT_POWER | G159: 5000000 | H159: 成就_战力13
F160: TID_CAMPAIGN_ROLE_COMBAT_POWER | G160: 6000000 | H160: 成就_战力14
F161: TID_CAMPAIGN_ROLE_COMBAT_POWER | G161: 7000000 | H161: 成就_战力15
F162: TID_CAMPAIGN_ROLE_COMBAT_POWER | G162: 8000000 | H162: 成就_战力16
F163: TID_CAMPAIGN_ROLE_COMBAT_POWER | G163: 9000000 | H163: 成就_战力17
F164: TID_CAMPAIGN_ROLE_COMBAT_POWER | G164: 10000000 | H164: 成就_战力18
F165: TID_CAMPAIGN_ROLE_COMBAT_POWER | G165: 11000000 | H165: 成就_战力19
F166: TID_CAMPAIGN_ROLE_COMBAT_POWER | G166: 12000000 | H166: 成就_战力20
F167: TID_CAMPAIGN_ROLE_COMBAT_POWER | G167: 13000000 | H167: 成就_战力21
F168: TID_CAMPAIGN_ROLE_COMBAT_POWER | G168: 14000000 | H168: 成就_战力22
F169: TID_CAMPAIGN_ROLE_COMBAT_POWER | G169: 15000000 | H169: 成就_战力23
F170: TID_CAMPAIGN_ROLE_COMBAT_POWER | G170: 16000000 | H170: 成就_战力24
F171: TID_CAMPAIGN_ROLE_COMBAT_POWER | G171: 17000000 | H171: 成就_战力25
F172: TID_CAMPAIGN_ROLE_COMBAT_POWER | G172: 18000000 | H172: 成就_战力26
F173: TID_CAMPAIGN_ROLE_COMBAT_POWER | G173: 19000000 | H173: 成就_战力27
F174: TID_CAMPAIGN_ROLE_COMBAT_POWER | G174: 20000000 | H174: 成就_战力28
F175: TID_CAMPAIGN_ROLE_COMBAT_POWER | G175: 21000000 | H175: 成就_战力29
F176: TID_CAMPAIGN_ROLE_COMBAT_POWER | G176: 22000000 | H176: 成就_战力30
F177: TID_CAMPAIGN_ROLE_COMBAT_POWER | G177: 23000000 | H177: 成就_战力31
F178: TID_CAMPAIGN_ROLE_COMBAT_POWER | G178: 24000000 | H178: 成就_战力32
F179: TID_CAMPAIGN_ROLE_COMBAT_POWER | G179: 25000000 | H179: 成就_战力33
F180: TID_CAMPAIGN_ROLE_COMBAT_POWER | G180: 26000000 | H180: 成就_战力34
F181: TID_CAMPAIGN_ROLE_COMBAT_POWER | G181: 27000000 | H181: 成就_战力35
F182: TID_CAMPAIGN_ROLE_COMBAT_POWER | G182: 28000000 | H182: 成就_战力36
F183: TID_CAMPAIGN_ROLE_COMBAT_POWER | G183: 29000000 | H183: 成就_战力37
F184: TID_CAMPAIGN_ROLE_COMBAT_POWER | G184: 30000000 | H184: 成就_战力38
F185: TID_CAMPAIGN_ROLE_COMBAT_POWER | G185: 31000000 | H185: 成就_战力39
F186: TID_CAMPAIGN_ROLE_COMBAT_POWER | G186: 32000000 | H186: 成就_战力40
F187: TID_CAMPAIGN_ROLE_COMBAT_POWER | G187: 33000000 | H187: 成就_战力41
F188: TID_CAMPAIGN_ROLE_COMBAT_POWER | G188: 34000000 | H188: 成就_战力42
F189: TID_CAMPAIGN_ROLE_COMBAT_POWER | G189: 35000000 | H189: 成就_战力43
B190: 2140001 | C190: 成就_主公等级 | D190: 成就 | F190: TID_CAMPAIGN_ROLE_LEVEL | G190: 5 | H190: 成就_主公等级1 | I190: role_level | J190: 主线副本
F191: TID_CAMPAIGN_ROLE_LEVEL | G191: 10 | H191: 成就_主公等级2
F192: TID_CAMPAIGN_ROLE_LEVEL | G192: 15 | H192: 成就_主公等级3
F193: TID_CAMPAIGN_ROLE_LEVEL | G193: 20 | H193: 成就_主公等级4
F194: TID_CAMPAIGN_ROLE_LEVEL | G194: 25 | H194: 成就_主公等级5
F195: TID_CAMPAIGN_ROLE_LEVEL | G195: 30 | H195: 成就_主公等级6
F196: TID_CAMPAIGN_ROLE_LEVEL | G196: 35 | H196: 成就_主公等级7
F197: TID_CAMPAIGN_ROLE_LEVEL | G197: 40 | H197: 成就_主公等级8
F198: TID_CAMPAIGN_ROLE_LEVEL | G198: 45 | H198: 成就_主公等级9
F199: TID_CAMPAIGN_ROLE_LEVEL | G199: 50 | H199: 成就_主公等级10
F200: TID_CAMPAIGN_ROLE_LEVEL | G200: 55 | H200: 成就_主公等级11
F201: TID_CAMPAIGN_ROLE_LEVEL | G201: 60 | H201: 成就_主公等级12
F202: TID_CAMPAIGN_ROLE_LEVEL | G202: 65 | H202: 成就_主公等级13
F203: TID_CAMPAIGN_ROLE_LEVEL | G203: 70 | H203: 成就_主公等级14
F204: TID_CAMPAIGN_ROLE_LEVEL | G204: 75 | H204: 成就_主公等级15
F205: TID_CAMPAIGN_ROLE_LEVEL | G205: 80 | H205: 成就_主公等级16
F206: TID_CAMPAIGN_ROLE_LEVEL | G206: 85 | H206: 成就_主公等级17
F207: TID_CAMPAIGN_ROLE_LEVEL | G207: 90 | H207: 成就_主公等级18
F208: TID_CAMPAIGN_ROLE_LEVEL | G208: 95 | H208: 成就_主公等级19
F209: TID_CAMPAIGN_ROLE_LEVEL | G209: 100 | H209: 成就_主公等级20
F210: TID_CAMPAIGN_ROLE_LEVEL | G210: 105 | H210: 成就_主公等级21
F211: TID_CAMPAIGN_ROLE_LEVEL | G211: 110 | H211: 成就_主公等级22
F212: TID_CAMPAIGN_ROLE_LEVEL | G212: 115 | H212: 成就_主公等级23
F213: TID_CAMPAIGN_ROLE_LEVEL | G213: 120 | H213: 成就_主公等级24
F214: TID_CAMPAIGN_ROLE_LEVEL | G214: 125 | H214: 成就_主公等级25
F215: TID_CAMPAIGN_ROLE_LEVEL | G215: 130 | H215: 成就_主公等级26
F216: TID_CAMPAIGN_ROLE_LEVEL | G216: 135 | H216: 成就_主公等级27
F217: TID_CAMPAIGN_ROLE_LEVEL | G217: 140 | H217: 成就_主公等级28
F218: TID_CAMPAIGN_ROLE_LEVEL | G218: 145 | H218: 成就_主公等级29
F219: TID_CAMPAIGN_ROLE_LEVEL | G219: 150 | H219: 成就_主公等级30
B220: 2140002 | C220: 成就_武将等级 | D220: 成就 | F220: TID_CAMPAIGN_LINEUP_HERO_LEVEL | G220: 5 | H220: 成就_武将等级1 | I220: lineup_hero_level | J220: 阵容
F221: TID_CAMPAIGN_LINEUP_HERO_LEVEL | G221: 10 | H221: 成就_武将等级2
F222: TID_CAMPAIGN_LINEUP_HERO_LEVEL | G222: 15 | H222: 成就_武将等级3
F223: TID_CAMPAIGN_LINEUP_HERO_LEVEL | G223: 20 | H223: 成就_武将等级4
F224: TID_CAMPAIGN_LINEUP_HERO_LEVEL | G224: 25 | H224: 成就_武将等级5
F225: TID_CAMPAIGN_LINEUP_HERO_LEVEL | G225: 30 | H225: 成就_武将等级6
F226: TID_CAMPAIGN_LINEUP_HERO_LEVEL | G226: 35 | H226: 成就_武将等级7
F227: TID_CAMPAIGN_LINEUP_HERO_LEVEL | G227: 40 | H227: 成就_武将等级8
F228: TID_CAMPAIGN_LINEUP_HERO_LEVEL | G228: 45 | H228: 成就_武将等级9
F229: TID_CAMPAIGN_LINEUP_HERO_LEVEL | G229: 50 | H229: 成就_武将等级10
F230: TID_CAMPAIGN_LINEUP_HERO_LEVEL | G230: 55 | H230: 成就_武将等级11
F231: TID_CAMPAIGN_LINEUP_HERO_LEVEL | G231: 60 | H231: 成就_武将等级12
F232: TID_CAMPAIGN_LINEUP_HERO_LEVEL | G232: 65 | H232: 成就_武将等级13
F233: TID_CAMPAIGN_LINEUP_HERO_LEVEL | G233: 70 | H233: 成就_武将等级14
F234: TID_CAMPAIGN_LINEUP_HERO_LEVEL | G234: 75 | H234: 成就_武将等级15
F235: TID_CAMPAIGN_LINEUP_HERO_LEVEL | G235: 80 | H235: 成就_武将等级16
F236: TID_CAMPAIGN_LINEUP_HERO_LEVEL | G236: 85 | H236: 成就_武将等级17
F237: TID_CAMPAIGN_LINEUP_HERO_LEVEL | G237: 90 | H237: 成就_武将等级18
F238: TID_CAMPAIGN_LINEUP_HERO_LEVEL | G238: 95 | H238: 成就_武将等级19
F239: TID_CAMPAIGN_LINEUP_HERO_LEVEL | G239: 100 | H239: 成就_武将等级20
F240: TID_CAMPAIGN_LINEUP_HERO_LEVEL | G240: 105 | H240: 成就_武将等级21
F241: TID_CAMPAIGN_LINEUP_HERO_LEVEL | G241: 110 | H241: 成就_武将等级22
F242: TID_CAMPAIGN_LINEUP_HERO_LEVEL | G242: 115 | H242: 成就_武将等级23
F243: TID_CAMPAIGN_LINEUP_HERO_LEVEL | G243: 120 | H243: 成就_武将等级24
F244: TID_CAMPAIGN_LINEUP_HERO_LEVEL | G244: 125 | H244: 成就_武将等级25
F245: TID_CAMPAIGN_LINEUP_HERO_LEVEL | G245: 130 | H245: 成就_武将等级26
F246: TID_CAMPAIGN_LINEUP_HERO_LEVEL | G246: 135 | H246: 成就_武将等级27
F247: TID_CAMPAIGN_LINEUP_HERO_LEVEL | G247: 140 | H247: 成就_武将等级28
F248: TID_CAMPAIGN_LINEUP_HERO_LEVEL | G248: 145 | H248: 成就_武将等级29
F249: TID_CAMPAIGN_LINEUP_HERO_LEVEL | G249: 150 | H249: 成就_武将等级30
B250: 2140003 | C250: 成就_装备等级 | D250: 成就 | F250: TID_CAMPAIGN_LINEUP_EQUIP_ENHANCE_LEVEL | G250: 10 | H250: 成就_装备等级1 | I250: lineup_equip_enhance_level | J250: 阵容
F251: TID_CAMPAIGN_LINEUP_EQUIP_ENHANCE_LEVEL | G251: 20 | H251: 成就_装备等级2
F252: TID_CAMPAIGN_LINEUP_EQUIP_ENHANCE_LEVEL | G252: 30 | H252: 成就_装备等级3
F253: TID_CAMPAIGN_LINEUP_EQUIP_ENHANCE_LEVEL | G253: 40 | H253: 成就_装备等级4
F254: TID_CAMPAIGN_LINEUP_EQUIP_ENHANCE_LEVEL | G254: 50 | H254: 成就_装备等级5
F255: TID_CAMPAIGN_LINEUP_EQUIP_ENHANCE_LEVEL | G255: 60 | H255: 成就_装备等级6
F256: TID_CAMPAIGN_LINEUP_EQUIP_ENHANCE_LEVEL | G256: 70 | H256: 成就_装备等级7
F257: TID_CAMPAIGN_LINEUP_EQUIP_ENHANCE_LEVEL | G257: 80 | H257: 成就_装备等级8
F258: TID_CAMPAIGN_LINEUP_EQUIP_ENHANCE_LEVEL | G258: 90 | H258: 成就_装备等级9
F259: TID_CAMPAIGN_LINEUP_EQUIP_ENHANCE_LEVEL | G259: 100 | H259: 成就_装备等级10
F260: TID_CAMPAIGN_LINEUP_EQUIP_ENHANCE_LEVEL | G260: 110 | H260: 成就_装备等级11
F261: TID_CAMPAIGN_LINEUP_EQUIP_ENHANCE_LEVEL | G261: 120 | H261: 成就_装备等级12
F262: TID_CAMPAIGN_LINEUP_EQUIP_ENHANCE_LEVEL | G262: 130 | H262: 成就_装备等级13
F263: TID_CAMPAIGN_LINEUP_EQUIP_ENHANCE_LEVEL | G263: 140 | H263: 成就_装备等级14
F264: TID_CAMPAIGN_LINEUP_EQUIP_ENHANCE_LEVEL | G264: 150 | H264: 成就_装备等级15
F265: TID_CAMPAIGN_LINEUP_EQUIP_ENHANCE_LEVEL | G265: 160 | H265: 成就_装备等级16
F266: TID_CAMPAIGN_LINEUP_EQUIP_ENHANCE_LEVEL | G266: 170 | H266: 成就_装备等级17
F267: TID_CAMPAIGN_LINEUP_EQUIP_ENHANCE_LEVEL | G267: 180 | H267: 成就_装备等级18
F268: TID_CAMPAIGN_LINEUP_EQUIP_ENHANCE_LEVEL | G268: 190 | H268: 成就_装备等级19
F269: TID_CAMPAIGN_LINEUP_EQUIP_ENHANCE_LEVEL | G269: 200 | H269: 成就_装备等级20
F270: TID_CAMPAIGN_LINEUP_EQUIP_ENHANCE_LEVEL | G270: 210 | H270: 成就_装备等级21
F271: TID_CAMPAIGN_LINEUP_EQUIP_ENHANCE_LEVEL | G271: 220 | H271: 成就_装备等级22
F272: TID_CAMPAIGN_LINEUP_EQUIP_ENHANCE_LEVEL | G272: 230 | H272: 成就_装备等级23
F273: TID_CAMPAIGN_LINEUP_EQUIP_ENHANCE_LEVEL | G273: 240 | H273: 成就_装备等级24
F274: TID_CAMPAIGN_LINEUP_EQUIP_ENHANCE_LEVEL | G274: 250 | H274: 成就_装备等级25
F275: TID_CAMPAIGN_LINEUP_EQUIP_ENHANCE_LEVEL | G275: 260 | H275: 成就_装备等级26
F276: TID_CAMPAIGN_LINEUP_EQUIP_ENHANCE_LEVEL | G276: 270 | H276: 成就_装备等级27
F277: TID_CAMPAIGN_LINEUP_EQUIP_ENHANCE_LEVEL | G277: 280 | H277: 成就_装备等级28
F278: TID_CAMPAIGN_LINEUP_EQUIP_ENHANCE_LEVEL | G278: 290 | H278: 成就_装备等级29
F279: TID_CAMPAIGN_LINEUP_EQUIP_ENHANCE_LEVEL | G279: 300 | H279: 成就_装备等级30
B280: 2140004 | C280: 成就_宝物等级 | D280: 成就 | F280: TID_CAMPAIGN_LINEUP_TREASURE_ENHANCE_LEVEL | G280: 2 | H280: 成就_宝物等级1 | I280: lineup_treasure_enhance_level | J280: 阵容
F281: TID_CAMPAIGN_LINEUP_TREASURE_ENHANCE_LEVEL | G281: 4 | H281: 成就_宝物等级2
F282: TID_CAMPAIGN_LINEUP_TREASURE_ENHANCE_LEVEL | G282: 6 | H282: 成就_宝物等级3
F283: TID_CAMPAIGN_LINEUP_TREASURE_ENHANCE_LEVEL | G283: 8 | H283: 成就_宝物等级4
F284: TID_CAMPAIGN_LINEUP_TREASURE_ENHANCE_LEVEL | G284: 10 | H284: 成就_宝物等级5
F285: TID_CAMPAIGN_LINEUP_TREASURE_ENHANCE_LEVEL | G285: 12 | H285: 成就_宝物等级6
F286: TID_CAMPAIGN_LINEUP_TREASURE_ENHANCE_LEVEL | G286: 14 | H286: 成就_宝物等级7
F287: TID_CAMPAIGN_LINEUP_TREASURE_ENHANCE_LEVEL | G287: 16 | H287: 成就_宝物等级8
F288: TID_CAMPAIGN_LINEUP_TREASURE_ENHANCE_LEVEL | G288: 18 | H288: 成就_宝物等级9
F289: TID_CAMPAIGN_LINEUP_TREASURE_ENHANCE_LEVEL | G289: 20 | H289: 成就_宝物等级10
F290: TID_CAMPAIGN_LINEUP_TREASURE_ENHANCE_LEVEL | G290: 25 | H290: 成就_宝物等级11
F291: TID_CAMPAIGN_LINEUP_TREASURE_ENHANCE_LEVEL | G291: 30 | H291: 成就_宝物等级12
F292: TID_CAMPAIGN_LINEUP_TREASURE_ENHANCE_LEVEL | G292: 35 | H292: 成就_宝物等级13
F293: TID_CAMPAIGN_LINEUP_TREASURE_ENHANCE_LEVEL | G293: 40 | H293: 成就_宝物等级14
F294: TID_CAMPAIGN_LINEUP_TREASURE_ENHANCE_LEVEL | G294: 45 | H294: 成就_宝物等级15
F295: TID_CAMPAIGN_LINEUP_TREASURE_ENHANCE_LEVEL | G295: 50 | H295: 成就_宝物等级16
F296: TID_CAMPAIGN_LINEUP_TREASURE_ENHANCE_LEVEL | G296: 55 | H296: 成就_宝物等级17
F297: TID_CAMPAIGN_LINEUP_TREASURE_ENHANCE_LEVEL | G297: 60 | H297: 成就_宝物等级18
F298: TID_CAMPAIGN_LINEUP_TREASURE_ENHANCE_LEVEL | G298: 65 | H298: 成就_宝物等级19
F299: TID_CAMPAIGN_LINEUP_TREASURE_ENHANCE_LEVEL | G299: 70 | H299: 成就_宝物等级20
F300: TID_CAMPAIGN_LINEUP_TREASURE_ENHANCE_LEVEL | G300: 75 | H300: 成就_宝物等级21
F301: TID_CAMPAIGN_LINEUP_TREASURE_ENHANCE_LEVEL | G301: 80 | H301: 成就_宝物等级22
B302: 2140005 | C302: 成就_随从等级 | D302: 成就 | F302: TID_CAMPAIGN_LINEUP_SQUAD_LEVEL | G302: 30 | H302: 成就_随从等级1 | I302: lineup_squad_level | J302: 阵容
F303: TID_CAMPAIGN_LINEUP_SQUAD_LEVEL | G303: 40 | H303: 成就_随从等级2
F304: TID_CAMPAIGN_LINEUP_SQUAD_LEVEL | G304: 50 | H304: 成就_随从等级3
F305: TID_CAMPAIGN_LINEUP_SQUAD_LEVEL | G305: 60 | H305: 成就_随从等级4
F306: TID_CAMPAIGN_LINEUP_SQUAD_LEVEL | G306: 70 | H306: 成就_随从等级5
F307: TID_CAMPAIGN_LINEUP_SQUAD_LEVEL | G307: 80 | H307: 成就_随从等级6
F308: TID_CAMPAIGN_LINEUP_SQUAD_LEVEL | G308: 90 | H308: 成就_随从等级7
F309: TID_CAMPAIGN_LINEUP_SQUAD_LEVEL | G309: 100 | H309: 成就_随从等级8
F310: TID_CAMPAIGN_LINEUP_SQUAD_LEVEL | G310: 110 | H310: 成就_随从等级9
F311: TID_CAMPAIGN_LINEUP_SQUAD_LEVEL | G311: 120 | H311: 成就_随从等级10
F312: TID_CAMPAIGN_LINEUP_SQUAD_LEVEL | G312: 130 | H312: 成就_随从等级11
F313: TID_CAMPAIGN_LINEUP_SQUAD_LEVEL | G313: 140 | H313: 成就_随从等级12
F314: TID_CAMPAIGN_LINEUP_SQUAD_LEVEL | G314: 150 | H314: 成就_随从等级13
F315: TID_CAMPAIGN_LINEUP_SQUAD_LEVEL | G315: 160 | H315: 成就_随从等级14
F316: TID_CAMPAIGN_LINEUP_SQUAD_LEVEL | G316: 170 | H316: 成就_随从等级15
F317: TID_CAMPAIGN_LINEUP_SQUAD_LEVEL | G317: 180 | H317: 成就_随从等级16
F318: TID_CAMPAIGN_LINEUP_SQUAD_LEVEL | G318: 190 | H318: 成就_随从等级17
F319: TID_CAMPAIGN_LINEUP_SQUAD_LEVEL | G319: 200 | H319: 成就_随从等级18
F320: TID_CAMPAIGN_LINEUP_SQUAD_LEVEL | G320: 210 | H320: 成就_随从等级19
F321: TID_CAMPAIGN_LINEUP_SQUAD_LEVEL | G321: 220 | H321: 成就_随从等级20
F322: TID_CAMPAIGN_LINEUP_SQUAD_LEVEL | G322: 230 | H322: 成就_随从等级21
F323: TID_CAMPAIGN_LINEUP_SQUAD_LEVEL | G323: 240 | H323: 成就_随从等级22
F324: TID_CAMPAIGN_LINEUP_SQUAD_LEVEL | G324: 250 | H324: 成就_随从等级23
F325: TID_CAMPAIGN_LINEUP_SQUAD_LEVEL | G325: 260 | H325: 成就_随从等级24
F326: TID_CAMPAIGN_LINEUP_SQUAD_LEVEL | G326: 270 | H326: 成就_随从等级25
F327: TID_CAMPAIGN_LINEUP_SQUAD_LEVEL | G327: 280 | H327: 成就_随从等级26
F328: TID_CAMPAIGN_LINEUP_SQUAD_LEVEL | G328: 290 | H328: 成就_随从等级27
F329: TID_CAMPAIGN_LINEUP_SQUAD_LEVEL | G329: 300 | H329: 成就_随从等级28
B330: 2140006 | C330: 成就_兵法等级 | D330: 成就 | F330: TID_CAMPAIGN_LINEUP_WARCRAFT_LEVEL | G330: 5 | H330: 成就_兵法等级1 | I330: lineup_warcraft_level | J330: 阵容
F331: TID_CAMPAIGN_LINEUP_WARCRAFT_LEVEL | G331: 10 | H331: 成就_兵法等级2
F332: TID_CAMPAIGN_LINEUP_WARCRAFT_LEVEL | G332: 15 | H332: 成就_兵法等级3
F333: TID_CAMPAIGN_LINEUP_WARCRAFT_LEVEL | G333: 20 | H333: 成就_兵法等级4
F334: TID_CAMPAIGN_LINEUP_WARCRAFT_LEVEL | G334: 25 | H334: 成就_兵法等级5
F335: TID_CAMPAIGN_LINEUP_WARCRAFT_LEVEL | G335: 30 | H335: 成就_兵法等级6
F336: TID_CAMPAIGN_LINEUP_WARCRAFT_LEVEL | G336: 35 | H336: 成就_兵法等级7
F337: TID_CAMPAIGN_LINEUP_WARCRAFT_LEVEL | G337: 40 | H337: 成就_兵法等级8
F338: TID_CAMPAIGN_LINEUP_WARCRAFT_LEVEL | G338: 45 | H338: 成就_兵法等级9
F339: TID_CAMPAIGN_LINEUP_WARCRAFT_LEVEL | G339: 50 | H339: 成就_兵法等级10
F340: TID_CAMPAIGN_LINEUP_WARCRAFT_LEVEL | G340: 55 | H340: 成就_兵法等级11
F341: TID_CAMPAIGN_LINEUP_WARCRAFT_LEVEL | G341: 60 | H341: 成就_兵法等级12
F342: TID_CAMPAIGN_LINEUP_WARCRAFT_LEVEL | G342: 65 | H342: 成就_兵法等级13
F343: TID_CAMPAIGN_LINEUP_WARCRAFT_LEVEL | G343: 70 | H343: 成就_兵法等级14
F344: TID_CAMPAIGN_LINEUP_WARCRAFT_LEVEL | G344: 75 | H344: 成就_兵法等级15
F345: TID_CAMPAIGN_LINEUP_WARCRAFT_LEVEL | G345: 80 | H345: 成就_兵法等级16
F346: TID_CAMPAIGN_LINEUP_WARCRAFT_LEVEL | G346: 85 | H346: 成就_兵法等级17
F347: TID_CAMPAIGN_LINEUP_WARCRAFT_LEVEL | G347: 90 | H347: 成就_兵法等级18
F348: TID_CAMPAIGN_LINEUP_WARCRAFT_LEVEL | G348: 95 | H348: 成就_兵法等级19
F349: TID_CAMPAIGN_LINEUP_WARCRAFT_LEVEL | G349: 100 | H349: 成就_兵法等级20
F350: TID_CAMPAIGN_LINEUP_WARCRAFT_LEVEL | G350: 105 | H350: 成就_兵法等级21
F351: TID_CAMPAIGN_LINEUP_WARCRAFT_LEVEL | G351: 110 | H351: 成就_兵法等级22
F352: TID_CAMPAIGN_LINEUP_WARCRAFT_LEVEL | G352: 115 | H352: 成就_兵法等级23
F353: TID_CAMPAIGN_LINEUP_WARCRAFT_LEVEL | G353: 120 | H353: 成就_兵法等级24
F354: TID_CAMPAIGN_LINEUP_WARCRAFT_LEVEL | G354: 125 | H354: 成就_兵法等级25
F355: TID_CAMPAIGN_LINEUP_WARCRAFT_LEVEL | G355: 130 | H355: 成就_兵法等级26
F356: TID_CAMPAIGN_LINEUP_WARCRAFT_LEVEL | G356: 135 | H356: 成就_兵法等级27
F357: TID_CAMPAIGN_LINEUP_WARCRAFT_LEVEL | G357: 140 | H357: 成就_兵法等级28
F358: TID_CAMPAIGN_LINEUP_WARCRAFT_LEVEL | G358: 145 | H358: 成就_兵法等级29
F359: TID_CAMPAIGN_LINEUP_WARCRAFT_LEVEL | G359: 150 | H359: 成就_兵法等级30
B360: 2140007 | C360: 成就_武将突破 | D360: 成就 | F360: TID_CAMPAIGN_LINEUP_HERO_BREAKTHROUGH_LEVEL | G360: 1 | H360: 成就_武将突破1 | I360: lineup_hero_breakthrough_level | J360: 阵容
F361: TID_CAMPAIGN_LINEUP_HERO_BREAKTHROUGH_LEVEL | G361: 2 | H361: 成就_武将突破2
F362: TID_CAMPAIGN_LINEUP_HERO_BREAKTHROUGH_LEVEL | G362: 3 | H362: 成就_武将突破3
F363: TID_CAMPAIGN_LINEUP_HERO_BREAKTHROUGH_LEVEL | G363: 4 | H363: 成就_武将突破4
F364: TID_CAMPAIGN_LINEUP_HERO_BREAKTHROUGH_LEVEL | G364: 5 | H364: 成就_武将突破5
F365: TID_CAMPAIGN_LINEUP_HERO_BREAKTHROUGH_LEVEL | G365: 6 | H365: 成就_武将突破6
F366: TID_CAMPAIGN_LINEUP_HERO_BREAKTHROUGH_LEVEL | G366: 7 | H366: 成就_武将突破7
F367: TID_CAMPAIGN_LINEUP_HERO_BREAKTHROUGH_LEVEL | G367: 8 | H367: 成就_武将突破8
F368: TID_CAMPAIGN_LINEUP_HERO_BREAKTHROUGH_LEVEL | G368: 9 | H368: 成就_武将突破9
F369: TID_CAMPAIGN_LINEUP_HERO_BREAKTHROUGH_LEVEL | G369: 10 | H369: 成就_武将突破10
F370: TID_CAMPAIGN_LINEUP_HERO_BREAKTHROUGH_LEVEL | G370: 11 | H370: 成就_武将突破11
F371: TID_CAMPAIGN_LINEUP_HERO_BREAKTHROUGH_LEVEL | G371: 12 | H371: 成就_武将突破12
F372: TID_CAMPAIGN_LINEUP_HERO_BREAKTHROUGH_LEVEL | G372: 13 | H372: 成就_武将突破13
F373: TID_CAMPAIGN_LINEUP_HERO_BREAKTHROUGH_LEVEL | G373: 14 | H373: 成就_武将突破14
F374: TID_CAMPAIGN_LINEUP_HERO_BREAKTHROUGH_LEVEL | G374: 15 | H374: 成就_武将突破15
B375: 2140008 | C375: 成就_武将将星 | D375: 成就 | F375: TID_CAMPAIGN_LINEUP_HERO_STARDUST_LEVEL | G375: 2 | H375: 成就_武将将星1 | I375: lineup_hero_stardust_level | J375: 阵容
F376: TID_CAMPAIGN_LINEUP_HERO_STARDUST_LEVEL | G376: =R[-1]C+1 -> 3 | H376: 成就_武将将星2
F377: TID_CAMPAIGN_LINEUP_HERO_STARDUST_LEVEL | G377: =R[-1]C+1 -> 4 | H377: 成就_武将将星3
F378: TID_CAMPAIGN_LINEUP_HERO_STARDUST_LEVEL | G378: =R[-1]C+1 -> 5 | H378: 成就_武将将星4
F379: TID_CAMPAIGN_LINEUP_HERO_STARDUST_LEVEL | G379: =R[-1]C+1 -> 6 | H379: 成就_武将将星5
F380: TID_CAMPAIGN_LINEUP_HERO_STARDUST_LEVEL | G380: =R[-1]C+1 -> 7 | H380: 成就_武将将星6
F381: TID_CAMPAIGN_LINEUP_HERO_STARDUST_LEVEL | G381: =R[-1]C+1 -> 8 | H381: 成就_武将将星7
F382: TID_CAMPAIGN_LINEUP_HERO_STARDUST_LEVEL | G382: =R[-1]C+1 -> 9 | H382: 成就_武将将星8
F383: TID_CAMPAIGN_LINEUP_HERO_STARDUST_LEVEL | G383: =R[-1]C+1 -> 10 | H383: 成就_武将将星9
F384: TID_CAMPAIGN_LINEUP_HERO_STARDUST_LEVEL | G384: =R[-1]C+1 -> 11 | H384: 成就_武将将星10
F385: TID_CAMPAIGN_LINEUP_HERO_STARDUST_LEVEL | G385: =R[-1]C+1 -> 12 | H385: 成就_武将将星11
F386: TID_CAMPAIGN_LINEUP_HERO_STARDUST_LEVEL | G386: =R[-1]C+1 -> 13 | H386: 成就_武将将星12
F387: TID_CAMPAIGN_LINEUP_HERO_STARDUST_LEVEL | G387: =R[-1]C+1 -> 14 | H387: 成就_武将将星13
F388: TID_CAMPAIGN_LINEUP_HERO_STARDUST_LEVEL | G388: =R[-1]C+1 -> 15 | H388: 成就_武将将星14
B389: 2140009 | C389: 成就_装备精炼 | D389: 成就 | F389: TID_CAMPAIGN_LINEUP_EQUIP_REFINE_LEVEL | G389: 2 | H389: 成就_装备精炼1 | I389: lineup_equip_refine_level | J389: 阵容
F390: TID_CAMPAIGN_LINEUP_EQUIP_REFINE_LEVEL | G390: 4 | H390: 成就_装备精炼2
F391: TID_CAMPAIGN_LINEUP_EQUIP_REFINE_LEVEL | G391: 6 | H391: 成就_装备精炼3
F392: TID_CAMPAIGN_LINEUP_EQUIP_REFINE_LEVEL | G392: 8 | H392: 成就_装备精炼4
F393: TID_CAMPAIGN_LINEUP_EQUIP_REFINE_LEVEL | G393: 10 | H393: 成就_装备精炼5
F394: TID_CAMPAIGN_LINEUP_EQUIP_REFINE_LEVEL | G394: 12 | H394: 成就_装备精炼6
F395: TID_CAMPAIGN_LINEUP_EQUIP_REFINE_LEVEL | G395: 14 | H395: 成就_装备精炼7
F396: TID_CAMPAIGN_LINEUP_EQUIP_REFINE_LEVEL | G396: 16 | H396: 成就_装备精炼8
F397: TID_CAMPAIGN_LINEUP_EQUIP_REFINE_LEVEL | G397: 18 | H397: 成就_装备精炼9
F398: TID_CAMPAIGN_LINEUP_EQUIP_REFINE_LEVEL | G398: 20 | H398: 成就_装备精炼10
F399: TID_CAMPAIGN_LINEUP_EQUIP_REFINE_LEVEL | G399: 22 | H399: 成就_装备精炼11
F400: TID_CAMPAIGN_LINEUP_EQUIP_REFINE_LEVEL | G400: 24 | H400: 成就_装备精炼12
F401: TID_CAMPAIGN_LINEUP_EQUIP_REFINE_LEVEL | G401: 26 | H401: 成就_装备精炼13
F402: TID_CAMPAIGN_LINEUP_EQUIP_REFINE_LEVEL | G402: 28 | H402: 成就_装备精炼14
F403: TID_CAMPAIGN_LINEUP_EQUIP_REFINE_LEVEL | G403: 30 | H403: 成就_装备精炼15
F404: TID_CAMPAIGN_LINEUP_EQUIP_REFINE_LEVEL | G404: 32 | H404: 成就_装备精炼16
F405: TID_CAMPAIGN_LINEUP_EQUIP_REFINE_LEVEL | G405: 34 | H405: 成就_装备精炼17
F406: TID_CAMPAIGN_LINEUP_EQUIP_REFINE_LEVEL | G406: 36 | H406: 成就_装备精炼18
F407: TID_CAMPAIGN_LINEUP_EQUIP_REFINE_LEVEL | G407: 38 | H407: 成就_装备精炼19
F408: TID_CAMPAIGN_LINEUP_EQUIP_REFINE_LEVEL | G408: 40 | H408: 成就_装备精炼20
F409: TID_CAMPAIGN_LINEUP_EQUIP_REFINE_LEVEL | G409: 42 | H409: 成就_装备精炼21
F410: TID_CAMPAIGN_LINEUP_EQUIP_REFINE_LEVEL | G410: 44 | H410: 成就_装备精炼22
F411: TID_CAMPAIGN_LINEUP_EQUIP_REFINE_LEVEL | G411: 46 | H411: 成就_装备精炼23
F412: TID_CAMPAIGN_LINEUP_EQUIP_REFINE_LEVEL | G412: 48 | H412: 成就_装备精炼24
F413: TID_CAMPAIGN_LINEUP_EQUIP_REFINE_LEVEL | G413: 50 | H413: 成就_装备精炼25
B414: 2140010 | C414: 成就_宝物精炼 | D414: 成就 | F414: TID_CAMPAIGN_LINEUP_TREASURE_REFINE_LEVEL | G414: 1 | H414: 成就_宝物精炼1 | I414: lineup_treasure_refine_level | J414: 阵容
F415: TID_CAMPAIGN_LINEUP_TREASURE_REFINE_LEVEL | G415: 2 | H415: 成就_宝物精炼2
F416: TID_CAMPAIGN_LINEUP_TREASURE_REFINE_LEVEL | G416: 3 | H416: 成就_宝物精炼3
F417: TID_CAMPAIGN_LINEUP_TREASURE_REFINE_LEVEL | G417: 4 | H417: 成就_宝物精炼4
F418: TID_CAMPAIGN_LINEUP_TREASURE_REFINE_LEVEL | G418: 5 | H418: 成就_宝物精炼5
F419: TID_CAMPAIGN_LINEUP_TREASURE_REFINE_LEVEL | G419: 6 | H419: 成就_宝物精炼6
F420: TID_CAMPAIGN_LINEUP_TREASURE_REFINE_LEVEL | G420: 7 | H420: 成就_宝物精炼7
F421: TID_CAMPAIGN_LINEUP_TREASURE_REFINE_LEVEL | G421: 8 | H421: 成就_宝物精炼8
F422: TID_CAMPAIGN_LINEUP_TREASURE_REFINE_LEVEL | G422: 9 | H422: 成就_宝物精炼9
F423: TID_CAMPAIGN_LINEUP_TREASURE_REFINE_LEVEL | G423: 10 | H423: 成就_宝物精炼10
F424: TID_CAMPAIGN_LINEUP_TREASURE_REFINE_LEVEL | G424: 11 | H424: 成就_宝物精炼11
F425: TID_CAMPAIGN_LINEUP_TREASURE_REFINE_LEVEL | G425: 12 | H425: 成就_宝物精炼12
F426: TID_CAMPAIGN_LINEUP_TREASURE_REFINE_LEVEL | G426: 13 | H426: 成就_宝物精炼13
F427: TID_CAMPAIGN_LINEUP_TREASURE_REFINE_LEVEL | G427: 14 | H427: 成就_宝物精炼14
F428: TID_CAMPAIGN_LINEUP_TREASURE_REFINE_LEVEL | G428: 15 | H428: 成就_宝物精炼15
F429: TID_CAMPAIGN_LINEUP_TREASURE_REFINE_LEVEL | G429: 16 | H429: 成就_宝物精炼16
F430: TID_CAMPAIGN_LINEUP_TREASURE_REFINE_LEVEL | G430: 17 | H430: 成就_宝物精炼17
F431: TID_CAMPAIGN_LINEUP_TREASURE_REFINE_LEVEL | G431: 18 | H431: 成就_宝物精炼18
F432: TID_CAMPAIGN_LINEUP_TREASURE_REFINE_LEVEL | G432: 19 | H432: 成就_宝物精炼19
F433: TID_CAMPAIGN_LINEUP_TREASURE_REFINE_LEVEL | G433: 20 | H433: 成就_宝物精炼20
B434: 2140011 | C434: 成就_随从突破 | D434: 成就 | F434: TID_CAMPAIGN_LIENUP_SQUAD_BREAKTHROUGH_LEVEL | G434: 1 | H434: 成就_随从突破1 | I434: lineup_squad_breakthrough_level | J434: 阵容
F435: TID_CAMPAIGN_LIENUP_SQUAD_BREAKTHROUGH_LEVEL | G435: 2 | H435: 成就_随从突破2
F436: TID_CAMPAIGN_LIENUP_SQUAD_BREAKTHROUGH_LEVEL | G436: 3 | H436: 成就_随从突破3
F437: TID_CAMPAIGN_LIENUP_SQUAD_BREAKTHROUGH_LEVEL | G437: 4 | H437: 成就_随从突破4
F438: TID_CAMPAIGN_LIENUP_SQUAD_BREAKTHROUGH_LEVEL | G438: 5 | H438: 成就_随从突破5
F439: TID_CAMPAIGN_LIENUP_SQUAD_BREAKTHROUGH_LEVEL | G439: 6 | H439: 成就_随从突破6
F440: TID_CAMPAIGN_LIENUP_SQUAD_BREAKTHROUGH_LEVEL | G440: 7 | H440: 成就_随从突破7
F441: TID_CAMPAIGN_LIENUP_SQUAD_BREAKTHROUGH_LEVEL | G441: 8 | H441: 成就_随从突破8
F442: TID_CAMPAIGN_LIENUP_SQUAD_BREAKTHROUGH_LEVEL | G442: 9 | H442: 成就_随从突破9
F443: TID_CAMPAIGN_LIENUP_SQUAD_BREAKTHROUGH_LEVEL | G443: 10 | H443: 成就_随从突破10
F444: TID_CAMPAIGN_LIENUP_SQUAD_BREAKTHROUGH_LEVEL | G444: 11 | H444: 成就_随从突破11
F445: TID_CAMPAIGN_LIENUP_SQUAD_BREAKTHROUGH_LEVEL | G445: 12 | H445: 成就_随从突破12
F446: TID_CAMPAIGN_LIENUP_SQUAD_BREAKTHROUGH_LEVEL | G446: 13 | H446: 成就_随从突破13
F447: TID_CAMPAIGN_LIENUP_SQUAD_BREAKTHROUGH_LEVEL | G447: 14 | H447: 成就_随从突破14
F448: TID_CAMPAIGN_LIENUP_SQUAD_BREAKTHROUGH_LEVEL | G448: 15 | H448: 成就_随从突破15
F449: TID_CAMPAIGN_LIENUP_SQUAD_BREAKTHROUGH_LEVEL | G449: 16 | H449: 成就_随从突破16
F450: TID_CAMPAIGN_LIENUP_SQUAD_BREAKTHROUGH_LEVEL | G450: 17 | H450: 成就_随从突破17
F451: TID_CAMPAIGN_LIENUP_SQUAD_BREAKTHROUGH_LEVEL | G451: 18 | H451: 成就_随从突破18
F452: TID_CAMPAIGN_LIENUP_SQUAD_BREAKTHROUGH_LEVEL | G452: 19 | H452: 成就_随从突破19
F453: TID_CAMPAIGN_LIENUP_SQUAD_BREAKTHROUGH_LEVEL | G453: 20 | H453: 成就_随从突破20
F454: TID_CAMPAIGN_LIENUP_SQUAD_BREAKTHROUGH_LEVEL | G454: 21 | H454: 成就_随从突破21
F455: TID_CAMPAIGN_LIENUP_SQUAD_BREAKTHROUGH_LEVEL | G455: 22 | H455: 成就_随从突破22
F456: TID_CAMPAIGN_LIENUP_SQUAD_BREAKTHROUGH_LEVEL | G456: 23 | H456: 成就_随从突破23
F457: TID_CAMPAIGN_LIENUP_SQUAD_BREAKTHROUGH_LEVEL | G457: 24 | H457: 成就_随从突破24
F458: TID_CAMPAIGN_LIENUP_SQUAD_BREAKTHROUGH_LEVEL | G458: 25 | H458: 成就_随从突破25
B459: 2140012 | C459: 成就_兵法精炼 | D459: 成就 | F459: TID_CAMPAIGN_LIENUP_WARCRAFT_REFINE_LEVEL | G459: 2 | H459: 成就_兵法精炼1 | I459: lineup_warcraft_refine_level | J459: 阵容
F460: TID_CAMPAIGN_LIENUP_WARCRAFT_REFINE_LEVEL | G460: 3 | H460: 成就_兵法精炼2
F461: TID_CAMPAIGN_LIENUP_WARCRAFT_REFINE_LEVEL | G461: 4 | H461: 成就_兵法精炼3
F462: TID_CAMPAIGN_LIENUP_WARCRAFT_REFINE_LEVEL | G462: 5 | H462: 成就_兵法精炼4
F463: TID_CAMPAIGN_LIENUP_WARCRAFT_REFINE_LEVEL | G463: 6 | H463: 成就_兵法精炼5
F464: TID_CAMPAIGN_LIENUP_WARCRAFT_REFINE_LEVEL | G464: 7 | H464: 成就_兵法精炼6
F465: TID_CAMPAIGN_LIENUP_WARCRAFT_REFINE_LEVEL | G465: 8 | H465: 成就_兵法精炼7
F466: TID_CAMPAIGN_LIENUP_WARCRAFT_REFINE_LEVEL | G466: 9 | H466: 成就_兵法精炼8
F467: TID_CAMPAIGN_LIENUP_WARCRAFT_REFINE_LEVEL | G467: 10 | H467: 成就_兵法精炼9
B468: 2140013 | C468: 成就_主线星数 | D468: 成就 | F468: TID_CAMPAIGN_STORY_STAGE_TOTAL_STAR | G468: 30 | H468: 成就_主线星数1 | I468: story_stage_total_star | J468: 主线副本
F469: TID_CAMPAIGN_STORY_STAGE_TOTAL_STAR | G469: 60 | H469: 成就_主线星数2
F470: TID_CAMPAIGN_STORY_STAGE_TOTAL_STAR | G470: 90 | H470: 成就_主线星数3
F471: TID_CAMPAIGN_STORY_STAGE_TOTAL_STAR | G471: 120 | H471: 成就_主线星数4
F472: TID_CAMPAIGN_STORY_STAGE_TOTAL_STAR | G472: 150 | H472: 成就_主线星数5
F473: TID_CAMPAIGN_STORY_STAGE_TOTAL_STAR | G473: 180 | H473: 成就_主线星数6
F474: TID_CAMPAIGN_STORY_STAGE_TOTAL_STAR | G474: 210 | H474: 成就_主线星数7
F475: TID_CAMPAIGN_STORY_STAGE_TOTAL_STAR | G475: 240 | H475: 成就_主线星数8
F476: TID_CAMPAIGN_STORY_STAGE_TOTAL_STAR | G476: 270 | H476: 成就_主线星数9
F477: TID_CAMPAIGN_STORY_STAGE_TOTAL_STAR | G477: 300 | H477: 成就_主线星数10
F478: TID_CAMPAIGN_STORY_STAGE_TOTAL_STAR | G478: 330 | H478: 成就_主线星数11
F479: TID_CAMPAIGN_STORY_STAGE_TOTAL_STAR | G479: 360 | H479: 成就_主线星数12
F480: TID_CAMPAIGN_STORY_STAGE_TOTAL_STAR | G480: 390 | H480: 成就_主线星数13
F481: TID_CAMPAIGN_STORY_STAGE_TOTAL_STAR | G481: 420 | H481: 成就_主线星数14
F482: TID_CAMPAIGN_STORY_STAGE_TOTAL_STAR | G482: 450 | H482: 成就_主线星数15
F483: TID_CAMPAIGN_STORY_STAGE_TOTAL_STAR | G483: 480 | H483: 成就_主线星数16
F484: TID_CAMPAIGN_STORY_STAGE_TOTAL_STAR | G484: 510 | H484: 成就_主线星数17
F485: TID_CAMPAIGN_STORY_STAGE_TOTAL_STAR | G485: 540 | H485: 成就_主线星数18
F486: TID_CAMPAIGN_STORY_STAGE_TOTAL_STAR | G486: 570 | H486: 成就_主线星数19
F487: TID_CAMPAIGN_STORY_STAGE_TOTAL_STAR | G487: 600 | H487: 成就_主线星数20
F488: TID_CAMPAIGN_STORY_STAGE_TOTAL_STAR | G488: 630 | H488: 成就_主线星数21
F489: TID_CAMPAIGN_STORY_STAGE_TOTAL_STAR | G489: 660 | H489: 成就_主线星数22
F490: TID_CAMPAIGN_STORY_STAGE_TOTAL_STAR | G490: 690 | H490: 成就_主线星数23
F491: TID_CAMPAIGN_STORY_STAGE_TOTAL_STAR | G491: 720 | H491: 成就_主线星数24
F492: TID_CAMPAIGN_STORY_STAGE_TOTAL_STAR | G492: 750 | H492: 成就_主线星数25
F493: TID_CAMPAIGN_STORY_STAGE_TOTAL_STAR | G493: 780 | H493: 成就_主线星数26
F494: TID_CAMPAIGN_STORY_STAGE_TOTAL_STAR | G494: 810 | H494: 成就_主线星数27
F495: TID_CAMPAIGN_STORY_STAGE_TOTAL_STAR | G495: 840 | H495: 成就_主线星数28
F496: TID_CAMPAIGN_STORY_STAGE_TOTAL_STAR | G496: 870 | H496: 成就_主线星数29
F497: TID_CAMPAIGN_STORY_STAGE_TOTAL_STAR | G497: 900 | H497: 成就_主线星数30
F498: TID_CAMPAIGN_STORY_STAGE_TOTAL_STAR | G498: 930 | H498: 成就_主线星数31
F499: TID_CAMPAIGN_STORY_STAGE_TOTAL_STAR | G499: 960 | H499: 成就_主线星数32
F500: TID_CAMPAIGN_STORY_STAGE_TOTAL_STAR | G500: 990 | H500: 成就_主线星数33
F501: TID_CAMPAIGN_STORY_STAGE_TOTAL_STAR | G501: 1020 | H501: 成就_主线星数34
F502: TID_CAMPAIGN_STORY_STAGE_TOTAL_STAR | G502: 1050 | H502: 成就_主线星数35
F503: TID_CAMPAIGN_STORY_STAGE_TOTAL_STAR | G503: 1080 | H503: 成就_主线星数36
F504: TID_CAMPAIGN_STORY_STAGE_TOTAL_STAR | G504: 1110 | H504: 成就_主线星数37
F505: TID_CAMPAIGN_STORY_STAGE_TOTAL_STAR | G505: 1140 | H505: 成就_主线星数38
F506: TID_CAMPAIGN_STORY_STAGE_TOTAL_STAR | G506: 1170 | H506: 成就_主线星数39
F507: TID_CAMPAIGN_STORY_STAGE_TOTAL_STAR | G507: 1200 | H507: 成就_主线星数40
F508: TID_CAMPAIGN_STORY_STAGE_TOTAL_STAR | G508: 1230 | H508: 成就_主线星数41
F509: TID_CAMPAIGN_STORY_STAGE_TOTAL_STAR | G509: 1260 | H509: 成就_主线星数42
F510: TID_CAMPAIGN_STORY_STAGE_TOTAL_STAR | G510: 1290 | H510: 成就_主线星数43
F511: TID_CAMPAIGN_STORY_STAGE_TOTAL_STAR | G511: 1320 | H511: 成就_主线星数44
F512: TID_CAMPAIGN_STORY_STAGE_TOTAL_STAR | G512: 1350 | H512: 成就_主线星数45
F513: TID_CAMPAIGN_STORY_STAGE_TOTAL_STAR | G513: 1380 | H513: 成就_主线星数46
F514: TID_CAMPAIGN_STORY_STAGE_TOTAL_STAR | G514: 1410 | H514: 成就_主线星数47
F515: TID_CAMPAIGN_STORY_STAGE_TOTAL_STAR | G515: 1440 | H515: 成就_主线星数48
B516: 2140014 | C516: 成就_名将副本 | D516: 成就 | F516: TID_CAMPAIGN_HERO_STAGE_CHAPTER | G516: 2 | H516: 成就_名将副本1 | I516: hero_stage_chapter | J516: 名将副本
F517: TID_CAMPAIGN_HERO_STAGE_CHAPTER | G517: 4 | H517: 成就_名将副本2
F518: TID_CAMPAIGN_HERO_STAGE_CHAPTER | G518: 6 | H518: 成就_名将副本3
F519: TID_CAMPAIGN_HERO_STAGE_CHAPTER | G519: 8 | H519: 成就_名将副本4
F520: TID_CAMPAIGN_HERO_STAGE_CHAPTER | G520: 10 | H520: 成就_名将副本5
F521: TID_CAMPAIGN_HERO_STAGE_CHAPTER | G521: 12 | H521: 成就_名将副本6
F522: TID_CAMPAIGN_HERO_STAGE_CHAPTER | G522: 14 | H522: 成就_名将副本7
F523: TID_CAMPAIGN_HERO_STAGE_CHAPTER | G523: 16 | H523: 成就_名将副本8
F524: TID_CAMPAIGN_HERO_STAGE_CHAPTER | G524: 18 | H524: 成就_名将副本9
F525: TID_CAMPAIGN_HERO_STAGE_CHAPTER | G525: 20 | H525: 成就_名将副本10
F526: TID_CAMPAIGN_HERO_STAGE_CHAPTER | G526: 22 | H526: 成就_名将副本11
F527: TID_CAMPAIGN_HERO_STAGE_CHAPTER | G527: 24 | H527: 成就_名将副本12
F528: TID_CAMPAIGN_HERO_STAGE_CHAPTER | G528: 26 | H528: 成就_名将副本13
F529: TID_CAMPAIGN_HERO_STAGE_CHAPTER | G529: 28 | H529: 成就_名将副本14
F530: TID_CAMPAIGN_HERO_STAGE_CHAPTER | G530: 30 | H530: 成就_名将副本15
F531: TID_CAMPAIGN_HERO_STAGE_CHAPTER | G531: 32 | H531: 成就_名将副本16
F532: TID_CAMPAIGN_HERO_STAGE_CHAPTER | G532: 34 | H532: 成就_名将副本17
F533: TID_CAMPAIGN_HERO_STAGE_CHAPTER | G533: 36 | H533: 成就_名将副本18
F534: TID_CAMPAIGN_HERO_STAGE_CHAPTER | G534: 38 | H534: 成就_名将副本19
F535: TID_CAMPAIGN_HERO_STAGE_CHAPTER | G535: 40 | H535: 成就_名将副本20
F536: TID_CAMPAIGN_HERO_STAGE_CHAPTER | G536: 42 | H536: 成就_名将副本21
F537: TID_CAMPAIGN_HERO_STAGE_CHAPTER | G537: 44 | H537: 成就_名将副本22
F538: TID_CAMPAIGN_HERO_STAGE_CHAPTER | G538: 46 | H538: 成就_名将副本23
F539: TID_CAMPAIGN_HERO_STAGE_CHAPTER | G539: 48 | H539: 成就_名将副本24
F540: TID_CAMPAIGN_HERO_STAGE_CHAPTER | G540: 50 | H540: 成就_名将副本25
F541: TID_CAMPAIGN_HERO_STAGE_CHAPTER | G541: 52 | H541: 成就_名将副本26
F542: TID_CAMPAIGN_HERO_STAGE_CHAPTER | G542: 54 | H542: 成就_名将副本27
F543: TID_CAMPAIGN_HERO_STAGE_CHAPTER | G543: 56 | H543: 成就_名将副本28
F544: TID_CAMPAIGN_HERO_STAGE_CHAPTER | G544: 58 | H544: 成就_名将副本29
F545: TID_CAMPAIGN_HERO_STAGE_CHAPTER | G545: 60 | H545: 成就_名将副本30
B546: 2140015 | C546: 成就_击杀BOSS数 | D546: 成就 | F546: TID_CAMPAIGN_WORLDBOSS_LAST_SHOT_COUNT | G546: 10 | H546: 成就_击杀BOSS数1 | I546: worldboss_last_shot_count | J546: 叛军
F547: TID_CAMPAIGN_WORLDBOSS_LAST_SHOT_COUNT | G547: 20 | H547: 成就_击杀BOSS数2
F548: TID_CAMPAIGN_WORLDBOSS_LAST_SHOT_COUNT | G548: 30 | H548: 成就_击杀BOSS数3
F549: TID_CAMPAIGN_WORLDBOSS_LAST_SHOT_COUNT | G549: 40 | H549: 成就_击杀BOSS数4
F550: TID_CAMPAIGN_WORLDBOSS_LAST_SHOT_COUNT | G550: 50 | H550: 成就_击杀BOSS数5
F551: TID_CAMPAIGN_WORLDBOSS_LAST_SHOT_COUNT | G551: 60 | H551: 成就_击杀BOSS数6
F552: TID_CAMPAIGN_WORLDBOSS_LAST_SHOT_COUNT | G552: 70 | H552: 成就_击杀BOSS数7
F553: TID_CAMPAIGN_WORLDBOSS_LAST_SHOT_COUNT | G553: 80 | H553: 成就_击杀BOSS数8
F554: TID_CAMPAIGN_WORLDBOSS_LAST_SHOT_COUNT | G554: 90 | H554: 成就_击杀BOSS数9
F555: TID_CAMPAIGN_WORLDBOSS_LAST_SHOT_COUNT | G555: 100 | H555: 成就_击杀BOSS数10
F556: TID_CAMPAIGN_WORLDBOSS_LAST_SHOT_COUNT | G556: 110 | H556: 成就_击杀BOSS数11
F557: TID_CAMPAIGN_WORLDBOSS_LAST_SHOT_COUNT | G557: 120 | H557: 成就_击杀BOSS数12
F558: TID_CAMPAIGN_WORLDBOSS_LAST_SHOT_COUNT | G558: 130 | H558: 成就_击杀BOSS数13
F559: TID_CAMPAIGN_WORLDBOSS_LAST_SHOT_COUNT | G559: 140 | H559: 成就_击杀BOSS数14
F560: TID_CAMPAIGN_WORLDBOSS_LAST_SHOT_COUNT | G560: 150 | H560: 成就_击杀BOSS数15
F561: TID_CAMPAIGN_WORLDBOSS_LAST_SHOT_COUNT | G561: 160 | H561: 成就_击杀BOSS数16
F562: TID_CAMPAIGN_WORLDBOSS_LAST_SHOT_COUNT | G562: 170 | H562: 成就_击杀BOSS数17
F563: TID_CAMPAIGN_WORLDBOSS_LAST_SHOT_COUNT | G563: 180 | H563: 成就_击杀BOSS数18
F564: TID_CAMPAIGN_WORLDBOSS_LAST_SHOT_COUNT | G564: 190 | H564: 成就_击杀BOSS数19
F565: TID_CAMPAIGN_WORLDBOSS_LAST_SHOT_COUNT | G565: 200 | H565: 成就_击杀BOSS数20
F566: TID_CAMPAIGN_WORLDBOSS_LAST_SHOT_COUNT | G566: 210 | H566: 成就_击杀BOSS数21
F567: TID_CAMPAIGN_WORLDBOSS_LAST_SHOT_COUNT | G567: 220 | H567: 成就_击杀BOSS数22
F568: TID_CAMPAIGN_WORLDBOSS_LAST_SHOT_COUNT | G568: 230 | H568: 成就_击杀BOSS数23
F569: TID_CAMPAIGN_WORLDBOSS_LAST_SHOT_COUNT | G569: 240 | H569: 成就_击杀BOSS数24
F570: TID_CAMPAIGN_WORLDBOSS_LAST_SHOT_COUNT | G570: 250 | H570: 成就_击杀BOSS数25
F571: TID_CAMPAIGN_WORLDBOSS_LAST_SHOT_COUNT | G571: 260 | H571: 成就_击杀BOSS数26
F572: TID_CAMPAIGN_WORLDBOSS_LAST_SHOT_COUNT | G572: 270 | H572: 成就_击杀BOSS数27
F573: TID_CAMPAIGN_WORLDBOSS_LAST_SHOT_COUNT | G573: 280 | H573: 成就_击杀BOSS数28
F574: TID_CAMPAIGN_WORLDBOSS_LAST_SHOT_COUNT | G574: 290 | H574: 成就_击杀BOSS数29
F575: TID_CAMPAIGN_WORLDBOSS_LAST_SHOT_COUNT | G575: 300 | H575: 成就_击杀BOSS数30
F576: TID_CAMPAIGN_WORLDBOSS_LAST_SHOT_COUNT | G576: 310 | H576: 成就_击杀BOSS数31
F577: TID_CAMPAIGN_WORLDBOSS_LAST_SHOT_COUNT | G577: 320 | H577: 成就_击杀BOSS数32
F578: TID_CAMPAIGN_WORLDBOSS_LAST_SHOT_COUNT | G578: 330 | H578: 成就_击杀BOSS数33
F579: TID_CAMPAIGN_WORLDBOSS_LAST_SHOT_COUNT | G579: 340 | H579: 成就_击杀BOSS数34
F580: TID_CAMPAIGN_WORLDBOSS_LAST_SHOT_COUNT | G580: 350 | H580: 成就_击杀BOSS数35
F581: TID_CAMPAIGN_WORLDBOSS_LAST_SHOT_COUNT | G581: 360 | H581: 成就_击杀BOSS数36
F582: TID_CAMPAIGN_WORLDBOSS_LAST_SHOT_COUNT | G582: 370 | H582: 成就_击杀BOSS数37
F583: TID_CAMPAIGN_WORLDBOSS_LAST_SHOT_COUNT | G583: 380 | H583: 成就_击杀BOSS数38
F584: TID_CAMPAIGN_WORLDBOSS_LAST_SHOT_COUNT | G584: 390 | H584: 成就_击杀BOSS数39
F585: TID_CAMPAIGN_WORLDBOSS_LAST_SHOT_COUNT | G585: 400 | H585: 成就_击杀BOSS数40
F586: TID_CAMPAIGN_WORLDBOSS_LAST_SHOT_COUNT | G586: 410 | H586: 成就_击杀BOSS数41
F587: TID_CAMPAIGN_WORLDBOSS_LAST_SHOT_COUNT | G587: 420 | H587: 成就_击杀BOSS数42
F588: TID_CAMPAIGN_WORLDBOSS_LAST_SHOT_COUNT | G588: 430 | H588: 成就_击杀BOSS数43
F589: TID_CAMPAIGN_WORLDBOSS_LAST_SHOT_COUNT | G589: 440 | H589: 成就_击杀BOSS数44
F590: TID_CAMPAIGN_WORLDBOSS_LAST_SHOT_COUNT | G590: 450 | H590: 成就_击杀BOSS数45
F591: TID_CAMPAIGN_WORLDBOSS_LAST_SHOT_COUNT | G591: 460 | H591: 成就_击杀BOSS数46
F592: TID_CAMPAIGN_WORLDBOSS_LAST_SHOT_COUNT | G592: 470 | H592: 成就_击杀BOSS数47
F593: TID_CAMPAIGN_WORLDBOSS_LAST_SHOT_COUNT | G593: 480 | H593: 成就_击杀BOSS数48
F594: TID_CAMPAIGN_WORLDBOSS_LAST_SHOT_COUNT | G594: 490 | H594: 成就_击杀BOSS数49
F595: TID_CAMPAIGN_WORLDBOSS_LAST_SHOT_COUNT | G595: 500 | H595: 成就_击杀BOSS数50
B596: 2140016 | C596: 成就_无双星数 | D596: 成就 | F596: TID_CAMPAIGN_WUSHUANG_TOTAL_STAR | G596: 10 | H596: 成就_无双星数1 | I596: wushuang_total_star | J596: 无双
F597: TID_CAMPAIGN_WUSHUANG_TOTAL_STAR | G597: 15 | H597: 成就_无双星数2
F598: TID_CAMPAIGN_WUSHUANG_TOTAL_STAR | G598: 20 | H598: 成就_无双星数3
F599: TID_CAMPAIGN_WUSHUANG_TOTAL_STAR | G599: 25 | H599: 成就_无双星数4
F600: TID_CAMPAIGN_WUSHUANG_TOTAL_STAR | G600: 30 | H600: 成就_无双星数5
F601: TID_CAMPAIGN_WUSHUANG_TOTAL_STAR | G601: 35 | H601: 成就_无双星数6
F602: TID_CAMPAIGN_WUSHUANG_TOTAL_STAR | G602: 40 | H602: 成就_无双星数7
F603: TID_CAMPAIGN_WUSHUANG_TOTAL_STAR | G603: 45 | H603: 成就_无双星数8
F604: TID_CAMPAIGN_WUSHUANG_TOTAL_STAR | G604: 50 | H604: 成就_无双星数9
F605: TID_CAMPAIGN_WUSHUANG_TOTAL_STAR | G605: 55 | H605: 成就_无双星数10
F606: TID_CAMPAIGN_WUSHUANG_TOTAL_STAR | G606: 60 | H606: 成就_无双星数11
F607: TID_CAMPAIGN_WUSHUANG_TOTAL_STAR | G607: 65 | H607: 成就_无双星数12
F608: TID_CAMPAIGN_WUSHUANG_TOTAL_STAR | G608: 70 | H608: 成就_无双星数13
F609: TID_CAMPAIGN_WUSHUANG_TOTAL_STAR | G609: 75 | H609: 成就_无双星数14
F610: TID_CAMPAIGN_WUSHUANG_TOTAL_STAR | G610: 80 | H610: 成就_无双星数15
F611: TID_CAMPAIGN_WUSHUANG_TOTAL_STAR | G611: 85 | H611: 成就_无双星数16
F612: TID_CAMPAIGN_WUSHUANG_TOTAL_STAR | G612: 90 | H612: 成就_无双星数17
F613: TID_CAMPAIGN_WUSHUANG_TOTAL_STAR | G613: 95 | H613: 成就_无双星数18
F614: TID_CAMPAIGN_WUSHUANG_TOTAL_STAR | G614: 100 | H614: 成就_无双星数19
F615: TID_CAMPAIGN_WUSHUANG_TOTAL_STAR | G615: 105 | H615: 成就_无双星数20
F616: TID_CAMPAIGN_WUSHUANG_TOTAL_STAR | G616: 110 | H616: 成就_无双星数21
F617: TID_CAMPAIGN_WUSHUANG_TOTAL_STAR | G617: 115 | H617: 成就_无双星数22
F618: TID_CAMPAIGN_WUSHUANG_TOTAL_STAR | G618: 120 | H618: 成就_无双星数23
F619: TID_CAMPAIGN_WUSHUANG_TOTAL_STAR | G619: 125 | H619: 成就_无双星数24
F620: TID_CAMPAIGN_WUSHUANG_TOTAL_STAR | G620: 130 | H620: 成就_无双星数25
F621: TID_CAMPAIGN_WUSHUANG_TOTAL_STAR | G621: 135 | H621: 成就_无双星数26
B622: 2140017 | C622: 成就_武将品质 | D622: 成就 | F622: TID_CAMPAIGN_LINEUP_HERO_QUALITY1 | G622: 2 | H622: 成就_武将品质1 | I622: lineup_hero_quality | J622: 阵容
F623: TID_CAMPAIGN_LINEUP_HERO_QUALITY2 | G623: 3 | H623: 成就_武将品质2
F624: TID_CAMPAIGN_LINEUP_HERO_QUALITY3 | G624: 4 | H624: 成就_武将品质3
F625: TID_CAMPAIGN_LINEUP_HERO_QUALITY4 | G625: 5 | H625: 成就_武将品质4
B626: 2140018 | C626: 成就_装备品质 | D626: 成就 | F626: TID_CAMPAIGN_LINEUP_EQUIP_PROMOTE_LEVEL1 | G626: 2 | H626: 成就_装备品质1 | I626: lineup_equip_promote_level | J626: 阵容
F627: TID_CAMPAIGN_LINEUP_EQUIP_PROMOTE_LEVEL2 | G627: =R[-1]C+1 -> 3 | H627: 成就_装备品质2
F628: TID_CAMPAIGN_LINEUP_EQUIP_PROMOTE_LEVEL3 | G628: =R[-1]C+1 -> 4 | H628: 成就_装备品质3
F629: TID_CAMPAIGN_LINEUP_EQUIP_PROMOTE_LEVEL4 | G629: =R[-1]C+1 -> 5 | H629: 成就_装备品质4
F630: TID_CAMPAIGN_LINEUP_EQUIP_PROMOTE_LEVEL5 | G630: =R[-1]C+1 -> 6 | H630: 成就_装备品质5
F631: TID_CAMPAIGN_LINEUP_EQUIP_PROMOTE_LEVEL6 | G631: =R[-1]C+1 -> 7 | H631: 成就_装备品质6
F632: TID_CAMPAIGN_LINEUP_EQUIP_PROMOTE_LEVEL7 | G632: =R[-1]C+1 -> 8 | H632: 成就_装备品质7
F633: TID_CAMPAIGN_LINEUP_EQUIP_PROMOTE_LEVEL8 | G633: =R[-1]C+1 -> 9 | H633: 成就_装备品质8
F634: TID_CAMPAIGN_LINEUP_EQUIP_PROMOTE_LEVEL9 | G634: =R[-1]C+1 -> 10 | H634: 成就_装备品质9
F635: TID_CAMPAIGN_LINEUP_EQUIP_PROMOTE_LEVEL10 | G635: =R[-1]C+1 -> 11 | H635: 成就_装备品质10
F636: TID_CAMPAIGN_LINEUP_EQUIP_PROMOTE_LEVEL11 | G636: =R[-1]C+1 -> 12 | H636: 成就_装备品质11
F637: TID_CAMPAIGN_LINEUP_EQUIP_PROMOTE_LEVEL12 | G637: =R[-1]C+1 -> 13 | H637: 成就_装备品质12
F638: TID_CAMPAIGN_LINEUP_EQUIP_PROMOTE_LEVEL13 | G638: =R[-1]C+1 -> 14 | H638: 成就_装备品质13
F639: TID_CAMPAIGN_LINEUP_EQUIP_PROMOTE_LEVEL14 | G639: =R[-1]C+1 -> 15 | H639: 成就_装备品质14
B640: 2140019 | C640: 成就_宝物品质 | D640: 成就 | F640: TID_CAMPAIGN_LINEUP_TREASUER_QUALITY1 | G640: 2 | H640: 成就_宝物品质1 | I640: lineup_treasure_quality | J640: 阵容
F641: TID_CAMPAIGN_LINEUP_TREASUER_QUALITY2 | G641: 3 | H641: 成就_宝物品质2
F642: TID_CAMPAIGN_LINEUP_TREASUER_QUALITY3 | G642: 4 | H642: 成就_宝物品质3
F643: TID_CAMPAIGN_LINEUP_TREASUER_QUALITY4 | G643: 5 | H643: 成就_宝物品质4
B644: 2140020 | C644: 成就_随从品质 | D644: 成就 | F644: TID_CAMPAIGN_LINEUP_SOLDIER_PROMOTE_LEVEL1 | G644: 2 | H644: 成就_随从品质1 | I644: lineup_soldier_promote_level | J644: 阵容
F645: TID_CAMPAIGN_LINEUP_SOLDIER_PROMOTE_LEVEL2 | G645: =R[-1]C+1 -> 3 | H645: 成就_随从品质2
F646: TID_CAMPAIGN_LINEUP_SOLDIER_PROMOTE_LEVEL3 | G646: =R[-1]C+1 -> 4 | H646: 成就_随从品质3
F647: TID_CAMPAIGN_LINEUP_SOLDIER_PROMOTE_LEVEL4 | G647: =R[-1]C+1 -> 5 | H647: 成就_随从品质4
F648: TID_CAMPAIGN_LINEUP_SOLDIER_PROMOTE_LEVEL5 | G648: =R[-1]C+1 -> 6 | H648: 成就_随从品质5
F649: TID_CAMPAIGN_LINEUP_SOLDIER_PROMOTE_LEVEL6 | G649: =R[-1]C+1 -> 7 | H649: 成就_随从品质6
F650: TID_CAMPAIGN_LINEUP_SOLDIER_PROMOTE_LEVEL7 | G650: =R[-1]C+1 -> 8 | H650: 成就_随从品质7
F651: TID_CAMPAIGN_LINEUP_SOLDIER_PROMOTE_LEVEL8 | G651: =R[-1]C+1 -> 9 | H651: 成就_随从品质8
F652: TID_CAMPAIGN_LINEUP_SOLDIER_PROMOTE_LEVEL9 | G652: =R[-1]C+1 -> 10 | H652: 成就_随从品质9
F653: TID_CAMPAIGN_LINEUP_SOLDIER_PROMOTE_LEVEL10 | G653: =R[-1]C+1 -> 11 | H653: 成就_随从品质10
F654: TID_CAMPAIGN_LINEUP_SOLDIER_PROMOTE_LEVEL11 | G654: =R[-1]C+1 -> 12 | H654: 成就_随从品质11
F655: TID_CAMPAIGN_LINEUP_SOLDIER_PROMOTE_LEVEL12 | G655: =R[-1]C+1 -> 13 | H655: 成就_随从品质12
F656: TID_CAMPAIGN_LINEUP_SOLDIER_PROMOTE_LEVEL13 | G656: =R[-1]C+1 -> 14 | H656: 成就_随从品质13
B657: 2140021 | C657: 成就_三军夺帅积分 | D657: 成就 | F657: TID_CAMPAIGN_HERO_BINGO_TOP_SCORE | G657: 500 | H657: 成就_三军夺帅积分1 | I657: hero_bingo_top_score | J657: 小兵玩法
F658: TID_CAMPAIGN_HERO_BINGO_TOP_SCORE | G658: 1000 | H658: 成就_三军夺帅积分2
F659: TID_CAMPAIGN_HERO_BINGO_TOP_SCORE | G659: 1500 | H659: 成就_三军夺帅积分3
F660: TID_CAMPAIGN_HERO_BINGO_TOP_SCORE | G660: 2000 | H660: 成就_三军夺帅积分4
F661: TID_CAMPAIGN_HERO_BINGO_TOP_SCORE | G661: 2500 | H661: 成就_三军夺帅积分5
F662: TID_CAMPAIGN_HERO_BINGO_TOP_SCORE | G662: 3000 | H662: 成就_三军夺帅积分6
F663: TID_CAMPAIGN_HERO_BINGO_TOP_SCORE | G663: 3500 | H663: 成就_三军夺帅积分7
F664: TID_CAMPAIGN_HERO_BINGO_TOP_SCORE | G664: 4000 | H664: 成就_三军夺帅积分8
F665: TID_CAMPAIGN_HERO_BINGO_TOP_SCORE | G665: 4500 | H665: 成就_三军夺帅积分9
F666: TID_CAMPAIGN_HERO_BINGO_TOP_SCORE | G666: 5000 | H666: 成就_三军夺帅积分10
F667: TID_CAMPAIGN_HERO_BINGO_TOP_SCORE | G667: 5500 | H667: 成就_三军夺帅积分11
F668: TID_CAMPAIGN_HERO_BINGO_TOP_SCORE | G668: 6000 | H668: 成就_三军夺帅积分12
F669: TID_CAMPAIGN_HERO_BINGO_TOP_SCORE | G669: 6500 | H669: 成就_三军夺帅积分13
F670: TID_CAMPAIGN_HERO_BINGO_TOP_SCORE | G670: 7000 | H670: 成就_三军夺帅积分14
F671: TID_CAMPAIGN_HERO_BINGO_TOP_SCORE | G671: 7500 | H671: 成就_三军夺帅积分15
F672: TID_CAMPAIGN_HERO_BINGO_TOP_SCORE | G672: 8000 | H672: 成就_三军夺帅积分16
F673: TID_CAMPAIGN_HERO_BINGO_TOP_SCORE | G673: 8500 | H673: 成就_三军夺帅积分17
F674: TID_CAMPAIGN_HERO_BINGO_TOP_SCORE | G674: 9000 | H674: 成就_三军夺帅积分18
F675: TID_CAMPAIGN_HERO_BINGO_TOP_SCORE | G675: 9500 | H675: 成就_三军夺帅积分19
F676: TID_CAMPAIGN_HERO_BINGO_TOP_SCORE | G676: 10000 | H676: 成就_三军夺帅积分20
F677: TID_CAMPAIGN_HERO_BINGO_TOP_SCORE | G677: 10500 | H677: 成就_三军夺帅积分21
F678: TID_CAMPAIGN_HERO_BINGO_TOP_SCORE | G678: 11000 | H678: 成就_三军夺帅积分22
F679: TID_CAMPAIGN_HERO_BINGO_TOP_SCORE | G679: 11500 | H679: 成就_三军夺帅积分23
F680: TID_CAMPAIGN_HERO_BINGO_TOP_SCORE | G680: 12000 | H680: 成就_三军夺帅积分24
F681: TID_CAMPAIGN_HERO_BINGO_TOP_SCORE | G681: 12500 | H681: 成就_三军夺帅积分25
F682: TID_CAMPAIGN_HERO_BINGO_TOP_SCORE | G682: 13000 | H682: 成就_三军夺帅积分26
F683: TID_CAMPAIGN_HERO_BINGO_TOP_SCORE | G683: 13500 | H683: 成就_三军夺帅积分27
F684: TID_CAMPAIGN_HERO_BINGO_TOP_SCORE | G684: 14000 | H684: 成就_三军夺帅积分28
F685: TID_CAMPAIGN_HERO_BINGO_TOP_SCORE | G685: 14500 | H685: 成就_三军夺帅积分29
F686: TID_CAMPAIGN_HERO_BINGO_TOP_SCORE | G686: 15000 | H686: 成就_三军夺帅积分30
F687: TID_CAMPAIGN_HERO_BINGO_TOP_SCORE | G687: 15500 | H687: 成就_三军夺帅积分31
F688: TID_CAMPAIGN_HERO_BINGO_TOP_SCORE | G688: 16000 | H688: 成就_三军夺帅积分32
F689: TID_CAMPAIGN_HERO_BINGO_TOP_SCORE | G689: 16500 | H689: 成就_三军夺帅积分33
F690: TID_CAMPAIGN_HERO_BINGO_TOP_SCORE | G690: 17000 | H690: 成就_三军夺帅积分34
F691: TID_CAMPAIGN_HERO_BINGO_TOP_SCORE | G691: 17500 | H691: 成就_三军夺帅积分35
F692: TID_CAMPAIGN_HERO_BINGO_TOP_SCORE | G692: 18000 | H692: 成就_三军夺帅积分36
F693: TID_CAMPAIGN_HERO_BINGO_TOP_SCORE | G693: 18500 | H693: 成就_三军夺帅积分37
F694: TID_CAMPAIGN_HERO_BINGO_TOP_SCORE | G694: 19000 | H694: 成就_三军夺帅积分38
F695: TID_CAMPAIGN_HERO_BINGO_TOP_SCORE | G695: 19500 | H695: 成就_三军夺帅积分39
F696: TID_CAMPAIGN_HERO_BINGO_TOP_SCORE | G696: 20000 | H696: 成就_三军夺帅积分40
F697: TID_CAMPAIGN_HERO_BINGO_TOP_SCORE | G697: 20500 | H697: 成就_三军夺帅积分41
F698: TID_CAMPAIGN_HERO_BINGO_TOP_SCORE | G698: 21000 | H698: 成就_三军夺帅积分42
F699: TID_CAMPAIGN_HERO_BINGO_TOP_SCORE | G699: 21500 | H699: 成就_三军夺帅积分43
F700: TID_CAMPAIGN_HERO_BINGO_TOP_SCORE | G700: 22000 | H700: 成就_三军夺帅积分44
F701: TID_CAMPAIGN_HERO_BINGO_TOP_SCORE | G701: 22500 | H701: 成就_三军夺帅积分45
F702: TID_CAMPAIGN_HERO_BINGO_TOP_SCORE | G702: 23000 | H702: 成就_三军夺帅积分46
F703: TID_CAMPAIGN_HERO_BINGO_TOP_SCORE | G703: 23500 | H703: 成就_三军夺帅积分47
F704: TID_CAMPAIGN_HERO_BINGO_TOP_SCORE | G704: 24000 | H704: 成就_三军夺帅积分48
F705: TID_CAMPAIGN_HERO_BINGO_TOP_SCORE | G705: 24500 | H705: 成就_三军夺帅积分49
F706: TID_CAMPAIGN_HERO_BINGO_TOP_SCORE | G706: 25000 | H706: 成就_三军夺帅积分50
B707: 2150001 | C707: 铜雀台_午_登陆领奖 | D707: 铜雀台_午 | F707: TID_CAMPAIGN_TIMING_RES_REWARD_1 | G707: 1 | H707: 铜雀台_午_登陆领奖 | I707: role_level
B708: 2150002 | C708: 铜雀台_晚_登陆领奖 | D708: 铜雀台_晚 | F708: TID_CAMPAIGN_TIMING_RES_REWARD_2 | G708: 1 | H708: 铜雀台_晚_登陆领奖 | I708: role_level
B709: 2160001 | C709: 宝物最高精炼到N阶 | D709: 测试_achieve条目 | F709: TID_CAMPAIGN_TEST_ACHIEVE1 | G709: 5 | H709: 测试条目奖励 | I709: treasure_refine_level | J709: 宝物列表
B710: 2160002 | C710: 上阵武将全身6件宝物精炼到N阶 | D710: 测试_achieve条目 | F710: TID_CAMPAIGN_TEST_ACHIEVE2 | G710: 3 | H710: 测试条目奖励 | I710: lineup_treasure_refine_level | J710: 宝物列表
B711: 2160003 | C711: 宝物最高强化到N阶 | D711: 测试_achieve条目 | F711: TID_CAMPAIGN_TEST_ACHIEVE3 | G711: 5 | H711: 测试条目奖励 | I711: treasure_enhance_level | J711: 宝物列表
B712: 2160004 | C712: 上阵武将全身6件宝物强化到N阶 | D712: 测试_achieve条目 | F712: TID_CAMPAIGN_TEST_ACHIEVE4 | G712: 3 | H712: 测试条目奖励 | I712: lineup_treasure_enhance_level | J712: 宝物列表
B713: 2160005 | C713: 上阵武将N名穿满2件宝物 | D713: 测试_achieve条目 | F713: TID_CAMPAIGN_TEST_ACHIEVE5 | G713: 3 | H713: 测试条目奖励 | I713: lineup_wear_2_treasure_hero_count | J713: 阵容
B714: 2160006 | C714: N个上阵武将穿满2件蓝色宝物及以上 | D714: 测试_achieve条目 | F714: TID_CAMPAIGN_TEST_ACHIEVE6 | G714: 3 | H714: 测试条目奖励 | I714: lineup_wear_2_blue_treasure_hero_count | J714: 阵容
B715: 2160007 | C715: N个上阵武将穿满2件紫色宝物及以上 | D715: 测试_achieve条目 | F715: TID_CAMPAIGN_TEST_ACHIEVE7 | G715: 3 | H715: 测试条目奖励 | I715: lineup_wear_2_purple_treasure_hero_count | J715: 阵容
B716: 2160008 | C716: N个上阵武将穿满2件橙色宝物及以上 | D716: 测试_achieve条目 | F716: TID_CAMPAIGN_TEST_ACHIEVE8 | G716: 3 | H716: 测试条目奖励 | I716: lineup_wear_2_orange_treasure_hero_count | J716: 阵容
B717: 2160009 | C717: 所有上阵武将等级达到N | D717: 测试_achieve条目 | F717: TID_CAMPAIGN_TEST_ACHIEVE9 | G717: 40 | H717: 测试条目奖励 | I717: lineup_hero_level | J717: 武将列表
B718: 2160010 | C718: 上阵N名橙将 | D718: 测试_achieve条目 | F718: TID_CAMPAIGN_TEST_ACHIEVE10 | G718: 3 | H718: 测试条目奖励 | I718: lineup_orange_hero_count | J718: 阵容
B719: 2160011 | C719: 武将最高天命达到N级 | D719: 测试_achieve条目 | F719: TID_CAMPAIGN_TEST_ACHIEVE11 | G719: 3 | H719: 测试条目奖励 | I719: hero_stardust_level | J719: 武将列表
B720: 2160012 | C720: 所有上阵武将天命都达到N级 | D720: 测试_achieve条目 | F720: TID_CAMPAIGN_TEST_ACHIEVE12 | G720: 5 | H720: 测试条目奖励 | I720: lineup_hero_stardust_level | J720: 武将列表
B721: 2160013 | C721: 武将最高突破达到N级 | D721: 测试_achieve条目 | F721: TID_CAMPAIGN_TEST_ACHIEVE13 | G721: 5 | H721: 测试条目奖励 | I721: hero_breakthrough_level | J721: 武将列表
B722: 2160014 | C722: 所有上阵武将突破都达到N级 | D722: 测试_achieve条目 | F722: TID_CAMPAIGN_TEST_ACHIEVE14 | G722: 3 | H722: 测试条目奖励 | I722: lineup_hero_breakthrough_level | J722: 武将列表
B723: 2160015 | C723: 上阵武将N名穿满4件装备 | D723: 测试_achieve条目 | F723: TID_CAMPAIGN_TEST_ACHIEVE15 | G723: 3 | H723: 测试条目奖励 | I723: lineup_wear_4_equip_hero_count | J723: 阵容
B724: 2160016 | C724: N个上阵武将穿满4件蓝色装备及以上 | D724: 测试_achieve条目 | F724: TID_CAMPAIGN_TEST_ACHIEVE16 | G724: 3 | H724: 测试条目奖励 | I724: lineup_wear_4_blue_equip_hero_count | J724: 阵容
B725: 2160017 | C725: N个上阵武将穿满4件紫色装备及以上 | D725: 测试_achieve条目 | F725: TID_CAMPAIGN_TEST_ACHIEVE17 | G725: 3 | H725: 测试条目奖励 | I725: lineup_wear_4_purple_equip_hero_count | J725: 阵容
B726: 2160018 | C726: N个上阵武将穿满4件橙色装备及以上 | D726: 测试_achieve条目 | F726: TID_CAMPAIGN_TEST_ACHIEVE18 | G726: 3 | H726: 测试条目奖励 | I726: lineup_wear_4_orange_equip_hero_count | J726: 阵容
B727: 2160019 | C727: 装备最高精炼N阶 | D727: 测试_achieve条目 | F727: TID_CAMPAIGN_TEST_ACHIEVE19 | G727: 10 | H727: 测试条目奖励 | I727: equip_refine_level | J727: 装备列表
B728: 2160020 | C728: 所有上阵武将12件装备精炼达到N阶 | D728: 测试_achieve条目 | F728: TID_CAMPAIGN_TEST_ACHIEVE20 | G728: 5 | H728: 测试条目奖励 | I728: lineup_equip_refine_level | J728: 装备列表
B729: 2160021 | C729: 装备最高强化N阶 | D729: 测试_achieve条目 | F729: TID_CAMPAIGN_TEST_ACHIEVE21 | G729: 20 | H729: 测试条目奖励 | I729: equip_enhance_level | J729: 装备列表
B730: 2160022 | C730: 所有上阵武将12件装备强化达到N阶 | D730: 测试_achieve条目 | F730: TID_CAMPAIGN_TEST_ACHIEVE22 | G730: 10 | H730: 测试条目奖励 | I730: lineup_equip_enhance_level | J730: 装备列表
B731: 2160023 | C731: 玩家等级达N级 | D731: 测试_achieve条目 | F731: TID_CAMPAIGN_TEST_ACHIEVE23 | G731: 30 | H731: 测试条目奖励 | I731: role_level | J731: 主线副本
B732: 2160024 | C732: 战力到达N | D732: 测试_achieve条目 | F732: TID_CAMPAIGN_TEST_ACHIEVE24 | G732: 200000 | H732: 测试条目奖励 | I732: combat_power | J732: 阵容
B733: 2160025 | C733: 竞技场最高N名 | D733: 测试_achieve条目 | E733: 1 | F733: TID_CAMPAIGN_TEST_ACHIEVE25 | G733: 200 | H733: 测试条目奖励 | I733: arena_best_rank | J733: 竞技场
B734: 2160026 | C734: 围剿叛军单次伤害达到N | D734: 测试_achieve条目 | F734: TID_CAMPAIGN_TEST_ACHIEVE26 | G734: 100000 | H734: 测试条目奖励 | I734: worldboss_max_damage | J734: 叛军
B735: 2160027 | C735: 围剿叛军每天累计伤害达到N | D735: 测试_achieve条目 | F735: TID_CAMPAIGN_TEST_ACHIEVE27 | G735: 500000 | H735: 测试条目奖励 | I735: worldboss_total_damage | J735: 叛军
B736: 2160028 | C736: 叛军击杀N个 | D736: 测试_achieve条目 | F736: TID_CAMPAIGN_TEST_ACHIEVE28 | G736: 3 | H736: 测试条目奖励 | I736: worldboss_last_shot_count | J736: 叛军
B737: 2160029 | C737: 三国无双最高排名到N | D737: 测试_achieve条目 | E737: 1 | F737: TID_CAMPAIGN_TEST_ACHIEVE29 | G737: 10 | H737: 测试条目奖励 | I737: wushuang_best_rank | J737: 无双
B738: 2160030 | C738: 三国无双最高N星 | D738: 测试_achieve条目 | F738: TID_CAMPAIGN_TEST_ACHIEVE30 | G738: 30 | H738: 测试条目奖励 | I738: wushuang_total_star | J738: 无双
B739: 2160031 | C739: 主线副本星数N | D739: 测试_achieve条目 | F739: TID_CAMPAIGN_TEST_ACHIEVE31 | G739: 20 | H739: 测试条目奖励 | I739: story_stage_total_star | J739: 主线副本
B740: 2160032 | C740: 主线副本通过第N章 | D740: 测试_achieve条目 | F740: TID_CAMPAIGN_TEST_ACHIEVE32 | G740: 3 | H740: 测试条目奖励 | I740: story_stage_chapter | J740: 主线副本
B741: 2160033 | C741: 名将副本通关第N帐篷 | D741: 测试_achieve条目 | F741: TID_CAMPAIGN_TEST_ACHIEVE33 | G741: 2 | H741: 测试条目奖励 | I741: epic_stage_top_level | J741: 名将副本
B742: 2160034 | C742: 名将副本通关第N章 | D742: 测试_achieve条目 | F742: TID_CAMPAIGN_TEST_ACHIEVE34 | G742: 3 | H742: 测试条目奖励 | I742: hero_stage_chapter | J742: 名将副本
B743: 2160035 | C743: 上阵N名红将 | D743: 测试_achieve条目 | F743: TID_CAMPAIGN_TEST_ACHIEVE35 | G743: 2 | H743: 测试条目奖励 | I743: lineup_red_hero_count | J743: 阵容
B744: 2160036 | C744: N个上阵武将穿满4件红色装备及以上 | D744: 测试_achieve条目 | F744: TID_CAMPAIGN_TEST_ACHIEVE36 | G744: 1 | H744: 测试条目奖励 | I744: lineup_wear_4_red_equip_hero_count | J744: 阵容
B745: 2160037 | C745: 所有上阵小兵等级达到N | D745: 测试_achieve条目 | F745: TID_CAMPAIGN_TEST_ACHIEVE37 | G745: 10 | H745: 测试条目奖励 | I745: lineup_squad_level | J745: 阵容
B746: 2160038 | C746: 小兵最高等级达到N | D746: 测试_achieve条目 | F746: TID_CAMPAIGN_TEST_ACHIEVE38 | G746: 20 | H746: 测试条目奖励 | I746: squad_level | J746: 阵容
B747: 2160039 | C747: 所有上阵小兵突破等级达到N | D747: 测试_achieve条目 | F747: TID_CAMPAIGN_TEST_ACHIEVE39 | G747: 2 | H747: 测试条目奖励 | I747: lineup_squad_breakthrough_level | J747: 阵容
B748: 2160040 | C748: 小兵最高突破等级达到N | D748: 测试_achieve条目 | F748: TID_CAMPAIGN_TEST_ACHIEVE40 | G748: 2 | H748: 测试条目奖励 | I748: squad_breakthrough_level | J748: 阵容
B749: 2160041 | C749: 所有上阵小兵品质达到N | D749: 测试_achieve条目 | F749: TID_CAMPAIGN_TEST_ACHIEVE41 | G749: 3 | H749: 测试条目奖励 | I749: lineup_soldier_promote_level | J749: 阵容
B750: 2160042 | C750: N个小兵品质达到蓝色 | D750: 测试_achieve条目 | F750: TID_CAMPAIGN_TEST_ACHIEVE42 | G750: 3 | H750: 测试条目奖励 | I750: lineup_blue_soldier_count | J750: 阵容
B751: 2160043 | C751: N个小兵品质达到紫色 | D751: 测试_achieve条目 | F751: TID_CAMPAIGN_TEST_ACHIEVE43 | G751: 3 | H751: 测试条目奖励 | I751: lineup_purple_soldier_count | J751: 阵容
B752: 2160044 | C752: N个小兵品质达到橙色 | D752: 测试_achieve条目 | F752: TID_CAMPAIGN_TEST_ACHIEVE44 | G752: 3 | H752: 测试条目奖励 | I752: lineup_orange_soldier_count | J752: 阵容
B753: 2160045 | C753: N个小兵品质达到红色 | D753: 测试_achieve条目 | F753: TID_CAMPAIGN_TEST_ACHIEVE45 | G753: 3 | H753: 测试条目奖励 | I753: lineup_red_soldier_count | J753: 阵容
B754: 2160046 | C754: 上阵小兵穿戴的9件兵法等级达到N | D754: 测试_achieve条目 | F754: TID_CAMPAIGN_TEST_ACHIEVE46 | G754: 10 | H754: 测试条目奖励 | I754: lineup_warcraft_level | J754: 阵容
B755: 2160047 | C755: 上阵小兵穿戴的3件兵法等级达到N | D755: 测试_achieve条目 | F755: TID_CAMPAIGN_TEST_ACHIEVE47 | G755: 10 | H755: 测试条目奖励 | I755: lineup_top3_warcraft_level | J755: 阵容
B756: 2160048 | C756: 兵法最高等级达到N | D756: 测试_achieve条目 | F756: TID_CAMPAIGN_TEST_ACHIEVE48 | G756: 10 | H756: 测试条目奖励 | I756: warcraft_level | J756: 阵容
B757: 2160049 | C757: 兵法最高精炼等级达到N | D757: 测试_achieve条目 | F757: TID_CAMPAIGN_TEST_ACHIEVE49 | G757: 3 | H757: 测试条目奖励 | I757: warcraft_refine_level | J757: 阵容
B758: 2160050 | C758: 上阵小兵穿戴的9件兵法精炼等级达到N | D758: 测试_achieve条目 | F758: TID_CAMPAIGN_TEST_ACHIEVE50 | G758: 3 | H758: 测试条目奖励 | I758: lineup_warcraft_refine_level | J758: 阵容
B759: 2160051 | C759: 上阵小兵穿戴的3件兵法精炼等级达到N | D759: 测试_achieve条目 | F759: TID_CAMPAIGN_TEST_ACHIEVE51 | G759: 3 | H759: 测试条目奖励 | I759: lineup_top3_warcraft_refine_level | J759: 阵容
B760: 2160052 | C760: 上阵小兵穿戴了N件兵法 | D760: 测试_achieve条目 | F760: TID_CAMPAIGN_TEST_ACHIEVE52 | G760: 2 | H760: 测试条目奖励 | I760: lineup_warcraft_count | J760: 阵容
B761: 2160053 | C761: 三军夺帅积分达到N | D761: 测试_achieve条目 | F761: TID_CAMPAIGN_TEST_ACHIEVE53 | G761: 1000 | H761: 测试条目奖励 | I761: hero_bingo_top_score | J761: 阵容
B762: 2160054 | C762: 三军夺帅最高N名 | D762: 测试_achieve条目 | F762: TID_CAMPAIGN_TEST_ACHIEVE54 | G762: 10 | H762: 测试条目奖励 | I762: hero_bingo_best_rank | J762: 阵容
B763: 2170001 | C763: 等级礼包1_免费赠送 | D763: 等级礼包1 | F763: TID_GAIN_CAMPAIGN_LEVEL_PACKAGE_1_FREE | G763: 20 | H763: 等级礼包1_免费赠送 | I763: role_level | J763: 主线副本
B764: 2170002 | C764: 等级礼包2_免费赠送 | D764: 等级礼包2 | F764: TID_GAIN_CAMPAIGN_LEVEL_PACKAGE_2_FREE | G764: 30 | H764: 等级礼包2_免费赠送 | I764: role_level | J764: 主线副本
B765: 2170003 | C765: 等级礼包3_免费赠送 | D765: 等级礼包3 | F765: TID_GAIN_CAMPAIGN_LEVEL_PACKAGE_3_FREE | G765: 32 | H765: 等级礼包3_免费赠送 | I765: role_level | J765: 主线副本
B766: 2170004 | C766: 等级礼包4_免费赠送 | D766: 等级礼包4 | F766: TID_GAIN_CAMPAIGN_LEVEL_PACKAGE_4_FREE | G766: 35 | H766: 等级礼包4_免费赠送 | I766: role_level | J766: 主线副本
B767: 2170005 | C767: 等级礼包5_免费赠送 | D767: 等级礼包5 | F767: TID_GAIN_CAMPAIGN_LEVEL_PACKAGE_5_FREE | G767: 36 | H767: 等级礼包5_免费赠送 | I767: role_level | J767: 主线副本
B768: 2170006 | C768: 等级礼包6_免费赠送 | D768: 等级礼包6 | F768: TID_GAIN_CAMPAIGN_LEVEL_PACKAGE_6_FREE | G768: 39 | H768: 等级礼包6_免费赠送 | I768: role_level | J768: 主线副本
B769: 2170007 | C769: 等级礼包7_免费赠送 | D769: 等级礼包7 | F769: TID_GAIN_CAMPAIGN_LEVEL_PACKAGE_7_FREE | G769: 40 | H769: 等级礼包7_免费赠送 | I769: role_level | J769: 主线副本
B770: 2170008 | C770: 等级礼包8_免费赠送 | D770: 等级礼包8 | F770: TID_GAIN_CAMPAIGN_LEVEL_PACKAGE_8_FREE | G770: 41 | H770: 等级礼包8_免费赠送 | I770: role_level | J770: 主线副本
B771: 2170009 | C771: 等级礼包9_免费赠送 | D771: 等级礼包9 | F771: TID_GAIN_CAMPAIGN_LEVEL_PACKAGE_9_FREE | G771: 43 | H771: 等级礼包9_免费赠送 | I771: role_level | J771: 主线副本
B772: 2170010 | C772: 等级礼包10_免费赠送 | D772: 等级礼包10 | F772: TID_GAIN_CAMPAIGN_LEVEL_PACKAGE_10_FREE | G772: 25 | H772: 等级礼包10_免费赠送 | I772: role_level | J772: 主线副本